id,country,description,designation,points,price,province,region_1,region_2,taster_name,taster_twitter_handle,title,variety,winery
88645,US,"Made from 57% Sémillon, the rest Sauvignon Blanc, this proprietary, estate wine is 100% barrel-fermented and built to age, a studious take on sultry oak and viscosity. Golden Delicious apple highlights the taste experience, reaching rich, concentrated proportion, before the wine finds its balance on the finish. Drink now through 2020.",Seta Proprietary White,91,70,California,Napa Valley,Napa,Virginie Boone,@vboone,Signorello 2013 Seta Proprietary White Semillon-Sauvignon Blanc (Napa Valley),Semillon-Sauvignon Blanc,Signorello
88739,US,"A 50-50 blend of Cabernet Franc and Petit Verdot, this wine shows aromas of ripe blackberries, spicy raspberry and warm vanilla. The palate seems a bit dichotomous, with ripe fruit on entry leading to a toasted oak character on the finish.",Zephyrus,85,45,Colorado,Grand Valley,NA,Alexander Peartree,NA,Anemoi 2013 Zephyrus Red (Grand Valley),Red Blend,Anemoi
88999,Austria,"Zweigelt can do easy-drinking styles but in the right hands, it can also turn into something more elegant. That's the case here: This exudes sophistication. Subtle use of oak supports the supple structure and gives the ripe red cherry fruit a more velvety spin. While this is ready now, it may well get even better with a year or two in bottle.",Heideboden,90,26,Burgenland,NA,NA,Anne Krebiehl MW,@AnneInVino,Nittnaus Hans und Christine 2013 Heideboden Zweigelt (Burgenland),Zweigelt,Nittnaus Hans und Christine
89004,US,"Tingling lemon and grapefruit pith make for a tantalizing experience in this white made from several vineyard sources throughout the Napa Valley. Saline and wet stone provide the minerality, with a searing seasoning of lemongrass. The wine finishes on a tart, herbal note that yearns to be matched with seafood.",NA,90,21,California,Napa Valley,Napa,Virginie Boone,@vboone,Atalon 2013 Sauvignon Blanc (Napa Valley),Sauvignon Blanc,Atalon
89005,US,"While intensely floral from nose to finish, this subtly nuanced Riesling has a more savory side as well, offsetting stark lemon, tangerine and lime flavors against wet stone and clay. It's ethereal and light on the palate, but finishes boldly with a lingering murmur of astringency.",Tanzen Dame Auten Vineyard 2nd Clone 239 Dry,90,40,New York,Finger Lakes,Finger Lakes,Anna Lee C. Iijima,NA,Bloomer Creek 2013 Tanzen Dame Auten Vineyard 2nd Clone 239 Dry Riesling (Finger Lakes),Riesling,Bloomer Creek
89009,US,"With fruit from The Benches (71%) and Canoe Ridge vineyards, this wine offers aromas of toast, pineapple, peach and pear, with barrel notes (100% American) providing accents. Flavors are creamy in feel with a finish that lingers.",Reserve,90,20,Washington,Horse Heaven Hills,Columbia Valley,Sean P. Sullivan,@wawinereport,Canoe Ridge 2013 Reserve Chardonnay (Horse Heaven Hills),Chardonnay,Canoe Ridge
89027,Italy,"This wine's new leather, pressed violet and orange zest aromas unfold in the glass. The vibrant, medium-bodied palate offers red berry, baking spice and crushed herb flavors framed by bright acidity and firm, refined tannins.",del Comune di Serralunga d'Alba,90,49,Piedmont,Barolo,NA,Kerin O’Keefe,@kerinokeefe,Palladino 2013 del Comune di Serralunga d'Alba  (Barolo),Nebbiolo,Palladino
89239,US,"Raspberry, herb and sugared-plum aromas are followed by easy-drinking red-fruit flavors that show a sense of balance that keeps the interest high.",NA,88,14,Washington,Columbia Valley (WA),Columbia Valley,Sean P. Sullivan,@wawinereport,Skyfall 2013 Merlot (Columbia Valley (WA)),Merlot,Skyfall
89306,US,"Blackberry paste, crushed black rocks and a pinch of baking spice show on the nose of this bottling, which is a project between sommelier Paolo Barbieri and his partner Erin Kempe. The flavors are full of dark red and candied purple fruits, with clove, olive and vanilla touches and a dense tannic structure.",NA,90,55,California,Paso Robles,Central Coast,Matt Kettmann,@mattkettmann,Kempe 2013 Cabernet Sauvignon (Paso Robles),Cabernet Sauvignon,Kempe
89510,South Africa,"This leads with slightly honeyed notes of peach, melon and pear. Flavors of grilled apple skin, peach pit and beeswax unfold on the palate, finishing somewhat warm and toasty. Drink up.",Old Vine,86,15,Stellenbosch,NA,NA,Lauren Buzzeo,@laurbuzz,Beau Joubert 2013 Old Vine Chenin Blanc (Stellenbosch),Chenin Blanc,Beau Joubert
89680,Australia,"Cranberries and pie cherries give a crisp, almost citrusy, edge to this wine. The tannins are silky and there's some appealing clove-like spice as well, but the acids are elevated, making the wine come across as tart and ungenerous.",The Little Villager,84,18,South Australia,Adelaide Hills,NA,Joe Czerwinski,@JoeCz,Stable Hill 2013 The Little Villager Pinot Noir (Adelaide Hills),Pinot Noir,Stable Hill
89758,Italy,"Fruity aromas of blueberry and red cherry lead the way along with violet and a whiff of mint. On the fresh, densely pigmented palate, chewy tannins offset ripe plum, blackberry and clove.",NA,89,25,Northeastern Italy,Alto Adige,NA,Kerin O’Keefe,@kerinokeefe,St. Pauls 2013 Lagrein (Alto Adige),Lagrein,St. Pauls
89760,Argentina,"Grapy aromas of berry fruits and the dust of spearmint gum set up a loud, high-acid, seemingly electrified palate that tastes of black currant, blackberry and plum. Overall, this is a linear feeling Bordeaux blend with bracing acidity and minty oak. Time should only help it along. Drink through 2022.",Quimera,89,35,Mendoza Province,Mendoza,NA,Michael Schachner,@wineschach,Achaval-Ferrer 2013 Quimera Red (Mendoza),Bordeaux-style Red Blend,Achaval-Ferrer
89767,France,"Soft and round, this ripe wine offers both fruit and acidity. It is young and full of green plum and pear flavors, still textured with a young, crisp character. It needs to fill out for a few years, and will be best from 2017.",NA,89,43,Burgundy,Pernand-Vergelesses,NA,Roger Voss,@vossroger,Jean-Luc and Paul Aegerter 2013  Pernand-Vergelesses,Chardonnay,Jean-Luc and Paul Aegerter
89846,US,"A small-production wine from a new producer, this impresses in plush red- and black-cherry, tangy minerality and a refreshing cloud of citrus that gives it buoyancy on the palate. This medium-bodied wine is fresh and alive from start to finish and will be delightful at the table.",NA,92,52,California,Russian River Valley,Sonoma,Virginie Boone,@vboone,RMH 2013 Pinot Noir (Russian River Valley),Pinot Noir,RMH
89858,US,"This vineyard is best known for its Syrah but Grenache also shines, as evidenced by this compelling bottle. The aromas pop with complex notes of flowers, brown stems, mineral, smoke, raspberries, peppery spice and the vineyard's signature earthy funk. The palate shows delicacy, precision and detail, with a lightly meaty, peppery finish that lingers. It's a completely captivating expression of the variety with balance that downright dazzles.",Boushey Vineyard,93,30,Washington,Yakima Valley,Columbia Valley,Sean P. Sullivan,@wawinereport,Two Vintners 2013 Boushey Vineyard Grenache (Yakima Valley),Grenache,Two Vintners
89975,US,"This wine is unmistakably Cabernet with its aromas of olive, herb and cherry along with whiffs of game. The palate shows a mixture of fruit and savory elements with a restrained styling and a finish that lingers.",House of Independent Producers Sagemoor Farms Vineyard,89,17,Washington,Columbia Valley (WA),Columbia Valley,Sean P. Sullivan,@wawinereport,Hedges Family Estate 2013 House of Independent Producers Sagemoor Farms Vineyard Cabernet Sauvignon (Columbia Valley (WA)),Cabernet Sauvignon,Hedges Family Estate
89996,US,"This exceedingly light wine was given very subtle amounts of oak. It offers a sophisticated take on sassafras and Bing cherry within an earthy, structured shell that imparts a medium-bodied mouthfeel and plenty of acidity. From a site in Sebastopol, it needs time to open in the glass.",Peters Vineyard,89,42,California,Sonoma Coast,Sonoma,Virginie Boone,@vboone,The Withers Winery 2013 Peters Vineyard Pinot Noir (Sonoma Coast),Pinot Noir,The Withers Winery
90048,US,"Rich and layered on the nose, this wine shows peppercorn, bacon fat and blackberry jam aromas. It is full and soft on the palate, with deeply rich yet still a tad tart boysenberry and elderberry fruit as well as an asphalt-driven grip.",Purisima Mountain Vineyard,93,32,California,Ballard Canyon,Central Coast,Matt Kettmann,@mattkettmann,Beckmen 2013 Purisima Mountain Vineyard Syrah (Ballard Canyon),Syrah,Beckmen
90291,US,"This wine is all from Yellow Jacket Vineyard, one of the oldest sites in The Rocks. The aromas bring subdued notes of black pepper, bacon fat, blue and blackberries, flowers, mineral and black olive. It has a hypnotic sense of texture—a very pretty interpretation of the variety and area.",Voyageur,91,40,Washington,Walla Walla Valley (WA),Columbia Valley,Sean P. Sullivan,@wawinereport,Maison Bleue 2013 Voyageur Syrah (Walla Walla Valley (WA)),Syrah,Maison Bleue
90431,US,"The aromas of wild strawberries, spice and sarsaparilla are immediate in their appeal. The palate is light bodied and elegant, with mouthwatering acids and flavors that linger. This wine is delicate but brings a lot of enjoyment.",Unconditional,88,16,Oregon,Oregon,Oregon Other,Sean P. Sullivan,@wawinereport,Battle Creek 2013 Unconditional Pinot Noir (Oregon),Pinot Noir,Battle Creek
90434,US,"Solidly built, almost chunky, the accent flavors suggest time spent in a percentage of new wood. Citrus and apple are cloaked in oaky spices and barrel flavors of toast, vanilla and butter.",NA,88,45,Oregon,Willamette Valley,Willamette Valley,Paul Gregutt,@paulgwine ,Big Table Farm 2013 Chardonnay (Willamette Valley),Chardonnay,Big Table Farm
90438,US,"From Michael Mondavi's portfolio, this affordable Cabernet is concentrated in red berry and savory leather, a nod to the small amounts of Syrah and Petite Sirah that are included in the blend. French oak provides a hint of vanilla and cardamom, while the medium-bodied palate and attractive finish is washed in coffee.",NA,90,25,California,Napa County,Napa,Virginie Boone,@vboone,Oberon 2013 Cabernet Sauvignon (Napa County),Cabernet Sauvignon,Oberon
90458,US,"Fruity, spicy, oaky aromas make an instant impression, and tasty, ripe fruit flavors deliver the goods. This full-bodied, lush-textured and quite flavorful wine is bold and dramatic.",Perli Vineyard,90,64,California,Mendocino Ridge,NA,Jim Gordon,@gordone_cellars,Arista 2013 Perli Vineyard Pinot Noir (Mendocino Ridge),Pinot Noir,Arista
90576,France,"Rounded notes of Bosc pear flesh and peel play softly on nose and palate. There is a very pleasant, slightly bitter phenolic edge, reminiscent of marzipan and a slight sweetness. Together they make for an intriguing and moreish contrast against a fluid, textured palate. The finish is off dry and has that marzipan edge.",Clos Saint Landelin Vorbourg Grand Cru,93,50,Alsace,Alsace,NA,Anne Krebiehl MW,@AnneInVino,René Muré 2013 Clos Saint Landelin Vorbourg Grand Cru Pinot Gris (Alsace),Pinot Gris,René Muré
90716,Argentina,"Tight, rooty, spicy aromas of cherry and cassis include notes of raw minerals and crushed rocks. This is a bit gritty and tannic, but it's not fierce or unyielding. Reedy, spicy plum, berry, coffee and cocoa flavors finish dry, with lasting notes of chocolate and baking spices. Drink through 2021.",Gran,92,36,Mendoza Province,Tupungato,NA,Michael Schachner,@wineschach,Riglos 2013 Gran Cabernet Sauvignon (Tupungato),Cabernet Sauvignon,Riglos
90718,Argentina,"Ripe, loamy blackberry, prune and cassis aromas lead to a structured palate that boasts big, firm tannins. This offers dark, ripe flavors of wild berry, black plum and chocolate prior to a toasty finish that's largely subtle and smooth. Drink through 2021.",Numina Spirit Vineyard Estate Bottled,92,41,Mendoza Province,Valle de Uco,NA,Michael Schachner,@wineschach,Salentein 2013 Numina Spirit Vineyard Estate Bottled Malbec (Valle de Uco),Malbec,Salentein
90763,US,"Incredibly rich blackberry-jam aromas meet with licorice, smoked beef and black rocks on the continually evolving and dynamic nose of this bottling from Paso Robles' west side. It's rich, juicy and expertly structured on the palate, where blackberry fruit meets with pencil-lead minerality and light espresso flavors. The tannic grip is solid and the acidity is strong, ensuring long ageability.",NA,93,42,California,Paso Robles Willow Creek District,Central Coast,Matt Kettmann,@mattkettmann,Dunning Vineyards 2013 Cabernet Sauvignon (Paso Robles Willow Creek District),Cabernet Sauvignon,Dunning Vineyards
90800,Argentina,"This is a mild, neutral Torrontés with yeasty notes and hints of tropical fruits. The palate is smooth but simple, while flavors of melon and green papaya finish with lingering lychee notes. Overall this is plump, fresh and good.",Leo,86,17,Mendoza Province,Mendoza,NA,Michael Schachner,@wineschach,Valentin Bianchi 2013 Leo Torrontés (Mendoza),Torrontés,Valentin Bianchi
90867,Spain,"Dark berry aromas, chocolate and grit define the nose on this blend of Syrah, Cabernet and Tempranillo. The palate feels ripe and fresh, but the tannins are hard and grabby. Black plum flavors are bold and offer notes of spice, herbs and earthiness. This is composed on the finish despite a reprise of hard smacking tannins.",Selección,89,16,Levante,Valencia,NA,Michael Schachner,@wineschach,Icono 2013 Selección Red (Valencia),Red Blend,Icono
90885,Italy,"Made entirely from Nero d'Avola, this opens with black-skinned berry, freshly turned soil and cooking spice aromas. The soft, juicy palate offers blackberry, carob and clove flavors while rounded tannins lend a smooth texture. Enjoy through 2019.",Violino,89,20,Sicily & Sardinia,Vittoria,NA,Kerin O’Keefe,@kerinokeefe,Paolo Calì 2013 Violino Nero d'Avola (Vittoria),Nero d'Avola,Paolo Calì
91148,US,"Aromas of dried herbs and leaves, vanilla, cassis, wood spice and cherry are followed by coffee and blue fruit. The tannins show some grit and need time to smooth out.",Eagle & Plow Block 93 Cavalie Vineyard,88,100,Washington,Horse Heaven Hills,Columbia Valley,Sean P. Sullivan,@wawinereport,Mercer 2013 Eagle & Plow Block 93 Cavalie Vineyard Cabernet Sauvignon (Horse Heaven Hills),Cabernet Sauvignon,Mercer
91233,France,"With fruit drawn from all over Burgundy, this is a light, bright and refreshing wine. It has light acidity, spice and apple flavors and a bright, tight aftertaste. Drink now.",Colette,85,23,Burgundy,Coteaux Bourguignons,NA,Roger Voss,@vossroger,Jean-Luc and Paul Aegerter 2013 Colette  (Coteaux Bourguignons),Chardonnay,Jean-Luc and Paul Aegerter
91339,US,"This winery's Walla Walla Valley debut displays aromas of ash, green olive, grilled asparagus, dried flowers, smoked meat and blue fruit. The smoke and savory flavors are soft and reserved in style, showing a pleasing persistence on the finish.",Stoney Vine Vineyard,91,58,Oregon,Walla Walla Valley (OR),Oregon Other,Sean P. Sullivan,@wawinereport,Rudius 2013 Stoney Vine Vineyard Syrah (Walla Walla Valley (OR)),Syrah,Rudius
91342,France,"This wine is ripe, packed with tropical fruit and rich acidity. A hint of vanilla has rounded the wine out, giving a full body to the delicious fruitiness. Opulent and generous, it is kept in order by final, aromatic acidity. Drink from 2016.",Cuvée Claude Brosse,91,NA,Burgundy,Saint-Véran,NA,Roger Voss,@vossroger,Terroirs et Talents 2013 Cuvée Claude Brosse  (Saint-Véran),Chardonnay,Terroirs et Talents
91351,France,"This wine is ripe, with good balance between acidity and the rich yellow fruits. It has a lightly tangy character, although it is more about delicious juiciness and a warm, generous character that is lightly sustained by toast. Drink from 2017.",NA,91,44,Burgundy,Pouilly-Fuissé,NA,Roger Voss,@vossroger,Domaine de la Croix Senaillet 2013  Pouilly-Fuissé,Chardonnay,Domaine de la Croix Senaillet
91458,Australia,"With a degree more alcohol than Moorooduc's 2013 Robinson bottling, this is a riper, even more richly textured example of Chardonnay. There's a hint of warmth on the finish as a result, but overall it keeps a fine sense of balance. Toast, brown sugar and caramelized pineapple notes lead the way, backed by hints of melon and citrus. Drink now.",The Moorooduc McIntyre,92,65,Victoria,Mornington Peninsula,NA,Joe Czerwinski,@JoeCz,Moorooduc 2013 The Moorooduc McIntyre Chardonnay (Mornington Peninsula),Chardonnay,Moorooduc
91589,US,"Odd aromas of orange oil and citronella mark the nose of this Cabernet Franc. Light and lithe on the palate, red cherry flavors are met by tobacco leaf and green peppercorn.",Estate Grown,83,25,Virginia,Monticello,NA,Alexander Peartree,NA,Grace Estate 2013 Estate Grown Cabernet Franc (Monticello),Cabernet Franc,Grace Estate
91627,Chile,"Ripe blackberry and spice aromas are a touch meaty and earthy but mostly straightforward. A grabby, fleshy palate is obtuse but still balanced, while this tastes of berry and cassis, which are textbook flavors for Cabernet Sauvignon. A dry, woody finish with a chocolate note renders this better than most for $20.",Grand Reserve,92,20,Colchagua Valley,NA,NA,Michael Schachner,@wineschach,Lucatoni 2013 Grand Reserve Cabernet Sauvignon (Colchagua Valley),Cabernet Sauvignon,Lucatoni
91717,Austria,"Texture rather than aroma is the main appeal of this slender white. The nose is restrained but the palate has spicy hints of pepper. While citrus dominates, it also shows a riper notion of tangy passion fruit.",Wieden & Berg,89,25,Kremstal,NA,NA,Anne Krebiehl MW,@AnneInVino,Salomon-Undhof 2013 Wieden & Berg Grüner Veltliner (Kremstal),Grüner Veltliner,Salomon-Undhof
91726,New Zealand,"A bit reticent on the nose, this only stubbornly offers up aromas of underbrush and ripe cherries. Then, on the palate, the fruit seems to darken, taking on black cherry overtones and hints of mocha before finishing tart and crisp. Drink now.",NA,86,20,Marlborough,NA,NA,Joe Czerwinski,@JoeCz,Saint Clair 2013 Pinot Noir (Marlborough),Pinot Noir,Saint Clair
91848,US,"A tremendously well-made and intriguing 100% varietal wine, this opens in seasonings of black pepper over popcorn, before red currant, herb, cedar and pencil lead provide the stuffing for an old-world nose. On the palate, it's all about the New World, a hit of power and concentration that takes on weight and length without ever becoming heavy, the acidity firmly in sync with the fruit.",Estate,95,85,California,Napa Valley,Napa,Virginie Boone,@vboone,D.R. Stephens 2013 Estate Cabernet Sauvignon (Napa Valley),Cabernet Sauvignon,D.R. Stephens
92210,US,"This is an aromatic wine with notes of rose water, pear and white flowers. It drinks medium sweet with abundant spice flavors throughout. Pair with spicy Thai dishes.",NA,87,10,Washington,Columbia Valley (WA),Columbia Valley,Sean P. Sullivan,@wawinereport,Chateau Ste. Michelle 2013 Gewürztraminer (Columbia Valley (WA)),Gewürztraminer,Chateau Ste. Michelle
92321,US,"Tight and bright, this tasty wine hits the mineral button under tangy lemon flesh and rind. The tart fruit is refreshing, clear and clean through a driving finish.",NA,89,14,Oregon,Willamette Valley,Willamette Valley,Paul Gregutt,@paulgwine ,Wine by Joe 2013 Pinot Gris (Willamette Valley),Pinot Gris,Wine by Joe
92415,US,"The film director's sparkling ode to his director daughter delivers aromas of apple blossoms, pear cider and chalk. An apparent sweetness on the palate is cut with a pithy grip, the apple-juice base leveled with ample lime elements.",Sofia Blanc de Blancs,87,19,California,Monterey County,Central Coast,Matt Kettmann,@mattkettmann,Francis Ford Coppola 2013 Sofia Blanc de Blancs Sparkling (Monterey County),Sparkling Blend,Francis Ford Coppola
92503,US,"Hearty black-cherry notes meet with leather, black spice and loam on this powerful bottling from a longtime winery that's seeing new life thanks to winemaker Colin Murphy. Concurrent waves of fruit and spice splash through the palate, with black plum, gingerbread, clove and allspice flavors.",NA,93,25,California,Santa Ynez Valley,Central Coast,Matt Kettmann,@mattkettmann,Koehler 2013 Mourvèdre (Santa Ynez Valley),Mourvèdre,Koehler
92856,Austria,"It has fragrant, lifted freshness and a seam of lemony acidity that focuses the textured palate. Slender and refreshing, with long, lemony finish.",Grosser Satz,90,19,Kremstal,NA,NA,Anne Krebiehl MW,@AnneInVino,Müller-Grossmann 2013 Grosser Satz Grüner Veltliner (Kremstal),Grüner Veltliner,Müller-Grossmann
92859,Austria,"Creamy yellow plum fruit and a flinty edge lead onto a full-fruited, brightly lit palate where all the fruit is pulled into zesty orange and lemon focus. Concentration and friendliness prove great assets here.",NA,90,20,Carnuntum,NA,NA,Anne Krebiehl MW,@AnneInVino,Netzl 2013 Chardonnay (Carnuntum),Chardonnay,Netzl
92866,Austria,"At first it reveals a layer of damask rose petals and white blossom. Then a deeper, riper notion unfolds, almost hinting at pineapple. Concentrated but slender, the palate manages to remain refreshing and light despite the heady aromas. Perfectly pitched with just a hint of spice.",NA,90,NA,Burgenland,NA,NA,Anne Krebiehl MW,@AnneInVino,Tinhof 2013 Muskat (Burgenland),Muskat,Tinhof
92872,Austria,"Lovage, ripe pear and a yeasty undertone speak separately before uniting into a mellow, food-friendly, concentrated but streamlined white. There is lots of subtly spiced midpalate interest to linger over. This cries out for food, especially soft cheeses.",Wiener Gemischter Satz,90,NA,Vienna,NA,NA,Anne Krebiehl MW,@AnneInVino,Lenikus 2013 Wiener Gemischter Satz White (Vienna),Austrian white blend,Lenikus
92921,New Zealand,"From an interior subregion of Hawke's Bay, this shows classic oak-aged Pinot aromas of cherries, brown sugar and baking spices. It's medium in weight, with a suede-like texture and a savory, mocha-tinged finish. This is already showing a hint of bricking at the rim, so drink it over the next few years.",NA,89,NA,Hawke's Bay,NA,NA,Joe Czerwinski,@JoeCz,Lime Rock 2013 Pinot Noir (Hawke's Bay),Pinot Noir,Lime Rock
93024,Italy,"Made from 80% Sangiovese and 20% Alicante, this opens with aromas of plum, black cherry and baking spice that follow through to the medium-bodied palate along with a hint of clove. It's easy drinking with firm but fine-grained tannins.",Belguardo Serrata,89,20,Tuscany,Toscana,NA,Kerin O’Keefe,@kerinokeefe,Mazzei 2013 Belguardo Serrata Red (Toscana),Red Blend,Mazzei
93092,US,"From the property of a longtime vineyard manager for the winery, this bottling is deliciously unique. The nose abounds with earth, dried cherry, anise, roasted meat and herb aromas. The structure is solid and somewhat gripping, presenting deep red-fruit flavors with dried herb accents, driven by balanced acidity.",Joughin Vineyard,92,28,California,Santa Ynez Valley,Central Coast,Matt Kettmann,@mattkettmann,Santa Barbara Winery 2013 Joughin Vineyard Primitivo (Santa Ynez Valley),Primitivo,Santa Barbara Winery
93123,Italy,"Aromas of jasmine, acacia flower, ripe stone fruit and honey lead the nose on this fragrant white. The savory palate offers mature green apple, white peach, menthol and mineral alongside zesty acidity.",NA,90,23,Southern Italy,Greco di Tufo,NA,Kerin O’Keefe,@kerinokeefe,Villa Raiano 2013  Greco di Tufo,Greco,Villa Raiano
93377,US,"Aromas of herbs, tar and plum lead to sweet, plush blue fruit flavors. It's not a particularly serious wine but brings plenty of appeal.",NA,87,19,Washington,Columbia Valley (WA),Columbia Valley,Sean P. Sullivan,@wawinereport,Boomtown 2013 Cabernet Sauvignon (Columbia Valley (WA)),Cabernet Sauvignon,Boomtown
93565,US,"This is a familiar and tasty take on the grape, with aromas of caramel, buttercream, vanilla smoke, brown spices and squeezed lemons. There's sea salt and lemon-lime on the palate, which is straightforward but quite clean and crisp.",Reserve,90,32,California,Santa Maria Valley,Central Coast,Matt Kettmann,@mattkettmann,Riverbench 2013 Reserve Chardonnay (Santa Maria Valley),Chardonnay,Riverbench
93594,US,"An underlying smoky oak impression complements the succulently ripe, soft blue fruit in this medium-bodied wine. The finish is powerfully rich.",Estate,87,42,California,Russian River Valley,Sonoma,Virginie Boone,@vboone,Viszlay Vineyards 2013 Estate Zinfandel (Russian River Valley),Zinfandel,Viszlay Vineyards
93756,France,"The price makes this a relative bargain for a cuvée sourced from 100-year-old vines within Le Crau, one of the appellation's most renowned lieux-dits. Notions of leather, cedar and cocoa accent bright red-plum fruit in this full-bodied wine, adding a hint of cracked pepper on the richly textured finish.",Grande Réserve Vieilles Vignes,91,45,Rhône Valley,Châteauneuf-du-Pape,NA,Joe Czerwinski,@JoeCz,Domaine la Boutinière 2013 Grande Réserve Vieilles Vignes Red (Châteauneuf-du-Pape),Rhône-style Red Blend,Domaine la Boutinière
93992,US,"The nose on this wine is fairly shy with pencil shavings, danker herbs and a plum-fruit backbone, which predicts a very dry palate. However, the flavors are extremely ripe and sweet, with strawberry, black plum, mission fig and vanilla flavors.",Estate,85,28,California,Paso Robles,Central Coast,Matt Kettmann,@mattkettmann,Minassian-Young 2013 Estate Zinfandel (Paso Robles),Zinfandel,Minassian-Young
94005,US,"Gravel and red fruit show on the nose of this widely available wine. The body is thinner than some contemporaries, but offers brown spice and dark-red plum fruit. The tannins are quite sticky.",NA,85,17,California,Paso Robles,Central Coast,Matt Kettmann,@mattkettmann,Austerity 2013 Cabernet Sauvignon (Paso Robles),Cabernet Sauvignon,Austerity
