id,country,description,designation,points,price,province,region_1,region_2,taster_name,taster_twitter_handle,title,variety,winery
32203,US,"Broad and earthy, with a dash of funk and a peppery lift, this grips the tongue with authority and power. It's poised and tense, as if balanced on the edge of a precipice, with the fruit, herb, roasted earth and coffee notes all tumbling around in glorious profusion.",Cougar Hills,93,45,Washington,Walla Walla Valley (WA),Columbia Valley,Paul Gregutt,@paulgwine ,K Vintners 2009 Cougar Hills Syrah (Walla Walla Valley (WA)),Syrah,K Vintners
32277,Portugal,"The Jaen grape is specific to the Dão region of central Portugal, where it can produce dense wines with enormous color. This 2009, still surprisingly young for the variety, is dark, concentrated and generous, with sweet black plum notes balanced by hints of oak and lively acidity. This wine is worth holding onto. Drink after 2015.",NA,93,32,Dão,NA,NA,Roger Voss,@vossroger,Quinta de Lemos 2009 Jaen (Dão),Jaen,Quinta de Lemos
32493,Italy,"This opens with a classic Nebbiolo fragrance of Morello cherry, dried rose petal, mint and thyme. The ripe palate offers up crushed black cherry, prune, black pepper, cake spices and licorice alongside brooding tannins and uplifting acidity. It's already well balanced but will be even better in another few years.",Muncagota Riserva,92,65,Piedmont,Barbaresco,NA,Kerin O’Keefe,@kerinokeefe,Produttori del Barbaresco 2009 Muncagota Riserva  (Barbaresco),Nebbiolo,Produttori del Barbaresco
32691,US,"Here's a pretty Pinot, direct and appealing for its range of fruit. Shows raspberry, cherry and persimmon flavors, uplifted by bright acidity. Drink it now.",NA,87,25,California,Sta. Rita Hills,Central Coast,NA,NA,Santa Barbara Winery 2009 Pinot Noir (Sta. Rita Hills),Pinot Noir,Santa Barbara Winery
33036,Italy,"Here's a fresh and bright rosé from Central Italy with a delicate bouquet of wild flowers and forest berry. The wine is luminous, pristine and would pair with appetizers or light summer pasta or chicken curry salad. In the mouth, the wine tastes fresh, crisp and clean.",Cerasuolo,87,12,Central Italy,Montepulciano d'Abruzzo Cerasuolo,NA,NA,NA,Talamonti 2009 Cerasuolo  (Montepulciano d'Abruzzo Cerasuolo),Rosé,Talamonti
33205,France,"Guigal's 2009 entry-level Côte Rôtie comes across as a bit austere. Cool scents of crushed stone and black olive mark the nose, while the palate is firm and tight, only slowly giving up hints of espresso. Drink 2018–2024.",Brune et Blonde,90,75,Rhône Valley,Côte Rôtie,NA,Joe Czerwinski,@JoeCz,E. Guigal 2009 Brune et Blonde  (Côte Rôtie),Syrah,E. Guigal
33540,France,"Powerful, concentrated Chablis. It is rich, with ripe apricot and nectarine fruit, laced with Seville orange acidity. With a touch of toast, a well-integrated structure, this is a wine for medium-term aging.",Vaudésir Grand Cru,92,80,Burgundy,Chablis,NA,Roger Voss,@vossroger,Olivier Leflaive 2009 Vaudésir Grand Cru  (Chablis),Chardonnay,Olivier Leflaive
33589,Italy,"Il 500 is a small-format dry red wine made with Sangiovese grapes from the Romagna area of central Italy. The wine shows a clean, bright quality of fruit with fresh aromas of cherry, blackberry and white almond. Pair it with pasta or cheese.",Il 500,88,11,Central Italy,Sangiovese di Romagna,NA,NA,NA,Fattoria Zerbina 2009 Il 500  (Sangiovese di Romagna),Sangiovese,Fattoria Zerbina
33606,US,"This is soft, smooth and refined, with rich, complex blackberry, cassis, bacon, pepper and smoky cedar flavors. Good as it is, it will develop bottle complexities over the next eight years. Almost as good as Zaca Mesa's more expensive Syrahs.",Estate Grown and Bottled,91,25,California,Santa Ynez Valley,Central Coast,NA,NA,Zaca Mesa 2009 Estate Grown and Bottled Syrah (Santa Ynez Valley),Syrah,Zaca Mesa
33944,France,"Rich and full, the wood and yellow fruit flavors are well integrated with the ripe acidity. Generous as well as elegant, it's a wine to drink now.",Les Chaniots Premier Cru,88,25,Burgundy,Montagny,NA,Roger Voss,@vossroger,Vignerons de Buxy 2009 Les Chaniots Premier Cru  (Montagny),Chardonnay,Vignerons de Buxy
34362,US,"New oak dominates this Chardonnay, lending buttered toast, vanilla and caramel aromas and flavors, while the underlying fruit veers toward very ripe, sweet pineapples. Made in the modern style, it will appeal to Chardonnay lovers of flash, but ultimately palls for too much upfront sweetness.",La Cruz Vineyard,88,38,California,Sonoma Coast,Sonoma,NA,NA,Keller Estate 2009 La Cruz Vineyard Chardonnay (Sonoma Coast),Chardonnay,Keller Estate
34375,Italy,"This well-priced blend of Sangiovese (70%) and Merlot offers friendly and approachable aromas of ripe berry fruit, blackberry jam, spice and light touches of leather and tobacco. The fresh finish makes it a perfect Tuscan red to pair with ravioli stuffed with minced meat or cheese.",Badiola,88,15,Tuscany,Toscana,NA,NA,NA,Mazzei 2009 Badiola Red (Toscana),Red Blend,Mazzei
34405,Argentina,"A home run in middle-tier Malbec. Excellent power and balance are on display. It's firm, minerally and tight, but with generous berry and cassis aromas and flavors along with ample coffee, spice and mocha qualities. Impressive, especially given the price tag; drink now through 2014.",Q,91,20,Mendoza Province,Mendoza,NA,Michael Schachner,@wineschach,Zuccardi 2009 Q Malbec (Mendoza),Malbec,Zuccardi
34913,New Zealand,"Pretty ripe stuff, marked by hints of stewed berries and chocolate. It's medium to full in body, with soft tannins, yet the acids remain crisp, turning tart almost to the point of being citrusy on the finish.",NA,86,18,Marlborough,NA,NA,Joe Czerwinski,@JoeCz,Stoneleigh 2009 Pinot Noir (Marlborough),Pinot Noir,Stoneleigh
35028,US,"Creamy and crisp—a nice trick—this refreshing Chardonnay livens up the palate with a mix of herb, celery, apple and Asian pear, rolling into a finish of caramel apple and toast. It has a light touch despite the 14.5% alcohol, and sits nicely in the back of the throat, inviting another glass.",Lumière,92,25,Washington,Columbia Valley (WA),Columbia Valley,Paul Gregutt,@paulgwine ,Sparkman 2009 Lumière Chardonnay (Columbia Valley (WA)),Chardonnay,Sparkman
35070,Spain,"This warm-climate Viura hits with plodding barrel aromas and flavors but there's not a lot of high-quality natural material to support that much faux/forced oak. Along the way it hints at mealy apple, spice, cinnamon powder and resin. A lot of noise but not much music.",Blanco,83,8,Northern Spain,Campo de Borja,NA,Michael Schachner,@wineschach,Borsao 2009 Blanco Viura (Campo de Borja),Viura,Borsao
35777,France,"A soft wood- and almond-flavored wine. It misses fresh fruit, instead offering a rounded, ripe character that suggests it is not for aging.",Vaucoupin Premier Cru,86,NA,Burgundy,Chablis,NA,Roger Voss,@vossroger,Domaine Corine Perchaud 2009 Vaucoupin Premier Cru  (Chablis),Chardonnay,Domaine Corine Perchaud
35788,Italy,"Toast, coffee, mocha and spiced plum aromas mingle in the glass. The firm palate offers black cherry, plum, espresso, licorice and tobacco alongside a tannic backbone. It's ripe and powerful but also has the intensity many 2009 wines lack. Drink 2016–2022.",Poggio Abate Riserva,90,81,Tuscany,Brunello di Montalcino,NA,Kerin O’Keefe,@kerinokeefe,Tenute del Cerro 2009 Poggio Abate Riserva  (Brunello di Montalcino),Sangiovese,Tenute del Cerro
36051,US,"Brisk in acidity, this everyday Sauvignon Blanc has ripe, bright flavors of tangerines, peaches and pineapples. It's a good by-the-glass wine for restaurants.",NA,86,19,California,Santa Ynez Valley,Central Coast,NA,NA,J Ludlow 2009 Sauvignon Blanc (Santa Ynez Valley),Sauvignon Blanc,J Ludlow
37044,US,"This dry, brusque Merlot has hard tannins and tart acidity, and the fruit isn't very concentrated. Gets by with a taste of black cherries and currants. Drink up.",Kinneybrook,85,20,California,Sonoma Valley,Sonoma,NA,NA,Kunde 2009 Kinneybrook Merlot (Sonoma Valley),Merlot,Kunde
37059,France,"A classic Gaillac blend of Duras, Gamay, Merlot and Syrah, this is a bright, fruity wine, the lighter of the two wines produced at Château Lecusse. Red berries dominate, allied to crisp acidity.",Grappes d'Or,85,11,Southwest France,Gaillac,NA,Roger Voss,@vossroger,Château Lecusse 2009 Grappes d'Or Red (Gaillac),Red Blend,Château Lecusse
37635,US,"Chalky tannins override the deep, black-cherry flavor. Cassis and licorice streaks are also present, and there is no quibble with the concentration. Perhaps more bottle age will smooth out the chalky finish.",Champoux Vineyard,88,39,Washington,Horse Heaven Hills,Columbia Valley,Paul Gregutt,@paulgwine ,Three Rivers 2009 Champoux Vineyard Cabernet Sauvignon (Horse Heaven Hills),Cabernet Sauvignon,Three Rivers
37911,France,"A wine without great varietal character, although with an attractive, light feel to it. The acidity gives a final mineral edge.",NA,84,NA,Alsace,Alsace,NA,Roger Voss,@vossroger,Domaine Specht 2009 Riesling (Alsace),Riesling,Domaine Specht
38234,Chile,"Solid, crisp and consistent with the previous vintage. Undurraga's T.H. from Leyda is a Sauvignon Blanc made in the oceanic, cool-climate style. It's stripped of all fat and weight; instead, it hits with tangerine, orange and a bit of green. A nice example of a streamlined, fit white wine.",T.H.,89,17,Leyda Valley,NA,NA,Michael Schachner,@wineschach,Undurraga 2009 T.H. Sauvignon Blanc (Leyda Valley),Sauvignon Blanc,Undurraga
38258,France,"Aging in wood for 18 months has brought out the richness of this generous wine. It has black-currant acidity that is balanced by the tarry tannins and smoky character. Rich and now in equilibrium, this wine is ready to drink.",NA,89,26,Bordeaux,Médoc,NA,Roger Voss,@vossroger,Château Hourbanon 2009  Médoc,Bordeaux-style Red Blend,Château Hourbanon
38298,Italy,"With fruit selected from a single-vineyard site, this riserva does a nice job of portraying a fresh cherry flavor within an elaborate framework of oak spice, leather and tobacco notes. The wine is propped up by tight wood-derived tannins, which gives it a firm structure. It could use a few more years of cellar aging",Bellezza Riserva,91,30,Tuscany,Chianti Classico,NA,NA,NA,Castello di Gabbiano 2009 Bellezza Riserva  (Chianti Classico),Sangiovese,Castello di Gabbiano
38465,Spain,"On first take, this is oily and smells of bitter almond and walnut. The mouthfeel is clunky and heavy, with low acidity. Bitterness is the lead flavor, and then honey and brown sugar enter the picture. On the finish it struggles to drive through the tape.",MR Mountain Wine,85,35,Andalucia,Málaga,NA,Michael Schachner,@wineschach,Telmo Rodríguez 2009 MR Mountain Wine Moscatel (Málaga),Moscatel,Telmo Rodríguez
38713,Chile,"Big, jumbled and foxy, with forced berry aromas. Feels full and bulky, with roasted, herbal flavors that suggest cherry and cassis. Mildly astringent and chalky feeling on the finish.",Reserva,83,12,Maule Valley,NA,NA,Michael Schachner,@wineschach,Sundance 2009 Reserva Cabernet Sauvignon (Maule Valley),Cabernet Sauvignon,Sundance
38973,Argentina,"Stalky, leathery aromas of cooked berry fruits precede a raw, acid-driven mouthfeel and sour flavors softened by a touch of malty oak. The finish is scouring and short.",Altivo Barrel Selection,81,17,Mendoza Province,Uco Valley,NA,Michael Schachner,@wineschach,Eugenio Bustos 2009 Altivo Barrel Selection Malbec (Uco Valley),Malbec,Eugenio Bustos
39440,France,"Dense and concentrated, with a mint flavor from the new wood, this is a wine that combines rich plum and blackberry flavors with firm tannins and juicy acids. Because it is so rich, it is likely to be ready to be drink in the next 2–3 years.",Château de Haute-Serre,90,24,Southwest France,Cahors,NA,Roger Voss,@vossroger,Georges Vigouroux 2009 Château de Haute-Serre Malbec (Cahors),Malbec,Georges Vigouroux
39466,US,"Kevin Furtado is a sommelier in Vail who owns this brand. The grapes come from some of Bien Nacido's best blocks. The wine is exceptionally lush and complex, showing flashes of tropical fruits, honey and minerals, tightly wound together in a firm structure. A really fine Chardonnay that should hold for up to 6 years.",Bien Nacido Vineyards,93,29,California,Santa Maria Valley,Central Coast,NA,NA,K. Furtado 2009 Bien Nacido Vineyards Chardonnay (Santa Maria Valley),Chardonnay,K. Furtado
39471,Italy,"This blend of Cabernet, Merlot and Syrah shows a decadently soft side thanks to its aromas of black cherry, tobacco, chocolate and subtle spice. It delivers density and substance on the finish and would pair with pasta and creamy porcini sauce.",Cum Laude,91,31,Tuscany,Toscana,NA,NA,NA,Castello Banfi 2009 Cum Laude Red (Toscana),Red Blend,Castello Banfi
39501,Chile,"Murky and soupy at worst and “earthy” at best, this soft, beefy Carmenère is loaded down with green, herbal flavors that can't be saved by touches of mocha and coffee. The finish is downright green, and overall the fruit is weak.",Reserva,82,9,Maipo Valley,NA,NA,Michael Schachner,@wineschach,Santa Alicia 2009 Reserva Carmenère (Maipo Valley),Carmenère,Santa Alicia
39577,US,"This broad, muscular blend is sourced from seven vineyards and aged for 18 months in French oak. It's relatively open and fruity, with berries, earth and spice all in proportion through a gentle fade.",Backbone,88,55,Oregon,Oregon,Oregon Other,Paul Gregutt,@paulgwine ,King Estate 2009 Backbone Pinot Noir (Oregon),Pinot Noir,King Estate
40174,France,"Bright, red berried wine from the charity-owned vineyards of the Hospices de Saumur. It has soft tannins and an attractive ripe cherry juice character, layered with acidity.",Clos Cristal,89,24,Loire Valley,Saumur-Champigny,NA,Roger Voss,@vossroger,Hospices de Saumur 2009 Clos Cristal  (Saumur-Champigny),Cabernet Franc,Hospices de Saumur
40190,Argentina,"This new wine from importer Bart Broadbent offers cherry, raspberry and plum aromas along with a touch of well-applied oak. It's a little tannic and biting in the mouth, but with food that should be no issue. Flavorwise, it's dealing slightly burnt notes atop full-fledged black cherry and wild berry. A firm, edgy wine with many good qualities.",NA,88,16,Mendoza Province,Mendoza,NA,Michael Schachner,@wineschach,Broadbent 2009 Malbec (Mendoza),Malbec,Broadbent
40420,US,"This Syrah is at the top of the lineup for Reininger. It's tightly wound, yet it opens gracefully to reveal deep flavors of blueberry and plum, with resonating notes of earth, iron, espresso and dark chocolate. This can age for up to a decade.",NA,92,44,Washington,Walla Walla Valley (WA),Columbia Valley,Paul Gregutt,@paulgwine ,Reininger 2009 Syrah (Walla Walla Valley (WA)),Syrah,Reininger
40423,US,"Stiff and tannic, this wine's bold black-cherry flavor, which is characteristic of the Champoux Vineyard, is veined with iron and gravel notes, plus a clover hint. It's complex and riveting, and the tannins finish with a peppery bite.",Champoux Vineyard,92,55,Washington,Horse Heaven Hills,Columbia Valley,Paul Gregutt,@paulgwine ,Januik 2009 Champoux Vineyard Cabernet Sauvignon (Horse Heaven Hills),Cabernet Sauvignon,Januik
40457,Chile,"A rooty style of warm-climate Pinot with sarsparilla, tomato leaf, beet and black cherry on what is a hot, slightly fiery nose. The palate is juicy, with cola, sweet cherry, herb and stemmy flavors, while the finish is snappy, with an aftertaste of caramel and berry liqueur. From vines planted in 1968.",Visión Block: 68 Old Vine Single Vineyard,85,15,Colchagua Valley,NA,NA,NA,NA,Cono Sur 2009 Visión Block: 68 Old Vine Single Vineyard Pinot Noir (Colchagua Valley),Pinot Noir,Cono Sur
40817,Italy,"Made from 90% Sangiovese and 10% Canaiolo, this hearty wine features earthy aromas of underbrush, tilled soil and mature black fruits. The juicy palate delivers fleshy black cherry, plum, nutmeg, espresso, black pepper and licorice alongside a solid tannic backbone. Drink through 2019.",NA,90,40,Tuscany,Chianti Classico,NA,Kerin O’Keefe,@kerinokeefe,Vèscine 2009  Chianti Classico,Red Blend,Vèscine
41027,Spain,"Aromas of brick dust, vitamins and baked fruits are gritty and require some navigating. This has a wiry, tight feel, yet in terms of flavors, it's ripe almost to the point of being raisiny. Heat, hard tannins and dried berry fruit flavors direct the finish. Drink through 2017.",NA,89,40,Catalonia,Priorat,NA,Michael Schachner,@wineschach,Genium Celler 2009 Red (Priorat),Red Blend,Genium Celler
41087,Italy,"Linear, fresh and tonic, this easy-drinking Gavi offers a lively mouthfeel accented by acidity and dusty mineral touches. Subdued aromas include white peach and almond blossom.",NA,86,16,Piedmont,Gavi,NA,NA,NA,La Zerba 2009  Gavi,Cortese,La Zerba
41106,Italy,"Here's a fresh Chardonnay from Venezia Giulia that drinks like one of those delightful Italian whites that pair so well with fish and Mediterranean dishes. It's a simple wine with fresh acidity, stone fruit and citrus.",Vigneto Vigne da Lis Maris,86,NA,Northeastern Italy,Venezia Giulia,NA,NA,NA,Di Lenardo 2009 Vigneto Vigne da Lis Maris Chardonnay (Venezia Giulia),Chardonnay,Di Lenardo
41108,France,"A big, burly wine with attractive tannins and rich plum and dark chocolate flavors. The wine is very accessible, ready to drink, a good value.",NA,86,15,Southwest France,Cahors,NA,Roger Voss,@vossroger,Domaine Brunet 2009 Malbec (Cahors),Malbec,Domaine Brunet
41259,US,"Maybe a tad off the pace from the excellent 2008, but still a wonderfully rich, complex wine. Pale in color, it tastes fresh and lively, with raspberry and cherry sour candy flavors accompanied by a burst of zesty acidity. Enjoyable now, and should gain bottle complexities over the next six years.",Bien Nacido Vineyard N Block,91,65,California,Santa Maria Valley,Central Coast,NA,NA,Tyler 2009 Bien Nacido Vineyard N Block Pinot Noir (Santa Maria Valley),Pinot Noir,Tyler
41275,France,"A rich wine with spice and red fruits, the tannins well integrated. It shows aging potential both from its ripe fruit and its dry, firm core. The wine is very structured, powerful, a fine example of this exceptional vintage.",Les Charmes,91,NA,Beaujolais,Morgon,NA,Roger Voss,@vossroger,Jacques Charlet 2009 Les Charmes  (Morgon),Gamay,Jacques Charlet
41388,Italy,"This gripping, delicious wine seamlessly weaves together sensations of blue flower, exotic incense, ripe black cherry, mature plum, cracked pepper, mocha, clove and graphite. It's already delicious and well balanced, with bracing tannins and racy acidity, but give it time to soften and develop complexity. Drink 2019–2029.",Fatica Contadina,94,34,Southern Italy,Taurasi,NA,Kerin O’Keefe,@kerinokeefe,Terredora Di Paolo 2009 Fatica Contadina  (Taurasi),Aglianico,Terredora Di Paolo
41685,Spain,"Aromas of graphite, asphalt, floral berry, black cherry and oak are harmonious and inviting. This wine feels juicy and rubbery, while black-fruit and plum flavors come with herbal notes and overt barrel notes. A fresh, juicy, zesty finish is pure Graciano.",Vendimia Seleccionada,89,19,Northern Spain,Rioja,NA,Michael Schachner,@wineschach,Viña Herminia 2009 Vendimia Seleccionada  (Rioja),Graciano,Viña Herminia
42015,US,"Fat, oily, unctuous and honeyed. Shows massive pineapple, mango, tangerine and Asian pear fruit, with a savory spiciness and plenty of sweet, smoky oak. As ripe as it is, it's saved from simplicity by brilliant acidity, a mineral cleanliness, and a thoroughly dry finish.",Heintz Vineyard,94,50,California,Russian River Valley,Sonoma,NA,NA,Williams Selyem 2009 Heintz Vineyard Chardonnay (Russian River Valley),Chardonnay,Williams Selyem
42020,US,"Superrich in pineapple, lime, kiwi and tropical fruit flavors, this lovely Chardonnay has a rich, balanced overlay of sweet, smoky oak. A blend of Lynmar's various vineyards, the wine's brisk acidity and minerality shine through, making the richness bright and clean. A brilliant Chardonnay to drink now.",La Sereinité,94,70,California,Russian River Valley,Sonoma,NA,NA,Lynmar 2009 La Sereinité Chardonnay (Russian River Valley),Chardonnay,Lynmar
42036,Chile,"A bit sharp and rubbery at first, with herbal, floral, berry aromas rising up in due time. The palate is a little rigid, with angular acidity and semitart raspberry and red currant flavors. Lightly toasted on the finish even if there's not much oak on this regular, competent CS.",Armador,85,12,Maipo Valley,NA,NA,Michael Schachner,@wineschach,Odfjell 2009 Armador Cabernet Sauvignon (Maipo Valley),Cabernet Sauvignon,Odfjell
42133,Chile,"The variety's requisite citrus and green aromas are on display, but they aren't very defined or exciting. Neither is the wet, chunky palate, which may be moderately fresh but doesn't offer much besides basic pineapple, kiwi and green melon. 270,000 cases made.",120,83,8,Central Valley,NA,NA,Michael Schachner,@wineschach,Santa Rita 2009 120 Sauvignon Blanc (Central Valley),Sauvignon Blanc,Santa Rita
42227,Italy,"Aromas of dried apricot, almond and pressed jasmine lead the nose. The firm palate offers fig, chestnut honey and a hint of baking spice. Pair it with vanilla ice cream or cream filled pastry.",Passito di Salina,88,36,Sicily & Sardinia,Malvasia delle Lipari,NA,Kerin O’Keefe,@kerinokeefe,Colosi 2009 Passito di Salina  (Malvasia delle Lipari),Moscato,Colosi
42460,US,"An elegant Syrah abundant in floral aromatics, demure in forward black and red fruit and a tinge of lavender. On the finish is pepper, the appropriate accent for a tastefully peppery meal.",Estate,88,28,California,Sierra Foothills,Sierra Foothills,Virginie Boone,@vboone,Martin Lane Winery 2009 Estate Syrah (Sierra Foothills),Syrah,Martin Lane Winery
42524,US,"This feels dramatic from the start. It's silky and refined in texture, with brisk acidity and a bite of tannic astringency. It shows a rich core of cherry, cola and sandalwood flavors. This should hang in there over the next five years.",Hawkster,90,66,California,Anderson Valley,NA,NA,NA,Maggy Hawk 2009 Hawkster Pinot Noir (Anderson Valley),Pinot Noir,Maggy Hawk
42525,US,"Tight and focused, this has a fine core of black cherry and cassis. Layers of coffee and dark chocolate are wrapped around the fruit, and the wine is compact and textural. Excellent now, but probably better in a few years.",NA,90,17,Washington,Columbia Valley (WA),Columbia Valley,Paul Gregutt,@paulgwine ,Maryhill 2009 Cabernet Sauvignon (Columbia Valley (WA)),Cabernet Sauvignon,Maryhill
42539,South Africa,"There's great richness to the nose, with a seriously decadent and robust apple-pie aroma. The palate shows a bit more balance and restraint, with ripe flavors of fig and melon fleshing out the creamy texture but staying bright thanks to lifting acidity. The evolving finish transitions from fruit to spice and finally ends on a citrus pith flavor.",Platinum,90,30,Elgin,NA,NA,Lauren Buzzeo,@laurbuzz,Rudera 2009 Platinum Chenin Blanc (Elgin),Chenin Blanc,Rudera
43100,US,"Striking acidity adds freshness to more rustic characteristics of cooked red fruit, caramelized sugar and hay on this medium-bodied Pinot. Brambly on the palate with hints of mushroom and foliage, it finishes clean with just a trace of tannins.",LUST,84,26,New York,Finger Lakes,Finger Lakes,Anna Lee C. Iijima,NA,Inspire Moore 2009 LUST Pinot Noir (Finger Lakes),Pinot Noir,Inspire Moore
43592,Italy,"Raw fruit notes of cherry and raspberry will find true dimension as this continues to age. There's a slightly sour note of bitter almond on the finish, and the mouthfeel is smooth and polished.",I Patriarchi,89,NA,Piedmont,Barbaresco,NA,NA,NA,Francone 2009 I Patriarchi  (Barbaresco),Nebbiolo,Francone
43798,US,"Fogarty continues its streak of great, Chablis-style Chardonnays with this single-vineyard bottling. True afficionados will love the dryness, acidity and minerality, which give it such great structure. The severity is relieved by flavors of citrus zest and white peach, and the creamy sourdough richness imparted by lees aging. Try aging it for at least six years.",Langley Hill Vineyard Estate Grown,92,50,California,Santa Cruz Mountains,Central Coast,NA,NA,Thomas Fogarty 2009 Langley Hill Vineyard Estate Grown Chardonnay (Santa Cruz Mountains),Chardonnay,Thomas Fogarty
43819,Portugal,"New-wood dominates this wine, with a very toasty quality, a seemingly sweet vanilla flavor and a touch of pepper from the alcohol. The black fruits are still burried under the wood character, although the fruits' weight suggests they will broaden out with time. Give this powerful effort at least four years.",Andreza Grande Reserva,92,28,Douro,NA,NA,Roger Voss,@vossroger,Wines & Winemakers 2009 Andreza Grande Reserva Red (Douro),Portuguese Red,Wines & Winemakers
43997,France,"95-97 Barrel sample. A beautiful wine, great elegance, delicacy and charm. The balance is perfect, with the freshest black currant character. At the center are dry tannins and solid texture.",Barrel sample,96,NA,Bordeaux,Margaux,NA,Roger Voss,@vossroger,Château Margaux 2009 Barrel sample  (Margaux),Bordeaux-style Red Blend,Château Margaux
43999,France,"92-94 Barrel sample. The wine feels very soft, with sweet spice and light tannins. It is packed with blackberry fruits, although there is a sold, firm structure under the ripe fruit.",La Dame de Montrose Barrel sample,93,NA,Bordeaux,Saint-Estèphe,NA,Roger Voss,@vossroger,Château Montrose 2009 La Dame de Montrose Barrel sample  (Saint-Estèphe),Bordeaux-style Red Blend,Château Montrose
44006,France,"91-93 Barrel sample. Very soft wine, with ripe Merlot dominant. There is a rich character along with fresh tannins, very juicy, licorice and big, firm fruits.",Les Carruades de Lafite Barrel sample,92,NA,Bordeaux,Pauillac,NA,Roger Voss,@vossroger,Château Lafite Rothschild 2009 Les Carruades de Lafite Barrel sample  (Pauillac),Bordeaux-style Red Blend,Château Lafite Rothschild
