id,country,description,designation,points,price,province,region_1,region_2,taster_name,taster_twitter_handle,title,variety,winery
25587,France,"This is a ripe and sunny wine full of tropical fruit and ripe apple flavors. Smooth and open, it has just enough crisp acidity at the end. Drink from 2018.",NA,85,19,Burgundy,Mâcon-Vinzelles,NA,Roger Voss,@vossroger,Cave des Grands Crus Blancs 2016  Mâcon-Vinzelles,Chardonnay,Cave des Grands Crus Blancs
26484,Portugal,"The wine, a blend of Antão Vaz, Arinto and Siria, comes from Vidigueira, one of the cooler regions of the Alentejo. That gives the wine its crispness while also allowing it to have a ripe yellow-fruit character. With its spice and final crisp acidity, the wine is ready to drink.",Pato Frio Selecção,87,10,Alentejano,NA,NA,Roger Voss,@vossroger,Ribafreixo 2016 Pato Frio Selecção White (Alentejano),Portuguese White,Ribafreixo
27501,New Zealand,"Cinnamon and clove notes accent fleshy fruit flavors of ripe pear and melon in this broad, nearly full-bodied wine. Those attractive spice notes linger on the finish.",Estate Grown,89,20,Marlborough,NA,NA,Joe Czerwinski,@JoeCz,Huia 2016 Estate Grown Pinot Gris (Marlborough),Pinot Gris,Huia
27990,US,"Juicy kiwi, lime blossom and sour apple candy aromas show on the nose of this ripe white—the first 2016 submitted from the region. The palate is oily in texture, with honeydew and more lime-kiwi-bubblegum flavors.",NA,86,24,California,South Coast,South Coast,Matt Kettmann,@mattkettmann,Hawk Watch Winery 2016 Viognier (South Coast),Viognier,Hawk Watch Winery
28656,US,"This unusual rosé is a cofermentation of 80% Pinot Noir and 20% Pinot Blanc. It's an uneasy compromise, with neither grape really taking the lead. Kind of like one of those awkward wine and food combos where the whole is less than either of its parts. Sour strawberry flavors thin out quickly; that's about it.",Rosé of Pinots,85,16,Oregon,McMinnville,Willamette Valley,Paul Gregutt,@paulgwine ,Yamhill Valley 2016 Rosé of Pinots Pinot Blanc-Pinot Noir (McMinnville),Pinot Blanc-Pinot Noir,Yamhill Valley
28665,France,"With plenty of citrus flavors, this wine is fruity while also tight and mineral textured. At this stage, it is all about acidity, so it needs to age for a few months. Drink from late 2017.",NA,85,14,Bordeaux,Bordeaux Blanc,NA,Roger Voss,@vossroger,Château de Parenchère 2016  Bordeaux Blanc,Bordeaux-style White Blend,Château de Parenchère
28677,France,"Showing the ripeness of the vintage, this is a smooth, lightly textured wine, with plenty of yellow and citrus fruits. The wine needs a few months, so drink from late 2017.",NA,84,10,Bordeaux,Bordeaux Blanc,NA,Roger Voss,@vossroger,Château de Costis 2016  Bordeaux Blanc,Bordeaux-style White Blend,Château de Costis
29755,US,"Extremely light in color and shy on the nose, this is closer to water than wine. The flavors are also faint, recalling only slight touches of red apple and pear.",Renaissance,83,22,California,California,California Other,Matt Kettmann,@mattkettmann,Reyes 2016 Renaissance Pinot Grigio (California),Pinot Grigio,Reyes
29830,US,"Despite its moderate alcohol, this dry, full-bodied Pinot Gris feels quite plush and plump. Ripe white peach and apricot flavors are honeyed in tone, off set by fresh acidity and a slightly steely finish.",NA,88,15,New York,Finger Lakes,Finger Lakes,Anna Lee C. Iijima,NA,Thirsty Owl Wine Company 2016 Pinot Gris (Finger Lakes),Pinot Gris,Thirsty Owl Wine Company
31125,US,"Aromas of white peach, honeysuckle and butterscotch are clean but quite plump on the nose of this widely available bottling. Tons of ripe stone fruit show on the palate, along with juicy apples and warm melons, cut by only the slightest acidity.",NA,85,10,California,Central Coast,Central Coast,Matt Kettmann,@mattkettmann,Castle Rock 2016 Chardonnay (Central Coast),Chardonnay,Castle Rock
31566,US,"Light copper-pink in color, this vineyard-designate shows a wealth of peach and orange flavors that combine to refreshing effect. Lightly made in a bright accessible style, the wine offers a moderate body weight and texture that's pleasing on the palate.",Wildcat Mountain Vineyard Rosé of,90,25,California,Sonoma Coast,Sonoma,Virginie Boone,@vboone,Parmeson 2016 Wildcat Mountain Vineyard Rosé of Pinot Noir (Sonoma Coast),Pinot Noir,Parmeson
31785,Australia,"This pale copper rosé blends 71% Shiraz with 16% Cabernet Sauvignon and 13% Sangiovese. Melon, stone fruit and citrus notes feature on the broad palate that comes into crisp focus on the long, mouthwatering finish. Drink now.",NA,89,22,Victoria,Bendigo,NA,Joe Czerwinski,@JoeCz,Fairbank Sutton Grange 2016 Rosé (Bendigo),Rosé,Fairbank Sutton Grange
32563,US,"Zesty tangerine peel, apple and pear abound on this crisp, light-bodied Riesling. It's not a deeply concentrated wine but dry and spry. The finish is a touch earthy. Drink now.",Reserve,86,14,New York,Finger Lakes,Finger Lakes,Anna Lee C. Iijima,NA,Fulkerson 2016 Reserve Riesling (Finger Lakes),Riesling,Fulkerson
33076,US,"Apricot aromas and tangy peach-skin flavors make this medium-bodied wine attractive and refreshing, while a slightly richer mouthfeel gives it more substance than expected.",NA,88,15,California,Lodi,Central Valley,Jim Gordon,@gordone_cellars,Klinker Brick 2016 Albariño (Lodi),Albariño,Klinker Brick
33566,US,"Pretty to look at and lovely in the mouth, this all-Pinot rosé offers gentle hints of plum, sour cherry and orangeade. Bracing acidity puts a tight, tangy twist to the finish.",Silver Linings Pinot Noir,88,17,Oregon,Oregon,Oregon Other,Paul Gregutt,@paulgwine ,Rainstorm 2016 Silver Linings Pinot Noir Rosé (Oregon),Rosé,Rainstorm
34583,Austria,"A restrained nose softly hints at tart berry and citrus. The palate is fresh but less precise when it comes to fruit: the body is light, dry and fresh, with a lasting note of citrus zestiness. With a clean finish and a tiny hint of grip, it's a wonderful rosé for the table.",Vom Kalk,90,15,Burgenland,NA,NA,Anne Krebiehl MW,@AnneInVino,Markus Altenburger 2016 Vom Kalk Rosé (Burgenland),Rosé,Markus Altenburger
34595,Austria,"Red apple and grapefruit zest are softly evoked on the nose. That same juicy combination plays on the light-bodied, dry palate. A zesty texture adds interest and crunch. The finish is clean and very refreshing.",NA,90,24,Kamptal,NA,NA,Anne Krebiehl MW,@AnneInVino,Steininger 2016 Riesling (Kamptal),Riesling,Steininger
35639,US,"This wine is a pretty very pale peach, almost bronze color. Light strawberry aromas are followed by bone-dry textured fruit flavors. Pink grapefruit lingers on the finish. Pair it with food to see it at its best.",Painted Hills Vineyard Grenache,88,22,Washington,Columbia Valley (WA),Columbia Valley,Sean P. Sullivan,@wawinereport,Kerloo 2016 Painted Hills Vineyard Grenache Rosé (Columbia Valley (WA)),Rosé,Kerloo
36130,Italy,"Made entirely with Nerello Mascalese, this charming rosato offers delicate but enticing scents of Spanish broom, aromatic herb and a whiff of Mediterranean scrub. The bright savory palate doles out wild cherry, strawberry compote, aromatic herb and a saline note alongside refreshing acidity.",NA,89,NA,Sicily & Sardinia,Etna,NA,Kerin O’Keefe,@kerinokeefe,Cottanera 2016 Rosato (Etna),Rosato,Cottanera
36131,Portugal,"Because this producer is in the southern Minho region, away from the northern Alvarinho vineyards, the wine is registered as Minho rather than Vinho Verde. But it has the same fine fruit and creamy richness that is typical of this grape. It could age a little longer, so wait until late 2017.",Pouco Comum,89,15,Minho,NA,NA,Roger Voss,@vossroger,Quinta da Lixa 2016 Pouco Comum Alvarinho (Minho),Alvarinho,Quinta da Lixa
36878,US,"The winery offers this bottling as a counterpart to their dry Riesling, but there's not much separation between the two. Its 10 g/L of residual sugar is certainly above threshhold, but with the searingly tart acidity underneath, it barely makes a dent. Citrus and apple flavors come through, but the sour lemon acidity is what dominates.",Perrydale Hills Vineyard Off-Dry,87,22,Oregon,Willamette Valley,Willamette Valley,Paul Gregutt,@paulgwine ,Samuel Robert 2016 Perrydale Hills Vineyard Off-Dry Riesling (Willamette Valley),Riesling,Samuel Robert
37282,US,"Balletto is making some fun, brightly crafted whites, like this floral, waxy one, that are not to be ignored amongst all its other estate offerings. Honey and white flower scents punctuate the nose before light, bright layers of lychee and orange flavors come through on the palate.",Estate Grown Estate Bottled,91,18,California,Russian River Valley,Sonoma,Virginie Boone,@vboone,Balletto 2016 Estate Grown Estate Bottled Gewürztraminer (Russian River Valley),Gewürztraminer,Balletto
37392,France,"This estate lies in a valley one set of ridges behind the Mediterranean. The sheltered location gives a warm style of wine, properly pale in color but also with delicious ripe red fruits touched by caramel. Drink the wine now.",Bain de Soleil,88,20,Provence,Côtes de Provence,NA,Roger Voss,@vossroger,Domaine Saint Roman d'Esclans 2016 Bain de Soleil Rosé (Côtes de Provence),Rosé,Domaine Saint Roman d'Esclans
37414,France,"This is a more serious style of rosé. It is structured with an edge of tannins that lead to richness as well as piles of delicious red-berry fruits and considerable balanced acidity. Owned by the Fabre family, this vineyard dates back to 1910. The estate produces the wine, although it is bottled by the Saint-Tropez cooperative. Drink now.",Domaine Aureillan,90,17,Provence,Côtes de Provence,NA,Roger Voss,@vossroger,Les Maîtres Vignerons de la Presqu'île de Saint-Tropez 2016 Domaine Aureillan Rosé (Côtes de Provence),Rosé,Les Maîtres Vignerons de la Presqu'île de Saint-Tropez
39213,Spain,Moderately floral aromas of stone fruits and fresh carrot juice feed into a round palate that's balanced and well shaped. Nectarine and peach flavors are nice and easy. This wine is slightly leesy-tasting on a medium-length finish.,Abadía de San Campio,89,20,Galicia,Rías Baixas,NA,Michael Schachner,@wineschach,Terras Gauda 2016 Abadía de San Campio Albariño (Rías Baixas),Albariño,Terras Gauda
39345,Spain,"This standard Verdejo is light on acidity, which is reflective of a hot year. Its citrus and green herb notes are fresh and prickly while its melon and thyme flavors lose intensity on the slightly bitter finish.",NA,87,14,Northern Spain,Rueda,NA,Michael Schachner,@wineschach,Beronia 2016 Verdejo (Rueda),Verdejo,Beronia
39365,Australia,"A great example of Margaret River flexing its Chardonnay muscles, and from a label producing wines of consistent quality and drinkability. Notes of smoke, lemon, melon, vanilla oak and a slight vegetal character lead into a nicely textured palate and a long, smokey finish. The acidity is rather searing at the moment, and the oak a bit apparent, but give this a little time and all will settle into place. Drink now–2025.",NA,91,30,Western Australia,Margaret River,NA,NA,NA,Stella Bella 2016 Chardonnay (Margaret River),Chardonnay,Stella Bella
40088,US,"This well-made wine is fermented in both stainless steel and neutral French oak. Aromas of freshly cut grass and honeysuckle dominate on the nose, while flavors of fig and lemon peel come into play on the racy palate.",NA,90,20,California,Alexander Valley,Sonoma,Virginie Boone,@vboone,Matanzas Creek 2016 Sauvignon Blanc (Alexander Valley),Sauvignon Blanc,Matanzas Creek
40122,US,"Aromas bring notes of beeswax, lees and lemon. The palate is medium bodied and creamy in feel, backed by zippy acidity. The variety isn't entirely distinct but, despite this, it delivers appeal.",NA,87,25,Washington,Walla Walla Valley (WA),Columbia Valley,Sean P. Sullivan,@wawinereport,Bontzu 2016 Pinot Gris (Walla Walla Valley (WA)),Pinot Gris,Bontzu
40792,France,"Guigal's Côtes du Rhône rosé is a blend of 70% Grenache, 20% Cinsault and 10% Syrah. It's a dark pink shade, rather full bodied and rich. Some earthy, savory notes help balance out the intense cherry-berry fruit, lingering on the finish.",NA,90,19,Rhône Valley,Côtes du Rhône,NA,Joe Czerwinski,@JoeCz,E. Guigal 2016 Rosé (Côtes du Rhône),Rosé,E. Guigal
40796,Austria,"Grapefruit peel, salty miso and white pepper create a savory and appetizing nose. The palate is slender and zippy, full of these spicy notes and enlivened by fresh lemon and green pear. It's a wonderfully easy but exciting Grüner: light but authentic, with lasting pepperiness.",Moosburgerin,90,19,Kremstal,NA,NA,Anne Krebiehl MW,@AnneInVino,Felsner 2016 Moosburgerin Grüner Veltliner (Kremstal),Grüner Veltliner,Felsner
41553,France,"Produced from organically grown grapes and bottled without added sulfur, this wine is full of life. With its juicy fruit and jammy texture, bursts with blackberry and black plum flavors. It's likely to age quickly, so drink from 2018.",Extra Libre,88,28,Southwest France,Cahors,NA,Roger Voss,@vossroger,Château du Cèdre 2016 Extra Libre Malbec (Cahors),Malbec,Château du Cèdre
41874,US,"Lightly sweet and very fruity, this wine is an easy-drinking, rather light-bodied choice for a picnic or for anyone with a sweet tooth.",NA,85,13,California,Mendocino,NA,Jim Gordon,@gordone_cellars,Husch 2016 Chenin Blanc (Mendocino),Chenin Blanc,Husch
42168,US,"Wet earth, pine needle and floral aromas and assertive menthol and lanolin flavors lend a bold, unorthodox personality to this full-bodied wine-in-a-can.",Finley Road Vineyard,83,10,California,Lake County,NA,Jim Gordon,@gordone_cellars,Sans Wine Co 2016 Finley Road Vineyard Sauvignon Blanc (Lake County),Sauvignon Blanc,Sans Wine Co
42172,France,"This wine is soft, smooth and bland. It has gentle fruit without the crisp edge necessary to give it a lift. Drink as an apéritif.",Champs de Provence,83,18,Provence,Côtes de Provence,NA,Roger Voss,@vossroger,Maison Denuzière 2016 Champs de Provence Rosé (Côtes de Provence),Rosé,Maison Denuzière
42179,US,"Light aromas of candle wax, kiwi and citrus lead to diluted fruit flavors. It lacks a sense of cohesion or variety.",The Expedition,82,16,Washington,Horse Heaven Hills,Columbia Valley,Sean P. Sullivan,@wawinereport,Canoe Ridge 2016 The Expedition Sauvignon Blanc (Horse Heaven Hills),Sauvignon Blanc,Canoe Ridge
42282,France,Organic grapes go into this light and fruity wine with its unexpected animal name. It is soft with bright red-berry fruits that are cut with acidity. The wine is dry with strong citrus flavors at the end. Drink now.,La Girafe Verte,86,17,Provence,Côtes de Provence,NA,Roger Voss,@vossroger,Château Barbanau 2016 La Girafe Verte Rosé (Côtes de Provence),Rosé,Château Barbanau
42288,Italy,"Here's a lively, informal white redolent of green apple, peach and citrus, with vibrant acidity. It's simple but well made, with a crisp, refreshing finish.",NA,86,15,Veneto,Soave,NA,Kerin O’Keefe,@kerinokeefe,Corte Giara 2016  Soave,White Blend,Corte Giara
44285,US,"There is a very juicy nose to this bottling, with dark plum, berry and the slightest hint of baking spice. Red cherry and cranberry flavors pop on the palate, alongside decent helping of clove-like spice, but it's the stony grip that takes this one to the next level.",Single Vineyard Rose of,88,36,California,Monterey County,Central Coast,Matt Kettmann,@mattkettmann,Le Mistral 2016 Single Vineyard Rose of Grenache (Monterey County),Grenache,Le Mistral
44313,US,"Bright aromas of orange blossom, night jasmine and gardenia are juxtaposed by a more mineral-driven backbone of wet cement. It's fairly light on its feet, with touches of sweetness, but more sprightly in tone, with fresh acidity and grippy texture taking it far beyond your grandma's Orange Muscat.",Margaret's Vineyard,88,16,California,Paso Robles,Central Coast,Matt Kettmann,@mattkettmann,Robert Hall 2016 Margaret's Vineyard Orange Muscat (Paso Robles),Orange Muscat,Robert Hall
44788,US,"Quite dry and reserved in flavor, this wine is intriguing: subtle rose petal and mineral notes, medium body and a bite of grapefruit zest on the finish that begs for another sip. One of the earliest producers of Gewürztraminer wines in Anderson Valley, it's still one of the best.",NA,92,22,California,Anderson Valley,NA,Jim Gordon,@gordone_cellars,Lazy Creek 2016 Gewürztraminer (Anderson Valley),Gewürztraminer,Lazy Creek
44838,Italy,"Made entirely with the native grape Bombino Nero, this informal light-bodied wine has subdued aromas of wild cherry and a hint of crushed herb. The aromas carry over to the über-simple palate along with a hint of pink grapefruit.",NA,84,10,Southern Italy,Castel del Monte,NA,Kerin O’Keefe,@kerinokeefe,Rivera 2016 Rosé (Castel del Monte),Rosé,Rivera
45252,US,"A whiff of spring blossoms introduces this lush richly textured Pinot Noir rosé. Its ripe and fruity, full of succulent berry, cherry and watermelon flavors, yet balanced neatly in acidity. Forward and fresh, it make for tempting summer guzzling.",Stony Lonesome Estate Reserve Dry Rosé of,89,16,New York,Finger Lakes,Finger Lakes,Anna Lee C. Iijima,NA,Three Brothers 2016 Stony Lonesome Estate Reserve Dry Rosé of Pinot Noir (Finger Lakes),Pinot Noir,Three Brothers
45326,US,"This brand reliably produces varietally correct, down-the-middle wines, and this is no exception, starting with aromas of Anjou pear, underripe honeydew, tight white-flower buds and freshly cut key lime. The ripe stone-fruit flavors on the sip are cut by citrus and wet cement, offering all the elements to please many a Sauv Blanc fan.",NA,88,12,California,Santa Barbara County,Central Coast,Matt Kettmann,@mattkettmann,SeaGlass 2016 Sauvignon Blanc (Santa Barbara County),Sauvignon Blanc,SeaGlass
45873,France,"This is a delicious soft wine with immediate fruity attraction. With its bright red-currant fruits and refreshing acidity, it is forward and ready to drink now. The wine is made from organic grapes.",L'Instant,86,18,Provence,Côtes de Provence,NA,Roger Voss,@vossroger,Château Barbanau 2016 L'Instant Rosé (Côtes de Provence),Rosé,Château Barbanau
47109,France,"Chardonnay from the producer's vineyards in Anjou is the base for this wine. It has a soft creamy texture that is light and fruity without any sign of wood aging. It is round, smooth and ready to drink now.",NA,85,15,Loire Valley,Pays de Loire,NA,Roger Voss,@vossroger,Domaine du Petit Clocher 2016 Chardonnay (Pays de Loire),Chardonnay,Domaine du Petit Clocher
47324,France,"As with many wines from brothers Martin and Mathieu Béraut, this is a blend of many grapes. The combination produces a typical herbal grassy wine, full of tangy citrus fruit and with a touch of apricot from the Petit Manseng in the blend. Drink this now.",Harmonie de Gascogne,85,12,Southwest France,Côtes de Gascogne,NA,Roger Voss,@vossroger,Domaine de Pellehaut 2016 Harmonie de Gascogne White (Côtes de Gascogne),White Blend,Domaine de Pellehaut
47328,France,"This is a warm and ripe style of Sauvignon Blanc. It has a crisp edge that is contrasted with the full white stone fruit and warm acidity. The fruitiness is intense, juicy and full of great final crispness.",Pigmentum,85,13,Southwest France,Côtes de Gascogne,NA,Roger Voss,@vossroger,Georges Vigouroux 2016 Pigmentum Sauvignon Blanc (Côtes de Gascogne),Sauvignon Blanc,Georges Vigouroux
47547,France,"This delicious wine from old Sémillon vines offers a hint of nuts and spice as well as crisp, clean fruit. It is lively with acidity as well as having a richer side. The wine will be just right from the end of 2017.",NA,88,17,Bordeaux,Bordeaux Blanc,NA,Roger Voss,@vossroger,Château Haut Mouleyre 2016  Bordeaux Blanc,Bordeaux-style White Blend,Château Haut Mouleyre
47548,France,"This crisp, clean wine has both fruit and acidity in just the right proportions. With lively acidity and hint of herbal and citrus flavors, it is a fine apéritif style. The aftertaste continues this bright and lively character.",NA,88,15,Bordeaux,Bordeaux Blanc,NA,Roger Voss,@vossroger,Château Mission Saint Vincent 2016  Bordeaux Blanc,Bordeaux-style White Blend,Château Mission Saint Vincent
49406,France,"There is a great burst of appealing acidity in this wine, accompanied by refreshing red fruits. This balanced wine is lively, crisp and with plenty of flavor. Drink now.",Château Haut Mondain,88,15,Bordeaux,Bordeaux Rosé,NA,Roger Voss,@vossroger,Château Les Hauts de Palette 2016 Château Haut Mondain Rosé (Bordeaux Rosé),Rosé,Château Les Hauts de Palette
49407,France,"Olivier Doujon made only 7,000 bottles of this 100% Merlot at the family estate in Fronsac. Rounded and ripe, this is a full-bodied wine with great fruitiness and attractive acidity. Well balanced, it offers red-cherry flavors with an edge of pepper. Drink the wine now.",NA,88,13,Bordeaux,Bordeaux Rosé,NA,Roger Voss,@vossroger,Château Magondeau 2016 Rosé (Bordeaux Rosé),Rosé,Château Magondeau
49412,France,"This lively wine comes from the Clarence Dillon group (Château Haut-Brion). It offers good balance between the considerable acidity and the red-berry fruit. With its spicy background, the wine is delicious to drink now.",NA,88,15,Bordeaux,Bordeaux Rosé,NA,Roger Voss,@vossroger,Clarendelle 2016 Rosé (Bordeaux Rosé),Rosé,Clarendelle
49541,US,"Welcoming bubblegum, key lime, grass and cement aromas check many Sauvignon Blanc boxes in this widely available and reliable bottling. The palate leads with decent structure, but then ripeness prevails, with peach and more bubblegum notes.",NA,87,17,California,Monterey County,Central Coast,Matt Kettmann,@mattkettmann,Slow Press 2016 Sauvignon Blanc (Monterey County),Sauvignon Blanc,Slow Press
49548,Chile,"Briny citrus aromas are mild to the point of quiet. This clear-looking SB is in solid shape on the palate. Peppery lightly zesty flavors include a note of sweet green melon, while this tastes a bit like jalapeño peppers on the finish.",Nimbus Single Vineyard,87,15,Casablanca Valley,NA,NA,Michael Schachner,@wineschach,Viña Casablanca 2016 Nimbus Single Vineyard Sauvignon Blanc (Casablanca Valley),Sauvignon Blanc,Viña Casablanca
49683,France,Ripe tropical fruit flavors give this wine from Sancerre producer Eric Louis its warm character. It has enough acidity to cut through the richness and give it a fruity aftertaste. It's ready to drink.,Alphonse Dolly Les Doigts d'Or de Dolly,86,14,France Other,Vin de France,NA,Roger Voss,@vossroger,Eric Louis 2016 Alphonse Dolly Les Doigts d'Or de Dolly Sauvignon Blanc (Vin de France),Sauvignon Blanc,Eric Louis
51472,Uruguay,"Odd aromas of burnt peanut and clove blend with murky fruit scents. This is raw and pulling on the palate, while clove and other oak-based flavors are front and center. Resiny oak and leftover clove notes push a hard finish. If you don't like clove, subtract a point or two from the score.",Reserva Familiar,83,12,Canelones,NA,NA,Michael Schachner,@wineschach,Montes Toscanini 2016 Reserva Familiar Tannat (Canelones),Tannat,Montes Toscanini
51616,France,"In this attractive blend, perfumed Vermentino is filled out by broad, ripe Chardonnay. The result is a wine that, while light, also has a rich character. Full of fruit, it's ready to drink.",Vermentino-Chardonnay,88,NA,France Other,Ile de Beauté,NA,Roger Voss,@vossroger,Domaine de Terra Vecchia 2016 Vermentino-Chardonnay White (Ile de Beauté),White Blend,Domaine de Terra Vecchia
52766,France,"This is a strongly herbal wine. Its acidity and crisp texture give it great lift, bringing out lively fruitiness and a green fruit aftertaste. Drink now.",Château les Jouberts Prestige,86,13,Bordeaux,Blaye Côtes de Bordeaux,NA,Roger Voss,@vossroger,Les Vignerons de Tutiac 2016 Château les Jouberts Prestige  (Blaye Côtes de Bordeaux),Bordeaux-style White Blend,Les Vignerons de Tutiac
52770,Portugal,"The wine is spicy, fruity with soft tannins and plenty of ripe red berries. Its dry core gives it shape along with a firm anchor for the generous fruitiness. Drink now.",Canoa,86,13,Lisboa,NA,NA,Roger Voss,@vossroger,Quinta do Conde 2016 Canoa Red (Lisboa),Portuguese Red,Quinta do Conde
53093,US,"A very appealing pale peach color, this wine brings aromas of strawberry and cherry. The flavors are tart and decisive, with a lingering finish.",And Why am I Mr. Pink? Rosé of,88,12,Washington,Columbia Valley (WA),Columbia Valley,Sean P. Sullivan,@wawinereport,Underground Wine Project 2016 And Why am I Mr. Pink? Rosé of Sangiovese (Columbia Valley (WA)),Sangiovese,Underground Wine Project
53119,US,"Very light in the glass, this bottling shows peach, melon, apple and key lime pith, which cuts through the riper elements. A simmering acidity is ever present on the sip, hewing the tropical guava flavors and providing a refreshing tension.",NA,89,35,California,Santa Ynez Valley,Central Coast,Matt Kettmann,@mattkettmann,Rideau 2016 Viognier (Santa Ynez Valley),Viognier,Rideau
53562,Italy,"Delicate scents of spring blossom and white stone fruit lead the way. The slightly off-dry linear palate shows finesse and freshness, offering white peach, pear and green apple set against crisp acidity and a refined perlage.",6° Senso Dry,89,23,Veneto,Valdobbiadene Prosecco Superiore,NA,Kerin O’Keefe,@kerinokeefe,Andreola 2016 6° Senso Dry  (Valdobbiadene Prosecco Superiore),Glera,Andreola
53567,France,"Rich and creamy, this is a delicious, ripe, and full style of Sauvignon. It has a light vanilla edge from its creamy texture as well as intense green-fruit acidity. The wine is concentrated and will be better to drink from 2018.",Domaine de la Charmoise,89,15,Loire Valley,Touraine,NA,Roger Voss,@vossroger,Henry Marionnet 2016 Domaine de la Charmoise Sauvignon Blanc (Touraine),Sauvignon Blanc,Henry Marionnet
