id,country,description,designation,points,price,province,region_1,region_2,taster_name,taster_twitter_handle,title,variety,winery
84922,Spain,"For a Valencia D.O. wine, this is darn appealing. The nose is warm, rooty and smells of cola nut, fresh raisins and cassis, while the driving palate offers roasted black fruit flavors along with sweet tomato and herbs. Drying and tannic on the finish, but balanced. Neither cooked nor overweight. Drink now through 2011.",N° 12 Selección Especial,90,35,Levante,Valencia,NA,Michael Schachner,@wineschach,Venta del Puerto 2006 N° 12 Selección Especial Red (Valencia),Red Blend,Venta del Puerto
85228,Spain,"There's an exotic twist to the nose, which rests on black cherry, plum and a splash of black coffee. The palate is sound and structured, with dark fruit flavors accented by spice and tea notes. Comfortable on the finish, with good tannins and acids holding it all together. Drink now.",Crianza,88,30,Northern Spain,Ribera del Duero,NA,Michael Schachner,@wineschach,Bodegas Qumrán 2006 Crianza  (Ribera del Duero),Tempranillo,Bodegas Qumrán
85391,US,"A good followup to last year's bottling, Cobblestone's '06 Chard hails from the Arroyo Seco, known for crisp, ripe, elegant white wines. It brims with pineapple, peach, tangerine, mineral, buttered toast and vanilla spice flavors.",NA,89,29,California,Arroyo Seco,Central Coast,NA,NA,Cobblestone 2006 Chardonnay (Arroyo Seco),Chardonnay,Cobblestone
85402,US,"This is one of those old-style field blend types of wines, with some other varieties besides Zin. A big, tannic, juicy, fruity wine, potent in jammy blackberry, blueberry, currant, dark unsweetened chocolate, coffee and pepper flavors that cry out for gilled beef, poultry or pork.",Coffaro Vineyards Old Vine,89,30,California,Dry Creek Valley,Sonoma,NA,NA,Wine Guerrilla 2006 Coffaro Vineyards Old Vine Zinfandel (Dry Creek Valley),Zinfandel,Wine Guerrilla
85454,US,"Super-fruity, offering a burst of chocolate-inspired cherries, raspberries and sweet, smoky vanilla and cedar. Fortunately, all this richness is balanced by fine tannins and acids. A lush wine to drink now, from a producer to keep your eye on.",NA,88,40,California,Lake County,NA,NA,NA,Zina Hyde Cunningham 2006 Cabernet Sauvignon (Lake County),Cabernet Sauvignon,Zina Hyde Cunningham
86094,France,"A big, fat, spicy wine flavored with white fruits and laced with crisp acidity. It is full and opulent, but not extravagantly so, the acidity cutting through richness, leaving yellow fruits and some toast.",Les Grands Charrons,89,NA,Burgundy,Meursault,NA,Roger Voss,@vossroger,Maison Champy 2006 Les Grands Charrons  (Meursault),Chardonnay,Maison Champy
86284,France,"A rounded, very soft Chardonnay from Chablis producer Simmonet-Febvre. There are green fruits, with hints of pears and light acidity. The edge of green tannin gives the wine some shape, but it is essentially soft. Screwcap.",NA,84,10,France Other,Vin de Pays des Portes de Méditerranée,NA,Roger Voss,@vossroger,Simonnet-Febvre 2006 Chardonnay (Vin de Pays des Portes de Méditerranée),Chardonnay,Simonnet-Febvre
86835,US,"Refreshing, varietally pure and crisp. That's the Bonterra style, and this Roussanne is right there. With partial barrel fermentation, it has smoky butter and vanilla notes that frame immaculate pineapple, pear, candied ginger and tangerine flavors. Enjoy this delicious, full-bodied white wine as an alternative to Chardonnay.",NA,90,18,California,Mendocino County,NA,NA,NA,Bonterra 2006 Roussanne (Mendocino County),Roussanne,Bonterra
87820,Italy,Prugnolo Gentile (another name for Sangiovese) is blended with small percentages of Merlot and Cabernet Sauvignon to produce a firmly intense wine with black fruit aromas and spicy cardamom. There's a gritty quality to the tannins and overall texture.,NA,88,19,Tuscany,Vino Nobile di Montepulciano,NA,NA,NA,Canneto 2006  Vino Nobile di Montepulciano,Prugnolo Gentile,Canneto
88163,France,"Black currants and spice provide the backbone to this classic Bordeaux red. There are dry tannins, some attractive smoky flavors, topped with acidity and a final, lightly wooded close.",NA,85,10,Bordeaux,Bordeaux,NA,Roger Voss,@vossroger,Barton & Guestier 2006  Bordeaux,Bordeaux-style Red Blend,Barton & Guestier
88384,US,"Shows the generosity and instant appeal of this fine vineyard, and also a structural integrity that lifts it above simple deliciousness. The cherry, orange, red licorice, cola and spice flavors are wrapped into firm tannins and brightened with cool coastal acidity.",Rancho Santa Rosa,91,45,California,Sta. Rita Hills,Central Coast,NA,NA,Rusack 2006 Rancho Santa Rosa Pinot Noir (Sta. Rita Hills),Pinot Noir,Rusack
88842,US,"Straightforward, this Chard shows well-ripened flavors of pineapple jam, nectarines, peaches and vanilla. It finishes with caramelized, butterscotchy sweetness.",NA,84,18,California,Santa Barbara County,Central Coast,NA,NA,Geode 2006 Chardonnay (Santa Barbara County),Chardonnay,Geode
88852,US,"Soft, jammy and simple, with ripe flavors of cherries, red plums, chocolate and smoky oak. Drink now.",Twelve Barrels,83,27,California,Sonoma County,Sonoma,NA,NA,Spann Vineyards 2006 Twelve Barrels Merlot (Sonoma County),Merlot,Spann Vineyards
89130,US,"This is a 100% Cabernet, grown further north than the winery's amazing Rockaway bottling, which is to say in a hotter area. Comparisons are inevitable. Although it's rich and even dramatic, it's not as impressive a wine, showing a raisiny edge to the black currants and chocolate. Doesn't have the balance for aging, so drink now with upscale beef and lamb dishes.",Brothers Ridge Single Vineyard,88,75,California,Alexander Valley,Sonoma,NA,NA,Rodney Strong 2006 Brothers Ridge Single Vineyard Cabernet Sauvignon (Alexander Valley),Cabernet Sauvignon,Rodney Strong
89278,Argentina,"Expensive Malbec, but there's no denying its quality and class. The bouquet is super smooth and silky, but also powerful. And that pretty much describes the palate: beautiful berry fruit rides a wave of richness that comes with accents of vanilla and pepper. Sexy, alluring wine with character.",Adrianna Vineyard,93,120,Mendoza Province,Mendoza,NA,Michael Schachner,@wineschach,Bodega Catena Zapata 2006 Adrianna Vineyard Malbec (Mendoza),Malbec,Bodega Catena Zapata
89816,US,"Light fruit, with milk chocolate in the nose and on the palate, yields a simple wine with tangy acidity. It's clean and fresh, but nondescript.",NA,85,26,Washington,Columbia Valley (WA),Columbia Valley,Paul Gregutt,@paulgwine ,Locati Cellars 2006 Sangiovese (Columbia Valley (WA)),Sangiovese,Locati Cellars
90066,US,"A lovely Syrah, dry, rich and deeply structured. Appeals immediately   for currant, mocha, Provençal herb and peppery spice flavors that have an exotic edge of balsam-splashed grilled Portobellos. Best now and through 2009.",NA,90,19,California,Sonoma County,Sonoma,NA,NA,Novy 2006 Syrah (Sonoma County),Syrah,Novy
90072,Chile,"Very nicely done, with full-force berry and plum balancing off mild vegetal/herbal aromas. The palate is ripe, round and textured, with alluring plum, berry, leather and vanilla flavors. It folds in cinnamon and pepper on the finish to bring everything full circle, while keeping the herbal element under control; 60% Carmenère and 40% Malbec.",Tributo Edicion Limitada Carmenère-Malbec,89,30,Colchagua Valley,NA,NA,Michael Schachner,@wineschach,Caliterra 2006 Tributo Edicion Limitada Carmenère-Malbec Red (Colchagua Valley),Red Blend,Caliterra
90514,US,"This is a powerful, gutsy Cabernet, currently lacking finesse. It's young, dry and brash, with sticky tannins and unmelded flavors and textures. The blackberry, cherry and oak flavors are sweet and delicious. Seems best now and soon, although it could be a sleeper.",Sycamore Vineyard,90,70,California,Rutherford,Napa,NA,NA,Freemark Abbey 2006 Sycamore Vineyard Cabernet Sauvignon (Rutherford),Cabernet Sauvignon,Freemark Abbey
91004,Italy,"This expression of Aglianico offers delicate shadings of almond paste, sweet spice, candied fruit, pipe tobacco and cedar wood. The mouthfeel is simple and clean and ends with a burst of sour cherries.",Vigna Quattro Confini,86,21,Southern Italy,Irpinia,NA,NA,NA,Benito Ferrara 2006 Vigna Quattro Confini Aglianico (Irpinia),Aglianico,Benito Ferrara
91013,France,The winemaking team of Château Lafite makes one of the better branded Bordeaux. This 2006 has tobacco aromas followed by flavors of fresh black currants with an attractive smoky character and a fine line of balancing acidity.,Réserve Spéciale,86,45,Bordeaux,Pauillac,NA,Roger Voss,@vossroger,Domaines Barons de Rothschild (Lafite) 2006 Réserve Spéciale  (Pauillac),Bordeaux-style Red Blend,Domaines Barons de Rothschild (Lafite)
91084,Italy,"Here's a bright and sharp rendition of Cabernet Sauvignon (and 10% Merlot) with background notes of wild berries, forest floor and vanilla bean. The wine is tonic and lean with a determined blast of freshness on the close.",Argillaia Intenso,87,20,Veneto,Veneto,NA,NA,NA,Fabiano 2006 Argillaia Intenso Cabernet Sauvignon (Veneto),Cabernet Sauvignon,Fabiano
91503,Austria,"A soft wine, with fresh fruit and floating, light acidity. There is a poised, balanced structure of green apple skins, and just a touch of pepper.",Weingebirge Federspiel,89,36,Wachau,NA,NA,Roger Voss,@vossroger,Nikolaihof 2006 Weingebirge Federspiel Grüner Veltliner (Wachau),Grüner Veltliner,Nikolaihof
91822,France,"A crisp, fresh, intensely dry wine that is balanced by some ripe caramel and red currant flavors. This is a rosé in the Provence tradition, dry, designed for food.",Le Mazet Rosé,86,9,Languedoc-Roussillon,Vin de Pays de L'Herault,NA,Roger Voss,@vossroger,Moulin de Gassac 2006 Le Mazet Rosé Red (Vin de Pays de L'Herault),Rhône-style Red Blend,Moulin de Gassac
91828,South Africa,"Cherry, pepper and spice on the nose are followed by similar flavors in this dry red. Balanced and touched with oak, the wine will pair well with grilled meats and spiced dishes. For fans of softer wines, age this for a few years before drinking.",NA,86,10,Darling,NA,NA,Susan Kostrzewa,@suskostrzewa,Westerland 2006 Pinotage (Darling),Pinotage,Westerland
92542,US,"Quite delicious, and loaded with wild berry flavors and herbal highlights, this impressive wine is almost pure Mourvèdre—just 4% Syrah was blended in. Twenty months in a mix of Hungarian, French and American oak has begun to soften its rather hard and slightly stemmy tannins. Further aging—up to five years—is recommended.",den Hoed Vineyard,89,26,Washington,Yakima Valley,Columbia Valley,Paul Gregutt,@paulgwine ,Trio Vintners 2006 den Hoed Vineyard Mourvèdre (Yakima Valley),Mourvèdre,Trio Vintners
92551,Argentina,"Mossy and quite woody, and maybe even bretty, but also rich and stout, with concentration. Aromas of cheesey black fruit are staunch, while the round palate has richness, thickness and flavors of molasses, baked berries and licorice. Finishes surprisingly quick.",Reserva,87,20,Other,Neuquén,NA,Michael Schachner,@wineschach,Valle Perdido 2006 Reserva Malbec (Neuquén),Malbec,Valle Perdido
92680,Italy,"Here is a full-force Pinot Bianco with compelling notes of mature apricot, candied fruit, honey, pine nut and maple syrup. The wine has a saturated, golden hue and resin-like flavors that add texture and dimension.",Pinot Bianco,87,NA,Northeastern Italy,Friuli Grave,NA,NA,NA,Castello di Porcìa 2006 Pinot Bianco Pinot Bianco (Friuli Grave),Pinot Bianco,Castello di Porcìa
92689,Chile,"Spice and pepper aromas act as a welcoming party, with cherry and raspberry scents sitting in reserve. The palate is herbal but fairly fruity, with fresh acidity and a solid, if not the most deep and lasting, finish. Despite showing some typical leafy qualities, this is good, young Carmenère.",Reserva,87,10,Maule Valley,NA,NA,Michael Schachner,@wineschach,Chilcas 2006 Reserva Carmenère (Maule Valley),Carmenère,Chilcas
92706,France,"Crisp and fresh, with a steely character, the fruit is fresh and forward, with citrus and spice flavors. The weight is here, giving density to this vibrant, delicious wine.",Morgeot Premier Cru,91,NA,Burgundy,Chassagne-Montrachet,NA,Roger Voss,@vossroger,Remoissenet Père et Fils 2006 Morgeot Premier Cru  (Chassagne-Montrachet),Chardonnay,Remoissenet Père et Fils
92724,US,"It's quite good, a dry, full-bodied wine with complex, mashed blackberry and cherry fruit baked into peppery, cinnamony pie crust. There are additional, savory nuances of tamari, broiled ground beef and sweet Provençal herbs. Have this dry, powerful Syrah with fine roasted meats.",Guyzer Block,91,38,California,Russian River Valley,Sonoma,NA,NA,Davis Family 2006 Guyzer Block Syrah (Russian River Valley),Syrah,Davis Family
93048,Italy,"Castello Banfi's 2006 Brunello opens with smooth and soft cherry flavors and is packed tight with background aromatics that include tobacco, cola, leather and more dark fruit. The wine's texture is silky, crisp and long-lasting.",NA,92,55,Tuscany,Brunello di Montalcino,NA,NA,NA,Castello Banfi 2006  Brunello di Montalcino,Sangiovese Grosso,Castello Banfi
93054,New Zealand,"Still youthful, showing hints of toast and vanilla on the nose, this full-bodied yet elegant offering features flavors of tart cherries balanced by brown sugar. Give this velvety-textured Pinot Noir another year or two to settle down and integrate, then drink it over the next 4–6 years.",Prima Donna,91,75,Waipara Valley,NA,NA,Joe Czerwinski,@JoeCz,Pegasus Bay 2006 Prima Donna Pinot Noir (Waipara Valley),Pinot Noir,Pegasus Bay
93063,Italy,"This is a nicely balanced wine with bright cherry and berry flavors that are offset by sweet spice, almond and toasted oak. The wood elements already show integration and will continue to diminish with time. Give this wine five or so more years of cellar aging.",NA,91,68,Tuscany,Brunello di Montalcino,NA,NA,NA,Canalicchio di Sopra 2006  Brunello di Montalcino,Sangiovese Grosso,Canalicchio di Sopra
93064,Italy,"Round, soft and velvety, this beautiful Riserva Chianti Classico offers a huge bouquet with mature cherry and black fruit aromas. The mouthfeel is tight, streamlined and compact.",Riserva,91,27,Tuscany,Chianti Classico,NA,NA,NA,Carpineto 2006 Riserva  (Chianti Classico),Sangiovese,Carpineto
93250,US,"This Loess is definitely more—more concentration, more ripeness, more Côte Rôtie character than the 2005, but already showing dramatic flavor development. Cofermented with 3% Viognier, it's a silky wine with flavors of blood, meat and earth dominating. Tannins are ripe, and it was barreled in second-fill oak, preserving the natural flavors of the vineyard. Clearly the best so far from Waters.",Loess Vineyard,92,40,Washington,Walla Walla Valley (WA),Columbia Valley,Paul Gregutt,@paulgwine ,Waters 2006 Loess Vineyard Syrah (Walla Walla Valley (WA)),Syrah,Waters
93252,France,"An initially wood-laden wine that only slowly reveals the rich fruit character. There is wood certainly, but the spice integrates well with the green fruits and the intense minerality. The great steely backbone on this wine indicates it will age.",Valmur Grand Cru,92,78,Burgundy,Chablis,NA,Roger Voss,@vossroger,Domaine Christian Moreau Père et Fils 2006 Valmur Grand Cru  (Chablis),Chardonnay,Domaine Christian Moreau Père et Fils
93429,Italy,"This is a beautiful sparkler with outstanding purity of aromas: Peach blossom, kiwi, exotic fruit, floral tones and caramel candy form a delicate embroidery. It boasts perky sweetness in the mouth with refreshing crispness on the close.",Cartizze,90,35,Veneto,Prosecco Superiore di Cartizze,NA,NA,NA,Bortolomiol 2006 Cartizze  (Prosecco Superiore di Cartizze),Prosecco,Bortolomiol
93494,Portugal,"This dry Vinho Verde shows great crisp, green apple and grapefruit flavors, a deliciously fresh wine, with green edges and lively flavors. Great summer drink.",NA,88,8,Vinho Verde,NA,NA,Roger Voss,@vossroger,Casa de Vila Verde 2006 White (Vinho Verde),Portuguese White,Casa de Vila Verde
93783,Austria,"With its label depicting the Queen of the Night in Mozart's Magic Flute opera, this is a huge and dry wine, despite its 20% botrytis. A wine to admire for its concentration, it demands attention as well as aging.",Unendlich Smaragd,94,145,Wachau,NA,NA,Roger Voss,@vossroger,F X Pichler 2006 Unendlich Smaragd Riesling (Wachau),Riesling,F X Pichler
95085,Australia,"Elderton is making classically styled Barossa Shiraz, marrying raspberry fruit with rich chocolaty overtones and wrapping them in a soft cocoon of supple tannins and balanced acidity. Drink now–2014.",NA,90,28,South Australia,Barossa,NA,Joe Czerwinski,@JoeCz,Elderton 2006 Shiraz (Barossa),Shiraz,Elderton
95750,US,"This is rather soft on entry, a buttery, meaty, forward and appealing Pinot, with a layered palate of black raspberry, black cherry, sassafras, cinnamon and vanilla bean. The tannins are substantial and a bit green, but the edges are nicely honed, and the green tea bitterness is largely held in abeyance. The wine carries its 14.5% alcohol with graceful charm.",Stermer Vineyard,89,48,Oregon,Willamette Valley,Willamette Valley,Paul Gregutt,@paulgwine ,Lemelson 2006 Stermer Vineyard Pinot Noir (Willamette Valley),Pinot Noir,Lemelson
95758,US,"Martin Ray has done a great job combining vineyards from multiple counties to produce this supple, polished, affordable Cabernet Sauvignon. With some Merlot and Cab Franc for complexity, it has flavors of black currants, cherries and smoky oak, and is fully ready to drink now.",NA,89,20,California,Napa-Mendocino-Sonoma,North Coast,NA,NA,Martin Ray 2006 Cabernet Sauvignon (Napa-Mendocino-Sonoma),Cabernet Sauvignon,Martin Ray
96235,US,"Lusty and forward, this Cab blasts off with explosive cherry, red and black currant, licorice, spicy red plum and mocha flavors. Not very subtle, but it's dry and rich in steak-busting tannins.",NA,85,16,California,Mendocino County,NA,NA,NA,Bonterra 2006 Cabernet Sauvignon (Mendocino County),Cabernet Sauvignon,Bonterra
96465,US,"Hard in tannins and bone dry, this Malbec needs rich beef dishes to balance out the astringency. It has a ripe heart of blackberries and currants, and is at its best now. Decant for a few hours.",Solstice,86,28,California,Paso Robles,Central Coast,NA,NA,Midnight 2006 Solstice Malbec (Paso Robles),Malbec,Midnight
96729,France,"An impressive quality of Cahors is that you can find a wine as concentrated and dense as this without excessive alcohol. This 2006, wood aged, with touches of eucalyptus, is a big hearted, black fruit dominated wine, smooth and powerful, and just so well balanced for food. Can drink now, but better age for 3–5 years.",NA,92,40,Southwest France,Cahors,NA,Roger Voss,@vossroger,Château Lagrézette 2006 Malbec (Cahors),Malbec,Château Lagrézette
97165,US,"Too sweet, with a sugary finish that tastes like lemonade and pineapple juice.",NA,82,10,California,Central Coast,Central Coast,NA,NA,Cycles Gladiator 2006 Chardonnay (Central Coast),Chardonnay,Cycles Gladiator
97170,US,"Rustic and tough but dry, with berry and currant flavors and a spicy finish. Drink now.",Estate Grown,82,19,California,Paso Robles,Central Coast,NA,NA,Lions Peak 2006 Estate Grown Cabernet Sauvignon (Paso Robles),Cabernet Sauvignon,Lions Peak
97275,Italy,"Sedàra, an easy-going Nero d'Avola from the dynamic Donnafugata winery in Marsala, Sicily, is not its usual self this year. Aromas of earth, red beet and root eclipse the purity of the fruit. The wine has ripe, gritty tannins and palate-cleaning power on the finish.",Sedàra,84,15,Sicily & Sardinia,Sicilia,NA,NA,NA,Donnafugata 2006 Sedàra Nero d'Avola (Sicilia),Nero d'Avola,Donnafugata
97285,Italy,"Aromas of candied fruit shape a ripe and slightly jammy wine with aromas of cooked blueberry and bramble. The wine is not too thick and heavy and, in fact, adds a refreshing element of crispness in the mouth. A Marc de Grazia selection, various American importers.",NA,84,15,Southern Italy,Salento,NA,NA,NA,Masserie Pisari 2006 Negroamaro (Salento),Negroamaro,Masserie Pisari
97291,Portugal,"Fruity and ripe, this is a spicy wine, with red cherry and berry flavors, livened by dried raisins. There is a rustic edge that puts it simply in its place, but the acidity is fine and so is the dry tannic core.",Farizoa,84,10,Alentejano,NA,NA,Roger Voss,@vossroger,Companhia das Quintas 2006 Farizoa Red (Alentejano),Portuguese Red,Companhia das Quintas
97759,Italy,"Alleanza represents a successful collaboration between winemakers in Italy and California. The 70-30 blend consists of Merlot and Sangiovese and the wine is seductively redolent of wild berries, exotic spice, soft chocolate and mild tobacco. The plush mouthfeel wins points thanks to the smooth and silky nature of the finish.",Alleanza,92,35,Tuscany,Toscana,NA,NA,NA,Castello di Gabbiano 2006 Alleanza Red (Toscana),Red Blend,Castello di Gabbiano
97917,US,"This is rich and fruity and direct. It appeals for its acid-laced lime, kiwi, passionfruit and pineapple flavors and rich, smoky coat of oak.",Rosella's Vineyard,85,19,California,Santa Lucia Highlands,Central Coast,NA,NA,Novy 2006 Rosella's Vineyard Chardonnay (Santa Lucia Highlands),Chardonnay,Novy
97937,Portugal,"A success in the sweeter Vinho Verde category. There is pleasant softness, flavors of green berries, grapefruit with sugar and freshness.",Santola,84,6,Vinho Verde,NA,NA,Roger Voss,@vossroger,Messias 2006 Santola White (Vinho Verde),Portuguese White,Messias
98559,Italy,"This is a gorgeous, compelling wine of power and finesse. It has a captivating fragrance of earth, leather, black fruit and incense accented with whiffs of exotic spice. The palate is rich but refined, delivering ripe black cherry, blue berry, tobacco and baking spices along with enveloping, velvety tannins. Drink 2016–2036.",Radici Riserva,95,75,Southern Italy,Taurasi,NA,Kerin O’Keefe,@kerinokeefe,Mastroberardino 2006 Radici Riserva  (Taurasi),Aglianico,Mastroberardino
99588,Italy,"Here's a beautiful Riserva Pinot Bianco that delivers intense aromas of stone fruit, honey, melon and toasted almond. The wine rests on the lees for eight months for extra heft and density on its naturally rich texture. Pair it with shellfish or white meat.",Riserva,91,36,Northeastern Italy,Collio,NA,NA,NA,Russiz Superiore 2006 Riserva Pinot Bianco (Collio),Pinot Bianco,Russiz Superiore
99683,US,"This is a blend of some of the winery's best vineyards. The '06 is quite a good wine, but showcases some of the limitations of the vintage. Structurally, it's fine, with a good acid-tannin balance, but it could be more concentrated. The cherry and currant flavors are a little unfocused.",Westside Road Neighbors,89,65,California,Russian River Valley,Sonoma,NA,NA,Williams Selyem 2006 Westside Road Neighbors Pinot Noir (Russian River Valley),Pinot Noir,Williams Selyem
99812,South Africa,"A nose of minerals, black fruit and dried lavender is the start of this stylish wine from Black Rock. On the palate, assertive flavors of blueberry, cherry and spice are lifted by fresh minerality. The finish is clean but lingering. An intriguing wine that offers elegance with an exotic touch.",Red Blend,89,24,Swartland,NA,NA,Susan Kostrzewa,@suskostrzewa,Black Rock 2006 Red Blend Red (Swartland),Rhône-style Red Blend,Black Rock
99818,US,"A very nice Chard that, at seven bucks less than the winery's Premier Reserve, is nearly as good. Dry and crisp in acidity, it has rich honey, pineapple and smoke flavors. How can a wine taste like honey and be dry? It's called magic.",NA,89,17,California,Mendocino,NA,NA,NA,Navarro 2006 Chardonnay (Mendocino),Chardonnay,Navarro
99986,South Africa,"Here's an interesting Cape Blend with 56% Cabernet Sauvignon, 30% Pinotage and 14% Petit Verdot that's different yet straightforward and approachable. Kirsch, black plum guts, rubber and vanilla start off on the nose, while the finish provides interesting hints of smoked cured meat and tobacco. Medium weight with soft tannins, this is a good partner for gamy dishes.",The William,87,17,Coastal Region,NA,NA,Lauren Buzzeo,@laurbuzz,Graham Beck 2006 The William Red (Coastal Region),Red Blend,Graham Beck
100023,Italy,"This firm and austere Taurasi opens with dark aromas of plum cake, chocolate, dried currant, cola and smoky barbecue sauce. The tannins are firm and dense and the wine needs a few more years of cellar aging before it softens.",NA,90,34,Southern Italy,Taurasi,NA,NA,NA,Donnachiara 2006  Taurasi,Aglianico,Donnachiara
100183,US,"A very nice Cab Franc that shows how well this variety can do in the Sierra Foothills. It's quite soft and light in body, making it a wine for early drinking. But it offers waves of cherries, anisettte liqueur, cocoa, pepper and mint flavors that are delicious.",Counterpoint,87,24,California,El Dorado,Sierra Foothills,NA,NA,R & B Cellars 2006 Counterpoint Cabernet Franc (El Dorado),Cabernet Franc,R & B Cellars
100596,US,"With a touch of smoky, honeyed oak, this Chard has forward peach, pear and tropical fruit flavors, balanced with a crisp streak of acidity. Nice and versatile, it's a good Chard at a fair price.",NA,85,12,California,Central Coast,Central Coast,NA,NA,Tortoise Creek 2006 Chardonnay (Central Coast),Chardonnay,Tortoise Creek
100661,France,"89—91 Barrel sample. Owned by Hubert de Bouärd of Château Angélus, this is an example of what can be done in the lesser appellations if money is no object. It is smooth, ripe, with new wood but not too much, powered by top quality, densely dry tannins.",Barrel sample,90,NA,Bordeaux,Lalande de Pomerol,NA,Roger Voss,@vossroger,Château la Fleur de Boüard 2006 Barrel sample  (Lalande de Pomerol),Bordeaux-style Red Blend,Château la Fleur de Boüard
