id,country,description,designation,points,price,province,region_1,region_2,taster_name,taster_twitter_handle,title,variety,winery
42638,France,"This mineral-dominated Malbec is dry, packed with tannins as well as black currants and wild berries. It is on the austere side, finishing with intense acidity.",Château Nozières,87,14,Southwest France,Cahors,NA,Roger Voss,@vossroger,Domaine du Grand Cros 2005 Château Nozières Malbec (Cahors),Malbec,Domaine du Grand Cros
42952,US,"Don't look for density or any particular varietal focus here, but what you will find is a pleasing, soft, smooth wine with black cherry, licorice, smoke and chocolate. It's all front-loaded and fruit-driven, but if you want something to enjoy right now, preferably outdoors, with some butterfat in the soft, pliable tannins, this wine will deliver the goods.",NA,87,28,Oregon,Rogue Valley,Southern Oregon,Paul Gregutt,@paulgwine ,Del Rio 2005 Merlot (Rogue Valley),Merlot,Del Rio
43203,Italy,"Suolo is a beautiful accomplishment and one of the most pleasing and delicate expressions of Sangiovese to be found. What's so outstanding about this wine is its balanced elegance. Aromas include intense red cherry, light chocolate shavings and vanilla bean. This wine boasts a modern, international persona that translates into supple smoothness and a soft, velvety mouthfeel.",Suolo,93,120,Tuscany,Toscana,NA,NA,NA,Argiano 2005 Suolo Sangiovese (Toscana),Sangiovese,Argiano
43208,Italy,"This modern red from the Montalcino area of Tuscany exhibits amazing chocolate-like intensity with dark shades of espresso bean, black cherry, vanilla, incense and strawberry cola. It has so much cherry in the mouth it recalls cherry liqueur or cherry-chocolate cake.",S.J. (San Jacopo),92,36,Tuscany,Toscana,NA,NA,NA,Fuligni 2005 S.J. (San Jacopo) Red (Toscana),Red Blend,Fuligni
43219,Germany,"This is a rich, succulent wine, more akin to an auslese than a true spätlese. Dried apricot and orange marmalade aromas and flavors surround a core of dried spices and crushed stone, finishing on a spicy, mineral note. Drink now–2025.",Erbacher Marcobrunn Spätlese,92,36,Rheingau,NA,NA,Joe Czerwinski,@JoeCz,Langwerth Von Simmern 2005 Erbacher Marcobrunn Spätlese Riesling (Rheingau),Riesling,Langwerth Von Simmern
43784,US,"Easton's estate Zin is big and lusty in blackberry, currant, licorice and spice flavors that are wrapped into sturdy tannins. It's a little on the superextracted, sweetly jammy side that emphasizes the fruit and pushes the wine's structural elements to the sideline. Could be an ager.",Estate Bottled,87,30,California,Shenandoah Valley (CA),Sierra Foothills,NA,NA,Easton 2005 Estate Bottled Zinfandel (Shenandoah Valley (CA)),Zinfandel,Easton
43791,Italy,"This blend of Cabernet Sauvignon, Sangiovese and Merlot delivers warm tones of mature berry fruit with nice earthy renderings and a determined, mineral-driven backbone. Delicate aromas of berry fruit and dried violets are backed by deep spice flavors and firm tannins that are slightly on the green side.",Foresco,87,18,Central Italy,Umbria,NA,NA,NA,Barberani 2005 Foresco Red (Umbria),Red Blend,Barberani
44950,France,"Powerful, ripe wine, plump and structured. There are fresh black cherries and plums and structure that promises some aging.",NA,88,NA,Burgundy,Gevrey-Chambertin,NA,Roger Voss,@vossroger,Corton André 2005  Gevrey-Chambertin,Pinot Noir,Corton André
45051,Italy,"Notes of eucalyptus, dried rosemary, humus, licorice, black olive and dark berry give this a unique personality. It glides smoothly over the palate thanks to its supple, velvety tannins, and it finishes with an additional bright spot of tangy green herb.",Terre di San Zeno,91,55,Veneto,Amarone della Valpolicella Classico,NA,NA,NA,Corteforte 2005 Terre di San Zeno  (Amarone della Valpolicella Classico),"Corvina, Rondinella, Molinara",Corteforte
46206,US,"A very tight, tart and tannic Pinot Noir, almost impossible to open up despite hours of breathing. Acidic and unyielding, the rating is a compromise between what it is currently showing and what it hints at if you probe deeply enough.",Cuvée Romy,88,90,Oregon,Oregon,Oregon Other,Paul Gregutt,@paulgwine ,Gypsy Dancer 2005 Cuvée Romy Pinot Noir (Oregon),Pinot Noir,Gypsy Dancer
46616,US,"Rather overripe, this Cab has the flavors of stewed or baked blackberries and raisins. On the plus side are rich chocolate and anise notes, smooth, firm tannins and a dry, spicy finish.",Le Vigne di San Domenico,84,25,California,Paso Robles,Central Coast,NA,NA,Sylvester 2005 Le Vigne di San Domenico Cabernet Sauvignon (Paso Robles),Cabernet Sauvignon,Sylvester
46617,Australia,"A medium-bodied red blend that will go with just about anything a weeknight meat-based dinner might entail, this wine offers hints of smoke and charred wood to go with plummy fruit and a tart, tangy finish. Drink now.",Merlot - Cabernet Sauvignon - Shiraz,84,13,Victoria,Murray-Darling,NA,Joe Czerwinski,@JoeCz,Tall Poppy 2005 Merlot - Cabernet Sauvignon - Shiraz Red (Murray-Darling),Red Blend,Tall Poppy
46624,Portugal,"Soft berry fruits, touches of wood vanilla and creamy caramel make for an accessible wine, simple, finishing with fresh acidity.",Late Bottled Vintage,85,NA,Port,NA,NA,Roger Voss,@vossroger,Quinta Santa Eufemia 2005 Late Bottled Vintage  (Port),Port,Quinta Santa Eufemia
47286,Italy,"This is an oak-heavy red wine from Southern Italy that is embellished by aromas of vanilla, toast and spice that sit heavy over a rich core of ripe fruit. The wine is firm and streamlined in the mouth and offers a hint of sour cherry on the close. This vintage represents a huge jump forward in quality compared to 2004.",Riserva,87,15,Southern Italy,Salice Salentino,NA,NA,NA,Leone de Castris 2005 Riserva Red (Salice Salentino),Red Blend,Leone de Castris
47310,US,"A very good wine, although a very young one that needs time. It's not because the tannins are hard, because they're not. But the primary blackberry and cherry flavors haven't married with the oak, despite the wine being more than three years of age. The grapes come from a tenderloin of the appellation that's known for quality. Best after 2009.",Red Winery Vineyard,91,60,California,Alexander Valley,Sonoma,NA,NA,Hawkes 2005 Red Winery Vineyard Cabernet Sauvignon (Alexander Valley),Cabernet Sauvignon,Hawkes
47773,US,"Wonderfully rich with lush dark chocolate and espresso notes, this is another lovely, highly drinkable Merlot from Comtesse Thérèse. There's a good amount of charred oak, but it's integrated seamlessly with concentrated black plum and berry flavors. The finish is long, and accented by pleasant astringency of walnut skins and tobacco.",Traditional,87,18,New York,North Fork of Long Island,Long Island,Anna Lee C. Iijima,NA,Comtesse Thérèse 2005 Traditional Merlot (North Fork of Long Island),Merlot,Comtesse Thérèse
48273,US,"This is easily Cuvaison's best Pinot Noir ever. It's not only delicious right out of the bottle, it's an ager. Really flatters the palate with appealing cherry, black raspberry, cola and tangerine fruit, wrapped in a silky texture. Yet it shows a dense, tightly tannic quality that suggest up to 8 years in the cellar.",Block F5,92,45,California,Carneros,Napa-Sonoma,NA,NA,Cuvaison 2005 Block F5 Pinot Noir (Carneros),Pinot Noir,Cuvaison
48275,France,"Regarded in Chablis as almost a grand cru vineyard, Vaulorent has produced a superconcentrated wine, layering minerals, yellow fruits and pear skin structure touched lightly by caramel. There is great acidity throughout this impressive wine.",Vaulorent Premier Cru,92,NA,Burgundy,Chablis,NA,Roger Voss,@vossroger,Jean-Marc Brocard 2005 Vaulorent Premier Cru  (Chablis),Chardonnay,Jean-Marc Brocard
48278,US,"A single-vineyard wine from Oregon can be a component rather than a complete wine, but here it is an absolute joy. Fragrant and complex, this offers pleasures for both nose and palate, with scents of leaf and spice and herb, leading into a surprisingly dense and textural blend of wild berry, rhubarb, melon and mixed tropical fruits. Fascinating and long, this is a fine example of Oregon Pinot at its most elegant and fascinating.",Corral Creek Vineyard,92,44,Oregon,Willamette Valley,Willamette Valley,Paul Gregutt,@paulgwine ,Chehalem 2005 Corral Creek Vineyard Pinot Noir (Willamette Valley),Pinot Noir,Chehalem
48473,US,"Nice everyday wine, with pleasant peach, pineapple and pear flavors that finish with a touch of smoky oak and vanilla. It's easy to enjoy this one with ham, crab, corn on the cob or just by itself.",Reserve,86,50,California,Napa Valley,Napa,NA,NA,Sterling 2005 Reserve Chardonnay (Napa Valley),Chardonnay,Sterling
48568,US,"A fine Cabernet that defines Alexander Valley's benchlands. It's entirely dry, a subtle wine whose herb-tinged blackberries, cherries and cedar turn increasingly complex in the glass. Shows a lightness and airy feeling that differentiates it from the heavier cult Napa style. Already throwing some sediment, so you might want to decant it before serving.",Scion,93,58,California,Alexander Valley,Sonoma,NA,NA,Robert Young 2005 Scion Cabernet Sauvignon (Alexander Valley),Cabernet Sauvignon,Robert Young
49559,Italy,"Here's a bold and modern Riserva that exhibits both grace and power. The aromatic layers are thick and intense and include cherry, smoked bacon, almond nut and dried blue flowers. The mouthfeel is bright with fine texture and smooth tannins.",Riserva del Cavaliere,91,NA,Tuscany,Chianti Classico,NA,NA,NA,Castelli del Grevepesa 2005 Riserva del Cavaliere  (Chianti Classico),Sangiovese,Castelli del Grevepesa
49899,Argentina,"A different style of Mendoza Malbec (with 30% Merlot), and for the most part it's intriguing and satisfying. For starters, the bouquet is a true bouquet: there's funky spice, cinnamon stick and floral fruit aromas. The palate has some snap and acidic sharpness, but also good blackberry essence. Finishes smoother than up front, with woodspice and pepper coming on strong. Drink now through 2010.",Primera Reserva,88,43,Mendoza Province,Mendoza,NA,Michael Schachner,@wineschach,Urraca 2005 Primera Reserva Red (Mendoza),Red Blend,Urraca
50592,US,"There's a lot of new oak in the nose, and it's tannic and has a fair amount of the volatile aromas that are found in several of the Hogue reds. The midpalate is soft to a fault, but shows hints of the spice and pepper of the grape. It finishes with volatility and unusually soft tannins. Tasting room exclusive.",Terroir Andrews Vineyard,83,25,Washington,Horse Heaven Hills,Columbia Valley,Paul Gregutt,@paulgwine ,Hogue 2005 Terroir Andrews Vineyard Malbec (Horse Heaven Hills),Malbec,Hogue
50629,Italy,"Bold and black with impenetrable thickness and inky tones of blackberry, smoked ham and peppercorn, this is a dense and opulent wine that shows the best of sunny Sicily with spicy overtones and a thick, full feel.",Sole dei Padri,91,55,Sicily & Sardinia,Sicilia,NA,NA,NA,Principi di Spadafora 2005 Sole dei Padri Syrah (Sicilia),Syrah,Principi di Spadafora
52640,US,"If you want to understand the essence of Dry Creek Valley Zinfandal, taste this wine. It's absolutely classic. Shows the region's balance, power and elegance. From the wild blackberry, raspberry, fig and tangerine zest fruit, to the clove, white pepper and anise spices, to the fabulously rich tannic structure, this is great, world-class Zinfandel. The high alcohol feels absolutely natural.",Lily Hill Estate,94,36,California,Dry Creek Valley,Sonoma,NA,NA,Bella 2005 Lily Hill Estate Zinfandel (Dry Creek Valley),Zinfandel,Bella
52651,US,"This is Washington Syrah at its most distinctive. The fruit stands out with tart and tangy flavors of boysenberry, raspberry and a tartness reminiscent of cranberry. There are streaks of meat, smoke and bacon, and the acids are clean. This is a glorious food wine, but so juicy, assertive and delicious that it almost demands to be drunk on its own. Will it evolve in the cellar? Probably, but it's hard to keep your hands off it long enough to find out.",NA,94,29,Washington,Columbia Valley (WA),Columbia Valley,Paul Gregutt,@paulgwine ,Robert Karl 2005 Syrah (Columbia Valley (WA)),Syrah,Robert Karl
52652,France,"A round, full-bodied wine that goes for the generous, opulent fruity aspect of red Burgundy with its big, blowsy red fruits, just kept in check by tannins. The acidity is lively and fresh, keeping pace with the intense vibrant fruits. Screwcap.",NA,93,169,Burgundy,Chambertin,NA,Roger Voss,@vossroger,Jean-Claude Boisset 2005  Chambertin,Pinot Noir,Jean-Claude Boisset
54207,Italy,"This is a dark, smooth and rich Riserva Brunello with a spot of sweet succulence and ripe cherry at the midpalate. The wine offers long, smooth texture and a clean, persistent mouthfeel.",Riserva,93,200,Tuscany,Brunello di Montalcino,NA,NA,NA,Poggio di Sotto 2005 Riserva  (Brunello di Montalcino),Sangiovese Grosso,Poggio di Sotto
54263,US,"Very fine and complex, this is a great sparkling wine, but one that needs lots of time in the bottle. A classic brut blended with Pinot Noir and Chardonnay, it's rich with flavors of strawberries, limes, vanilla and honey, with lots of smoky toast and yeastiness. Above all, the mousse is exceptionally refined and pure.",Reserve,95,110,California,North Coast,North Coast,NA,NA,Schramsberg 2005 Reserve Sparkling (North Coast),Sparkling Blend,Schramsberg
55487,Italy,"This is a big, blockbuster blend of Cab, Alicante and Petit Verdot with thick extraction and raw tones of fruit, tobacco and spice that liven up its chewy, textured mouthfeel.",Poggio al Lupo,92,45,Tuscany,Maremma,NA,NA,NA,Tenuta Sette Ponti 2005 Poggio al Lupo  (Maremma),Red Blend,Tenuta Sette Ponti
56342,Chile,"Big and saturated is the best way to describe this mammoth blend of Cabernet, Carmenère and Cab Franc. It's full of ripe fruit, coconut and cassis on the nose. Next up is a pure, bulky palate of raspberry, plum and vanilla. There's some sweet, resiny oak notes if you dig deep, but overall it is a high-end, structured red blend. Drink now through 2012.",Catalina,91,37,Cachapoal Valley,NA,NA,Michael Schachner,@wineschach,Santa Ema 2005 Catalina Red (Cachapoal Valley),Cabernet Blend,Santa Ema
56404,US,"Fruity and simple, with pie-filling blackberry, cherry and raspberry flavors that have been generously oaked. Almost sweet, a fruit bomb. Doesn't seem likely to age.",The Winemaster,85,80,California,Napa Valley,Napa,NA,NA,Cosentino 2005 The Winemaster Cabernet Sauvignon (Napa Valley),Cabernet Sauvignon,Cosentino
56537,Italy,"Here's a pleasantly fragrant blend of Negroamaro and Malvasia Nera that does a good job of delivering ripe berry notes that are intense, but not exaggerated. Black pepper, clove and chili notes are present but well dosed. Pair it with pecorino cheese or braised meats.",Schiaccianoci,87,NA,Southern Italy,Salento,NA,NA,NA,Vigne & Vini 2005 Schiaccianoci Negroamaro (Salento),Negroamaro,Vigne & Vini
56541,US,"With very ripe fruit and firm tannins, this mountain Cab shows attractive flavors of cassis and cedar. It's pretty tough and astringent in youth, so decant it and drink with rich marbled beef.",Tephra Ridge Vineyard,87,40,California,Lake County,NA,NA,NA,Langtry 2005 Tephra Ridge Vineyard Cabernet Sauvignon (Lake County),Cabernet Sauvignon,Langtry
56771,US,"This is a Merlot and Cabernet Sauvignon blend grown in the little appellation of Sonoma Mountain. It shows firm tannins and deeply concentrated flavors of currants and cherries, accented with smoky new oak. Despite the tannins, it has a softness that makes it drinkable now.",Pickberry Vineyards,90,50,California,Sonoma Mountain,Sonoma,NA,NA,Ravenswood 2005 Pickberry Vineyards Merlot (Sonoma Mountain),Merlot,Ravenswood
57802,US,"The Shea vineyard is still recovering from extensive post-phylloxera replanting, and many of the wines produced from its fruit seem much lighter than in the past. Here, however it compensates, at least partially, with a graceful, elegant composition. The mix of red fruits, mineral and light spring herbs is perfectly set against polished tannins. I would expect this wine to add texture and complexity over the next decade or more.",Shea Vineyard,90,75,Oregon,Willamette Valley,NA,Paul Gregutt,@paulgwine ,Torii Mor 2005 Shea Vineyard Pinot Noir,Pinot Noir,Torii Mor
58206,US,"This is an aromatic, smoky, herbal and ultimately captivating Syrah. Dense, smoky, tarry and herbal, it is a serious effort from a winery that specializes in the grape. The fruit is a juicy mix of wild berries, cassis and black cherry, with substantial tannins that add herbal, green tea flavors. Give it time to smooth out in the glass and notice how the finish runs on and on into a lovely dénouement of Provençal herb, black olive and spice.",NA,91,48,Washington,Yakima Valley,Columbia Valley,Paul Gregutt,@paulgwine ,Doyenne 2005 Syrah (Yakima Valley),Syrah,Doyenne
58257,US,"Locked down by hard tannins, this nonetheless is a beautiful Zinfandel, dry and rich in flavor. It bursts with savory wild berry, tobacco, mocha and pepper flavors, and feels elegant and refined. The tannins call for enormously rich beef, pasta, sauces and cheeses.",Shaw Vineyard Reserve Century Vines,92,35,California,Sonoma Valley,Sonoma,NA,NA,Kunde 2005 Shaw Vineyard Reserve Century Vines Zinfandel (Sonoma Valley),Zinfandel,Kunde
58575,US,"Softly direct in fruity concentration, this easy-drinking Syrah has powerfully ripe flavors of red cherry jam, red currants, milk chocolate and pepper spice. It tastes a little sugary sweet through the finish. Drink now.",Estate,85,40,California,Santa Ynez Valley,Central Coast,NA,NA,Bridlewood 2005 Estate Syrah (Santa Ynez Valley),Syrah,Bridlewood
58592,France,"Cedar aromas mingle with cherry and mixed berries on the nose, giving way to earth and cinnamon flavors on the elegant palate. With little tannin and moderate acidity, this is a wine for drinking over the next year.",La Cuvée Mythique,85,16,Languedoc-Roussillon,Vin de Pays d'Oc,NA,NA,NA,Les Vignerons de la Méditerranée 2005 La Cuvée Mythique Red (Vin de Pays d'Oc),Rhône-style Red Blend,Les Vignerons de la Méditerranée
58699,US,"A problematic wine. It starts out with an inert aroma that's mainly caramelized wood. In the mouth it's sweet and simple, with cola, blackberry, Dr. Pepper and cocoa flavors, and some bitterness on the finish.",Winegrower Selection Chase Vineyard,83,28,California,Redwood Valley,NA,NA,NA,Lolonis 2005 Winegrower Selection Chase Vineyard Zinfandel (Redwood Valley),Zinfandel,Lolonis
59176,Portugal,"This brand, first produced in 1881, has been among the most famous in Portugal. In its latest manifestation, it has a fresh red fruit character, smooth, with light acidity and soft tannins. There is a burst of juicy flavors that promises easy drinking.",Serradayres Reserva,84,NA,Ribatejo,NA,NA,Roger Voss,@vossroger,Caves Velhas 2005 Serradayres Reserva Red (Ribatejo),Portuguese Red,Caves Velhas
59274,US,"Much better than the watery 2004, this wine still seems a bit light and thin for its Reserve status. It's got some tart, sharp flavors of wild blackberry, but the herbal flavors suggest unripe grapes.",Reserve,84,23,Washington,Columbia Valley (WA),Columbia Valley,Paul Gregutt,@paulgwine ,Snoqualmie 2005 Reserve Syrah (Columbia Valley (WA)),Syrah,Snoqualmie
59797,Italy,"This Bordeaux-inspired blend (2005 is the second vintage made) represents the collaborative effort of Lodovico Antinori and Michel Rolland. You'll get clear berry fruit, green peppercorn, dried herbs and smoky oak tones. The estate's flagship wine, Biserno, will be released later this year, and expect great things from this duo in years to come as the estate matures.",Il Pino di Biserno,93,80,Tuscany,Toscana,NA,NA,NA,Tenuta di Biserno 2005 Il Pino di Biserno Red (Toscana),Red Blend,Tenuta di Biserno
59802,US,"Superripe in fruit and superoaky, this is a big, lush, powerful Chardonnay, but for all the size, it maintains balance and elegance. Potent in smoky, vanilla-accented pineapple brûlée, exotic date and stony mineral flavors, it shows the crisp acidity the vineyard is known for, and finishes dry and spicy.",Hommage Mitsuko's Vineyard,93,40,California,Carneros,Napa-Sonoma,NA,NA,Clos Pegase 2005 Hommage Mitsuko's Vineyard Chardonnay (Carneros),Chardonnay,Clos Pegase
59895,US,"A big wine, round and ripe with luscious flavors of peach, pineapple and citrus fruits, layered into plenty of toasty oak. It's smooth and seductive, and the finish, which tastes like a dessert of toasty hazelnuts and cream, is especially enticing. Just a bit of heat runs through it.",NA,90,20,Oregon,Willamette Valley,Willamette Valley,Paul Gregutt,@paulgwine ,Ponzi 2005 Chardonnay (Willamette Valley),Chardonnay,Ponzi
60155,Australia,"A lightweight, supple Pinot with decent varietal definition, Salitage's Treehouse Pinot features slightly herbal notes of brown sugar and cherries, then fades quickly on the finish. Drink now.",Treehouse,84,20,Western Australia,Pemberton,NA,Joe Czerwinski,@JoeCz,Salitage 2005 Treehouse Pinot Noir (Pemberton),Pinot Noir,Salitage
60272,Italy,"This 100% Syrah is aged 24 months in barrique and consequently opens with a solid wall of new wood that will require at least five years to integrate, but soft cherry nuances and delicate mineral shadings promise good things to those who wait.",Banditone,90,55,Tuscany,Sant'Antimo,NA,NA,NA,Máté 2005 Banditone Syrah (Sant'Antimo),Syrah,Máté
60279,Italy,"Exotic spice, red fruit, herbal notes and cherry cola characterize this 50-50 blend of Alicante and Syrah. The wine delivers measured intensity but does boast deep freshness thanks to its acidity and menthol finish.",Finisterre,90,60,Tuscany,Maremma,NA,NA,NA,Poggio Argentiera 2005 Finisterre  (Maremma),Red Blend,Poggio Argentiera
60286,US,"This new vineyard site, on the east side of the Chehalem mountains, has delivered a precisely rendered, spicy wine, with a pleasing mix of leaf, herb, berry and earth flavors. It's cut on the tart, acidic side, but it's neither dull nor simple. Given its balance and texture, it may well age for another decade or more.",Five Mountain,90,38,Oregon,Willamette Valley,Willamette Valley,Paul Gregutt,@paulgwine ,Elk Cove 2005 Five Mountain Pinot Noir (Willamette Valley),Pinot Noir,Elk Cove
60410,US,"Good, rich Napa Cabernet in this bottle, packed with blackberry, currant, licorice and cedar flavors. The wine shows a firm, full-bodied texture. Best now and through 2010.",NA,88,55,California,Napa Valley,Napa,NA,NA,John Anthony 2005 Cabernet Sauvignon (Napa Valley),Cabernet Sauvignon,John Anthony
61562,US,"The fruit is plenty ripe, offering rich flavors of blackberries and black currants, and the finish is thoroughly dry. The drawback with this Cab is its texture. It's rough and angular, suggesting unevenly ripe stems and seeds. Drink now.",Reserve Bingham Ranch,84,65,California,Napa Valley,Napa,NA,NA,R & B Cellars 2005 Reserve Bingham Ranch Cabernet Sauvignon (Napa Valley),Cabernet Sauvignon,R & B Cellars
61846,US,"While briskly composed, this delicately bubbly blend of Chardonnay and Pinot Noir envelops the palate with a flurry of delicate foam. Late disgorged, it highlights flavors of pressed apples, pears and the faintest hint of brioche. Drink now.",Brut Méthode Champenoise,87,30,New York,Finger Lakes,Finger Lakes,Anna Lee C. Iijima,NA,Glenora 2005 Brut Méthode Champenoise  (Finger Lakes),Champagne Blend,Glenora
62171,Italy,"This Brunello has an edgy, raw feel that translates into aromas of white cherry, wild raspberries and violets. It's a streamlined and traditional wine with a vibrant, buoyant personality topped by sharp acidity and firm tannins. Pair it with creamy or cheesy dishes.",NA,90,NA,Tuscany,Brunello di Montalcino,NA,NA,NA,Molino di Sant'Antimo 2005  Brunello di Montalcino,Sangiovese Grosso,Molino di Sant'Antimo
64643,US,"A bit herbal, green and sharp, this Cab has modest flavors of blackberries and cherries, enriched with some new French oak.",NA,84,34,California,Carmel Valley,Central Coast,NA,NA,Joullian 2005 Cabernet Sauvignon (Carmel Valley),Cabernet Sauvignon,Joullian
64759,US,"A lovely young Pinot, filled with fresh fruits and spices, wrapped into a fine, silky texture. The flavors of raspberries, cherries and cola have a rich, meaty, leathery edge that adds complexity and earthiness. Good now, and should hold for several years.",NA,89,30,California,Sonoma Coast,Sonoma,NA,NA,Castle 2005 Pinot Noir (Sonoma Coast),Pinot Noir,Castle
65389,Spain,"Classic Priorato aromatics of raspberry, cherry, schisty mineral and smoke are welcoming. Elegant and firm in the mouth, with drying tannins and staunch red fruit flavors of cherry and tomato blended with wild herbs and reeds. Earthy and dry on the finish, and not overpowering or overripe.",Montgarnatx,91,43,Catalonia,Priorat,NA,Michael Schachner,@wineschach,Francesc Sanchez Bas 2005 Montgarnatx Red (Priorat),Red Blend,Francesc Sanchez Bas
65494,France,"Made from young vines from the Vaulorent portion of the Fourchaume vineyard, this is an open, rounded and lively wine with white fruits and weight, just lifted by acidity.",Fourchaume Premier Cru,90,45,Burgundy,Chablis,NA,Roger Voss,@vossroger,William Fèvre 2005 Fourchaume Premier Cru  (Chablis),Chardonnay,William Fèvre
65728,Argentina,"This is an elegant wine that shows that Argentinean reds can improve with time. Tobacco, clay dust and dry spice comprise the bouquet. It's tight and well structured in the mouth, with chocolate, herb and baked berry flavors. A chocolaty aftertaste completes the picture. Drink this blend of Merlot, Malbec, Cabernet Sauvignon and Cab Franc now through 2015.",Pasionado Cuatro Cepas,91,50,Mendoza Province,Mendoza,NA,Michael Schachner,@wineschach,Andeluna 2005 Pasionado Cuatro Cepas Red (Mendoza),Bordeaux-style Red Blend,Andeluna
