id,country,description,designation,points,price,province,region_1,region_2,taster_name,taster_twitter_handle,title,variety,winery
95318,France,"Big, dusty tannins dominate this rich and opulent wine. With black plum and juicy red berries, it is well balanced, the acidity cutting through to point up the richness. Very ready to drink, but it will age. Drink now and until 2020.",Réserve,91,30,Bordeaux,Graves,NA,Roger Voss,@vossroger,Château Haut Selve 2009 Réserve  (Graves),Bordeaux-style Red Blend,Château Haut Selve
95390,Chile,"Sweet on the nose, with a lot of mocha, vanilla and candied fruit. The palate is tannic and very oaky for a wine of this level. Flavors of toffee, cocoa, mocha and generic berry fruit show more oak than purity. A good wine but heavy handed with the oak. Contains 15% Syrah.",Reserva,86,10,Colchagua Valley,NA,NA,Michael Schachner,@wineschach,Ventisquero 2009 Reserva Cabernet Sauvignon (Colchagua Valley),Cabernet Sauvignon,Ventisquero
95797,US,"A blend of Grenache, Mourvèdre, Syrah and Counoise, this wine brings an intriguing assortment of red and blue jammy fruit, herbs, cranberry and peppery spices. Reflective of the warm vintage it comes from, it's ripe, full bodied and in a sweet spot. Drink now.",Sirocco,90,28,Washington,Yakima Valley,Columbia Valley,Sean P. Sullivan,@wawinereport,McCrea 2009 Sirocco Red (Yakima Valley),Rhône-style Red Blend,McCrea
95911,US,"A robust Syrah, simple and direct, but loaded with flavor, with classic tannins and fine coastal acidity. It's power-packed with blackberries, currants, leather and loads of savory baking spices. Drink now.",SRH,87,23,California,Sta. Rita Hills,Central Coast,NA,NA,Lafond 2009 SRH Syrah (Sta. Rita Hills),Syrah,Lafond
96094,US,"It's all about flashy fruit in this ripe Pinot Noir. Enormously concentrated with raspberry, date and cherry flavors and hints of spicy bacon and raisins.",Sangiacomo Vineyard,87,38,California,Sonoma Coast,Sonoma,NA,NA,Gregory Graham 2009 Sangiacomo Vineyard Pinot Noir (Sonoma Coast),Pinot Noir,Gregory Graham
96518,US,"Based on Merlot, this Bordeaux-style blend is very ripe and forward in blueberry, cherry and raspberry jam, and it finishes in a swirl of dusty baking spices. It's a good wine, if a bit rustic, with some edgy tannins and high alcohol.",Bastille,86,38,California,Sonoma County,Sonoma,NA,NA,De Novo 2009 Bastille Red (Sonoma County),Bordeaux-style Red Blend,De Novo
96538,US,"This is ripe and spicy, with plenty of blackberry and blueberry flavors. Although it's a little lighter on the palate than expected, it's fine for barbecue.",NA,85,22,California,Dry Creek Valley,Sonoma,NA,NA,Redemption 2009 Zinfandel (Dry Creek Valley),Zinfandel,Redemption
96546,US,"Aged in a mix of French and American oak barrels, this is dominated by their effusively toasty aromatics. But after the oak rush, the fruit seems a little light, just barely ripe enough to be present; the flavors run more to the herbal side of Syrah.",Burgess Vineyard,87,20,Washington,Columbia Valley (WA),Columbia Valley,Paul Gregutt,@paulgwine ,Thurston Wolfe 2009 Burgess Vineyard Syrah (Columbia Valley (WA)),Syrah,Thurston Wolfe
96557,France,"A field blend of the Enclos vineyard has given a superrich wine, densely packed with juicy black plum fruits and sweet tannins. Ripe, full-bodied with a slight alcohol burn.",Triple A,87,59,Bordeaux,Sainte-Foy Bordeaux,NA,Roger Voss,@vossroger,Château l'Enclos 2009 Triple A  (Sainte-Foy Bordeaux),Bordeaux-style Red Blend,Château l'Enclos
96651,Australia,"This wine from high-altitude inland Victoria is built around acids, not tannins. It's full bodied but bright, lively and refreshing, with crisp cherry and cassis fruit framed by hints of tobacco, vanilla and mint.",Stone Dwellers,90,20,Victoria,Strathbogie Ranges,NA,Joe Czerwinski,@JoeCz,Fowles Wine 2009 Stone Dwellers Shiraz (Strathbogie Ranges),Shiraz,Fowles Wine
97703,Italy,"Packaged in a squat, medallion-shaped bottle, this fragrant Moscato Giallo offers a full bouquet of peach blossom, honey, acacia flower and jasmine. It's sweet and tangy in the mouth to the right measure and would pair with fruit salad or apricot tarts.",Giallo,85,20,Northeastern Italy,Trentino,NA,NA,NA,Gaierhof 2009 Giallo Moscato Giallo (Trentino),Moscato Giallo,Gaierhof
97749,US,"This is a luscious, butterscotchy, fresh, lime- and lemon-flavored Chardonnay; a true delight. Melon and peach fruit flavors thread into the core, and the wine has a wonderful richness without losing its finesse or acid base.",Three Hills Cuvée,92,30,Oregon,Willamette Valley,Willamette Valley,Paul Gregutt,@paulgwine ,Lange 2009 Three Hills Cuvée Chardonnay (Willamette Valley),Chardonnay,Lange
97895,Australia,"A medium-bodied Shiraz suited to everyday drinking, with cherry-berry fruit accented by hints of leather and smoke. It's a fresh, easy quaff to match with burgers or pizza.",Reserve,85,8,Australia Other,South Eastern Australia,NA,Joe Czerwinski,@JoeCz,Gosford 2009 Reserve Shiraz (South Eastern Australia),Shiraz,Gosford
98381,Italy,"The bottle that changed Italian wine forever, Tignanello is as modern and innovative as its first vintage many decades ago. Soft blackberry and cherry is backed by balanced spice, leather and toasted espresso. Those rich oak tones do a wonderful job of holding up the wine's natural richness and velvety smoothness. Hold 10 years or more.",Tignanello,95,105,Tuscany,Toscana,NA,NA,NA,Marchesi Antinori 2009 Tignanello Red (Toscana),Red Blend,Marchesi Antinori
98424,US,"Some Napa Cabs that are ageable also are good to go now because the fruit is so ripe and the tannins are soft. Not this one. It's almost old-fashioned in tannins, with a lockdown astringency. But it's balanced and elegant, and the flavors are rich in blackberries, cherries, currants, cocoa and sweet oak. Give it at least six years in the cellar, and it could go for another 10 or 15.",Legacy Lot 30,92,115,California,Napa Valley,Napa,NA,NA,Tudal 2009 Legacy Lot 30 Cabernet Sauvignon (Napa Valley),Cabernet Sauvignon,Tudal
98441,US,"Here's a great Syrah from a vineyard not specifically known for this grape. It immediately impacts the palate with concentrated flavors of raspberry and cassis swathed in coffee liqueur, dark chocolate and a hint of red licorice. This has great concentration and length; drink it over the next 6–8 years.",Ciel du Cheval Vineyard,94,28,Washington,Red Mountain,Columbia Valley,Paul Gregutt,@paulgwine ,Tamarack Cellars 2009 Ciel du Cheval Vineyard Syrah (Red Mountain),Syrah,Tamarack Cellars
98442,France,"Very dense and firm, this has powerful tannins as well as a blackberry jam flavor. The wine is complex, full of both dark tannins and the richest fruits, layered with notes of herb, spice and a concentrated structure.",NA,94,NA,Bordeaux,Pessac-Léognan,NA,Roger Voss,@vossroger,Château Smith Haut Lafitte 2009  Pessac-Léognan,Bordeaux-style Red Blend,Château Smith Haut Lafitte
98445,US,"Dry, elegant and complex, this is rich in red cherry, pomegranate and cola flavors, with earthy complexities suggesting mushroom and dried herb. Beautiful to drink now, and it should improve in the bottle over the next six years.",Brown Ranch,94,60,California,Carneros,Napa-Sonoma,NA,NA,Saintsbury 2009 Brown Ranch Pinot Noir (Carneros),Pinot Noir,Saintsbury
98459,US,"Smooth, svelte and utterly delicious, this glossy, seamless Petit Verdot is packed with bright flavors of berry, cherry and plum. The management of the fruit is perfect, and the barrel aging adds proportionate streaks of espresso and mocha. The finish is long and creamy.",Living in the Limelight,93,55,Washington,Columbia Valley (WA),Columbia Valley,Paul Gregutt,@paulgwine ,Rasa 2009 Living in the Limelight Petit Verdot (Columbia Valley (WA)),Petit Verdot,Rasa
98631,Argentina,"Smoky, roasted and full on the bouquet, with rich berry and plum aromas. The palate is fleshy, with a chunky middle but just enough tannin and acid to provide structure. Tastes of baked black fruits, fig and herbs. Dry and snappy on the finish.",NA,89,13,Mendoza Province,Mendoza,NA,Michael Schachner,@wineschach,Valentin Bianchi 2009 Malbec (Mendoza),Malbec,Valentin Bianchi
98682,US,"Even if you like some earthy, mushroomy notes in your Syrah, this one is unripe to the point of vegetal. It's also too soft for balance. Despite some decent blackberry and cola flavors, it's a real disappointment.",Estate,82,35,California,Atlas Peak,Napa,NA,NA,Astrale e Terra 2009 Estate Syrah (Atlas Peak),Syrah,Astrale e Terra
98876,US,"This is a Rhône-style blend of Viognier, Roussanne and Marsanne. It's fruity in pineapple, peach, apple, mango and Meyer lemon flavors, with a honeysuckle richness, and finishes dry and crisp. A nice wine for drinking now with smoked meats, especially ham.",Heritage Blanc,86,18,California,Santa Barbara County,Central Coast,NA,NA,Curtis 2009 Heritage Blanc White (Santa Barbara County),Rhône-style White Blend,Curtis
98877,Italy,"This luminous wine, presented in attractively clean packaging, opens with inviting aromas of citrus, peach and Golden Delicious. It's an informal, easy-drinking wine that washes down the palate in a very refreshing manner.",NA,86,20,Piedmont,Langhe,NA,NA,NA,Damilano 2009 Arneis (Langhe),Arneis,Damilano
98988,France,"Obviously a wine for Baby Boomers, this is bright and fresh, packed with red fruits and a perfect light pink color. The final taste is lively, clean and crisp.",Pink Floyd,88,NA,Provence,Côtes de Provence,NA,Roger Voss,@vossroger,Château Miraval 2009 Pink Floyd Rosé (Côtes de Provence),Rosé,Château Miraval
99153,Spain,"Peach and melon aromas are inviting and clean. Very juicy and juice-like in the mouth, probably more so than I can remember for this wine. It tastes like orange, tangerine and grapefuit juices mixed together. The texture isn't very smooth or wine-like; seems less refined and less minerally than in the past.",NA,86,19,Northern Spain,Valdeorras,NA,Michael Schachner,@wineschach,Viña Godeval 2009 Godello (Valdeorras),Godello,Viña Godeval
99277,Italy,"A 50-50 blend of Bombino Bianco and Chardonnay, this oak-aged white blend from southern Italy delivers bright acidity from the first grape variety and smooth vanilla, butterscotch and peach from the second.",Bacca Rara,84,15,Southern Italy,Puglia,NA,NA,NA,Torrevento 2009 Bacca Rara White (Puglia),White Blend,Torrevento
99543,US,"There's a very fine wine lurking inside this bottle, but right now, everything's disjointed. There are big tannins over here, oak over there, and sandwiched in between are huge, intense flavors of blackberry, blueberry and cassis liqueur. It's nowhere near ready, but there's no reason why this dramatic young wine shouldn't come together and improve over the years. Cellar it until 2017 and check up on it; this could be really something in 2025.",Beckstoffer To Kalon,93,125,California,Napa Valley,Napa,NA,NA,Macauley 2009 Beckstoffer To Kalon Cabernet Sauvignon (Napa Valley),Cabernet Sauvignon,Macauley
99563,US,"Superbly ripe, with gorgeous blackberry jam, crème de cassis and toasted oak flavors. It defines the modern style of Cabernet. Although it's very tannic, its richness will tempt you to drink it right away.",NA,93,50,California,Napa Valley,Napa,NA,NA,Hunnicutt 2009 Cabernet Sauvignon (Napa Valley),Cabernet Sauvignon,Hunnicutt
99590,US,"Dry, racy and clean. Shows real class, with plenty of zesty lemon and lime acidity, brightening the citrus, lemongrass, white peach and mineral flavors. Production was 3,500 cases.",NA,91,30,California,Russian River Valley,Sonoma,NA,NA,La Crema 2009 Chardonnay (Russian River Valley),Chardonnay,La Crema
99661,US,"A good, dry Zinfandel, although it's a little overripe in prunes. Not too much, though, so don't be alarmed. It's very spicy, suggesting drinking with equally spicy foods, like spice-rubbed beef, pork and chicken, grilled to perfection. Nice restaurant wine due to its elegance.",York Creek,88,30,California,Napa Valley,Napa,NA,NA,Ridge 2009 York Creek Zinfandel (Napa Valley),Zinfandel,Ridge
99982,France,"Crisp and also creamy, this is a soft, ripe wine that also preserves good acidity. It shows the freshness of 2009, while also bringing out a richly herbaceous character.",La Grande Cuvée,88,11,Bordeaux,Bordeaux Blanc,NA,Roger Voss,@vossroger,Dourthe 2009 La Grande Cuvée  (Bordeaux Blanc),Bordeaux-style White Blend,Dourthe
99985,France,"Full in the mouth, this is a rich and easy wine, packed with jammy fruit. It is soft, the plum flavors rounded and only light brushed by tannin and acidity.",Sélection,88,NA,Beaujolais,Saint-Amour,NA,Roger Voss,@vossroger,Georges Duboeuf 2009 Sélection  (Saint-Amour),Gamay,Georges Duboeuf
100025,New Zealand,"Plump and slightly sweet, this late-harvest Riesling comes in at 10% alcohol—something along the lines of a rich spätlese in terms of its alcohol-acid-sugar balance. Notes of pineapple and crushed stone open up to melon fruit on the palate and finish long, with a bit of cinnamon or ginger spice.",Late Harvest,90,55,Martinborough,NA,NA,Joe Czerwinski,@JoeCz,Dry River 2009 Late Harvest Riesling (Martinborough),Riesling,Dry River
100073,US,"This 100% Cabernet is very dry, with hard tannins housing blackberry, plum, raisin and cedar flavors. It could develop bottle complexity over the years, but at this price, it's an expensive risk.",C.C. Ranch,87,100,California,Rutherford,Napa,NA,NA,Nickel & Nickel 2009 C.C. Ranch Cabernet Sauvignon (Rutherford),Cabernet Sauvignon,Nickel & Nickel
100512,Italy,"This opens with aromas of underbrush, tobacco, espresso and stewed prune. The full-bodied palate offers sour cherry, raisin, licorice and ground pepper alongside fine-grained but rather evolved tannins. It has seen fresher days so drink soon.",Vigna Sant'Angelo,88,45,Central Italy,Montepulciano d'Abruzzo Colline Teramane,NA,Kerin O’Keefe,@kerinokeefe,Valori 2009 Vigna Sant'Angelo  (Montepulciano d'Abruzzo Colline Teramane),Montepulciano,Valori
100640,US,"Made to commemorate the sparkling wine the winery produced for the Reagan-Gorbachev Summit Meetings in the 1980s, this blends 74% Pinot Noir and 26% Chardonnay in a richer style, still dry, and just recently disgorged in July 2014. Complex and creamy, it offers a seductive nose of ripe apple and custard, the flavors following through in a medium-weight, mellowed way.",Russian Cuvée,92,38,California,Green Valley,Sonoma,Virginie Boone,@vboone,Iron Horse 2009 Russian Cuvée Sparkling (Green Valley),Sparkling Blend,Iron Horse
100819,US,"Made in a sweetly ripe, oaky manner, this is a drink-me-now Pinot Noir. Easy to like for its jammy raspberry, cherry and Dr. Pepper cola flavors. The acidity and soft tannins define the modern Russian River style.",Bella Luna Vineyard,88,49,California,Russian River Valley,Sonoma,NA,NA,Signaterra 2009 Bella Luna Vineyard Pinot Noir (Russian River Valley),Pinot Noir,Signaterra
100820,Spain,"A generous example of young Ribera. Dark mint, cola and blackberry aromas get more herbal with airing. The palate is secure and tannic, with ripe blackberry and sweet Bing cherry flavors. Chocolaty and tannic on the finish.",Roble,88,16,Northern Spain,Ribera del Duero,NA,Michael Schachner,@wineschach,Vecordia 2009 Roble  (Ribera del Duero),Tempranillo,Vecordia
101119,France,"As rich as it is tannic, this is powerful and concentrated. It shows the rich 2009 fruit at its best, full of sweet berries, deliciously ripe. Enjoyable, while it is also serious.",Domaine de la Chaponne,92,NA,Beaujolais,Morgon,NA,Roger Voss,@vossroger,Georges Duboeuf 2009 Domaine de la Chaponne  (Morgon),Gamay,Georges Duboeuf
101126,France,"Atypically round for a Crozes-Hermitage—a result of the vintage—but immediately attractive, with ample weight backing up the smoky, bacony notes and plummy fruit. Finishes long and richly textured, with hints of oak. Drink now–2020.",Cuvée Gaby,91,42,Rhône Valley,Crozes-Hermitage,NA,Joe Czerwinski,@JoeCz,Domaine du Colombier 2009 Cuvée Gaby  (Crozes-Hermitage),Syrah,Domaine du Colombier
101140,US,"Merlot is certainly one of the real strengths at Fidélitas, and two different versions are offered. This broad and flavorful effort has pretty cherry fruit backed with pleasing baking spices. The finish is focused and precise, adding streaks of cinnamon and chocolate.",NA,91,25,Washington,Columbia Valley (WA),Columbia Valley,Paul Gregutt,@paulgwine ,Fidelitas 2009 Merlot (Columbia Valley (WA)),Merlot,Fidelitas
101330,US,"Quite a good Zinfandel, although it does show some of the weaknesses that strike this vineyard in a cool year. You'll find a smooth, full-bodied wine, with ample tannins and fine berry-cherry fruit and spices. Yet it's curiously ambiguous in the mouth, and the concentration falls apart midpalate.",Forchini Vineyard North Flats,87,50,California,Russian River Valley,Sonoma,NA,NA,Williams Selyem 2009 Forchini Vineyard North Flats Zinfandel (Russian River Valley),Zinfandel,Williams Selyem
101641,Spain,"Strapping aromas of blackberry and licorice are fiery and grating. This Syrah-led blend from a hot vintage is mighty tannic, so much so that it collapses under tannic weight. Flavors of blackberry, prune and cherry are spicy, while this tastes rooty and warm on the finish. Drink through 2019.",NA,89,32,Central Spain,Manchuela,NA,Michael Schachner,@wineschach,Finca Sandoval 2009 Red (Manchuela),Red Blend,Finca Sandoval
101870,Austria,"An impressive, rich Riesling that shows a balance between tropical fruit flavors as well as textured acidity. Apple and pineapple come together harmoniously with perfumes and a delicious juicy aftertaste.",Kellermeister Privat Kremser Kremsleiten,89,19,Niederösterreich,NA,NA,Roger Voss,@vossroger,Winzer Krems 2009 Kellermeister Privat Kremser Kremsleiten Riesling (Niederösterreich),Riesling,Winzer Krems
102008,South Africa,"Fresh and light with ripe fruit notes of red apple and apricot spiced with hints of white florals and lime zest. The medium weight mouth is juicy and clean, the ripe stone fruit flavors carrying through to the close. Drink now.",NA,86,20,Elgin,NA,NA,Lauren Buzzeo,@laurbuzz,Elgin Vintners 2009 Viognier (Elgin),Viognier,Elgin Vintners
102019,Chile,"Blackberry and balsam wood are the key aromas, but there's a pinch of cumin in there too. The palate is wide, broad and tannic, with leathery, roasted flavors of dark berry and black plum. Finishes savory and a bit salty, with a clacky, hard, tannic residue.",Toro de Piedra Reserva,86,14,Curicó Valley,NA,NA,Michael Schachner,@wineschach,Viña Requingua 2009 Toro de Piedra Reserva Syrah-Cabernet (Curicó Valley),Syrah-Cabernet,Viña Requingua
102578,US,"There's residual sugar in this wine, to judge by the sweet cherry cola flavors with a hit of alcohol.",Mischief,82,10,California,California,California Other,NA,NA,Lost Angel 2009 Mischief Red (California),Red Blend,Lost Angel
102706,Australia,"This doesn't fit the current fashion in Australian Pinot Noir toward lightness and delicacy. Instead, it delivers rich and mellow flavors of black cherry, tinged with licorice, earth and moss. Drink it over the next several years.",NA,90,95,Victoria,Yarra Valley,NA,Joe Czerwinski,@JoeCz,Yarra Yering 2009 Pinot Noir (Yarra Valley),Pinot Noir,Yarra Yering
103115,US,"The tannins are so fierce on this baby Cabernet that they effectively lock it down and make it tough to drink now. Yet there's a fabulous core of blackberries that are rich, ripe and intense. Everything about it suggests ageability. Give it at least eight years in a proper cellar, and it could age even longer.",NA,95,65,California,Howell Mountain,Napa,NA,NA,La Jota Vineyard 2009 Cabernet Sauvignon (Howell Mountain),Cabernet Sauvignon,La Jota Vineyard
103127,US,"A big, thick, massive Cabernet, impressive for sheer volume. Yet it's very tannic and dry. Deep down inside is an intense core of concentrated blackberry essence, coated in smoky new oak. This feels dramatic and important, but nowhere near ready. Give it eight years in the cellar.",Christopher's,94,100,California,Alexander Valley,Sonoma,NA,NA,Stonestreet 2009 Christopher's Cabernet Sauvignon (Alexander Valley),Cabernet Sauvignon,Stonestreet
103339,Argentina,"Gold in color and about as overoaked as a white wine can be. This blend of Viognier, Chardonnay and Riesling is all resin and barrel spice. It actually offers some sophistication in terms of mouthfeel, but overall it's grossly out of balance and brutally dominated by oak-based aromas and flavors.",Gala 3,81,36,Mendoza Province,Maipú,NA,Michael Schachner,@wineschach,Luigi Bosca 2009 Gala 3 White (Maipú),White Blend,Luigi Bosca
103488,Germany,"In a flight of five 2009 kabinetts from the Sonnenuhr, this was the most alcoholic (at 9.5% abv), but the extra weight    didn't stand out beyond a bit of extra creaminess on the palate. Hints of lees and slate add complexity to the apple and citrus notes, then linger elegantly on the finish.",Wehlener Sonnenuhr Kabinett,90,23,Mosel,NA,NA,Joe Czerwinski,@JoeCz,Dr. Pauly Bergweiler 2009 Wehlener Sonnenuhr Kabinett Riesling (Mosel),Riesling,Dr. Pauly Bergweiler
103495,Germany,"Light in body, with a fine backbone of taut acidity, this is a throwback to a time when spätleses were slightly drier than today. Delicate scents of crushed stone and pressed flowers are underscored by hints of green apple and lime. This would make a fine apéritif on its own, or could perhaps partner subtle seafood dishes.",Wehlener Sonnenuhr Spätlese,90,24,Mosel,NA,NA,Joe Czerwinski,@JoeCz,Studert-Prüm 2009 Wehlener Sonnenuhr Spätlese Riesling (Mosel),Riesling,Studert-Prüm
103589,Spain,Big grapy aromas of blackberry and cassis are rather heavy and flat. This has a tannic abrasive mouthfeel in which nothing is smooth. Borderline overripe flavors of baked plum and blackberry finish chocolaty and with baking-spice flavors.,Calmo Vino de Lágrima Nocturno,88,100,Northern Spain,Ribera del Duero,NA,Michael Schachner,@wineschach,Legaris 2009 Calmo Vino de Lágrima Nocturno  (Ribera del Duero),Tempranillo,Legaris
103811,US,"This starts with a startling but tangy lemon-tea flavor. Cinnamon and plum notes enter the palate, which are underscored by rather chalky acidity, and finished with a coffee highlight.",NA,88,40,Washington,Columbia Valley (WA),Columbia Valley,Paul Gregutt,@paulgwine ,Northstar 2009 Cabernet Sauvignon (Columbia Valley (WA)),Cabernet Sauvignon,Northstar
104006,Georgia,"While aromatically subdued, this is a refreshing, easy-drinking white blend, with pleasant lemon and apple flavors. A hint of orange peel and a brisk, lime-accented acidity highlight the midpalate. Drink now.",Marani Tsinandali,86,10,Kakheti,NA,NA,Anna Lee C. Iijima,NA,Telavi 2009 Marani Tsinandali White (Kakheti),White Blend,Telavi
104547,US,"This is Rochioli's basic Pinot Noir. It's a beautiful wine, marked by great structure and accessible fruit. Near-perfect acids and tannins lend it elegance, while the cherry and cola flavors have a rich touch of smoky oak. Drink now.",NA,91,69,California,Russian River Valley,Sonoma,NA,NA,Rochioli 2009 Pinot Noir (Russian River Valley),Pinot Noir,Rochioli
104688,Italy,"Light and pretty, this is aged in large oak cask for 12 months, which imparts notes of spice and toasted almond. Otherwise, the wine's core is all fruit: raspberry, cherry and currant flavors abound.",NA,86,13,Veneto,Valpolicella Classico Superiore,NA,NA,NA,Scriani 2009  Valpolicella Classico Superiore,"Corvina, Rondinella, Molinara",Scriani
104711,US,"This wine has flavors of wild blackberry, blueberry and mocha, with a rich vein of herb, tobacco and spice. However, it's hot in alcohol, and finishes with glyceriney sweetness—almost like a minor Port. Drink up.",NA,86,35,California,Napa Valley,Napa,NA,NA,Kuleto Estate 2009 Zinfandel (Napa Valley),Zinfandel,Kuleto Estate
104834,Italy,This opens with a savory earth tone and drying layers of crushed stone and wet granite. There are also pretty aromas of violets and pressed blue flowers. It finishes with fine tannins and a slightly gritty texture.,Rio Sordo,90,50,Piedmont,Barbaresco,NA,NA,NA,Cascina delle Rose 2009 Rio Sordo  (Barbaresco),Nebbiolo,Cascina delle Rose
104845,US,"In 2009, this vineyard's yields were reduced, and production of this wine was cut to just 75 cases. It is compact and astringent to such a degree that even 24 hours of breathing time does little to make it budge. Flavors of cassis, white pepper and a hint of herb poke out from a bed of tannins. It's just too soon to tell where this is going.",Klipsun Vineyard,89,45,Washington,Red Mountain,Columbia Valley,Paul Gregutt,@paulgwine ,Seven Hills 2009 Klipsun Vineyard Cabernet Sauvignon (Red Mountain),Cabernet Sauvignon,Seven Hills
104903,US,"A fine red wine, full-bodied, tannic and spicy, with juicy berry and tobacco flavors. The jug-shaped bottle is one of the cutest in California.",Red,87,18,California,California,California Other,NA,NA,Martin Ray 2009 Red Red (California),Red Blend,Martin Ray
104917,Italy,"Pecorino is the white wine of the moment for those who love the rustic tastes of Italy's vast patrimony of indigenous grapes. This expression shows loads of peach, lemon and Golden Delicious apple.",Trabocchetto,87,16,Central Italy,Colline Pescaresi,NA,NA,NA,Talamonti 2009 Trabocchetto Pecorino (Colline Pescaresi),Pecorino,Talamonti
105020,US,"A big, rich, flashy Chardonnay that's designed to impress, and does. Almost too much of a good thing, with massive lemondrop candy, pineapple, lime and kiwi fruit flavors, as well as firm minerality and lots of toasty oak. Drink now with opulent fare, such as shellfish.",Drake Estate Vineyard,92,60,California,Russian River Valley,Sonoma,NA,NA,Williams Selyem 2009 Drake Estate Vineyard Chardonnay (Russian River Valley),Chardonnay,Williams Selyem
