id,country,description,designation,points,price,province,region_1,region_2,taster_name,taster_twitter_handle,title,variety,winery
61536,Austria,"The faintest hint of pineapple signals ripe fruit on the nose. Soft but fresh, the palate delivers uncomplicated, unoaked and simple drinking pleasure with a seam of fresh acidity.",NA,86,12,Austria,NA,NA,Anne Krebiehl MW,@AnneInVino,Kirnbauer 2013 Welschriesling (Austria),Welschriesling,Kirnbauer
62132,US,The wine's very reserved nose requires patience to release the asphalt and blackberry jam aromas. Berry flavors show on the palate as does some asphalt and pepper. Everything feels balanced but it could use some more power and punch.,Reserve,86,40,California,Edna Valley,Central Coast,Matt Kettmann,@mattkettmann,Edna Valley Vineyard 2013 Reserve Syrah (Edna Valley),Syrah,Edna Valley Vineyard
62182,France,"With attractive acidity, this perfumed wine has a bright character and plenty of black-currant flavors. It's not a concentrated wine however it does have an attractive fruitiness. Bordeaux Sciences Agro school uses this 55-acre vineyard for training and experiments.",NA,86,45,Bordeaux,Pessac-Léognan,NA,Roger Voss,@vossroger,Château Luchey-Halde 2013  Pessac-Léognan,Bordeaux-style Red Blend,Château Luchey-Halde
62213,Australia,"A solid value, the 2013 Shoofly is an open-knit, savory wine for drinking over the next year or two. Cola and earth predominate, dressed up by hints of dried spices and green coffee bean.",NA,87,14,Victoria,Yarra Valley,NA,Joe Czerwinski,@JoeCz,Shoofly 2013 Pinot Noir (Yarra Valley),Pinot Noir,Shoofly
62215,US,"Concentrated violets, cranberries and plum-pie aromas show on the nose of this wine by the Miller family, who own Bien Nacido Vineyard. The palate offers cola, tart cherries, cranberries and black-slate minerality.",NA,87,27,California,Santa Maria Valley,Central Coast,Matt Kettmann,@mattkettmann,J. Wilkes 2013 Pinot Noir (Santa Maria Valley),Pinot Noir,J. Wilkes
62316,US,"This is a beautiful blend of 60% Merlot, 20% Cabernet Franc and 20% Cabernet Sauvignon. Sanguine, ethereal currant and cranberry are twisted in game and black pepper, the midpalate velvety in texture with a gravelly edge.",Page Turner,94,65,California,Oakville,Napa,Virginie Boone,@vboone,Textbook 2013 Page Turner Red (Oakville),Bordeaux-style Red Blend,Textbook
62417,US,"There's a very focused darkness to the nose of this blend of 58% Cabernet Sauvignon, 28% Cabernet Franc and 14% Merlot, with black olive, char and graphite adding to the depth. That midnight sensation continues to the palate, where blackberry and blueberry flavors benefit from touches of vanilla, star anise and more slate-driven minerality.",Mitigation,92,42,California,South Coast,South Coast,Matt Kettmann,@mattkettmann,Eli Madyson 2013 Mitigation Red (South Coast),Bordeaux-style Red Blend,Eli Madyson
62544,US,"Black raspberry, blackberry, lavender and pepper show on the deeply purple nose of this blend of 67% Grenache and 33% Syrah. Dense black fruit shows first on the palate, followed by a zesty explosion of acidity, flowery spices and cola.",Las Arenas,90,25,California,Arroyo Seco,Central Coast,Matt Kettmann,@mattkettmann,Chesebro 2013 Las Arenas Red (Arroyo Seco),Rhône-style Red Blend,Chesebro
62633,Spain,"Dense, slightly soupy aromas of herbs, earth and blackberry settle in front of a flush, plump palate. Chunky blackberry flavors mix with earth and saline notes, while the finish is full and easy, with mild tannins. Drink through 2018.",Clàssic,88,22,Catalonia,Priorat,NA,Michael Schachner,@wineschach,Onix 2013 Clàssic Grenache-Carignan (Priorat),Grenache-Carignan,Onix
62639,Germany,"Notes of crushed granite and slate find harmony against a backdrop of pert grapefruit and lime flavors. Vivacious and lean, this finishes briskly with a spray of orange blossom.",RK,88,17,Mosel,NA,NA,Anna Lee C. Iijima,NA,Reichsgraf von Kesselstatt 2013 RK Pinot Blanc (Mosel),Pinot Blanc,Reichsgraf von Kesselstatt
62668,Greece,"The Savatiano-whisperer Papagiannakos continues his mastery here, traditionally the variety used for retsina. Here, the single variety is barrel fermented and left on the lees to offer a richer expression of the grape's lemon, spice and peach notes. This is an elegant white with aging ability. Try with grilled fish, salty cheeses.",Vareli Skin Contact,90,25,Markopoulo,NA,NA,Susan Kostrzewa,@suskostrzewa,Papagiannakos 2013 Vareli Skin Contact Savatiano (Markopoulo),Savatiano,Papagiannakos
62723,Spain,"Touches of warm radiator dust and minerality accent citrus aromas. In the mouth, this is juicy and stony, with flavors of pithy green citrus and peach pit. The finish is solid and just crisp enough.",NA,87,17,Northern Spain,Rueda,NA,Michael Schachner,@wineschach,Oro de Castilla 2013 Verdejo (Rueda),Verdejo,Oro de Castilla
62777,US,"Aromas and flavors of sandalwood and grenadine layer around this velvety, seductive wine. It offers black tea, truffle and forest floor, the body sinewy and complex. Savory in cinnamon and clove on the finish, it needs more time to open; decant or cellar through 2021.",Estate Cuvée,91,55,California,Russian River Valley,Sonoma,Virginie Boone,@vboone,Small Vines 2013 Estate Cuvée Pinot Noir (Russian River Valley),Pinot Noir,Small Vines
62802,Austria,"This wine is reminiscent of ripe, plump pears and yellow plums fallen onto wet, cool autumn leaves on moss and grass. Those ripe notions are totally evident on the smooth, rounded palate that has a lick of vivacious lemon acidity. The long finish majors on citrus and clove-like spice.",Gaisberg Reserve,92,43,Kamptal,NA,NA,Anne Krebiehl MW,@AnneInVino,Hiedler 2013 Gaisberg Reserve Riesling (Kamptal),Riesling,Hiedler
63096,France,"A ripe, fleshy wine, full of cherry notes and spice. It is rich, full in the mouth while keeping a light fruitiness that allows it to develop fast. Overpowering banana flavors at the end spoil the overall effect.",NA,84,14,Beaujolais,Beaujolais-Villages,NA,Roger Voss,@vossroger,Louis Jadot 2013  Beaujolais-Villages,Gamay,Louis Jadot
63099,France,"Produced from Syrah, this is still a cool wine, with crisp fruitiness to the front. Lively acidity and fresh red fruits are balanced by a warmer layer of caramel. Drink now.",NA,84,12,Southwest France,Côtes de Gascogne,NA,Roger Voss,@vossroger,Domaine d'Arton 2013 Rosé (Côtes de Gascogne),Rosé,Domaine d'Arton
63163,France,"Flinty reduction still dominates the nose but this is only a sign of youth in this nuanced wine. It discloses tentative pear blossom and fruit, plus notions of wet earth and candied lime. Above all, a zesty spine of acidity and freshness directs all the attention to a profound, stony core. There is life force here and you know this will continue to evolve.",Calcaire,92,55,Alsace,Alsace,NA,Anne Krebiehl MW,@AnneInVino,Domaine Zind-Humbrecht 2013 Calcaire Pinot Gris (Alsace),Pinot Gris,Domaine Zind-Humbrecht
63169,US,"Pungently earthy in red strawberry and cherry, this is a seductively textured wine from a fine vineyard, made in tiny amounts. Fresh-cut roses and black tea provide a savory element, balancing exuberant fruit and complex notes of cola.",Landy Vineyard,92,52,California,Russian River Valley,Sonoma,Virginie Boone,@vboone,Fulcrum 2013 Landy Vineyard Pinot Noir (Russian River Valley),Pinot Noir,Fulcrum
63292,US,"Blending Zinfandel, Petite Sirah, Cabernet Sauvignon and Petit Verdot, this is a plummy, prune-like expression. Firm, generous tannins surround its juicy black fruit and black pepper flavors, lending structure to the full-bodied fruitiness.",Por que No?,88,30,California,Napa Valley,Napa,Virginie Boone,@vboone,Tres Sabores 2013 Por que No? Red (Napa Valley),Red Blend,Tres Sabores
63332,US,"Pressed apples meld with coconut on the nose. The medium-bodied palate brings notes of banana, melon and an oddly floral note.",NA,84,30,Virginia,Monticello,NA,Alexander Peartree,NA,Tarara 2013 Chardonnay (Monticello),Chardonnay,Tarara
63340,Italy,"This presents aromas of toasted oak, espresso and a whiff of burned tire rubber. The lean palate displays raw, red cherry, coffee and oak extract alongside astringent tannins that leave an abrupt, bitter finish.",Vignabenefizio,84,19,Tuscany,Morellino di Scansano,NA,Kerin O’Keefe,@kerinokeefe,Vignaioli del Morellino di Scansano 2013 Vignabenefizio  (Morellino di Scansano),Red Blend,Vignaioli del Morellino di Scansano
63346,US,"Very perfumed aromas of violets and Hawaiian Punch hit the nose. The palate is effervescent and bouncy, with sour pomegranate and fruit skin bitterness.",NA,83,7,California,Central Coast,Central Coast,Matt Kettmann,@mattkettmann,10Span 2013 Pinot Noir (Central Coast),Pinot Noir,10Span
63360,New Zealand,"This is a crisp, tightly focused offering, but one that doesn't lack fruit. Scents of guava and gooseberry mark the nose, while the flavors are more like grapefruit and underripe pineapple. It shows admirable length for such an inexpensive wine.",Pathway Single Estate,88,13,Marlborough,NA,NA,Joe Czerwinski,@JoeCz,Ara 2013 Pathway Single Estate Sauvignon Blanc (Marlborough),Sauvignon Blanc,Ara
63420,Italy,"Made entirely from Cabernet Franc, this offers blueberry, cedar and bell pepper aromas. The palate is juicy, full of red currant, vanilla and Mediterranean herb flavors, held firm with polished tannins and a tart finish. Drink through 2022.",Scipio,90,110,Tuscany,Toscana,NA,Kerin O’Keefe,@kerinokeefe,Tenuta Sette Cieli 2013 Scipio Red (Toscana),Red Blend,Tenuta Sette Cieli
63457,Austria,"A rounded, fruity and yet zesty Riesling full of freshness and ease. The core of stone fruit is richer than the nose suggests and counters the ripe but zingy acidity beautifully.",Aichleiten Reserve,89,35,Niederösterreich,NA,NA,Anne Krebiehl MW,@AnneInVino,Schwarzböck 2013 Aichleiten Reserve Riesling (Niederösterreich),Riesling,Schwarzböck
63592,Israel,Tropical fruit aromas of mango and guava prepare the palate for flavors of lemon-lime sorbet with notes of freesia. There is a nice vein of minerality that offers a faint sensation of chalkiness on the gums. Softly lingering tannins recede into a crisp finish.,Matar,86,38,Galilee,NA,NA,Mike DeSimone,@worldwineguys,Pelter 2013 Matar Chardonnay (Galilee),Chardonnay,Pelter
63813,Austria,"Very ripe notions of pineapple and soft banana are coupled with a fresh, clean earthiness. A phenolic edge lends mouthfeel and structure while citrus zest pervades the palate with freshness and linearity. With more time in glass, a very charming, tender note of ripe conference pear appears. Give this time to unfold. Drink from 2018.",Achleiten Smaragd,92,39,Wachau,NA,NA,Anne Krebiehl MW,@AnneInVino,Jäger 2013 Achleiten Smaragd Grüner Veltliner (Wachau),Grüner Veltliner,Jäger
64151,Italy,"A tribute to the late Angelo Rocca, this delicious wine opens with aromas suggesting leather, truffle, mature black-skinned berry, fragrant blue flower and a whiff of menthol. The smooth, full-bodied palate offers mouthfuls of red cherry, juicy raspberry, and a note of cake spice while fine-grained tannins provide polished support.",Angelo,92,105,Piedmont,Barbaresco,NA,Kerin O’Keefe,@kerinokeefe,Albino Rocca 2013 Angelo  (Barbaresco),Nebbiolo,Albino Rocca
64169,Australia,"Meaty and savory, this is surprisingly full-bodied and supple for a Yarra Valley Syrah. Blackberry and spice notes balance out the meatiness, imparting a bright, mouthwatering juiciness to the long finish.",Under Woods Steels Creek,92,55,Victoria,Yarra Valley,NA,Joe Czerwinski,@JoeCz,Ben Haines 2013 Under Woods Steels Creek Syrah (Yarra Valley),Syrah,Ben Haines
64232,France,"Sonorous and rounded notions of ripe pear pervade nose and palate. This richness is countered by lovely, fresh and bright acidity, with peppery spice around the edges. This finishes with a pleasant, clean, warm glow.",NA,90,26,Alsace,Alsace,NA,Anne Krebiehl MW,@AnneInVino,Leon Beyer 2013 Pinot Gris (Alsace),Pinot Gris,Leon Beyer
64320,US,"Coming from the Radian Vineyard atop the Sta. Rita Hills, the appellation's veteran Bryan Babcock delivers aromas of pineapple cake, fresh apricot and lemon butter. The wine is well oaked, so expect vanilla and baking spice, but there's a lemony acidity as well, creating a well-balanced wine.",The Limit,92,45,California,Sta. Rita Hills,Central Coast,Matt Kettmann,@mattkettmann,Babcock 2013 The Limit Chardonnay (Sta. Rita Hills),Chardonnay,Babcock
64451,US,"From century-old grapevines found on Santa Cruz Island, this bottling offers concentrated raspberry and a touch of strawberry, lifted by eucalyptus and lavender notes. The palate is enlivening, with tight cranberry fruit, elderflower and pencil-lead flavors.",Estate,90,45,California,Ballard Canyon,Central Coast,Matt Kettmann,@mattkettmann,Rusack 2013 Estate Zinfandel (Ballard Canyon),Zinfandel,Rusack
64914,Australia,"Another fine effort from Sidewood, a winery in the Adelaide Hills that is making some solid wines at realistic prices. Although this wine sees six months of French oak, the oak flavoring impact is minimal, and the wine shows ample fruit, ranging from pear and melon through peach and pineapple. It's a reasonably rich, fruity quaff for summertime drinking.",NA,88,18,South Australia,Adelaide Hills,NA,Joe Czerwinski,@JoeCz,Sidewood 2013 Chardonnay (Adelaide Hills),Chardonnay,Sidewood
64923,US,"This three-vineyard blend is still quite tight and tannic. Flavors of green tea and lemon oil abound, with lighter flavors of pie cherries. Drying tannins wrap it up.",Dundee Hills Select,88,45,Oregon,Dundee Hills,Willamette Valley,Paul Gregutt,@paulgwine ,Torii Mor 2013 Dundee Hills Select Pinot Noir (Dundee Hills),Pinot Noir,Torii Mor
65176,France,"This 65% Merlot wine is ripe, fruity and soft. Coming from a light vintage, it is ready to drink with its blackberry fruits and supporting tannins.",NA,88,35,Bordeaux,Lalande de Pomerol,NA,Roger Voss,@vossroger,Château Vieux Cardinal Lafaurie 2013  Lalande de Pomerol,Bordeaux-style Red Blend,Château Vieux Cardinal Lafaurie
65187,Italy,"Aromas of menthol, espresso and pressed rose take center stage. The medium-bodied palate shows spiced cranberry, pomegranate, roasted coffee bean, anise and a rather green note of powdered sage. Assertive close-grained tannins clench the finish. Give the tannins a few more years to unwind then drink.",Paesi Tuoi,88,60,Piedmont,Barolo,NA,Kerin O’Keefe,@kerinokeefe,Vite Colte 2013 Paesi Tuoi  (Barolo),Nebbiolo,Vite Colte
65195,US,"The aromas of barrel spice, herb and cherry are light and elusive. The red-fruit flavors are medium bodied, pulling up short on the finish.",NA,88,37,Washington,Walla Walla Valley (WA),Columbia Valley,Sean P. Sullivan,@wawinereport,Kontos 2013 Merlot (Walla Walla Valley (WA)),Merlot,Kontos
65287,US,"This stellar unoaked version of the variety, nicely priced, opens with sweet aromas of honeysuckle and jasmine. From there, bristling acidity leads down a road of stone fruit, apple and quince, with a savory twist of ginger on the finish.",Unoaked,88,19,California,Carneros,Napa-Sonoma,Virginie Boone,@vboone,Kopriva 2013 Unoaked Chardonnay (Carneros),Chardonnay,Kopriva
65309,US,"Actress Drew Barrymore's project with Carmel Road shows aromas of sliced golden and red apples, wet cement and freshly cut grass. It's slightly salty on the palate with a tremendous amount of apple cider-like zing that runs through the whole sipping experience, showing both the floral and bitter flavors of ruby-red grapefruit pith.",NA,88,15,California,Monterey,Central Coast,Matt Kettmann,@mattkettmann,Barrymore 2013 Pinot Grigio (Monterey),Pinot Grigio,Barrymore
65469,US,"This full-bodied wine spent 18 months in French oak barrels and has a lightly smoky aroma, vivid red cherry and raspberry flavors, a sleek texture and good concentration.",NA,88,40,California,Livermore Valley,Central Coast,Jim Gordon,@gordone_cellars,3 Steves Winery 2013 Merlot (Livermore Valley),Merlot,3 Steves Winery
65506,US,"Tropical scents of guava and cherimoya with the mineral edge of concrete lead the aromatics on this Carmel Valley wine. Sharp acidity at first sip massages into softness soon afterward, upholding the nose's rocky promise as well as delivering lime-zest tang throughout.",Reserve,91,26,California,Monterey,Central Coast,Matt Kettmann,@mattkettmann,Joullian 2013 Reserve Sauvignon Blanc (Monterey),Sauvignon Blanc,Joullian
65542,France,"The wine is soft and fruity with attractive red cherry favors and light acidity. It's smooth, round and ready to drink, with lively acidity and a touch of tannin on the finish.",NA,84,NA,Beaujolais,Beaujolais-Villages,NA,Roger Voss,@vossroger,Louis Tête 2013  Beaujolais-Villages,Gamay,Louis Tête
65545,Chile,"This SB smells neutral except for a pinch of grassy green. The palate is tangy, while citrusy flavors are not specific. On the finish, this is zesty at first and then falls off.",Reserva,84,9,Bío Bío Valley,NA,NA,Michael Schachner,@wineschach,Porta 2013 Reserva Sauvignon Blanc (Bío Bío Valley),Sauvignon Blanc,Porta
65548,France,"Made from Malbec, this lightly structured wine tastes rich while also fruity. Caramel flavors go over the red berry fruits and give a rounded, still fresh aftertaste.",Chevalier Famaey,84,12,Southwest France,Côtes du Lot,NA,Roger Voss,@vossroger,Château Famaey 2013 Chevalier Famaey Rosé (Côtes du Lot),Rosé,Château Famaey
65571,US,"This pure varietal wine is finished completely dry. Lightly spiced, with fruit flavors of waxy lemon, it seems to fall a bit flat once it hits the tongue. Drink up.",Estate,85,24,Oregon,Rogue Valley,Southern Oregon,Paul Gregutt,@paulgwine ,Weisinger 2013 Estate Gewürztraminer (Rogue Valley),Gewürztraminer,Weisinger
65598,US,"Mike Sinor puts most of his Bassi Ranch fruit, which grows just 1.3 miles from the Shell Beach seafront, into this bottling, which shows ginger snaps, iron, cinnamon, strawberry fruit and black slate on the nose. The palate is tight, focused and driven by rocky minerals, offering just enough cranberry juice to keep it delicious.",NA,92,30,California,San Luis Obispo County,Central Coast,Matt Kettmann,@mattkettmann,Sinor-LaVallee 2013 Pinot Noir (San Luis Obispo County),Pinot Noir,Sinor-LaVallee
65602,Chile,"Aromas of shaved balsam wood, aged cheese and spice accent berry tones on a nose that's far from blowsy. In the mouth, this blend of Cabernet Sauvignon, Syrah, Petit Verdot and Carmenère is ripe, rich and a touch soft. Heady, toasted dark-fruit flavors of blackberry and plum finish spicy and ripe. Drink through 2019.",Aluvion Ensamblaje,92,26,Cachapoal Valley,NA,NA,Michael Schachner,@wineschach,Lagar de Bezana 2013 Aluvion Ensamblaje Red (Cachapoal Valley),Red Blend,Lagar de Bezana
65637,US,"Plum, white peach, pineapple and mango show on the nose of this wine that is quite tropical in aromas. The palate offers yellow pear, buttered toast and salty acidity that come together in a delicious package that is affordable and widely available.",NA,90,18,California,Monterey County,Central Coast,Matt Kettmann,@mattkettmann,Garnet 2013 Chardonnay (Monterey County),Chardonnay,Garnet
65653,France,"For many consumers, Guigal remains a reference point for Rhône wines. This Saint-Joseph is a fine example, showcasing black-cherry fruit, earth and leather notes. It's firmly structured, with crisp acids as well, and should drink well for up to a decade or more.",NA,89,34,Rhône Valley,Saint-Joseph,NA,Joe Czerwinski,@JoeCz,E. Guigal 2013  Saint-Joseph,Rhône-style Red Blend,E. Guigal
65677,US,"This medium-bodied wine has a surprisingly firm texture from crisp acidity and a relative abundance of tannin. It shows tasty, tart cherry and cranberry flavors, and an astringent finish. A little age should smooth it out by late 2015 and beyond.",NA,87,16,California,Mendocino County,NA,Jim Gordon,@gordone_cellars,Bonterra 2013 Pinot Noir (Mendocino County),Pinot Noir,Bonterra
65815,US,"This vintage of Mirabai is open and full-throttle fruity, with appealing cherry scents and flavors. It's a lovely, delicate shade of rose, with a floral component to the bouquet. It's a subtle, elegant wine that offers immediate enjoyment and the prospect of cellaring well through 2020 or longer.",Mirabai,92,35,Oregon,Willamette Valley,Willamette Valley,Paul Gregutt,@paulgwine ,Kelley Fox 2013 Mirabai Pinot Noir (Willamette Valley),Pinot Noir,Kelley Fox
66127,Chile,"Spicy plum and currant aromas have an earthy note about them. This feels raw and lean. Berry and plum flavors are candied, with oaky/spicy accents. On the finish, it's peppery tasting then bitter once the fruit fades.",Reserva,84,11,Casablanca Valley,NA,NA,Michael Schachner,@wineschach,Santa Carolina 2013 Reserva Pinot Noir (Casablanca Valley),Pinot Noir,Santa Carolina
66624,Chile,"Crisp aromas of zesty citrus fold in touches of brine and bitterness. Fresh and peppery on the palate, it has pyrazinic flavors of bell pepper, arugula and passion fruit. A juicy, briny, mildly bitter finish is typical for Leyda SB.",Reserva,86,12,Leyda Valley,NA,NA,Michael Schachner,@wineschach,MontGras 2013 Reserva Sauvignon Blanc (Leyda Valley),Sauvignon Blanc,MontGras
66859,US,"Buttery warmth shows on the nose of this wine by vintner Travis Proctor, alongside poached pear fruit and an iodine edge. Featuring original artwork by James Caprell on the label, the wine offers pan-seared golden apples, tart pear skin and more of the iodine edge once sipped.",NA,89,20,California,Santa Lucia Highlands,Central Coast,Matt Kettmann,@mattkettmann,Poiema 2013 Chardonnay (Santa Lucia Highlands),Chardonnay,Poiema
66866,US,"The Paso producer heads a bit north to produce this wine. Aromas suggest browned butter, lemon slices, pan-seared peach and a bit of smoke, with some steely aromatic backbone. The palate is consumed by lemon blossoms and buttered toast.",Reserve,89,28,California,Santa Lucia Highlands,Central Coast,Matt Kettmann,@mattkettmann,Sextant 2013 Reserve Chardonnay (Santa Lucia Highlands),Chardonnay,Sextant
66868,France,"From Aegerter's own vineyards, this is an initially soft wine. It's only when the background tannins kick in that it becomes firmer, giving a dry, still-young core to this ripe wine. Red fruits dominate, balanced by acidity and a stylish, while firm, aftertaste. Drink from 2017.",NA,89,82,Burgundy,Nuits-St.-Georges,NA,Roger Voss,@vossroger,Jean-Luc and Paul Aegerter 2013  Nuits-St.-Georges,Pinot Noir,Jean-Luc and Paul Aegerter
66878,US,"A complex mélange of briny, preserved lemon, apple crisp and caramel brittle, this wine is deceptively elegant and refined, with a dark, brooding finish.",Oro de Plata,92,33,California,Sonoma Coast,Sonoma,Virginie Boone,@vboone,Keller 2013 Oro de Plata Chardonnay (Sonoma Coast),Chardonnay,Keller
66910,Chile,"Like any good Leyda Valley SB, this opens with oceanic aromas of citrus fruits, sea foam and minerality. In the mouth, it is juicy and stony, with washing acidity. Flavors of honeydew, lime and jalapeño finish firm, with good backbone. Drink this with salads, shellfish and ceviche.",Reserve,88,15,Leyda Valley,NA,NA,Michael Schachner,@wineschach,Santa Ema 2013 Reserve Sauvignon Blanc (Leyda Valley),Sauvignon Blanc,Santa Ema
66920,US,"A blend of Cabernet Sauvignon (70%) and Syrah, brooding aromas of ground stone, herb, brown stem and black fruit give way to dense layered blackberry flavors. It shows great focus, poise, texture and exquisite length. Best from 2021 to 2027.",King Coal Stoneridge Vineyard,95,100,Washington,Washington,Washington Other,Sean P. Sullivan,@wawinereport,K Vintners 2013 King Coal Stoneridge Vineyard Red (Washington),Red Blend,K Vintners
66921,US,"There is impressive depth to the nose of this bottling, with concentrated black cherry, black plum and blueberry fruit enhanced by white pepper, roasted meat, licorice and hot asphalt. The palate is awash in savory flavors, with soy, charred beef and tobacco followed by waves of blueberry and leather and a wash of vanilla, plum skin and mocha, all atop perfectly polished tannins.",Mia's Vineyard,95,50,California,Paso Robles,Central Coast,Matt Kettmann,@mattkettmann,Falcone 2013 Mia's Vineyard Cabernet Sauvignon (Paso Robles),Cabernet Sauvignon,Falcone
66971,US,"Waxy white florals and lifted apple aromas add freshness to slightly cider-like flavors of pressed apple and mulling spice in this dry Riesling. Delicately light bodied it has a brisk, refreshing finish.",Old West Block,87,19,New York,Finger Lakes,Finger Lakes,Anna Lee C. Iijima,NA,Standing Stone 2013 Old West Block Riesling (Finger Lakes),Riesling,Standing Stone
67129,Italy,"Made with 50% Sangiovese, 25% Merlot and 25% Syrah this has aromas suggesting black cherry and Mediterranean herb. The round palate offers black currant, licorice, white pepper and a note of espresso alongside smooth tannins.",Clemente VII,88,50,Tuscany,Toscana,NA,Kerin O’Keefe,@kerinokeefe,Castelli del Grevepesa 2013 Clemente VII Red (Toscana),Red Blend,Castelli del Grevepesa
67164,US,"This wine's aromas are quite generous, suggesting herbs, vanilla, baking spice and purple fruit. Its cranberry and cherry flavors are both tart and ripe, supported by soft tannins and a lingering café au lait note. The oak influence gets in the way of the fruit at times, but it's pleasant all the same.",NA,88,28,Washington,Yakima Valley,Columbia Valley,Sean P. Sullivan,@wawinereport,Stottle 2013 Merlot (Yakima Valley),Merlot,Stottle
67169,Portugal,"This firm, powerful and structured wine is rich with tannins and dark fruits. Spice and wood flavors compete with the ground coffee and juicy fruitiness. A concentrated wine for the long-term, it needs to age, . Drink from 2017.",Terra d'Alter,92,20,Alentejano,NA,NA,Roger Voss,@vossroger,Terras de Alter 2013 Terra d'Alter Alicante Bouschet (Alentejano),Alicante Bouschet,Terras de Alter
