id,country,description,designation,points,price,province,region_1,region_2,taster_name,taster_twitter_handle,title,variety,winery
65745,Italy,"This Riserva Brunello shows the elegant and slightly astringent characteristics associated with the 2006 vintage. The wine is streamlined and tight with bright berry, cassis, cherry cola and licorice aromas. Let it age 5–10 years.",Riserva,91,120,Tuscany,Brunello di Montalcino,NA,NA,NA,Il Cocco 2006 Riserva  (Brunello di Montalcino),Sangiovese Grosso,Il Cocco
67066,France,"A lovely blend from the Languedoc comprised of 60% Cabernet Franc, 30% Syrah and 10% Merlot. The nose and mouth offers loads of menthol and garrigue herbs (especially lavender) along side bright small red berries and sweet green pepper. Medium weight and well structured with a lengthy finish.",NA,87,14,Languedoc-Roussillon,Vin de Pays d'Oc,NA,Lauren Buzzeo,@laurbuzz,Puydeval 2006 Red (Vin de Pays d'Oc),Red Blend,Puydeval
67398,US,"It's pronounced tung-GEE and was formerly known as Chehalem Mountain vineyards. As is often the case with this AVA, it has substantial tannins and a firm, compact structure that bodes well for cellaring. The fruit mixes cherry, pomegranate and hints of banana, while the barrel flavors add some toast and butter.",Tuenge,90,50,Oregon,Chehalem Mountains,Willamette Valley,Paul Gregutt,@paulgwine ,Erath 2006 Tuenge Pinot Noir (Chehalem Mountains),Pinot Noir,Erath
67496,Italy,"This Roero Riserva boasts a light, elegant appearance with defined aromas of citrus zest, pressed flowers and wild blueberries. The tight, drying tannins would pair well with aged cheese or creamy sauces.",Printi Riserva,87,NA,Piedmont,Roero,NA,NA,NA,Monchiero Carbone 2006 Printi Riserva  (Roero),Nebbiolo,Monchiero Carbone
68470,US,"Best of the three, this ripe and round Merlot is fully loaded with juicy, appealing red and blue fruits. Forward and clean, with excellent palate penetration, its smooth tannins are supported with firm acid.",Me,88,18,Washington,Columbia Valley (WA),Columbia Valley,Paul Gregutt,@paulgwine ,Substance 2006 Me Merlot (Columbia Valley (WA)),Merlot,Substance
68725,US,"Made using classic Port grape varieties, this is rich and sweet, with chocolate, coffee, orange, plum and spice flavors. Crisp acidity provides needed balance. It shows a complexity that lifts it above the ordinary. Drink now–2015.",Mistral,93,40,California,Central Coast,Central Coast,NA,NA,Williams Selyem 2006 Mistral Port (Central Coast),Port,Williams Selyem
70252,France,"Beychevelle's style is for elegance, and this wine epitomizes that character. It is sweet, soft, with light tannins, achieving a balance of black fruits and acidity, light in structure and depth.",NA,90,NA,Bordeaux,Saint-Julien,NA,Roger Voss,@vossroger,Château Beychevelle 2006  Saint-Julien,Bordeaux-style Red Blend,Château Beychevelle
70391,Italy,"The color here is a deeper shade of gold and the fragrant aromas are characteristic of a well-made, concentrated Pinot Grigio: honey, peach and Golden Delicious apple ride over a creamy, supple mouthfeel. Fresh flavors include caramel and peach.",NA,87,23,Northeastern Italy,Collio,NA,NA,NA,Pighin 2006 Pinot Grigio (Collio),Pinot Grigio,Pighin
70392,Italy,"Rich texture and concentration are layered with aromas of stone fruit, toasted nut and a distinctive herbal accent. This is a vibrant, golden wine with a round, silky essence and attractive crispness.",NA,87,16,Northeastern Italy,Friuli Grave,NA,NA,NA,Pighin 2006 Pinot Grigio (Friuli Grave),Pinot Grigio,Pighin
70542,Argentina,"This is cool, earthy and tight on the nose. Then it opens and blooms, with classy roasted notes that set the stage for a smooth-rolling palate with bold blackberry, herb and chocolate flavors. By the time it finishes, complex bitter-chocolate and toast notes have taken over. This is primed and ready to drink.",Limited Edition,92,47,Mendoza Province,Luján de Cuyo,NA,Michael Schachner,@wineschach,Enrique Foster 2006 Limited Edition Malbec (Luján de Cuyo),Malbec,Enrique Foster
70913,Italy,"Here's an elegant and powerful wine from the deep south of Italy that cries out for a pairing with succulent steak or an aged cheese such as pecorino. Despite its blunt power and firm tannins, the wine delivers pretty complexity in the form of black currant, prune, slate and tobacco aromas.",NA,90,NA,Southern Italy,Aglianico del Vulture,NA,NA,NA,Macarico 2006  Aglianico del Vulture,Aglianico,Macarico
71062,US,"Known primarily for Zinfandel, this winery's Petite Sirah is robust and full-bodied. It shows the rustic tannins that characterize the variety, with earthy flavors of blackberries and blueberries. Should develop bottle complexity for many years.",NA,86,25,California,Mendocino County,NA,NA,NA,Artezin 2006 Petite Sirah (Mendocino County),Petite Sirah,Artezin
71069,Spain,"A traditional young wine with true Rioja flavors and aromas. It begins with dry, leafy and vanilla aromas along with cherry and raspberry. The palate is fairly acidic, but food will tame any wayward sharpness. For a leaner-bodied but still well-made Rioja, this is good for the money.",Viña Alarde,86,10,Northern Spain,Rioja,NA,Michael Schachner,@wineschach,Berberana 2006 Viña Alarde  (Rioja),Tempranillo,Berberana
71070,Italy,"Crisp and easy with a pristine and luminous appearance and nice tones of pear and peach blossom, this is a no-fuss white that would pair well with fish or appetizers. The alcohol is a bit high but it offers clean acidity and mineral tones in the mouth for balance.",Greco di Tufo,86,18,Southern Italy,Greco di Tufo,NA,NA,NA,Cantina Dei Monaci 2006 Greco di Tufo  (Greco di Tufo),Greco,Cantina Dei Monaci
71127,Italy,"Only a few producers import wines made with the Pecorino variety, and if you like fresh, light Italian whites they are definitely worth trying. This expression is redolent of fresh pear, honey and Golden Delicious apple and even has a slightly greenish hue within its pretty golden highlights.",Colle Vecchio,86,24,Central Italy,Offida Pecorino,NA,NA,NA,Tenuta Cocci Grifoni 2006 Colle Vecchio  (Offida Pecorino),Pecorino,Tenuta Cocci Grifoni
71506,France,"A light wine that shows extreme freshness, rather than any depth. The acidity comes from red currant fruits, showing the freshness that is the wine's dominant character. The finish is short and fruity, a wine to be drunk within two years.",Chapelle de Potensac,86,NA,Bordeaux,Médoc,NA,Roger Voss,@vossroger,Château Potensac 2006 Chapelle de Potensac  (Médoc),Bordeaux-style Red Blend,Château Potensac
71510,Austria,"A rich, vividly red and juicy wine, with a fine balance between the acidity and the bright berry fruits. The whole is then underlined by a sweet, raspberry jam character, ripe and easy.",NA,86,15,Burgenland,NA,NA,Roger Voss,@vossroger,Höpler 2006 Zweigelt (Burgenland),Zweigelt,Höpler
71584,Italy,"Sengia Rossa is a blend of Corvina, Rondinella, Merlot and other varieties that shows plush, rich concentration and a soft, velvety feel. Aromas here include black cherry, cassis, leather, tobacco and a touch of licorice.",Sengia Rossa,88,20,Veneto,Rosso del Veronese,NA,NA,NA,Aldegheri 2006 Sengia Rossa Red (Rosso del Veronese),Red Blend,Aldegheri
71885,Italy,"Light in color and density, Frappato should be consumed slightly chilled with cold cuts or salads. This is a successful and well-priced expression of the native Sicilian variety that offers small berry aromas with background tones of pistachio, marzipan and cherry liqueur.",Mandragola,85,23,Sicily & Sardinia,Vittoria Frappato,NA,NA,NA,Paolo Calì 2006 Mandragola  (Vittoria Frappato),Frappato,Paolo Calì
71910,US,"This best-of-barrels reserve shows a richness and complexity that make for compelling drinking. A mixture of several clones and selections of Pinot Noir, the wine has firm tannins, but the burst of cherries, red currants, root beer and sweet smoky oak gives it a supple, mouth-filling quality. Delicious now with decanting, and should hold and improve through 2012.",Cuvée Sandra,92,75,California,Sta. Rita Hills,Central Coast,NA,NA,Demetria 2006 Cuvée Sandra Pinot Noir (Sta. Rita Hills),Pinot Noir,Demetria
72237,Spain,"Since Torres launched Celeste a few years ago, the wine has gotten better and better with each passing vintage. The 2006 is friendly and complete, with no outlying or iffy aromas or flavors. This is textbook Ribera; it has smoothness and size along with intriguing black cherry, plum, herbs, tea and tobacco. A bottling for pretty much any wine lover.",Celeste Crianza,91,24,Northern Spain,Ribera del Duero,NA,Michael Schachner,@wineschach,Torres 2006 Celeste Crianza  (Ribera del Duero),Tempranillo Blend,Torres
73734,France,87—89 Barrel sample. Full of the vibrant Merlot which is a hallmark of 2006. The wine adds to the fruit solid tannins and a dense structure.,Barrel sample,88,NA,Bordeaux,Saint-Émilion,NA,Roger Voss,@vossroger,Château Teyssier 2006 Barrel sample  (Saint-Émilion),Bordeaux-style Red Blend,Château Teyssier
73819,US,"The trick with growing Syrah in the Highlands is hitting the sweet spot between ripeness and its opposite. This bottling certainly achieves very fruity black currant, dark chocolate, pepper and root beer flavors that are delicious. It has a sharpness throughout that detracts from the lush feeling, but that sharpness may go away with some time in the bottle.",Paraiso Vineyard,86,35,California,Santa Lucia Highlands,Central Coast,NA,NA,Manzoni 2006 Paraiso Vineyard Syrah (Santa Lucia Highlands),Syrah,Manzoni
74079,Italy,"Cuvette Brut has a beautiful floral fragrance of white and yellow flowers, baked bread and Alpine herbs. The elegantly sparkling palate delivers citrus fruit layered with sage and rosemary. The wine's creamy texture is supported by crisp acidity.",Cuvette Brut,91,40,Lombardy,Franciacorta,NA,Kerin O’Keefe,@kerinokeefe,Villa 2006 Cuvette Brut Sparkling (Franciacorta),Sparkling Blend,Villa
74269,Italy,"An unfussy nose of rapberries and grape jam leads to a crisp, juicy palate that finishes with appealing blackberry flavors. The lack of tannin makes this smooth example a good choice for pasta in a tomato sauce.",Quattro Fratelli,86,25,Piedmont,Barbera d'Alba,NA,NA,NA,Boroli 2006 Quattro Fratelli  (Barbera d'Alba),Barbera,Boroli
74358,Chile,"Bramble and green tobacco notes are part of the bouquet, as is rubbery dark fruit. The palate is smooth in feel but a little herbal and leafy, with a mix of berry fruit and mild green notes.",Casa La Joya Reserve,84,11,Colchagua Valley,NA,NA,Michael Schachner,@wineschach,Viña Bisquertt 2006 Casa La Joya Reserve Cabernet Sauvignon (Colchagua Valley),Cabernet Sauvignon,Viña Bisquertt
74575,Italy,"This plush Syrah opens with a pretty ruby color and thick, almost syrupy, tones of blueberry and raspberry. The fruit aromas are followed by spice and roasted almonds and the wine is succulent and chewy to the very end.",Una Viola Signature,88,16,Sicily & Sardinia,Sicilia,NA,NA,NA,Spadina 2006 Una Viola Signature Syrah (Sicilia),Syrah,Spadina
74776,US,"Starting to lose fruit at the age of four years, with the cherries and blackberries fading into the background, which lets the alcohol show through. Soft, too. Seems a bit threadbare, and probably was better a year ago.",Zayante Vineyard,85,45,California,Santa Cruz Mountains,Central Coast,NA,NA,Beauregard 2006 Zayante Vineyard Syrah (Santa Cruz Mountains),Syrah,Beauregard
74797,Argentina,"A strong blast of oak comes across as resin and clove, and thus the wood doesn't augment but instead takes away from the fruit. Speaking of fruit, it's jumpy and tangy, with a finish that tastes of green olives. Overall it doesn't show proper balance or full development.",Maipu Vineyards,83,12,Mendoza Province,Mendoza,NA,Michael Schachner,@wineschach,Pascual Toso 2006 Maipu Vineyards Merlot (Mendoza),Merlot,Pascual Toso
75604,Italy,"Flat and a bit flabby on the nose, this golden Malvasia delivers aromas of stone fruit, mature melon, ash and white mineral. The wine is definitely much more lively in the mouth. where sharp mineral tones add definition and the wine's natural acidity kicks in.",Malvasia,85,22,Northeastern Italy,Friuli Isonzo,NA,NA,NA,Ronco del Gelso 2006 Malvasia Malvasia Istriana (Friuli Isonzo),Malvasia Istriana,Ronco del Gelso
75967,US,"From Stillwater Creek vineyard, this 80/20 blend of Malbec and Cabernet Sauvignon simply tastes young. The fruit is ripe enough, but superficial, with a lot of barrel flavors providing the weight and filling in with smoke, toast and coffee. Malbec has a very promising future in Washington State, and it's good to see young and talented wineries such as Tildio doing the exploration. Right now, this is just a pleasant table wine.",NA,85,28,Washington,Columbia Valley (WA),Columbia Valley,Paul Gregutt,@paulgwine ,Tildio 2006 Malbec (Columbia Valley (WA)),Malbec,Tildio
76048,Argentina,"Fairly reduced, leaving gaseous aromas to struggle with earthy fruit. Talk about chunky ripe fruit and soft tannins: this has almost no detectable grip or grab, thus the structure is flabby and there's zero bite. Conversely, the flavors are deep and the richness is up there. Drink now.",NA,86,35,Mendoza Province,Altos de Mendoza,NA,Michael Schachner,@wineschach,Luca 2006 Malbec (Altos de Mendoza),Malbec,Luca
76330,US,"Here's an everyday, country-style Chardonnay with good enough flavors of tropical fruits and smoky vanilla oak, and a nicely creamy texture, to satisfy.",Estate,84,17,California,Dry Creek Valley,Sonoma,NA,NA,Mill Creek 2006 Estate Chardonnay (Dry Creek Valley),Chardonnay,Mill Creek
77119,France,"High toast and burnt wood are initially off-putting. The tannins in the wine are also on the smoky side. However, there is fruit here, offering some balance in this powerful, dry wine, and giving some blackberry juiciness, which gives relief from the intensity of the wood.",Les Comtes,87,28,Bordeaux,Premieres Côtes de Bordeaux,NA,Roger Voss,@vossroger,Château Lagarosse 2006 Les Comtes  (Premieres Côtes de Bordeaux),Bordeaux-style Red Blend,Château Lagarosse
77427,US,"This is an impressive wine, with its aromas of pear, apple, spice and honey, and its rich spiced flavors buoyed by crisp acidity. Complex but refreshing, with a smooth, lingering finish. Overall, food friendly and stylish.",Barrel Fermented,87,18,New York,Finger Lakes,Finger Lakes,Susan Kostrzewa,@suskostrzewa,Red Tail Ridge 2006 Barrel Fermented Chardonnay (Finger Lakes),Chardonnay,Red Tail Ridge
77436,US,"An interesting white wine that shows the usual Paso Robles fruity ripeness, but also a rich minerality. The flavors are of jammy pineapples, nectarines and honeysuckle flowers, with a chalky undertow.",Points West,87,32,California,Paso Robles,Central Coast,NA,NA,Lone Madrone 2006 Points West Roussanne (Paso Robles),Roussanne,Lone Madrone
77621,Austria,"A Pannobile blend is one that is tasted and approved by a group of producers in Gols, on the north shore of Lake Neusiedl. This firmly tannic wine is a good example of the style—solid, rich, more than the sum of its parts, giving big black berry fruits as well as vibrant juiciness.",Pannobile,90,35,Burgenland,NA,NA,Roger Voss,@vossroger,Gsellmann & Hans 2006 Pannobile Red (Burgenland),Austrian Red Blend,Gsellmann & Hans
77635,France,"Soft, velvety, with sweet chocolate flavors from new wood and tannins that are gently wrapped in red berry fruits. It is developing quickly, the wood opening up. It will be very enjoyable in 2–3 years.",NA,89,NA,Bordeaux,Margaux,NA,Roger Voss,@vossroger,Château Siran 2006  Margaux,Bordeaux-style Red Blend,Château Siran
78252,US,"No question that the flavors of this Mourvedre, Grenache, Syrah and Counoise blend are delicious. Raspberry and cherry tart, mocha, oatmeal raisin cookie, vanilla, what's not to like? The problem is the structure, which is soft and lacking in vibrancy and tannic firmness. Drink now.",Esprit de Beaucastel,87,45,California,Paso Robles,Central Coast,NA,NA,Tablas Creek 2006 Esprit de Beaucastel Red (Paso Robles),Rhône-style Red Blend,Tablas Creek
78413,US,"There are Russian River Pinot Noirs that are dark, heavy and dense, and then there are bottlings like this. It's a silky, light-hearted wine, easy and gentle in the mouth. At the same time, the flavors are complex, with waves of cherries, red currants, cola, pomegranates, mocha and an array of sweet Asian spices. Drink now.",Maboroshi Vineyard,90,42,California,Russian River Valley,Sonoma,NA,NA,De Loach 2006 Maboroshi Vineyard Pinot Noir (Russian River Valley),Pinot Noir,De Loach
78419,Austria,"Certainly a rich Riesling, but at the same time the white fruits show delicacy and elegance. Yellow plums, peach and almonds come together in a complex wine that has fruit juice freshness along with a crisp lime aftertaste. It could certainly age—give it 4–5 years. Screwcap.",Terrassen,90,31,Kamptal,NA,NA,Roger Voss,@vossroger,Loimer 2006 Terrassen Riesling (Kamptal),Riesling,Loimer
78478,South Africa,"Savory cherry, raspberry and plum aromas in this approachable Pinotage lead into spicy, savory flavors of cherry, plum and smoke. It's an accessible version of a variety that can be tough for some to embrace. Pair with pork or spicy dishes.",NA,86,10,Western Cape,NA,NA,Susan Kostrzewa,@suskostrzewa,Golden Kaan 2006 Pinotage (Western Cape),Pinotage,Golden Kaan
79761,Italy,"From the Valpantena subzone of Valpolicella, this easy Ripasso opens with a thin ruby color and bright aromas of white cherry, raspberry candy and vanilla. The wine closes with a fresh, tonic feel and lively berry flavors.",NA,87,20,Veneto,Valpolicella Ripasso Valpantena Superiore,NA,NA,NA,Tezza 2006  Valpolicella Ripasso Valpantena Superiore,"Corvina, Rondinella, Molinara",Tezza
80639,France,"Definitely the lightest of Saint-Emilion's Premiers Grand Crus in 2006, this wine aims below its station. It is attractive, perfumed, fresh, with open berry fruits. But the texture is thin and the tannins are almost mature. Not for much aging.",NA,90,NA,Bordeaux,Saint-Émilion,NA,Roger Voss,@vossroger,Château Beausejour-Duffau-Lagarrosse 2006  Saint-Émilion,Bordeaux-style Red Blend,Château Beausejour-Duffau-Lagarrosse
80923,Italy,"This savory and meaty red wine is made from air-dried Nebbiolo grapes much in the same style as Amarone. It opens with thick tones of pipe tobacco, smoked bacon and dried blackberry fruit. It shows power, density and personality.",Ronco del Picchio,90,64,Lombardy,Sforzato di Valtellina,NA,NA,NA,Fay 2006 Ronco del Picchio  (Sforzato di Valtellina),Nebbiolo,Fay
81065,US,"David Hill's 2006 Pinot Noirs are a clear step up from earlier vintages. This Barrel Select bottling, done in a fairly light, rather delicate style, offers lovely texture and balance, with ripe flavors of strawberry, brandied cherries and baker's chocolate. Suggestions of earth and iron filings add interest and weight to the finish.",Barrel Select Estate,89,28,Oregon,Willamette Valley,Willamette Valley,Paul Gregutt,@paulgwine ,David Hill 2006 Barrel Select Estate Pinot Noir (Willamette Valley),Pinot Noir,David Hill
81292,US,"In a sea of mediocre Merlots, Longboard's '06 stands out. It's not only deliciously ripe and generous in blackberries, cherries, currants, licorice, cola and mocha flavors, but the structure of fine acidity and smooth, elegant tannins makes it delectable.",DaKine Vineyard,91,24,California,Russian River Valley,Sonoma,NA,NA,Longboard 2006 DaKine Vineyard Merlot (Russian River Valley),Merlot,Longboard
81465,US,"Though Washington is rarely recognized for its Gewürztraminers, the grape does exceptionally well here, and Celilo in particular has become a treasured hunting ground for winemakers specializing in the grape. This one is a gem: spicy and off-dry, it expands across the palate with authority and precision. Rather than sweetly floral, it leans toward flavors that are sweetly grassy, but lets pretty rose petal highlights fill in the back of the palate.",NA,89,14,Washington,Columbia Valley (WA),Columbia Valley,Paul Gregutt,@paulgwine ,Maryhill 2006 Gewürztraminer (Columbia Valley (WA)),Gewürztraminer,Maryhill
81466,US,"This is a lovely, orange blossom special. Sweet and tart, penetrating and long, with lovely peaches, apricots and oranges lighting it up.",Lewis Vineyards,89,12,Washington,Yakima Valley,Columbia Valley,Paul Gregutt,@paulgwine ,Trio Vintners 2006 Lewis Vineyards Riesling (Yakima Valley),Riesling,Trio Vintners
81763,Australia,"Penley's vineyards, towards the warmer north end of Coonawarra, consistently produce noteworthy Shiraz. It's on the big size, at 15% alcohol, but structured, with bushels of mixed berries supported by cinnamon toast, brown sugar and a hint of mintiness. Drink it now and over the next 10 years.",Special Select,90,50,South Australia,Coonawarra,NA,Joe Czerwinski,@JoeCz,Penley Estate 2006 Special Select Shiraz (Coonawarra),Shiraz,Penley Estate
81865,France,"89—91 Barrel sample. The top wine produced by Jess Jackson in St-Emilion, Lassègue is soft, ripe, open, packed with dark plums, very opulent.",Barrel sample,90,NA,Bordeaux,Saint-Émilion,NA,Roger Voss,@vossroger,Château Lassègue 2006 Barrel sample  (Saint-Émilion),Bordeaux-style Red Blend,Château Lassègue
82483,Italy,"San Polo has shown very impressive work lately and this velvety rich Brunello pushes its ambitions even further. The bouquet offers a long succession of beautiful aromas including black cherry, vanilla, carob, cola, cinnamon spice and black licorice. There's also a drying mineral note that adds a dusty touch of elegance and sophistication.",NA,94,75,Tuscany,Brunello di Montalcino,NA,NA,NA,San Polo 2006  Brunello di Montalcino,Sangiovese Grosso,San Polo
82549,US,Spun sugar scents lead into a wine with modest fruit flavors. The mouthfeel and finish are a touch dilute.,Anna Maria,82,24,Oregon,Applegate Valley,Southern Oregon,Paul Gregutt,@paulgwine ,Valley View 2006 Anna Maria Cabernet Sauvignon (Applegate Valley),Cabernet Sauvignon,Valley View
82872,Italy,"Rocche Barolo is another homerun for Vietti. You'll fall in love with the wine's rich intensity and the ensuing complexity that becomes apparent as the wine spends more time in the glass. Thanks to a continuing evolution, you'll recognize aromas of wild berry, smoke, crushed stone, licorice, cola and mesquite. The tannins are silky and smooth. Hold ten years or more.",Rocche,95,130,Piedmont,Barolo,NA,NA,NA,Vietti 2006 Rocche  (Barolo),Nebbiolo,Vietti
83383,Italy,"Campo Prognài is a gracefully oak-aged Valpolicella Superiore that shows surprising density and persistency with lively aromas of cherry, blackberry, toasted almond and exotic spice. Pair this wine with roasted chicken or meatloaf.",Campo Prognài,87,25,Veneto,Valpolicella Superiore,NA,NA,NA,Latium di Morini 2006 Campo Prognài  (Valpolicella Superiore),"Corvina, Rondinella, Molinara",Latium di Morini
83911,US,"Bone dry, tough and leathery, with a bitter, raisiny edge to the blackberries and cherries. Drink now.",Tatria Vintner's Limited Reserve,83,35,California,Temecula Valley,South Coast,NA,NA,Stuart Cellars 2006 Tatria Vintner's Limited Reserve Meritage (Temecula Valley),Meritage,Stuart Cellars
84081,Italy,"Here's a fun, screwcap Pinot Grigio that opens with peach, pineapple and lemon zest followed by light mineral shadings. It's fresh, easy and compact overall.",NA,85,13,Northeastern Italy,Delle Venezie,NA,NA,NA,Esperto 2006 Pinot Grigio (Delle Venezie),Pinot Grigio,Esperto
84088,Italy,"Here is a playful Riesling with a nice balance between sweet fruit and drying mineral tones that give the wine dimension and intensity. Aromas include stone fruit, white flower and natural rubber.",Riesling,85,22,Northeastern Italy,Colli Orientali del Friuli,NA,NA,NA,Aquila del Torre 2006 Riesling Riesling (Colli Orientali del Friuli),Riesling,Aquila del Torre
84187,Germany,"This wine doesn't have the easy elegance of Nik Weis's best vintages, but it still packs in plenty of mineral-tinged apple and citrus flavor. Give it a year or two to come together, then drink it over the next five.",Ockfener Bockstein Kabinett,88,16,Mosel-Saar-Ruwer,NA,NA,Joe Czerwinski,@JoeCz,St. Urbans-Hof 2006 Ockfener Bockstein Kabinett Riesling (Mosel-Saar-Ruwer),Riesling,St. Urbans-Hof
84192,Portugal,"This dry Vinho Verde shows great crisp, green apple and grapefruit flavors, a deliciously fresh wine, with green edges and lively flavors. Great summer drink.",NA,88,8,Vinho Verde,NA,NA,Roger Voss,@vossroger,Casa de Vila Verde 2006 White (Vinho Verde),Portuguese White,Casa de Vila Verde
84673,Italy,"This wine delivers electric intensity backed by mature notes of black cherry, prune, plum, tobacco, leather and spice. It's a bit on the ripe, juicy side and that's what gives this Chianti Classico its chewy texture and lengthy persistency. It has good balance between spice and fruit in the mouth.",NA,88,NA,Tuscany,Chianti Classico,NA,NA,NA,Castello di Uzzano 2006  Chianti Classico,Sangiovese,Castello di Uzzano
84674,Italy,"Here's a modern, sweet-smelling Chianti Classico (with 10% Cabernet Sauvignon in the blend) with many aromatic layers. The wine offers luscious berry fruit, loads of spice, mineral nuances and toasted nut or vanilla bean. It has beautiful intensity and concentration with sweet notes of spice and plump cherry in the mouth.",Messer Pietro di Teuzzo,88,NA,Tuscany,Chianti Classico,NA,NA,NA,Cecchi 2006 Messer Pietro di Teuzzo  (Chianti Classico),Sangiovese,Cecchi
84687,Italy,"This is a genuine wine with very nice integrity of fruit and a clean, compact quality through and through. Aromas include cherry, blueberry, almond paste, molasses, forest berry and coffee bean. It has a fresh personality and imparts lasting tones of crisp fruit on the palate. Made by enologist Gioia Cresti.",NA,88,NA,Tuscany,Chianti Classico,NA,NA,NA,Lornano 2006  Chianti Classico,Sangiovese,Lornano
