id,country,description,designation,points,price,province,region_1,region_2,taster_name,taster_twitter_handle,title,variety,winery
65864,US,"Merlot comprises 53% of the blend, Cabernet Sauvignon 40%, and Cab Franc fills in the final 7%. Well built and satisfyingly complete, this tribute to grower Dick Boushey uses fruit from his oldest (25-year) vines. Scents of toast, mint and moist earth introduce varied fruit flavors of boysenberry, purple grape, cherry and plum. It's a big, bold wine that segues neatly into a finish of chocolate and butterscotch.",Boushey Vineyard Red Wine,91,50,Washington,Yakima Valley,Columbia Valley,Paul Gregutt,@paulgwine ,Fidelitas 2005 Boushey Vineyard Red Wine Red (Yakima Valley),Red Blend,Fidelitas
65867,Italy,"A gorgeous blend of Cabernet and Negroamaro, this is one of Puglia's best red wines. The Cabernet element adds accents of spice and blackberry and the Negroamaro grounds the robust wine to its territory. The tannins are tight and firm and suggest that Nero could do with a few years of bottle aging.",Nero,90,53,Southern Italy,Salento,NA,NA,NA,Conti Zecca 2005 Nero Red (Salento),Red Blend,Conti Zecca
66748,US,"A beautiful Cabernet, made in an elegantly approachable way. Dry and smooth, it shows complex flavors of blackberries, currants and dried herbs, wrapped into rich, dusty tannins. The alcohol level is quite high, but balanced, in a California way.",NA,92,50,California,Sonoma County,Sonoma,NA,NA,Arrowood 2005 Cabernet Sauvignon (Sonoma County),Cabernet Sauvignon,Arrowood
67023,Spain,"This wine is absolutely what fans of traditional Rioja should be on the lookout for. It's smooth, elegant and complex on the bouquet, the perfect introduction to a firm yet classy palate, with berry, plum, spice, tobacco and vanilla flavors. Dry, toasty and just right on the finish. Drink now–2020.",Gran Reserva,93,33,Northern Spain,Rioja,NA,Michael Schachner,@wineschach,Beronia 2005 Gran Reserva  (Rioja),Red Blend,Beronia
67707,Argentina,"A touch raisiny but lusty and rich, with licorice, mint, black plum and fruitcake aromas. The palate is mouthfilling despite rather pointed acidity, and thus the flavors of juicy blackberry, cherry, pepper and coffee are accurate and appropriate. Long, toasty and yet again slightly raisiny on the finish. Drink now; 300 cases made.",Gran Reserva,90,45,Mendoza Province,Mendoza,NA,Michael Schachner,@wineschach,Cinco Sentidos 2005 Gran Reserva Red (Mendoza),Red Blend,Cinco Sentidos
68580,Portugal,"A deliciously rich and spicy wine, very much in the style of the new Douro wines, softly perfumed, with black plums, sweet and dusty tannins, only a hint of dryness. The wine is balanced, with great fruit and acidity to go with the structure.",Três Bagos,91,18,Douro,NA,NA,Roger Voss,@vossroger,Lavradores de Feitoria 2005 Três Bagos Red (Douro),Portuguese Red,Lavradores de Feitoria
70644,US,"Mondavi Cabernet from Paso Robles? Well, yes, and a pretty good one for the price. It's dry and balanced, with juicy currant, blackberry and oak flavors. Shows quite a bit of sophistication. Drink now.",NA,86,17,California,Paso Robles,Central Coast,NA,NA,Solaire by Robert Mondavi 2005 Cabernet Sauvignon (Paso Robles),Cabernet Sauvignon,Solaire by Robert Mondavi
71053,Spain,"For a fresh and fruity wine that tastes real and of the place, we recommend this Tempranillo-Cabernet blend. It is floral and just the slightest bit touched by oak. The palate is sweet, ripe and creamy, with strawberry and raspberry flavors holding on until the last drop. Good value from Campo de Borja, Spain.",NA,86,10,Northern Spain,Campo de Borja,NA,Michael Schachner,@wineschach,Coto de Hayas 2005 Tempranillo-Cabernet Sauvignon (Campo de Borja),Tempranillo-Cabernet Sauvignon,Coto de Hayas
71112,US,"A little weedy, despite lots of flashy oak. The pineapples and peaches have notes of dried dill and thyme, and the finish is dry and crisp. Nice with broiled halibut in a thyme-butter sauce.",NA,86,24,California,Carneros,Napa-Sonoma,NA,NA,Domaine Chandon 2005 Chardonnay (Carneros),Chardonnay,Domaine Chandon
71178,Spain,"Méntrida is an island wine region in the middle of central Spain, and this blend of Garnacha and Syrah is lively, juicy and delicious. The nose is deep and luscious, with mounds of cassis and blackberry. The spunky palate shows big tannins but plenty of offsetting fruit and pulp. Finishing notes of chocolate and pepper leave a positive lasting impression. Should age for several more years; 400 cases produced.",NA,91,24,Central Spain,Mentrida,NA,Michael Schachner,@wineschach,Tres Patas 2005 Grenache-Syrah (Mentrida),Grenache-Syrah,Tres Patas
71284,Italy,"Duemani is known for its high quality organic and biodynamic wines from Tuscany. This hearty expression of Cab Franc shows wonderful intensity with dark aromas of blackberry, black cherry, crushed pepper and polished river stone. The wine is firm and and focused with finely textured tannins.",NA,90,90,Tuscany,Toscana,NA,NA,NA,Duemani 2005 Cabernet Franc (Toscana),Cabernet Franc,Duemani
71316,Italy,"This cheerful Barolo shows many of the most common characteristics associated with the Brunate cru. Because this site has darker, denser soils, the wine shows more richness and intensity of aromas and flavors. You'll get black cherry, plum, peppercorn and Indian spice. The mouthfeel is tight and firm.",Vigneto Brunate,92,NA,Piedmont,Barolo,NA,NA,NA,Andrea Oberto 2005 Vigneto Brunate  (Barolo),Nebbiolo,Andrea Oberto
72230,Spain,"A tiny production wine with class and style. It's toasty and dark, with bold black cherry and cassis aromas offset by ample minerality. From the town of Torroja, this 233-case wine is full of molasses, black cherry and other rich, brandied flavors. And it finishes warm, with caramel, coffee and other major-league attributes. Hold until 2010, if possible.",NA,91,75,Catalonia,Priorat,NA,Michael Schachner,@wineschach,Terroir Al Límit 2005 Red (Priorat),Red Blend,Terroir Al Límit
73108,US,"A rustic, brawny wine made for barbecued steak, this Cab has pronounced tannins balanced by lots of sweet, ripe fruit. The cherry, blackberry, plum and unsweetened chocolate flavors have a spicy, peppery finish.",Crystal Valley Cellars The Cab,86,18,California,California,California Other,NA,NA,Cosentino 2005 Crystal Valley Cellars The Cab Cabernet Sauvignon (California),Cabernet Sauvignon,Cosentino
73807,US,"Peppery and hot, with blackberry and currant flavors wrapped into firm tannins. Not showing much openness now, but feels like it has the potential to develop with a few years in the bottle.",Jack London Vineyard,86,35,California,Sonoma Valley,Sonoma,NA,NA,Kenwood 2005 Jack London Vineyard Cabernet Sauvignon (Sonoma Valley),Cabernet Sauvignon,Kenwood
74555,Chile,"In every vintage this blend of Cabernet, Malbec, Merlot and Carmenère gets a little better, and the 2005 is the best yet. It's a ripe one for sure, with licorice, kirsch and earthy warmth on the nose. The body is big and the wine tastes of berry jam, licorice and chocolate. Balanced and long, with bitter espresso on the finish. Drink now through 2010.",Quatro Reserva,91,16,Colchagua Valley,NA,NA,Michael Schachner,@wineschach,MontGras 2005 Quatro Reserva Red (Colchagua Valley),Red Blend,MontGras
74864,Italy,"Renieri's newest Brunello offers perfumed tones of church incense backed by Indian spice and red berries. The wine is bright and tonic with some sour fruit and a nice, silky feel to the tannins.",NA,89,NA,Tuscany,Brunello di Montalcino,NA,NA,NA,Renieri 2005  Brunello di Montalcino,Sangiovese Grosso,Renieri
76041,US,"Showing some aggressive tannins now, this unusual blend hails from Napa, San Luis Obispo and San Joaquin counties. It's very dry, with a solid core of red and black currant, carob and bell pepper flavors. Could develop some bottle complexity in a few years.",Special Reserve Cabernet Sauvignon-Zinfandel-Syrah,86,34,California,California,California Other,NA,NA,Herzog 2005 Special Reserve Cabernet Sauvignon-Zinfandel-Syrah Red (California),Red Blend,Herzog
77023,Spain,"Values from Spain are becoming less common than they were a few years back, so hail this nicely made Tempranillo that delivers tons of ripe fruit, purity and drinkability. It's nothing difficult or complex; instead it is dark, chewy and pounds you with ripe black-fruit flavors. A mouthfilling, fully ripe wine with a modest upside but no faults.",NA,88,12,Central Spain,La Mancha,NA,Michael Schachner,@wineschach,Finca Antigua 2005 Tempranillo (La Mancha),Tempranillo,Finca Antigua
77419,US,"Deliciously drinkable now, with very dry but ripely opulent flavors of black currants, cherry marmalade, mocha, root beer and caramelized oak. Could have greater structure and a longer finish, but lovely with a charbroiled steak.",NA,87,100,California,Napa Valley,Napa,NA,NA,Palmaz 2005 Cabernet Sauvignon (Napa Valley),Cabernet Sauvignon,Palmaz
77429,Spain,"Sierra Cantabria's wines are usually so good that one that's simple, tasty and regular such as this might get overlooked. But if you want an honest crianza with touches of balsam wood, bacon and rubber as well as dry plum and cherry fruit, this is it. Finishes peppery, with full tannins and oak-driven mocha flavor.",Crianza,87,20,Northern Spain,Rioja,NA,Michael Schachner,@wineschach,Sierra Cantabria 2005 Crianza  (Rioja),Tempranillo Blend,Sierra Cantabria
77712,US,"Sugary and simple, with sweet cola, licorice, blackberry and cherry jam flavors. The tannins are very finely structured, but the wine is just too sweet.",Rolling Hills Estate Vineyard,83,24,California,Temecula,South Coast,NA,NA,South Coast 2005 Rolling Hills Estate Vineyard Syrah (Temecula),Syrah,South Coast
77806,Italy,"This is a very pleasant and elegant blend of Nero d'Avola, Cabernet Sauvignon and Merlot that does a great job of presenting a united aromatic front. There are no loose edges here and the wine is compact and smooth in the mouth. Very nice.",Triskelè,89,29,Sicily & Sardinia,Sicilia,NA,NA,NA,Duca di Salaparuta 2005 Triskelè Red (Sicilia),Red Blend,Duca di Salaparuta
78089,US,"A blend of four of the major Bordeaux varieties, this wine is soft and rustic. It has dry, earthy cherry, currant and tobacco flavors that taste a little sweet and sour.",Sortie,83,22,California,North Coast,North Coast,NA,NA,Estraié 2005 Sortie Red (North Coast),Bordeaux-style Red Blend,Estraié
78241,US,"Ultra-ripe, this Cab is decadently tasty, but not really dry. It's almost as gooey soft and sweet as a dessert pastry, with flavors of pie crust, chocolate pudding, sweet blackberry jam, currants and licorice. Drink now.",NA,87,60,California,Napa Valley,Napa,NA,NA,Brookman 2005 Cabernet Sauvignon (Napa Valley),Cabernet Sauvignon,Brookman
78242,Italy,"D'istinto is a very attractive and plump Shiraz from Sicily that delivers aromas of exotic spice, leather, tobacco, crushed peppercorn and black cherry. The wine is dense, chewy and raw but makes a solid, everyday drinking red.",D'istinto,87,14,Sicily & Sardinia,Sicilia,NA,NA,NA,Calatrasi 2005 D'istinto Shiraz (Sicilia),Shiraz,Calatrasi
78264,Spain,"Earthy, dusty plum and berry aromas are concentrated, while this mature gran reserva is still vital on the palate due to fine, crisp acidity. Classic Rioja flavors of vanilla and tobacco accent raspberry and dried cherry flavors, while the finish is mild, harmonious and full of oaky vanilla notes. Drink through 2025.",Coto de Imaz Gran Reserva,93,44,Northern Spain,Rioja,NA,Michael Schachner,@wineschach,El Coto 2005 Coto de Imaz Gran Reserva  (Rioja),Tempranillo,El Coto
78412,US,"This 100% estate-grown Syrah remains obstinately hard and tight, with a strongly tannic streak. Tangy and concentrated fruit flavors include boysenberry and loganberry jam, with a streak of graphite and stone. Give it a lot of breathing time—decanting would be best.",Dauphiné,90,70,Washington,Walla Walla Valley (WA),Columbia Valley,Paul Gregutt,@paulgwine ,Nicholas Cole Cellars 2005 Dauphiné Syrah (Walla Walla Valley (WA)),Syrah,Nicholas Cole Cellars
79119,US,"This has light, pretty cherry and raspberry fruit flavors, forward and slightly sweet. The acids are chewy and puckery—acidification?—and therefore the finish is rather citric and sharp. The addition of 25% Cabernet Sauvignon may have also contributed.",NA,84,10,Washington,Columbia Valley (WA),Columbia Valley,Paul Gregutt,@paulgwine ,Snoqualmie 2005 Merlot (Columbia Valley (WA)),Merlot,Snoqualmie
79618,US,"Bring this down to the cellar and let it sleep for at least 5–6 years. It's super-tannic, giving a hard, angular mouthfeel, even though the blackberry, cherry, currant and cedar flavors are powerful. It just wants to throw some sediment and let that mountain fruit shine.",Gist Ranch Estate,90,48,California,Santa Cruz Mountains,Central Coast,NA,NA,Thomas Fogarty 2005 Gist Ranch Estate Merlot (Santa Cruz Mountains),Merlot,Thomas Fogarty
79668,US,"A sweaty smell opens the wine, followed with light strawberry and leafy herb notes. In the mouth the wine is thin and tart, with a hard, tannic finish. There isn't any stuffing, and it lacks the elegance and precision that could take the place of mere power. What's left is leafy, herbal and astringent, but charmless. Two bottles tasted.",Vintage Reserve,83,34,Oregon,Willamette Valley,Willamette Valley,Paul Gregutt,@paulgwine ,Oak Knoll 2005 Vintage Reserve Pinot Noir (Willamette Valley),Pinot Noir,Oak Knoll
80125,US,"Good structure on this dry table wine, with firm tannins and cleansing acidity. But there's not a whole lot of flavor, with watered-down notes of blackberries.",NA,83,25,California,Napa Valley,Napa,NA,NA,Markham 2005 Merlot (Napa Valley),Merlot,Markham
80211,Italy,"Aromas include bright red cherry, cured meat, spice, plum and pencil lead. The wine has a direct delivery of fragrances and the focus here is definitely in the quality of fruit and its natural intensity. The execution is polished and pristine and the wine has a smooth, but firm texture on the finish.",Asij,90,43,Piedmont,Barbaresco,NA,NA,NA,Ceretto 2005 Asij  (Barbaresco),Nebbiolo,Ceretto
80335,Spain,"A traditional style of Rioja with earthy, peppery, dry aromas in front of a healthy, lively palate. Tastes like vanilla and buttery oak on top of zesty but restrained raspberry and red plum. Shows spice, character and a wholeness that makes it a winner. Drink now through 2015.",Reserva,91,45,Northern Spain,Rioja,NA,Michael Schachner,@wineschach,Marqués de Elciego 2005 Reserva  (Rioja),Tempranillo,Marqués de Elciego
81045,US,"A very nice, polished Syrah that shows its cool-climate origins in the brisk acidity and black pepper spiciness that make the tastebuds whistle. There's a good core of blackberry, coffee and baker's chocolate fruit, although it could be a little more concentrated for the price. Drink now through 2009.",Limited Selection,89,42,California,Sta. Rita Hills,Central Coast,NA,NA,Gainey 2005 Limited Selection Syrah (Sta. Rita Hills),Syrah,Gainey
81295,Portugal,"A fine, balanced wine that brings out good toastiness alongside sweet, ripe fruit. Well made, showing good balance, with acidity giving a lift to all the richness. The aftertaste is rounded and delicious.",Reserva,91,28,Douro,NA,NA,Roger Voss,@vossroger,Quinta das Tecedeiras 2005 Reserva Red (Douro),Portuguese Red,Quinta das Tecedeiras
81300,France,"Certainly intense, dominated by dry botrytis, with the syrup element here in texture rather than taste. The wine has a great tension between richness and intense acidity, a wine with a potential of 15 years aging or more, but for the moment an intense glass of wine.",Nectar de Moncontour,91,45,Loire Valley,Vouvray,NA,Roger Voss,@vossroger,Château Moncontour 2005 Nectar de Moncontour  (Vouvray),Chenin Blanc,Château Moncontour
81308,US,"The grapes for this Cabernet Sauvignon and Merlot blend were grown in the Chiles Valley section of Napa. The wine in its youth is extremely tannic and dry, making it unsuitable for drinking anytime soon. But it's exceptionally balanced and has a deep, attractive core of black currant and cedar flavors. There's no reason why it should not age well. Try after 2011.",Estate,90,42,California,Chiles Valley,Napa,NA,NA,Volker Eisele Family Estate 2005 Estate Cabernet Sauvignon (Chiles Valley),Cabernet Sauvignon,Volker Eisele Family Estate
81422,US,"Not showing much now, beyond good berry and orange fruit, smooth tannins and fine acidity. It's a wine you'd easily bypass in a big tasting, in favor of a more muscular style. But then, showiness in youth has never been Calera's forte. Should slowly gain bottle complexity over the years. Best 2010-2013.",Thirtieth Anniversary Vintage Reed Vineyard,90,50,California,Mt. Harlan,Central Coast,NA,NA,Calera 2005 Thirtieth Anniversary Vintage Reed Vineyard Pinot Noir (Mt. Harlan),Pinot Noir,Calera
81424,US,"This is 100% Cabernet from three different vineyards, mixing cherry, berry, plum and cassis, and setting the fruit against crisp acids. The tannins, slightly green around the edges, are focused and appropriate. Could it be fleshed out with a little Merlot? Yes, but the elegance and precision of pure Cabernet is somehow more thrilling.",Columbia Valley,90,30,Washington,Columbia Valley (WA),Columbia Valley,Paul Gregutt,@paulgwine ,Fall Line 2005 Columbia Valley Cabernet Sauvignon (Columbia Valley (WA)),Cabernet Sauvignon,Fall Line
81454,US,"Shafer's '05 is drier, crisper and more minerally than its predecessors from warmer vintages. You might even call it leaner. But it still shows the elegant balance that always characterizes the wine, with brilliant acidity.",Red Shoulder Ranch,89,45,California,Carneros,Napa-Sonoma,NA,NA,Shafer 2005 Red Shoulder Ranch Chardonnay (Carneros),Chardonnay,Shafer
84692,US,"Soft in texture, this Zin has flavors of freshly crushed, ripe blackberries, cherries and raspberries, cocoa and black pepper, with a burnt brown-butter, baked pastry crust edge. It's pretty tannic, which makes it a good foil for rich meats and cheeses. Decant for an hour or two.",Old Vines,88,32,California,Sonoma County,Sonoma,NA,NA,Wild Oak by St. Francis 2005 Old Vines Zinfandel (Sonoma County),Zinfandel,Wild Oak by St. Francis
84783,Spain,"Hailing from a warm year, this wine is still a brute. Smoky, rubbery aromas of cassis and strawberry vascilate between ripe and candied. This is full-volume, even pushy, on the palate, with blazing acidity and rocky, spicy, peppery berry flavors. Let this rest at least another five years; revisit in 2019–2020.",Imperial Gran Reserva,90,60,Northern Spain,Rioja,NA,Michael Schachner,@wineschach,CVNE 2005 Imperial Gran Reserva  (Rioja),Tempranillo,CVNE
85008,Spain,"This rating is a follow-up to one we did about a year ago, and it doesn't seem as though this wine is making any progress. It's still clumsy as an ox, with stark pineapple flavors and overt acidity. Citrus juice is the best way to describe it; it bears little to no resemblance to Chardonnay as we know it.",El Cerezo Unoaked,81,12,Northern Spain,Navarra,NA,Michael Schachner,@wineschach,Castillo de Monjardin 2005 El Cerezo Unoaked Chardonnay (Navarra),Chardonnay,Castillo de Monjardin
85137,US,"This Meritage blend is 60% Cabernet Sauvignon, 25% Merlot and 10% Cab Franc, 4% Malbec and 1% Petit Verdot, and barrel aged for a couple of years. Dark, sappy, loaded with ripe cassis and black cherry fruit, perfect, silky tannins, juicy acids, this Bordeaux blend is beautifully integrated and will age for many more years.",Dionysus Red,92,45,Washington,Columbia Valley (WA),Columbia Valley,Paul Gregutt,@paulgwine ,Arbor Crest 2005 Dionysus Red Red (Columbia Valley (WA)),Red Blend,Arbor Crest
85216,US,"Here's a beautiful, balanced wine to drink now. It's soft and rich and complex, with flavors of blackberries, cherries, currants and milk chocolate, accented with sweet, smoky oak. A Cabernet Franc-based Bordeaux blend with a splash of Syrah.",Ancestor Estate Reserve,88,44,California,Paso Robles,Central Coast,NA,NA,Halter Ranch 2005 Ancestor Estate Reserve Red (Paso Robles),Red Blend,Halter Ranch
86100,Italy,"Very approachable and inviting, L'Aspetto (Sangiovese and Canaiolo) is a bold and dense wine with a dark ruby color and velvety tones that sit heavy on the tongue. Its aromas include black cherry, dried currant, pressed rose petal, Spanish cedar and exotic spice.",L'Aspetto,88,24,Tuscany,Toscana,NA,NA,NA,Fattoria Fibbiano 2005 L'Aspetto Red (Toscana),Red Blend,Fattoria Fibbiano
87126,Spain,"One look, one whiff, one taste and you're swooning. This mature, tawny, ready-to-drink gran reserva with aromas of lemon peel, cedar and dried cherry is the epitome of elegance. A juicy, supple palate is highly approachable, while flavors of vanilla, orange peel, saffron and dried plum don't waver on the finish. Drink through 2027.",Gran Reserva 904,96,50,Northern Spain,Rioja,NA,Michael Schachner,@wineschach,La Rioja Alta 2005 Gran Reserva 904  (Rioja),Red Blend,La Rioja Alta
87472,US,"Orphelin is a real head-scratcher. A mutt wine blend of nine grapes, it might be trying to be Châteauneuf-du-WA except for the Cabernet, Petit Verdot, Pinot Noir and Touriga. Whatever, it comes together in a raisiny, broadly-built, unfocused red wine that could be fine on a picnic.",Orphelin Red Wine,85,30,Washington,Columbia Valley (WA),Columbia Valley,Paul Gregutt,@paulgwine ,Chateau Ste. Michelle 2005 Orphelin Red Wine Red (Columbia Valley (WA)),Red Blend,Chateau Ste. Michelle
87476,US,"A bit heavy and rugged, with dry black currant and unsweetened chocolate flavors that veer into raisins. Not likely to improve, so drink now.",Claret,85,30,California,Napa Valley,Napa,NA,NA,Bell 2005 Claret Cabernet Sauvignon (Napa Valley),Cabernet Sauvignon,Bell
90830,Italy,"Dark color, concentration and supple aromas of milk chocolate and mature cherry open the nose of this pretty Barolo Riserva. The wine boasts a soft, plush feel with velvety intensity that would pair with most sophisticated meat dishes or porcini mushrooms on the grill.",Leon Riserva,93,80,Piedmont,Barolo,NA,NA,NA,Rivetto 2005 Leon Riserva  (Barolo),Nebbiolo,Rivetto
90955,US,"Shows classic Howell Mountain tight, hard tannins that lock down the flavors and make the wine astringent. But what flavors they are. Just detonates on the palate with massive blackberries, currants, plums, chocolate and cedar, with incredible depth and length. Desperately needs time. Best after 2011.",Rancho del Oso,94,75,California,Howell Mountain,Napa,NA,NA,Sbragia 2005 Rancho del Oso Cabernet Sauvignon (Howell Mountain),Cabernet Sauvignon,Sbragia
91260,Chile,"A bit of volatility and jamminess is acceptable here because overall the wine is good. The nose mixes graphite and cassis with leather and earth to give a sense of good things to come, while the palate is snappy and properly tannic, with nice black cherry, plum and chocolate flavors. Solid and sturdy; 60% Cabernet and 40% Merlot.",60/40 Barrel Select,86,11,Maipo Valley,NA,NA,Michael Schachner,@wineschach,Santa Ema 2005 60/40 Barrel Select Cabernet Sauvignon-Merlot (Maipo Valley),Cabernet Sauvignon-Merlot,Santa Ema
91798,US,"This is too oaky. The wine is just overwhelmed by charry toast and strong, spicy oak wood flavors. Some people confuse the taste of Chardonnay with the taste of oak, but they are not the same.",Catherine's Vineyard,83,28,California,Carneros,Napa-Sonoma,NA,NA,Bonneau 2005 Catherine's Vineyard Chardonnay (Carneros),Chardonnay,Bonneau
92430,US,"This blend of Cabernet and Merlot tastes more like a Shiraz than a Bordeaux blend. It's jammy and peppery and also Porty, with an overripe, brandied taste.",Proprietary Red Wine,81,12,California,Dry Creek Valley,Sonoma,NA,NA,Crush 2005 Proprietary Red Wine Red (Dry Creek Valley),Bordeaux-style Red Blend,Crush
92437,US,"Just what many people like, an oaky, ripe, sweet Chardonnay, but purists will find it simple and pandering to public taste.",NA,81,14,California,Napa Valley,Napa,NA,NA,Irony 2005 Chardonnay (Napa Valley),Chardonnay,Irony
93503,Italy,"Sasyr is a new product from Rocca della Macìe. It's a blend of Sangiovese and Syrah with great fruit intensity and spice carried forward by the wine's natural succulence and intensity. Its top selling point, however, is its easy drinkability and broad food-pairing potential.",Sasyr,88,17,Tuscany,Toscana,NA,NA,NA,Rocca delle Macìe 2005 Sasyr Red (Toscana),Red Blend,Rocca delle Macìe
93778,US,"Outstanding. Almost equal parts Cab and Merlot, this wine is immature now, all primary cherry and currant fruit, unintegrated oak and chunky tannins. But it's a stunning wine, brilliant and pure, with a rich earthiness. You can drink it now, with a few hours of decanting, but it will be best after 2010 and beyond.",Transformation Proprietary Blend,94,58,California,St. Helena,Napa,NA,NA,Jaffe 2005 Transformation Proprietary Blend Red (St. Helena),Bordeaux-style Red Blend,Jaffe
94825,France,"This firm's top Crozes-Hermitage cuvée is the Domaine Raymond Roure, which sees plenty of new wood in its upbringing, to judge from its somewhat coarse vanilla and cedar notes. There is plenty of blackberry fruit lurking beneath, so hopefully this will come together in time. Try after 2010.",Domaine Raymond Roure,89,44,Rhône Valley,Crozes-Hermitage,NA,Joe Czerwinski,@JoeCz,Paul Jaboulet Aîné 2005 Domaine Raymond Roure  (Crozes-Hermitage),Syrah,Paul Jaboulet Aîné
