id,country,description,designation,points,price,province,region_1,region_2,taster_name,taster_twitter_handle,title,variety,winery
19980,Germany,"This is a lithe, sinewy wine, powerful yet lean, with coiled intensity to its crisp citrus and mineral flavors. It finishes long and tart, with the bracing acids suggestive of a long evolution. Hold 3–5 years and see if it blossoms.",Abtsberg Superior,87,NA,Mosel-Saar-Ruwer,NA,NA,Joe Czerwinski,@JoeCz,Maximin Grünhäuser 2005 Abtsberg Superior Riesling (Mosel-Saar-Ruwer),Riesling,Maximin Grünhäuser
19990,US,"Fans of Barbera will find the hard acids and thick tannins they love in this rustic Italian variety. The flavors are all dry: dried blackberries and cherries, dried leather, cured tobacco leaf, beef jerky, star anise. Yet there's a fruity sweetness that's charming. Great with almost anything starring sausage.",Terra d'Oro,87,18,California,Amador County,Sierra Foothills,NA,NA,Montevina 2005 Terra d'Oro Barbera (Amador County),Barbera,Montevina
19995,US,"This small production (200 cases) Pinot Noir is a mix of older and younger estate vines, a selection of lots given 22 months in 60 and 132 gallon French oak casks. It's still tasting quite young, sharp and chewy, with spicy fruit backed up against earthy tannins. Give it plenty of breathing time.",Estate Reserve,87,38,Oregon,Willamette Valley,Willamette Valley,Paul Gregutt,@paulgwine ,David Hill 2005 Estate Reserve Pinot Noir (Willamette Valley),Pinot Noir,David Hill
20249,US,"The Aviator Red is a well-crafted blend that mixes strawberry, raspberry, pepper and stone in an effective balance that seems to draw the best from each grape. For a modest, everyday wine, this works quite well.",Aviator Red,87,28,Washington,Yakima Valley,Columbia Valley,Paul Gregutt,@paulgwine ,Airfield Estates 2005 Aviator Red Red (Yakima Valley),Red Blend,Airfield Estates
20825,US,"This is a food-friendly Cab. It's made in an elegant style, with fine acidity and firm tannins that frame black and red currant, plum, mocha and cedar flavors. Lovely now, but so balanced, it should develop for ten years.",Clift Vineyard,91,35,California,Oak Knoll District,Napa,NA,NA,Tudal 2005 Clift Vineyard Cabernet Sauvignon (Oak Knoll District),Cabernet Sauvignon,Tudal
20954,France,This example shows a bit more character than many Pays d'Oc Chardonnays. Pretty scents of lemon and honeysuckle lead to a palate with above-average concentration and lovely lemon meringue pie flavors. Tangy acidity renders this a good choice for salmon.,South of France,84,20,Languedoc-Roussillon,Vin de Pays d'Oc,NA,NA,NA,Robert Skalli 2005 South of France Chardonnay (Vin de Pays d'Oc),Chardonnay,Robert Skalli
21409,Canada,"It's no surprise that excellent icewine is being made in the Niagara region of Canada, but this Vidal offering from Jackson-Triggs is a pleasure nonetheless. With its layered aromas and flavors of orange, apricot and honey lifted by crisp acidity, this is both approachable and collectible. A serious wine with a fun and flirty side. Imported by Icon Estates.",Proprietors' Reserve Icewine,91,20,Ontario,Niagara Peninsula,NA,Susan Kostrzewa,@suskostrzewa,Jackson-Triggs 2005 Proprietors' Reserve Icewine Vidal Blanc (Niagara Peninsula),Vidal Blanc,Jackson-Triggs
21629,US,"This is Gainey's basic '05 Pinot, and it shows the quality of the vintage. The wine is dry, crisp in acidity and under 14% in alcohol, with dramatic cherry and boysenberry fruit complexed with leather, cola, Chinese five spice and balsamic notes. Fairly tannic, it's best now and for a few years.",NA,92,30,California,Sta. Rita Hills,Central Coast,NA,NA,Gainey 2005 Pinot Noir (Sta. Rita Hills),Pinot Noir,Gainey
21702,US,"Robust and briary, this Zin is bone-dry and pretty tannic, with earthy flavors of blackberries, tobacco, currants and spices. Could mellow with age, but will never be particularly complex.",Mariah Vineyard,85,25,California,Mendocino Ridge,NA,NA,NA,Sanctuary 2005 Mariah Vineyard Zinfandel (Mendocino Ridge),Zinfandel,Sanctuary
21937,Italy,"This wonderful ruby-colored Riserva delivers notes of ripe cherry, milk chocolate, herbs and pipe tobacco. It has loads of zest and pizzazz, with lingering spice tones, solid structure and silky tannins. It presents a complete and very pretty package.",Riserva Rocca Guicciarda,90,25,Tuscany,Chianti Classico,NA,NA,NA,Barone Ricasoli 2005 Riserva Rocca Guicciarda  (Chianti Classico),Sangiovese,Barone Ricasoli
22197,South Africa,"Pepper, plum and smoke on the nose starts this wine off with a sultry kick. On the palate, it offers medium bodied, smoky spice flavors that linger. pair with lamb, wild game or blue cheeses.",NA,85,13,Durbanville,NA,NA,Susan Kostrzewa,@suskostrzewa,Durbanville Hills 2005 Shiraz (Durbanville),Shiraz,Durbanville Hills
22352,Argentina,"Solid and broad on the nose, with black cherry, berry and controlled rubbery aromas. Fresh, juicy and healthy on the palate, with good drive and dark, toasty flavors of black fruits, spice and chocolate. Spicy, warm and a bit complex on the finish. Malbec with Cab Sauvignon and Syrah; drink now.",Finca,90,20,Mendoza Province,Mendoza,NA,Michael Schachner,@wineschach,Qaramy 2005 Finca Red (Mendoza),Red Blend,Qaramy
22833,US,"Robust and exuberant, this wine doesn't pull any punches. It unleashes a blast of wild berry, currant, pepper and chai tea flavors, wrapped into sturdy but finely ground tannins. Easy to drink with barbecue.",Old Vine,86,15,California,Lodi,Central Valley,NA,NA,OZV 2005 Old Vine Zinfandel (Lodi),Zinfandel,OZV
23372,Spain,"Hefty and a tiny bit herbal on the nose, with tomato, red berry and spice aromas. The palate is perfectly formed and balanced, with roasted berry, smoked meat and earthy flavors. Turns juicy and dry on what amounts to a tight finish. Excellent modern Rioja to drink now through 2015.",Dioro,92,33,Northern Spain,Rioja,NA,Michael Schachner,@wineschach,Valsacro 2005 Dioro  (Rioja),Red Blend,Valsacro
23458,Italy,"This is a plush and upfront wine that offers succulent aromas of cherry, black fruit and plum. It glides clean down the palate thanks to its thick density and soft, smooth texture. The wine has the pulp and density to pair with most winter foods.",NA,86,14,Piedmont,Barbera d'Alba,NA,NA,NA,Pelassa 2005  Barbera d'Alba,Barbera,Pelassa
24199,France,"For a Petit Chablis, this is serious and complex, with delicious ripe green and yellow fruits; there is a touch of caramel with toast just at the edge.",NA,87,28,Burgundy,Petit Chablis,NA,Roger Voss,@vossroger,Domaine Vincent Dauvissat 2005  Petit Chablis,Chardonnay,Domaine Vincent Dauvissat
24610,US,"Waterstone's non-reserve Cabernet is often quite good and the '05 is just about their best ever. It's a fine wine, dry and full-bodied and rich in black currants, smoky oak and spices. Drink now and for the next several years.",NA,87,26,California,Napa Valley,Napa,NA,NA,Waterstone 2005 Cabernet Sauvignon (Napa Valley),Cabernet Sauvignon,Waterstone
26198,Portugal,"A finely structured wine that brings forward its firm tannins, but also keeps black berry and red plum fruit flavors. It has an edge of leanness, minerality perhaps, its tannins emphasizing dryness. The balance between the structure and the fruit produces a good value wine that is on a knife edge of exciting tension.",Domini,89,15,Douro,NA,NA,Roger Voss,@vossroger,José Maria da Fonseca 2005 Domini Red (Douro),Portuguese Red,José Maria da Fonseca
27082,US,"A good, everyday sort of Zin, dry and fruity. It has a rich tannic structure, with spicy cherry, tangerine, currant, cola and cocoa flavors.",NA,85,18,California,Amador County,Sierra Foothills,NA,NA,Folie à Deux 2005 Zinfandel (Amador County),Zinfandel,Folie à Deux
27527,Italy,"The wine opens with aromas of lush cherry fruit, cola, coffee and leather. It boasts very good intensity, chewy tannins and ripe succulence on the finish. A Sangiovese, Merlot and Cabernet Sauvignon blend.",Borgoforte,88,12,Tuscany,Toscana,NA,NA,NA,Villa Pillo 2005 Borgoforte Red (Toscana),Red Blend,Villa Pillo
28120,Australia,"Ripe black cherry and cedary aromas can't hide the touch of alcohol that seems to emanate from the glass. But the wine is balanced on the palate, not showing any excessive warmth, framing its black cherry and chocolate flavors with bright acidity. The crisp acids on the finish accentuate the tannins, making this an uncommonly structured Grenache. Imported by Wine Brokers Unlimited.",Hickinbotham,90,65,South Australia,Clarendon,NA,Joe Czerwinski,@JoeCz,Clarendon Hills 2005 Hickinbotham Grenache (Clarendon),Grenache,Clarendon Hills
28128,US,"Textbook Santa Lucia Highlands Pinot, big and bold, yet with great textural balance and complexity. Strikes the palate with concentrated cherry, red currant, licorice, orange zest, root beer, clove, cinnamon and pepper flavors that are totally dry, with a full-bodied weight.",NA,90,38,California,Santa Lucia Highlands,Central Coast,NA,NA,Lucienne 2005 Pinot Noir (Santa Lucia Highlands),Pinot Noir,Lucienne
28138,Australia,"This blend of 70% Grenache, 25% Shiraz and 5% Mourvèdre features surprisingly dark fruit flavors akin to blackberries and cola. A hint of mint or eucalyptus enlivens the bouquet and helps to lighten this otherwise rather full-bodied, brooding wine. Finishes long, with enough dusty tannins to warrant cellaring through 2015.",The Ironstone Pressings,90,65,South Australia,McLaren Vale,NA,Joe Czerwinski,@JoeCz,D'Arenberg 2005 The Ironstone Pressings G-S-M (McLaren Vale),G-S-M,D'Arenberg
28330,South Africa,"This is for real Pinotage lovers, so bashful drinkers, beware. The nose bursts with ripe red fruit and spice—Pinotage hallmarks—and on the palate, lively, spicy and smoky flavors of berry and savory spice abound. It's a wine full of personality and is best enjoyed with a dish of grilled spicy ribs or ethnic food that can tame its wildness.",NA,86,14,Paarl,NA,NA,Susan Kostrzewa,@suskostrzewa,Fairview 2005 Pinotage (Paarl),Pinotage,Fairview
28559,US,"A spicy, candied fruitcake nose leads into slightly tart cherry flavors in this New Mexico Cab. The structure is good but the wine needs a bit more balance and depth. Still, it has potential.",Reserve,81,32,New Mexico,New Mexico,NA,Susan Kostrzewa,@suskostrzewa,La Chiripada 2005 Reserve Cabernet Sauvignon (New Mexico),Cabernet Sauvignon,La Chiripada
29069,Spain,"Opens with a warm, baked nose of raisin, roasted plum and tobacco. The palate is scouring and crisp due to sharp acids, and thus the flavors follow suit in that they're lean and tart and focus on pie cherry and red plum. Lean, zesty and lively Rioja to drink now.",Vendimia Seleccionada Crianza,86,17,Northern Spain,Rioja,NA,Michael Schachner,@wineschach,Bodegas Muriel 2005 Vendimia Seleccionada Crianza  (Rioja),Tempranillo,Bodegas Muriel
31143,France,"An attractively ripe and mature wine with a great balance between the orangy citrus fruits and a tight, taut, mineral texture. The wine is rich in its dosage and fruitiness while showing signs of maturer toast and almond flavors. However, it could still age.",Clos des Bouveries Brut,92,75,Champagne,Champagne,NA,Roger Voss,@vossroger,Duval-Leroy 2005 Clos des Bouveries Brut Chardonnay (Champagne),Chardonnay,Duval-Leroy
31201,US,"Dazzles now for its richness. Shows those classic Howell Mountain tannins, but they've been so tamed and refined, you can drink it now. The flavors are spectacular, over the top; pure Cirque du Soleil spectacle of blackberry, currant and chocolate acrobatics.",Vintage III,93,105,California,Howell Mountain,Napa,NA,NA,Lamborn Family Vineyards 2005 Vintage III Cabernet Sauvignon (Howell Mountain),Cabernet Sauvignon,Lamborn Family Vineyards
31910,US,"Sweet, tannic and superfruity, this blend of Dolcetto, Zin, Merlot, Tempranillo and Carignane is rustic and clean. With its flood of blackberry, cherry, chocolate and spice flavors, it will happily wash down simple fare, like cheeseburgers.",Rosso,84,12,California,California,California Other,NA,NA,Bargetto 2005 Rosso Red (California),Red Blend,Bargetto
32538,Italy,"Amarone Ambrosan opens with lovely tones of plush fruit and savory spice followed by plum cake, cinnamon and sweet bread. This is a deeply layered wine with soft tannins and a blast of bright red cherry on the close. Very nice.",Ambrosan,93,88,Veneto,Amarone della Valpolicella Classico,NA,NA,NA,Nicolis 2005 Ambrosan  (Amarone della Valpolicella Classico),"Corvina, Rondinella, Molinara",Nicolis
32868,Australia,"Complex aromas and flavors of blackberries, leather, roasted meat and coffee show plenty of class, and this wine appears to firm up in the glass, offering more structure than its initial suppleness and amplitude suggest. It may close up for a few years, so try it now, or hold and try it after 2012.",NA,89,31,South Australia,Adelaide Hills,NA,Joe Czerwinski,@JoeCz,Shaw and Smith 2005 Shiraz (Adelaide Hills),Shiraz,Shaw and Smith
32880,US,"This is 100% Malbec, so inky it is black in color. The flavors echo the color, with amazing density. Black fruits, black olives, smoke and spice are structured around thick tannins. A minute-plus finish adds licorice and mint; even after being opened for a full 48 hours this wine remained fresh and balanced. It's the first varietal Malbec ever from Walla Walla Vintners, but certainly one hopes it is not the last.",NA,92,30,Washington,Columbia Valley (WA),Columbia Valley,Paul Gregutt,@paulgwine ,Walla Walla Vintners 2005 Malbec (Columbia Valley (WA)),Malbec,Walla Walla Vintners
32936,US,"Don't let the price tag fool you; this is a sophisticated blend with Merlot, Cab Franc, Malbec and Syrah comprising a quarter of the total. Aromatic and inviting, it brings spicy berry, red currant and Bing cherry fruit into play. Chewy tannins carry a hint of herb, and the presence of new oak is minimal at best. Just a hint of chocolate malt hits in the finish.",NA,87,16,Washington,Columbia Valley (WA),Columbia Valley,Paul Gregutt,@paulgwine ,Chateau Ste. Michelle 2005 Cabernet Sauvignon (Columbia Valley (WA)),Cabernet Sauvignon,Chateau Ste. Michelle
33588,Italy,"The name Porpora refers to this wine's ruby red color and rich texture. Its aromas recall mature fruit, black cherry and chewy blackberry. From the hot 2005 vintage, Porpora Riserva is definitely on the ripe, jammy side.",Porpora Riserva,88,20,Tuscany,Chianti,NA,NA,NA,Fattoria di Casalbosco 2005 Porpora Riserva  (Chianti),Sangiovese,Fattoria di Casalbosco
33710,US,"Tastes way too oaky, with a plaster of sweet vanilla and caramelized charcoal. The underlying pineapple fruit just isn't strong enough to support all that wood.",NA,82,19,California,Monterey,Central Coast,NA,NA,San Simeon 2005 Chardonnay (Monterey),Chardonnay,San Simeon
33822,US,"An example of California Barbera at its best, this is brawny and muscular and rich in flavor, which makes it perfect for roasts and hearty pasta dishes. With firm tannins and crisp acidity, this one is filled with rewarding currant, mocha, olive tapenade and spice flavors.",NA,88,22,California,Sierra Foothills,Sierra Foothills,NA,NA,Indian Rock 2005 Barbera (Sierra Foothills),Barbera,Indian Rock
34003,Italy,"This plump and fruit-driven Barbaresco offers nuances of ripe cherry and forest berry backed by lingering tones of licorice, vanilla, dark chocolate and clove. The wine is distinguished by a precise and focused mouthfeel that is shaped by acidity and firm tannins.",Bricco Rio Sordo,91,40,Piedmont,Barbaresco,NA,NA,NA,Musso 2005 Bricco Rio Sordo  (Barbaresco),Nebbiolo,Musso
34020,Italy,"Barolo San Lorenzo has very nice intensity—it's there, but not in your face. The wine is already starting to show some interesting mineral components that are backed by black fruit, licorice and truffle. Its intensity builds in the glass and although it starts slow, it picks up loads of speed in the mouth. Drink after 2015.",San Lorenzo,91,70,Piedmont,Barolo,NA,NA,NA,Fratelli Alessandria 2005 San Lorenzo  (Barolo),Nebbiolo,Fratelli Alessandria
34131,Italy,"This hearty blend boasts a dark, inky color, with bright aromas of black fruit, cola, dried rosemary, black olive and spice. The finish is thick, concentrated and long lasting.",Turriga,90,80,Sicily & Sardinia,Isola dei Nuraghi,NA,NA,NA,Argiolas 2005 Turriga Red (Isola dei Nuraghi),Red Blend,Argiolas
35350,France,"A pale gold color leads into a wine that is mature and rich. The fruits have mellowed into almond and spice, with attractive acidity, while the ripe texture remains. The balance is just right in a wine that is generous and full in the mouth. Drink now.",Blanc de Noirs Millésimé Brut,92,93,Champagne,Champagne,NA,Roger Voss,@vossroger,Jean Laurent 2005 Blanc de Noirs Millésimé Brut Pinot Noir (Champagne),Pinot Noir,Jean Laurent
35594,Australia,"From Margaret River in Western Australia, this is a full-bodied, impressively endowed Shiraz at a reasonable price. Superripe aromas of blackberries and licorice mark the nose, while the palate features similar flavors, supple tanins and a creamy-textured finish. Good to go now, with enough concentration to hold until 2015.",Eagle Bay,91,21,Western Australia,Margaret River,NA,Joe Czerwinski,@JoeCz,Wise 2005 Eagle Bay Shiraz (Margaret River),Shiraz,Wise
35597,Australia,"This is a full-bodied, firmly structured Shiraz with plummy, intense aromas tinged with licorice and framboise. Bits of chocolate, mint and spice accent the plum and raspberry flavors, and the wine finishes crisp, dry and deeply textured. It should drink well from now through 2015.",Reserve,91,40,South Australia,McLaren Vale,NA,Joe Czerwinski,@JoeCz,Longwood 2005 Reserve Shiraz (McLaren Vale),Shiraz,Longwood
36490,Spain,"With the exact same rating as the awesome 2004, this new vintage of Aurus is an unbridled winner. It's a little creamy and sweet on first blush, but time and air reveals its darker, more serious side. Flavors of blackberry, barbecued beef and fudge tell all you need to know about ripeness and richness, and among the new classics of Rioja, Aurus is one of the leaders. Drink now and over the next three years. It's not really for long-term cellaring.",Aurus,94,248,Northern Spain,Rioja,NA,Michael Schachner,@wineschach,Finca Allende 2005 Aurus  (Rioja),Tempranillo Blend,Finca Allende
36761,US,"Another lovely wine from Chaddsford, with both class and a delicate touch. A pretty, poised nose of black pepper and spice are followed by restrained, minerally flavors that leave a clean but complex wave on the palate.  Pair this with more elegant French dishes with a seafood slant.",Miller Estate Vineyard,86,35,Pennsylvania,Pennsylvania,NA,Susan Kostrzewa,@suskostrzewa,Chaddsford 2005 Miller Estate Vineyard Pinot Noir (Pennsylvania),Pinot Noir,Chaddsford
37063,France,"The Buzet co-op's top brand, this is big, powerful and rich. It is dominated by blackberry jelly and sweet plums, as well as firm tannins. The palate is weighty, solid, maybe missing freshness but certainly giving good intensity.",Baron d'Ardeuil Vieilles Vignes,88,17,Southwest France,Buzet,NA,Roger Voss,@vossroger,Vignerons de Buzet 2005 Baron d'Ardeuil Vieilles Vignes Red (Buzet),Bordeaux-style Red Blend,Vignerons de Buzet
37623,Italy,"This is one of the more exotic Barberas. The dark fruit is mixed with scents of licorice, curry and violets. On the palate, there is plenty of dark fruit, but it still retains its likeable spicy character. Although the finish is short to medium, this is a pleasant wine, and a natural match with a good juicy steak.",Torriglione,87,17,Piedmont,Barbera d'Alba,NA,NA,NA,Renato Ratti 2005 Torriglione  (Barbera d'Alba),Barbera,Renato Ratti
37626,Italy,"This is lighter Barbera showing a pleasant very ripe, plummy character. The wine has evolved early, and gives a seamless backdrop to the pretty flavors of spice and Christmas pudding. Easygoing and complex. Imported by MW Imports.",NA,87,15,Piedmont,Barbera d'Alba,NA,NA,NA,Pertinace 2005  Barbera d'Alba,Barbera,Pertinace
38012,South Africa,"A lovely nose of violet, clove and pepper begin this stylish wine from Neil Ellis. On the palate, blackberry and spice flavors are concentrated and balanced. Smooth tannins and a smoldering finish add to the package.",Vineyard Selection,87,43,Jonkershoek Valley,NA,NA,Susan Kostrzewa,@suskostrzewa,Neil Ellis 2005 Vineyard Selection Syrah (Jonkershoek Valley),Syrah,Neil Ellis
38634,US,"I love the briary, spicy aroma on this wine. It's so inviting. But then when you taste it, it turns too soft and sweet, like a melted cherry- and cassis-filled chocolate truffle. That's a delicious flavor, but it's not really a dry table wine.",Rockpile Road Vineyard,84,35,California,Rockpile,Sonoma,NA,NA,Rosenblum 2005 Rockpile Road Vineyard Zinfandel (Rockpile),Zinfandel,Rosenblum
39135,Italy,"Aromas of dried yellow fruit, candied citrus zest and a whiff of oak lead the nose. The palate offers toasted bread crust, candied lemon drop, walnut and ripe golden apple alongside bright acidity and a firm perlage.",Severina Blanc de Blancs Extra Brut Metodo Classico,89,NA,Italy Other,Vino Spumante,NA,Kerin O’Keefe,@kerinokeefe,Matteo Correggia 2005 Severina Blanc de Blancs Extra Brut Metodo Classico Sparkling (Vino Spumante),Sparkling Blend,Matteo Correggia
39656,Italy,"Planeta's flagship red is a lush, modern wine that showcases Nero d'Avola's vast enological potential. The aromas are deep, layered and generous and draw attention to chocolate fudge, creamy espresso, plump cherry and smooth blackberry preserves. The finish is silky and long with bright notes of red fruit and spice. Dusty tannins back the robust structure.",Santa Cecilia,91,39,Sicily & Sardinia,Sicilia,NA,NA,NA,Planeta 2005 Santa Cecilia Nero d'Avola (Sicilia),Nero d'Avola,Planeta
39659,US,"The fruit is perfectly ripe and succulent, a juicy mix of berries and black cherries. It's set against firm but ripe and polished tannins, which provide muscle and add some spice as well. The oak contributes just the right level of toast, not too heavy. The exceptional, sweet and tasty fruit takes the center stage, while the pretty oak flavors do the final curtain call.",NA,91,25,Washington,Columbia Valley (WA),Columbia Valley,Paul Gregutt,@paulgwine ,Barrister 2005 Cabernet Franc (Columbia Valley (WA)),Cabernet Franc,Barrister
39660,US,"Acorn has produced one of their best bottlings ever. The wine is drily crisp and tannic, but rich and supple, with cassis, cherry and carob flavors that have an earthy, mushroom and tobacco grounding. The wine contains smaller amounts of at least 10 other varieties, in the manner of an old field blend.",Alegria Vineyards Heritage Vines,91,34,California,Russian River Valley,Sonoma,NA,NA,Acorn 2005 Alegria Vineyards Heritage Vines Zinfandel (Russian River Valley),Zinfandel,Acorn
39661,US,"This vineyard has been the source of a string of rich, complex, classic Zins from Bella, and the '05 is the best yet. It's a big, lusty wine whose volume is pumped up with a dose of Petite Sirah. The flavors run toward blackberries, boysenberries, plums, coffee, carob and Asian spices.",Big River Ranch,91,36,California,Alexander Valley,Sonoma,NA,NA,Bella 2005 Big River Ranch Zinfandel (Alexander Valley),Zinfandel,Bella
39829,France,"This Champagne exhibits both the freshness of the vintage and a sense of toasty maturity. Baked apple aromas are touched with notes of almonds and cookies. The palate is substantially weighty with a density of flavors and a rich, full aftertaste. Ready to drink now.",Vintage Brut,90,NA,Champagne,Champagne,NA,Roger Voss,@vossroger,Thiénot 2005 Vintage Brut  (Champagne),Champagne Blend,Thiénot
39921,Spain,"Tight, compact and rubbery on the nose, with a mineral, medicinal edge to the black-fruit aromas. Snappy and hard on the cheeks, with midland berry fruit and a scouring, juicy, woody finish. Lots of red fruit but scratchy and a little medicinal.",Finca Helena,84,89,Northern Spain,Ribera del Duero,NA,Michael Schachner,@wineschach,Bodegas Imperiales 2005 Finca Helena  (Ribera del Duero),Tempranillo,Bodegas Imperiales
39990,US,"A soft, dry and easy wine to like, this Merlot has flavors of cherries, blackberries, Asian spices and cola, with smoky overtones of oak. Drink now.",NA,84,28,California,Santa Barbara County,Central Coast,NA,NA,Sunstone 2005 Merlot (Santa Barbara County),Merlot,Sunstone
40236,US,"Dry and fruity, but a little brittle in tannins and acids, this Merlot has red currant, mocha, cinnamon and smoky oak flavors. Drink now.",NA,85,37,California,San Luis Obispo County,Central Coast,NA,NA,Silver Stone Winery 2005 Merlot (San Luis Obispo County),Merlot,Silver Stone Winery
40943,US,"Very stiff and tannic, with hard, stemmy flavors and very little evidence of ripe fruit.",NA,82,17,Washington,Columbia Valley (WA),Columbia Valley,Paul Gregutt,@paulgwine ,Hoodsport 2005 Cabernet Merlot (Columbia Valley (WA)),Cabernet Merlot,Hoodsport
41849,US,"With this brut-style wine, Domaine Carneros competes against California's most serious sparkling wine contenders. It is certainly the finest Le Rêve ever, glamorous and provocative, massively flavored in lemon, lime and tangerine flavors, yet balanced and elegant, with the doughy tartness of Champagne. A great achievement.",Le Rêve,95,90,California,Carneros,Napa-Sonoma,NA,NA,Domaine Carneros 2005 Le Rêve Sparkling (Carneros),Sparkling Blend,Domaine Carneros
41979,US,"A rich, polished Cabernet. Doesn't taste particularly Oakville-like, due to extreme ripeness, softness, high alcohol and refined tannins that could come from anywhere, but it's well crafted and delicious. Offers waves of blackberries, black currants, chocolate and cedar. Now–2013.",NA,91,60,California,Oakville,Napa,NA,NA,Coniglio 2005 Cabernet Sauvignon (Oakville),Cabernet Sauvignon,Coniglio
