id,country,description,designation,points,price,province,region_1,region_2,taster_name,taster_twitter_handle,title,variety,winery
93518,US,"Frank rarely misses a mark and this wine is another example of the poised flavors one expects from this winery. The aromas are fresh but subtle, with a delicate spin of toasted oak. The wine offers a restrained and sophisticated profile that balances depth with a clean, measured use of oak.",Barrel Fermented,88,15,New York,Finger Lakes,Finger Lakes,Susan Kostrzewa,@suskostrzewa,Dr. Konstantin Frank 2005 Barrel Fermented Chardonnay (Finger Lakes),Chardonnay,Dr. Konstantin Frank
93769,US,"From one of the oldest vineyards on Diamond Mountain, this Bordeaux blend is impressively powerful and balanced. Based on Cabernet, with small quantities of Merlot, Cab Franc and Petit Verdot, it has oak-influenced black and red currant, cassis, cherry, spicy plum pudding and sweet, smoky vanilla flavors, with a cedar, pencil-lead note reminiscent of a fine Pauillac. Lush now, it should develop well through 2015.",Sori Bricco Vineyard,95,70,California,Diamond Mountain District,Napa,NA,NA,Von Strasser 2005 Sori Bricco Vineyard Cabernet Sauvignon (Diamond Mountain District),Cabernet Sauvignon,Von Strasser
95300,France,"Fermented in 225-liter barrels, this is a rich, full-flavored wine touched with hints of toast and brisk acidity. The palate is weighty, but there's a crisp, dry fruit quality on the palate. Still youthful, it's not quite integrated yet, so keep until 2016.",Cuvée 225 Millesimé Brut,91,90,Champagne,Champagne,NA,Roger Voss,@vossroger,Nicolas Feuillatte 2005 Cuvée 225 Millesimé Brut  (Champagne),Champagne Blend,Nicolas Feuillatte
95392,Italy,"There's a raw, chewy quality to this simple Valpolicella that recalls black cherry and vinous grape. The wine proceeds with a mellow, soft feel and offers much more fruity intensity and personality in the mouth than it does on the nose.",NA,86,NA,Veneto,Valpolicella Superiore,NA,NA,NA,Le Guaite 2005  Valpolicella Superiore,"Corvina, Rondinella, Molinara",Le Guaite
95562,France,"An intensely perfumed wine that smells of a candy shop. It has tight acidity, but that is lost in the welter of white fruit flavors, allied with sweet wood. It seems at first too sweet, but then toast and acidity come in to give the wine an edgy finale.",Hauts Marconnets Premier Cru,87,60,Burgundy,Savigny-lès-Beaune,NA,Roger Voss,@vossroger,Chanson Père et Fils 2005 Hauts Marconnets Premier Cru  (Savigny-lès-Beaune),Chardonnay,Chanson Père et Fils
95865,US,"A decent everyday Cab, a little rough around the edges, but dry, flavorful and firm in tannins. Nice and moderate in alcohol, it's ready to drink now.",Rooftop Red,84,20,California,Napa Valley,Napa,NA,NA,C&T; 2005 Rooftop Red Cabernet Sauvignon (Napa Valley),Cabernet Sauvignon,C&T;
96244,US,"This is a good wine, fruity and oaky, with fresh, jammy flavors of raspberries, cherries, currants and cocoa. It's a direct wine with a good structure. Drink now.",NA,85,35,California,Santa Maria Valley,Central Coast,NA,NA,Nicholls 2005 Pinot Noir (Santa Maria Valley),Pinot Noir,Nicholls
96253,US,"Pretty good, but a little on the rustic side, with baked blackberry, cherry and currant flavors wrapped into some rugged, edgy tannins. Could just be going through an awkward phase, but its future is hard to predict.",Private Reserve,85,40,California,Monterey County,Central Coast,NA,NA,Château Julien 2005 Private Reserve Zinfandel (Monterey County),Zinfandel,Château Julien
97328,US,"The first sniffs show plenty of toasty oak, with brambly, tart red fruits and a bit of stem in the tannins. This is a nicely textural Pinot, with hints of barnyard and compost woven around the solid cherry fruit. It feels a bit unresolved, with plenty of interesting components that need more cellar time to knit themselves together.",Cote Est,88,45,Oregon,Willamette Valley,Willamette Valley,Paul Gregutt,@paulgwine ,Le Cadeau 2005 Cote Est Pinot Noir (Willamette Valley),Pinot Noir,Le Cadeau
97599,France,"This is a smooth, rich wine with a dosage that adds enough sweetness to balance creamy apple flavors marked with sharp acidity. Ripe yet elegantly balanced, it's maturing well. It can be drunk now, but a year or two of waiting will serve it well. Drink now–2016.",Cuvée Vintage Brut,92,NA,Champagne,Champagne,NA,Roger Voss,@vossroger,Jacquart 2005 Cuvée Vintage Brut  (Champagne),Champagne Blend,Jacquart
97805,US,"A strongly flavored, tannic wine, marked by black currant, blackberry and blueberry flavors, sprinkled with exotic Indian spices. Drink this bone-dry Cabernet over the next several years.",Block 21,87,35,California,Dry Creek Valley,Sonoma,NA,NA,Merriam 2005 Block 21 Cabernet Sauvignon (Dry Creek Valley),Cabernet Sauvignon,Merriam
97932,US,"A rustic Merlot. The cherry, cassis and chocolate fruit flavors are so powerful, they swamp the wine, leaving elegance behind and making it indelicate.",Red,84,18,California,Napa Valley,Napa,NA,NA,American Roots 2005 Red Merlot (Napa Valley),Merlot,American Roots
99150,Argentina,"Earthy and spicy on the nose, with tomato and raisin but also some herbal green, which is likely attributable to the 50% Cabernet in this Malbec-CS blend. Tame on the palate, with tomatoey notes and dry raspberry flavors. Simple and pleasant but more herbal and less exciting that Gradum's straight '05 Malbec.",Gradum Reserve,86,14,Mendoza Province,Mendoza,NA,Michael Schachner,@wineschach,Bodega Vistandes 2005 Gradum Reserve Malbec-Cabernet Sauvignon (Mendoza),Malbec-Cabernet Sauvignon,Bodega Vistandes
99294,US,"There's something so smoothly sweet about this Cabernet, it's like an old Cognac. The sweetly toasted oak is merging its caramel and vanilla with the ripe black and red cherries, leading to an unctuous, long, spicy finish. Really quite a compelling wine that's beautiful now.",Reserve,93,60,California,Rutherford,Napa,NA,NA,Bartalotti 2005 Reserve Cabernet Sauvignon (Rutherford),Cabernet Sauvignon,Bartalotti
99297,Italy,"What sets this Taurasi apart is a distinct floral note of blue flower or pressed rose that sits over a much broader and bolder base of dark spice, black fruit, prune, resin and cola. The little floral accent adds a feminine touch to what is without a doubt one of Italy's most masculine wines.",Tenuta di Altavilla,92,NA,Southern Italy,Taurasi,NA,NA,NA,Villa Matilde 2005 Tenuta di Altavilla  (Taurasi),Aglianico,Villa Matilde
99681,US,"The 2005 vintage was kind to this wine, grown in the warmer, northerly Middle Reach section of the valley. While lacking the depth of the 2002 and 2003, it shows flavorful black currants, cherries and root beer, with a peppery finish. The tannins are rich and fine. Small additions of Zin, Malbec, Petite Sirah and other red varieties add complexity.",DaKine Vineyard,89,45,California,Russian River Valley,Sonoma,NA,NA,Longboard 2005 DaKine Vineyard Syrah (Russian River Valley),Syrah,Longboard
99688,Portugal,"Fresh, jammy strawberry aromas, followed by a soft, balanced wine, with tannins and wood in fine harmony. It's ripe, packed with berry fruits, edged with dry tannins. The strawberry gives a fresh aftertaste.",Quinta dos Quatros Ventos Colheita,89,29,Douro,NA,NA,Roger Voss,@vossroger,Caves Aliança 2005 Quinta dos Quatros Ventos Colheita Red (Douro),Portuguese Red,Caves Aliança
99693,South Africa,"A big, exuberant nose leads on this impressive Syrah. On the palate, it's a muscular red, with balance, strength and elegant tannins. Mouthfilling but minerally enough to maintain poise, it will age well or pair now with roasted meat.",NA,89,37,Stellenbosch,NA,NA,Susan Kostrzewa,@suskostrzewa,Rudi Schultz 2005 Syrah (Stellenbosch),Syrah,Rudi Schultz
99928,France,"Leathery and earthy, with hints of cranberries and chocolate. It's medium bodied and supple enough to drink now, turning a bit tart on the finish.",NA,84,11,Rhône Valley,Côtes du Rhône,NA,Joe Czerwinski,@JoeCz,Lucas Carton 2005 Red (Côtes du Rhône),Rhône-style Red Blend,Lucas Carton
100450,US,"A little rustic and sharp, but perfectly okay if you're looking for an everyday Cab to elevate simple fare. It shows black currant and oak flavors, and is thoroughly dry.",NA,84,11,California,California,California Other,NA,NA,Bogle 2005 Cabernet Sauvignon (California),Cabernet Sauvignon,Bogle
101354,Spain,"Earthy, baked, raisiny aromas convey ripeness and sweetness. The palate is medium in body and intensity, with juicy acidity propping up lightly leafy and herbal berry and plum flavors. Has good length and feel, with tomato and herbs on the finish.",Old Vines Gran Reserva,86,20,Central Spain,Valdepeñas,NA,Michael Schachner,@wineschach,Bodegas Navarro López 2005 Old Vines Gran Reserva Tempranillo (Valdepeñas),Tempranillo,Bodegas Navarro López
101393,US,"This big Chardonnay, which was entirely barrel fermented, is tasting a bit too oaky. It was sourced from the winery's estate Carneros vineyard and shows that appellation's crisp acids, along with bright tropical fruit and spice flavors. But the sweet, charry vanilla and caramel from barrels tends to dominate.",Reserve,88,42,California,Napa Valley,Napa,NA,NA,Clos du Val 2005 Reserve Chardonnay (Napa Valley),Chardonnay,Clos du Val
101399,US,"Barrel-fermented and aged on the lees, this Burgundian-style Chard is creamy and rich in ripe tropical fruit flavors and new oak. It's a big wine, forward in pineapple and mango flavors that are honey-ripe and crisp.",Arroyo Seco Vineyard,88,25,California,Arroyo Seco,Central Coast,NA,NA,J. Lohr 2005 Arroyo Seco Vineyard Chardonnay (Arroyo Seco),Chardonnay,J. Lohr
101401,Portugal,"A powerful expression of Portuguese varieties, with dense tannins, dark fruit flavors and ripeness. If the alcohol is too high—and it shows in the pepper edge to the wine—it still has a sense of shape and structure.",NA,88,18,Estremadura,NA,NA,Roger Voss,@vossroger,Quinta de Chocapalha 2005 Red (Estremadura),Portuguese Red,Quinta de Chocapalha
102030,Greece,"Rustic, with a spin of smoke, this red has a nose of green herbs, black cherry and smoke, and flavors of dried herb, red berry and tobacco. Masculine and focused, it's perfect for spicy meat dishes and stews.",Ovilos,86,55,Pangeon,NA,NA,Susan Kostrzewa,@suskostrzewa,Estate Biblia Chora 2005 Ovilos Red (Pangeon),Red Blend,Estate Biblia Chora
102571,Portugal,"With its fresh fruits, this wine emphasizes its cool origins. The spice is discreet, but the soft tannins go well with the light black currant fruits. It is a wine driven by its acidity and fruit. Give it an hour to open out before drinking, it deserves it.",Vinha Conchas,86,8,Estremadura,NA,NA,Roger Voss,@vossroger,Quinta da Cortezia 2005 Vinha Conchas Red (Estremadura),Portuguese Red,Quinta da Cortezia
102726,US,"Ripe fruit and new oak combine to produce a wine of power, if not of subtlety. A Cabernet Sauvignon-based blend of Bordeaux varieties, it blasts the palate with blackberry jam, cassis, chocolate and caramelized new oak flavors, and the acidity is soft and mild.",NA,86,48,California,Napa Valley,Napa,NA,NA,Calafia 2005 Meritage (Napa Valley),Meritage,Calafia
103136,Spain,"A huge wine that's tannic as nails but so aromatic and flavor packed. Toasted oak, mint, cola, maple, marzipan work the potent nose, while the saturated palate thumps along with massive black-fruit flavors and coffee, fudge and light herb accents. This is one of the most powerful wines from Spain or anywhere. Drink or hold.",Emeritus,94,100,Central Spain,Dominio de Valdepusa,NA,Michael Schachner,@wineschach,Marques de Griñon 2005 Emeritus Red (Dominio de Valdepusa),Red Blend,Marques de Griñon
104801,US,"This bottling has turned out to be one of California's more important Merlot releases. The '05, like its immediate predecessors, is a dry, richly tannic wine of great elegance and structural complexity. It pleases now for the wealth of black currants, anise, herbs, spices and smoky oak, and should develop bottle nuances through 2011.",Reserve Mailbox Vineyard,93,60,California,Spring Mountain District,Napa,NA,NA,Keenan 2005 Reserve Mailbox Vineyard Merlot (Spring Mountain District),Merlot,Keenan
105306,US,"Even in his less-expensive wines, such as this Columbia Valley Merlot, winemaker Charlie Hoppes gets excellent color extraction. Along with the color come stiff, substantial tannins; once in the mouth, however, the wine sets a different course, turning rather light and fruity. Tart cherry and wild berry flavors quickly give way to thick tannins and barrel flavors of baking chocolate.",NA,87,25,Washington,Columbia Valley (WA),Columbia Valley,Paul Gregutt,@paulgwine ,Fidelitas 2005 Merlot (Columbia Valley (WA)),Merlot,Fidelitas
107401,US,"The vineyard name is a combination of the two prevalent soil types, Nekia and WillaKenzie. The Dijon clone Pinot is dark and pleasantly earthy, with core flavors of cassis and cherry liqueur. The earthy, slightly rustic tannins coat the throat, leaving an astringent, green tea residue, but the silky fruit compensates. This needs some further bottle age to really shine.",Willakia,90,35,Oregon,Eola-Amity Hills,Willamette Valley,Paul Gregutt,@paulgwine ,Soléna 2005 Willakia Pinot Noir (Eola-Amity Hills),Pinot Noir,Soléna
107798,Australia,"Wines like this are why Yarra Valley has achieved a certain reputation for Chardonnay. It starts off with wonderfully complex aromas of spring flowers, honey, ripe peaches and citrus fruits, then crams honeyed hints of truffle and oranges into a full-bodied but dry expression of the grape.Finishes elegantly, with a dusting of dried spices.",NA,90,35,Victoria,Yarra Valley,NA,Joe Czerwinski,@JoeCz,Yeringberg 2005 Chardonnay (Yarra Valley),Chardonnay,Yeringberg
108883,US,"Made for the long haul, this 100% Cab was fermented in 100% new French oak. Right now, it's a hard, tannic wine, with little to relieve the astringency. The dominant flavors are of primary fruit black currants and sweet, charred wood. The score reflects the current drinkability, but it's a wine that could improve dramatically over the years.",Leonardini Vineyard,88,100,California,St. Helena,Napa,NA,NA,Whitehall Lane 2005 Leonardini Vineyard Cabernet Sauvignon (St. Helena),Cabernet Sauvignon,Whitehall Lane
108894,Portugal,"A new joint venture between winemaker Jorge Moreira and owner the Bergqvist family, both of Quinta de la Rosa. The vineyard is in the remote Douro Superior. You can certainly smell the dry heat in this young wine. To taste it has a Port-like smoothness overlying its dry tannins. The fruit is sweet, succulent, layered with blackberry jam and dark berries.",Passagem,88,28,Douro,NA,NA,Roger Voss,@vossroger,Quinta das Bandeiras 2005 Passagem Red (Douro),Portuguese Red,Quinta das Bandeiras
110060,Italy,"Gravisano is a sun-drenched dessert wine from the Murgia area of Puglia in the deep south of Italy that offers candied fruit, honey roasted almond and butterscotch flavors. The wine is soft and chewy with a thick, sweet close.",Gravisano Passito,89,35,Southern Italy,Murgia,NA,NA,NA,Botromagno 2005 Gravisano Passito Malvasia (Murgia),Malvasia,Botromagno
111425,Italy,"Here's a bright and fresh expression of Raboso with aromas of small berry, spice, forest floor and chopped herbs. Overall, this easy red wine from Northern Italy offers simple and genuine flavors that would pair with hardy, home-cooked meals.",Potestà,87,23,Veneto,Piave,NA,NA,NA,Bonotto delle Tezze 2005 Potestà Raboso (Piave),Raboso,Bonotto delle Tezze
112145,US,"Tannins mark this tough, still young wine from beginning to end. The astringency envelops the fruit, giving the mouthfeel a hard, dry astringency. Even though there are some well-developed blackberry and currant flavors, the wine is unrelieved in harshness. Try cellaring until at least 2013, but it's risky.",Gist Ranch Estate,87,56,California,Santa Cruz Mountains,Central Coast,NA,NA,Thomas Fogarty 2005 Gist Ranch Estate Cabernet Sauvignon (Santa Cruz Mountains),Cabernet Sauvignon,Thomas Fogarty
112440,US,"A massive wine that absolutely demands time in the cellar, Lancaster's '05 is nearly all Cabernet, with tiny amounts of the other four Bordeaux varieties. It stuns with the power and authenticity of its hilly Cabernet origins, offering vast black currant, orange rind, anise and smoky oak flavors that implode on the palate. But the tannins are hard. It should blossom and fully come into its own after 2010.",NA,95,70,California,Alexander Valley,Sonoma,NA,NA,Lancaster 2005 Cabernet Sauvignon (Alexander Valley),Cabernet Sauvignon,Lancaster
112768,Italy,"This blend of Cabernet, Merlot and Syrah has a lot of heat and power locked within, recognized by slightly cooked or jammy fruit notes. But you'll also get very pleasant, warm tones of soft leather and sweet pipe tobacco.",Poggio ai Ginepri,87,28,Tuscany,Bolgheri,NA,NA,NA,Tenuta Argentiera 2005 Poggio ai Ginepri  (Bolgheri),Red Blend,Tenuta Argentiera
112793,US,"This Pinot Noir, named for a particular soil type in the Willamette valley, is scented strongly of the lumber smell you get at a building supplies store. There is a simple but pleasing layer of strawberry/raspberry fruit hidden in the wine's core. Perhaps a year or two of bottle age will pull things together.",Jory Cuvée,87,30,Oregon,Willamette Valley,Willamette Valley,Paul Gregutt,@paulgwine ,Duck Pond 2005 Jory Cuvée Pinot Noir (Willamette Valley),Pinot Noir,Duck Pond
112869,Portugal,"A strong, concentrated and ultimately rustic wine, a flavor that derives from the Alicante Bouschet in the blend. This gives it power and alcohol that shows in a pepper character. The final juicy palate feels solid and heavy.",Herdade das Servas Vinhas Velhas,87,12,Alentejano,NA,NA,Roger Voss,@vossroger,Serrano Mira 2005 Herdade das Servas Vinhas Velhas Red (Alentejano),Portuguese Red,Serrano Mira
113774,Italy,"This is a wine for anyone who longs for an old fashioned Barbara. An interesting, funky  and very complex nose of menthol, wet fur, coffee, and strawberries. On the palate, it seemed surprisingly soft (one would have expected more acidity) and the flavors less funky than the nose, with a core of sweet strawberry fruit at the finish.",Ciabot Camerano,88,18,Piedmont,Barbera d'Alba,NA,NA,NA,Marcarini 2005 Ciabot Camerano  (Barbera d'Alba),Barbera,Marcarini
113809,Australia,"Well done Shiraz, carefully made and judiciously oaked, with vanilla and cedar accenting blackberry, plum and black olive flavors. It's moderately tannic on the finish, where it adds some coffee-like nuances as well. Drink 2010–2018.",NA,90,35,Victoria,Heathcote,NA,Joe Czerwinski,@JoeCz,Taltarni 2005 Shiraz (Heathcote),Shiraz,Taltarni
115529,US,"Fermented and aged in Burgundian oak, this is intended to evoke a traditional Meursault style. It isn't far from the mark; soft and oaky, it's a bit like biting into a ripe banana squished between two graham crackers. Other tropical fruit flavors are in evidence: mango, pineapple and papaya. It's an easy-drinking style that will have a lot of consumer appeal.",Chateau Puryear Vineyard,88,20,Washington,Rattlesnake Hills,Columbia Valley,Paul Gregutt,@paulgwine ,Bonair 2005 Chateau Puryear Vineyard Chardonnay (Rattlesnake Hills),Chardonnay,Bonair
115637,Spain,"Warm, ripe, earthy aromas of plum and berry are welcoming. This is moderately tannic, with lasting acidity. Oaky aromas of coconut and vanilla blend nicely with loamy earth, black plum and prune flavors. A mellow, flavorful, smooth finish amounts to a fine ending; drink through 2020.",Gran Reserva,91,50,Northern Spain,Rioja,NA,Michael Schachner,@wineschach,Marqués del Puerto 2005 Gran Reserva  (Rioja),Tempranillo Blend,Marqués del Puerto
115729,Argentina,"This is your quintessential New World Best Buy. The bouquet is full, slightly oaky and a touch burnt, and overall it's very nice. Same goes for the mouth, full of ripe berry and cassis flavors. It's medium to full in terms of weight and intensity, while the tannins create a chewy, masculine sensation.",Henry Lagarde Reserve,89,11,Mendoza Province,Mendoza,NA,Michael Schachner,@wineschach,Lagarde 2005 Henry Lagarde Reserve Cabernet Sauvignon (Mendoza),Cabernet Sauvignon,Lagarde
115808,Chile,"Chocolate, a hint of mint, spice and black fruit make this a true-smelling Syrah. The flavors run a little bit red, i.e. raspberry and red plum, and the finish offers a smack of oak along with dried fruit flavors. More of an acid-based, lively style.",Gran Reserva,87,16,Maipo Valley,NA,NA,Michael Schachner,@wineschach,Morandé 2005 Gran Reserva Syrah (Maipo Valley),Syrah,Morandé
116321,South Africa,"An instantly recommendable Pinotage, with soft, pretty aromas of berry and spice and a balanced, integrated overall flavor. It's approachable and full of juicy red berry that plays along with spice. Many Pinotages verge on tongue-stripping; this one is both playful and serious. Will pair well with grilled meat.",Bellevue Estate Wine,87,17,Stellenbosch,NA,NA,Susan Kostrzewa,@suskostrzewa,Tumara 2005 Bellevue Estate Wine Pinotage (Stellenbosch),Pinotage,Tumara
116343,US,"A bright cherry-red color, this lively, sweet-scented wine proves that Oregon can still make a Pinot Noir in a lighter style without having it turn vegetal. Despite a citrusy snap to the palate, it feels smooth and even a bit satiny, and the pretty cranberry/cherry fruit is annotated with cinnamon and light toast. A superb value.",NA,87,14,Oregon,Oregon,Oregon Other,Paul Gregutt,@paulgwine ,Firesteed 2005 Pinot Noir (Oregon),Pinot Noir,Firesteed
116346,US,"Pretty good price for a Napa Syrah of this quality. It's a pleasantly fruity sipper, immediately appealing for its ripe, fresh blackberry, cherry and leather flavors. Has a level of dry elegance and tannic complexity that lifts it above the ordinary.",NA,87,15,California,Napa Valley,Napa,NA,NA,Big Ass 2005 Syrah (Napa Valley),Syrah,Big Ass
116377,Australia,"With its supple tannins and expansive mouthfeel, this wine has some real positives working for it, but there's also a definite clove and rubber edge to the aromas and the flavors show more leather and spice than fresh fruit. Turns crisp on the finish.",NA,85,11,South Australia,McLaren Vale,NA,Joe Czerwinski,@JoeCz,Nine Stones 2005 Shiraz (McLaren Vale),Shiraz,Nine Stones
116853,US,"Give this young puppy a few years to shed its babyfat. It's a bit tannic and hard now, although the blackberry, currant and cedar flavors are just fine. But it's not a longterm ager due to some raisining.",J.D. Hurley,89,30,California,Santa Cruz Mountains,Central Coast,NA,NA,Martin Ranch 2005 J.D. Hurley Cabernet Sauvignon (Santa Cruz Mountains),Cabernet Sauvignon,Martin Ranch
117377,New Zealand,"Shows good concentration of tropical and citrus fruit, but also a heavy veneer of vanillin oak, ending on notes of tangerine and slightly bitter roasted coffee. It's still a good wine, and if your preferences run toward dark, oaky flavors on the finish, you may like it more than this.",Godfrey Reserve,86,29,Marlborough,NA,NA,Joe Czerwinski,@JoeCz,Kathy Lynskey 2005 Godfrey Reserve Chardonnay (Marlborough),Chardonnay,Kathy Lynskey
117391,Italy,"Mature peach and stone fruit, honeysuckle and pine nut come to mind as do dried Mediterranean herbs. These aromas are forthcoming and generous, but also a bit muddy on first impact, which is why this wine hasn't scored higher.",NA,85,NA,Northeastern Italy,Colli Orientali del Friuli,NA,NA,NA,Ronco delle Betulle 2005 Tocai Friulano (Colli Orientali del Friuli),Tocai Friulano,Ronco delle Betulle
117394,Argentina,"A big and mauling version of Malbec. The nose is minty and dark, while the palate runs syrupy and full, with heavy black-fruit flavors darkened even more by a persistent peppery streak. Much less restrained and elegant than the Kaiken Ultra.",NA,85,14,Mendoza Province,Mendoza,NA,Michael Schachner,@wineschach,Kaiken 2005 Malbec (Mendoza),Malbec,Kaiken
118594,Italy,"This wine has structure and concentration, but is less generous in terms of its aromas. There are evident notes of ripe cherry, leather, vanilla and some tobacco, but they never come into full bloom. The tannins are gritty and still a bit raw and the wine offers sour cherry flavors in the mouth.",NA,86,22,Tuscany,Vino Nobile di Montepulciano,NA,NA,NA,Bindella 2005  Vino Nobile di Montepulciano,Prugnolo Gentile,Bindella
119269,US,"Easy to nail this as a Syrah because it's so peppery. Aside from that, it's also so ripe and fruity, it could be Cabernet, with juicy blackberry, cassis, cherry and chocolate flavors.",NA,87,26,California,Napa Valley,Napa,NA,NA,White Oak 2005 Syrah (Napa Valley),Syrah,White Oak
121167,US,"This is a serious Merlot, a welcome relief from the sea of mediocrity that masquerades under the variety. Grown in the winery's estate vineyard in the southerly Coombville area, the wine shows similarities to Carneros Merlots. Dry, fairly tannic, with crisp acidity and an earthy grounding, it has supple, refined flavors of black cherries, currants, cocoa, violets and cedar.",NA,92,40,California,Napa Valley,Napa,NA,NA,Frazier 2005 Merlot (Napa Valley),Merlot,Frazier
121327,France,"Unlike the heavily oaked Cuvée Crescendo produced from the same vineyard in 2005, this wine relies much more on ripe black fruits and open tannins. Certainly it has power, a broad and opulent character, the berry fruits jammy in their sweetness. Age 2–3 years.",Clos de l'Echo,91,42,Loire Valley,Chinon,NA,Roger Voss,@vossroger,Couly-Dutheil 2005 Clos de l'Echo  (Chinon),Cabernet Franc,Couly-Dutheil
121667,France,"A fine, ripe wine, creamy toast coming through the red fruits and light tannins. It is already well developed, not a wine for aging, but it is delicious to drink now, very fresh, juicy.",NA,87,17,Bordeaux,Haut-Médoc,NA,Roger Voss,@vossroger,Château d'Arcins 2005  Haut-Médoc,Bordeaux-style Red Blend,Château d'Arcins
