id,country,description,designation,points,price,province,region_1,region_2,taster_name,taster_twitter_handle,title,variety,winery
26900,Austria,"The merest touch of tropicality, of ripe passion fruit, hovers on the nose before lemon and orange kick in. The palate still has an edge of reduction but that is a good and reassuring sign. There is a rich core of ripe poised fruit: tangerine and aromatic oranges are firmly held with grapefruit freshness. There is a beautiful juxtaposition of generosity and tangy freshness. The finish is lip-smacking and utterly fresh—that rich core of fruit invites you to sip and explore again and again.",Steiner Kögl Reserve,95,51,Kremstal,NA,NA,Anne Krebiehl MW,@AnneInVino,Salomon-Undhof 2015 Steiner Kögl Reserve Riesling (Kremstal),Riesling,Salomon-Undhof
27027,Italy,"Ripe orchard fruit, mature citrus and honey aromas set the tone. On the structured palate, sage and toasted almond notes add interest to mature yellow peach fruit while a hint of lemon drop lends a tangy finish.",Dulcinea,88,NA,Southern Italy,Fiano di Avellino,NA,Kerin O’Keefe,@kerinokeefe,Amarano 2015 Dulcinea  (Fiano di Avellino),Fiano,Amarano
27034,Italy,"This linear, mineral-driven white opens with intriguing sea breeze, herb and field flower scents. The elegant palate offers citrus zest, yellow stone fruit and toasted almond flavors, alongside fresh acidity.",NA,88,20,Northeastern Italy,Friuli,NA,Kerin O’Keefe,@kerinokeefe,Castelvecchio 2015 Malvasia (Friuli),Malvasia,Castelvecchio
27351,US,"These biodynamic grapes, fermented with native yeasts, spent three months in 40% new French oak. It's built like a precision watch, ticking off complete and balanced varietal flavors of citrus rind and juice, with light touches of fresh herb, lemon verbena and a delicate hint of vanilla.",Reserve,93,50,Oregon,Applegate Valley,Southern Oregon,Paul Gregutt,@paulgwine ,Cowhorn 2015 Reserve Viognier (Applegate Valley),Viognier,Cowhorn
27357,US,"A strong chaparral spice note marks the nose of this bottling, with background aromas of roast pork, sage, blueberry syrup and Dr. Pepper. Framed by firm but forgiving tannins, the palate offers cracked pepper, blackened lamb, pine forest and rosemary flavors.",Kimsey Vineyard,93,50,California,Santa Barbara County,Central Coast,Matt Kettmann,@mattkettmann,Hug 2015 Kimsey Vineyard Syrah (Santa Barbara County),Syrah,Hug
27471,France,"Produced in vineyards close to Mont Saint-Victoire in the west of the Provence vineyards, this perfumed, floral wine has crisp acidity along with orange and citrus flavors. The wine is light, very fruity and bright at the end.",Esprit Gassier,86,19,Provence,Côtes de Provence,NA,Roger Voss,@vossroger,Gassier 2015 Esprit Gassier Rosé (Côtes de Provence),Rosé,Gassier
27499,Italy,"Bright and refreshing, this opens with white spring flower and yellow stone fruit aromas. The linear palate evokes yellow peach, mature apple and juicy nectarine, brightened with tangy acidity. It finishes clean and crisp.",NA,89,16,Northeastern Italy,Collio,NA,Kerin O’Keefe,@kerinokeefe,Gradis'ciutta 2015 Ribolla Gialla (Collio),Ribolla Gialla,Gradis'ciutta
27554,Austria,The generous appetizing aromas of very ripe yellow plums and apricots play on the nose. The palate shows equal generosity and ripeness. It is cut by totally focused lemon-zest freshness that just tingles all the senses. This has tension and excitement and lots of concentration that make this long lived and impressive. The finish is supremely aromatic. Drink now–2035.,Ehrenfels Reserve,94,52,Kremstal,NA,NA,Anne Krebiehl MW,@AnneInVino,Proidl 2015 Ehrenfels Reserve Riesling (Kremstal),Riesling,Proidl
27986,Argentina,"Floral white-fruit aromas are yeasty and lack intensity. This feels mildly citric, with basic lime and green-apple flavors. A tangy easy simple finish sends this quaffable SB on its way.",NA,86,10,Mendoza Province,Mendoza,NA,Michael Schachner,@wineschach,Lucky Frog 2015 Sauvignon Blanc (Mendoza),Sauvignon Blanc,Lucky Frog
28352,Spain,"Stone-fruit and melon aromas are minerally. This feels linear and tight due to racy acidity. Flavors of white fruits, lime and stones are slightly tart, while this is short but firm on the finish. For barrel-fermented Viura, this is not oaky in any overt way.",Barrel Fermented,89,17,Northern Spain,Rioja,NA,Michael Schachner,@wineschach,Muga 2015 Barrel Fermented White (Rioja),White Blend,Muga
28361,Spain,"Citrus, mineral and honey aromas are good but not all that complex. This feels full and weighty, with nectarine and orange flavors. On the finish, dry citrus flavors are round and lasting but low on elegance. Drink now.",Selección Especial,89,27,Galicia,Rías Baixas,NA,Michael Schachner,@wineschach,Adegas Gran Vinum 2015 Selección Especial Albariño (Rías Baixas),Albariño,Adegas Gran Vinum
28397,Austria,Faint notes of white pepper and bay leaf create an aromatic introduction to this delicate rosé. The slender palate delivers red apple and a pleasant hit of citrus which lingers beautifully.,NA,88,19,Wachau,NA,NA,Anne Krebiehl MW,@AnneInVino,Jäger 2015 Rosé (Wachau),Rosé,Jäger
28669,Portugal,"The wine, named after a typical mustache from the 19th century, is all fruit: ripe blackberries with balancing acidity. This is an easy ripe wine that will be great with barbecues this summer thanks to its soft tannins and drinkability.",Bigode Tinto,85,9,Lisboa,NA,NA,Roger Voss,@vossroger,DFJ Vinhos 2015 Bigode Tinto Red (Lisboa),Portuguese Red,DFJ Vinhos
28701,Italy,"Delicate scents of beeswax and white spring flower lift out of the glass. The round, juicy palate offers mature pear, white almond and a hint of citrus alongside soft acidity.",Anterisio,87,14,Piedmont,Roero,NA,Kerin O’Keefe,@kerinokeefe,Cascina Chicco 2015 Anterisio  (Roero),Arneis,Cascina Chicco
28719,Spain,"Cotton candy and apple cider aromas give way to a mild palate with soft acidity but a sense of complexity. Plump red-fruit flavors are not specific, and overall this blend of Tempranillo, Syrah and Garnacha is appealing but slightly vacuous.",Sommelier Tempranillo-Syrah-Garnacha,86,30,Central Spain,La Mancha,NA,Michael Schachner,@wineschach,Alcardet 2015 Sommelier Tempranillo-Syrah-Garnacha Rosé (La Mancha),Rosé,Alcardet
28757,Austria,"Lemon and pear take center stage on the nose while the palate presents zesty freshness and wonderful texture. While these Viennese field blends are wonderfully varied, they always are fresh and textured, joyful and food friendly. This wine will lend energy to any repast with its clarion calls of freshness and verve.",NA,91,23,Wiener Gemischter Satz,NA,NA,Anne Krebiehl MW,@AnneInVino,Stift Klosterneuburg 2015 White (Wiener Gemischter Satz),White Blend,Stift Klosterneuburg
28852,US,"A very pretty pale salmon color, cherry and spice aromas are followed by light, tart, dry, mouthwatering fruit flavors. The concentration seems light but there's still much to enjoy.",Rosé,86,12,Washington,Washington,Washington Other,Sean P. Sullivan,@wawinereport,Vino 2015 Rosé Sangiovese (Washington),Sangiovese,Vino
28885,France,"While it misses out on the firmer side of the Morgon cru, this is a robust ripe wine. It has attractive red-cherry fruit and juicy acidity. The structure will allow it to age for a few more months, so drink from late 2017.",Flower Label,87,20,Beaujolais,Morgon,NA,Roger Voss,@vossroger,Georges Duboeuf 2015 Flower Label  (Morgon),Gamay,Georges Duboeuf
28953,France,"A certain faint spiciness hovers over everything, recalling honeysuckle. The textured palate is fresh and equally pepper-spiced. This has freshness and verve, a certain ease and tons of lemony crispness. If you wanted to hold a party to welcome summer, this would be the perfect wine.",Mise du Printemps,90,21,Alsace,Alsace,NA,Anne Krebiehl MW,@AnneInVino,Josmeyer 2015 Mise du Printemps Pinot Blanc (Alsace),Pinot Blanc,Josmeyer
29531,Portugal,"If you like your Sauvignon Blanc herbal, then this is the wine for you. It's very fruity and New World in style, has tight acidity and is ready to drink.",NA,84,NA,Tejo,NA,NA,Roger Voss,@vossroger,Quinta da Alorna 2015 Sauvignon Blanc (Tejo),Sauvignon Blanc,Quinta da Alorna
29535,Portugal,"A light wine with attractive berry flavors, this has a touch of caramel to go with its fruitiness and crisp acidity. Drink now.",NA,84,18,Alentejano,NA,NA,Roger Voss,@vossroger,Dona Maria-Júlio Bastos 2015 Rosé (Alentejano),Rosé,Dona Maria-Júlio Bastos
29587,France,"The wine is rich, accenting tropical-fruit flavors as well as concentrated acidity. Its spice and tangy character are part of the wine's intensity. This superripe wine is still on the young side and will be better from 2018.",La Dame de Châtenoy,88,25,Loire Valley,Menetou-Salon,NA,Roger Voss,@vossroger,Isabelle et Pierre Clément 2015 La Dame de Châtenoy  (Menetou-Salon),Sauvignon Blanc,Isabelle et Pierre Clément
29603,France,"This is a soft rounded wine. With a generous texture and warm white stone-fruit flavors, it is smooth with only a mild tang of clementine peel. The wine is delicious, ripe and ready to drink.",NA,88,20,Loire Valley,Menetou-Salon,NA,Roger Voss,@vossroger,Domaine Chavet 2015  Menetou-Salon,Sauvignon Blanc,Domaine Chavet
29835,Spain,"Ripe aromas of baked berry and plum offer a window into this slightly jumpy, acidic Tempranillo. Roasted, blackened berry flavors show the “roble,” meaning this is a bit oaky. On the finish, this is short but solid and fruity.",Tinto Roble,88,18,Northern Spain,Ribera del Duero,NA,Michael Schachner,@wineschach,Viña Mayor 2015 Tinto Roble  (Ribera del Duero),Tempranillo,Viña Mayor
29915,Italy,Here's an easygoing rosato that offers aromas of red berry and a hint of Mediterranean herb that carry over to the simple palate. A touch of white pepper marks the finish.,NA,86,14,Central Italy,Cerasuolo d'Abruzzo,NA,Kerin O’Keefe,@kerinokeefe,Valori 2015  Cerasuolo d'Abruzzo,Rosato,Valori
29918,US,"With strong fruity aromas like lemon and lime, this wine starts off bold and then turns more mellow and smooth on the palate. It has light vanilla accents and a creamy texture.",NA,86,12,California,California,California Other,Jim Gordon,@gordone_cellars,Leese-Fitch 2015 Chardonnay (California),Chardonnay,Leese-Fitch
29919,US,"Sweet and light bodied, this wine has plenty of jasmine aromas, peach and pistachio flavors, and a rich, soft texture.",NA,86,18,California,California,California Other,Jim Gordon,@gordone_cellars,100 Percent Wine 2015 Moscato (California),Moscato,100 Percent Wine
29930,Spain,"A fruit-forward nose with earthy plum and berry aromas leads to a sharp, lively palate with high acidity. Plum and berry flavors are rendered angular by said acidity, while mild salty notes rise up on the finish.",Ocho y Media,85,9,Central Spain,Vino de la Tierra de Castilla,NA,Michael Schachner,@wineschach,Finca La Estacada 2015 Ocho y Media Tinto Velasco (Vino de la Tierra de Castilla),Tinto Velasco,Finca La Estacada
30830,Portugal,"This wine is all fruit. Its black-currant flavors and attractive acidity come from a blend that is dominated by Tinta Roriz, Touriga Franca and Tinta Barroca. It has minerality and a dry edge, although its fruitiness means it is ready to drink.",NA,87,10,Douro,NA,NA,Roger Voss,@vossroger,Delaforce 2015 Red (Douro),Red Blend,Delaforce
31122,US,"This medium-bodied wine has ripe plum and cherry-candy aromas. Equally fruity flavors are accented by some oak spice, with pretty good balance from mild tannins and acidity.",Reserve,85,14,California,California,California Other,Jim Gordon,@gordone_cellars,Red Rock 2015 Reserve Pinot Noir (California),Pinot Noir,Red Rock
31135,US,Aromas of overripe slightly turned apple and grape skin are followed by dry citrus and guava flavors. It seems quite disjointed.,NA,85,12,Washington,Columbia Valley (WA),Columbia Valley,Sean P. Sullivan,@wawinereport,Skyfall 2015 Pinot Gris (Columbia Valley (WA)),Pinot Gris,Skyfall
31413,US,"If anyone can elevate Oregon's already excellent Chardonnays to the next level, it's Jacques Lardière, who makes Résonance for Louis Jadot after four decades at their winery in Burgundy. This nutty toasty chiseled wine has impeccable breeding, power and elegance. White peach, pear and apple fruit is wrapped in lush barrel flavors of caramel, buttered toast and vanilla wafer, with firm acids for a foundation. Drink now and on through 2025.",Hyland Vineyard,95,50,Oregon,McMinnville,Willamette Valley,Paul Gregutt,@paulgwine ,Résonance 2015 Hyland Vineyard Chardonnay (McMinnville),Chardonnay,Résonance
31448,US,"This is rich, almost unctuous, in terms of mouthfeel. That roundness, coupled with the bright golden hue, suggest that this wine may have been barrel aged. Some aromatic traces of talcum powder remain, drifting above chunky fruit flavors of pineapple and peach. The finish is full bodied and lightly toasty.",Oak Ridge Vineyard,88,18,Oregon,Columbia Gorge (OR),Oregon Other,Paul Gregutt,@paulgwine ,Brooks 2015 Oak Ridge Vineyard Gewürztraminer (Columbia Gorge (OR)),Gewürztraminer,Brooks
31467,France,"The abbey of Marmoutier was founded in the 4th century by Saint Martin. The walled vineyard is owned by the city of Tours, across the Loire from Vouvray. The wine is off dry, ripe with pear and honey and deliciously balanced with the acidity. It is young and will repay aging, so drink from 2020.",Abbaye de Marmoutier Clos du Rougemont,93,26,Loire Valley,Vouvray,NA,Roger Voss,@vossroger,Domaine Vigneau-Chevreau 2015 Abbaye de Marmoutier Clos du Rougemont  (Vouvray),Chenin Blanc,Domaine Vigneau-Chevreau
31470,US,"This delicious, reserve-level effort keeps the alcohol low without sacrificing power, weight or depth of flavor. Barrel-fermented and aged sur lie, it's a full-bodied wine with scents and flavors of ripe stone fruit, buttered toast and caramel. Decant and drink now or cellar for a few years.",Lux,93,55,Oregon,Willamette Valley,Willamette Valley,Paul Gregutt,@paulgwine ,Fullerton 2015 Lux Chardonnay (Willamette Valley),Chardonnay,Fullerton
31476,France,"Originally planted by monks in the 12th century, this vineyard has produced an intensely herbaceous wine. Steely and crisp with grapefruit and gooseberry flavors, the wine's texture brings out the chalky soil. Still young, it will be better from 2018.",Les Vignes de Saint-Laurent l'Abbaye,92,22,Loire Valley,Pouilly-Fumé,NA,Roger Voss,@vossroger,Domaine Chatelain 2015 Les Vignes de Saint-Laurent l'Abbaye  (Pouilly-Fumé),Sauvignon Blanc,Domaine Chatelain
31479,France,"Expanding on their fathers' legacies, the cousins Jean-Laurent and Jean-Dominique Vacheron have a deserving reputation for their almost-Burgundian Sancerre. This latest vintage, packed with both fruit and structure, shows why. It is ripe with red cherries and dark plums laced with acidity. The wine is full of great ripe fruit and generous tannins. Drink from 2018.",NA,92,40,Loire Valley,Sancerre,NA,Roger Voss,@vossroger,Domaine Vacheron 2015  Sancerre,Pinot Noir,Domaine Vacheron
31483,France,"One of the wines produced to celebrate the family's 500-year history, this is intensely herbal, with taut and highly textured minerality. It tastes of the chalk soil with its zesty flavor, bursting out of the glass. Drink this still young wine from 2018.",L'Original,92,80,Loire Valley,Sancerre,NA,Roger Voss,@vossroger,Joseph Mellot 2015 L'Original  (Sancerre),Sauvignon Blanc,Joseph Mellot
31491,US,"After a faulty first bottle of this wine, the second was a revelation: sexy, polished and lushly endowed with a mix of orange, apple, pear and apricot flavors. Its texture, length and definition are truly impressive.",Gravel Road,92,40,Oregon,Willamette Valley,Willamette Valley,Paul Gregutt,@paulgwine ,Roco 2015 Gravel Road Chardonnay (Willamette Valley),Chardonnay,Roco
31546,Chile,"Aromas of baked blackberry are a touch earthy but mostly easy to process. This Cabernet feels solid but not overextracted. Malty, earthy flavors of baked berry fruits and cassis finish with coffee and mocha notes. Drink through 2021.",Gravas Rojas,90,NA,Puente Alto,NA,NA,Michael Schachner,@wineschach,Concha y Toro 2015 Gravas Rojas Cabernet Sauvignon (Puente Alto),Cabernet Sauvignon,Concha y Toro
31778,US,"A fine value, this tart young wine opens with cranberry, raspberry and cocoa flavors. It's graceful, flavorful and already drinking well but should continue to give pleasure over the next five years.",Lylee,89,23,Oregon,Willamette Valley,Willamette Valley,Paul Gregutt,@paulgwine ,Brigadoon 2015 Lylee Pinot Noir (Willamette Valley),Pinot Noir,Brigadoon
31816,Australia,"Give this wine a few minutes to open up, and once it does it's a lovely example of cool climate Chardonnay. Subtle notes of ripe lemon, stone fruit, butter, and smoke lead into a slippery textured, medium-weighted palate. More lemon and stone fruit mark the flavors, and toast and smoke show on the finish.",NA,90,25,South Australia,Adelaide Hills,NA,NA,NA,Bird in Hand 2015 Chardonnay (Adelaide Hills),Chardonnay,Bird in Hand
31840,US,"There's a leathery quality to the nose of this bottling, with charred berries, roasted pepper-crusted beef and slightly sour gamy aromas as well. Cracked black pepper, blackberry, animal skins and beef jerky flavors show on the sip, which hides the high-alcohol content well.",Hart Family Vineyard Limited Release,90,NA,California,Temecula Valley,South Coast,Matt Kettmann,@mattkettmann,Hart 2015 Hart Family Vineyard Limited Release Tempranillo (Temecula Valley),Tempranillo,Hart
32050,Portugal,"This wine is ripe, balanced and full of bold, rich fruit. Solid tannins under the opulent black plums and black currants fit well with the acidity and the structure. Give it a little time and drink from 2018.",Reserva Tinto,91,NA,Alentejano,NA,NA,Roger Voss,@vossroger,Santos & Seixo 2015 Reserva Tinto Red (Alentejano),Portuguese Red,Santos & Seixo
32240,France,"Yeasty funk still dominates the nose and only lets a touch of lemon zest through. The palate continues with the zesty background against which flashes of riper fruit appear: juicy pear and luscious tangerine. The fruit expression is ripe but utterly fresh. The taut dry palate is anchored in something cool and fresh, something that expands as texture and fills not only the palate but also the mind. This is fresh and luminous, elegant and fine boned. Drink now through 2030.",Roche Calcaire,94,55,Alsace,Alsace,NA,Anne Krebiehl MW,@AnneInVino,Domaine Zind-Humbrecht 2015 Roche Calcaire Riesling (Alsace),Riesling,Domaine Zind-Humbrecht
32242,France,"Intense lemon and tangerine notes create a most inviting nose. The palate continues in full tangy mode: the aromatic zest of tangerine and ripe Amalfi lemon create a concentrated, uplifting and even cooling freshness. The body is slender but totally concentrated with a dynamic linear structure. Over time, riper notes of honeyed stone fruit appear despite the very dry style, but the chief charms are a marvel of citrus diversity. Drink now through 2035.",Letzenberg,94,36,Alsace,Alsace,NA,Anne Krebiehl MW,@AnneInVino,Jean-Baptiste Adam 2015 Letzenberg Riesling (Alsace),Riesling,Jean-Baptiste Adam
32354,Croatia,"This straw-colored wine has delightful aromas of white jasmine, cotton candy and violets. Flavors recall guava, mango and papaya. Medium bodied and well balanced, it has a clean, crisp finish.",NA,89,20,Kutjevo,NA,NA,Jeff Jenssen,@worldwineguys,Adzic 2015 Graševina (Kutjevo),Graševina,Adzic
32362,US,"Very primary aromas of lime zest and mineral are followed by lightly spritzy, just a hair off-dry citrus flavors backed by bright, tart acidity.",The Magician Evergreen Vineyard,89,18,Washington,Ancient Lakes,Columbia Valley,Sean P. Sullivan,@wawinereport,Sleight of Hand 2015 The Magician Evergreen Vineyard Riesling (Ancient Lakes),Riesling,Sleight of Hand
32574,France,"This highly perfumed wine comes from a small Gamay appellation that is in fact in the Mâcon region. With some tight tannins and rich black fruits, it is a ripe, juicy wine that has intense acidity as well as a spicy aftertaste. Drink this ripe wine from 2018.",Le Clos,86,26,Beaujolais,Beaujolais-Leynes,NA,Roger Voss,@vossroger,Château de Lavernette 2015 Le Clos  (Beaujolais-Leynes),Gamay,Château de Lavernette
33056,France,"Produced for the Xavier Flouret brand at Château des Demoiselles in the Vallée d'Esclans in the heart of the Côtes de Provence, this is a fresh wine that wears its fruit on its sleeve. With citrus mingling with red fruits, it is bright with acidity, finishing with a tangy aftertaste. Drink now.",Nationale 7,87,20,Provence,Côtes de Provence,NA,Roger Voss,@vossroger,Xavier Flouret 2015 Nationale 7 Rosé (Côtes de Provence),Rosé,Xavier Flouret
33078,US,"While the nose is subdued, the palate of this semidry Riesling offers loads of fresh peach and yellow-cherry flavors. It's crisply balanced with fresh lime acidity and a brisk revitalizing finish.",Full Monty,88,15,New York,Finger Lakes,Finger Lakes,Anna Lee C. Iijima,NA,Lakewood 2015 Full Monty Riesling (Finger Lakes),Riesling,Lakewood
33083,US,"Cherry, strawberry and baking spices combine in this medium-bodied wine that offers texture and soft, supple layers of refreshing acidity.",NA,88,25,California,Sonoma Coast,Sonoma,Virginie Boone,@vboone,Pacific Heights Wines 2015 Pinot Noir (Sonoma Coast),Pinot Noir,Pacific Heights Wines
33160,France,"This is a classic Bordeaux-style white wine with its cool herbal character and light perfume from the Muscadelle in the blend. The wine has no oak aging, just ripe fruit that has citrus, pineapple and green fruit flavors. Drink now.",Bélingard,87,10,Southwest France,Bergerac Sec,NA,Roger Voss,@vossroger,Château Bélingard 2015 Bélingard White (Bergerac Sec),Bordeaux-style White Blend,Château Bélingard
33433,New Zealand,"A sleek, streamlined rendering of Pinot Noir, marked by hints of espresso and barrel char, but also offering ample pie cherry, pomegranate and tea shadings. It's crisp but not very tannic, so there's no need to wait on this one. Drink now–2020.",Unravelled,88,30,Central Otago,NA,NA,Joe Czerwinski,@JoeCz,Carrick 2015 Unravelled Pinot Noir (Central Otago),Pinot Noir,Carrick
33438,France,"From dark granite soil, this wine is structured and concentrated. It has ripe black-cherry fruit and spice that add to the mineral texture and firm tannins in the background. Drink this cru wine from late 2017.",Flower Label,88,20,Beaujolais,Saint-Amour,NA,Roger Voss,@vossroger,Georges Duboeuf 2015 Flower Label  (Saint-Amour),Gamay,Georges Duboeuf
33666,France,"Fresh notes of crunchy red cherry have a spicy edge of pepper. The body of this slender Pinot Noir is very light, totally peppery and very appetizing. The structure is soft and very refreshing. This could also be chilled and is a fabulously light-bodied but sprightly lunch red. The finish is perfectly dry and very enlivening.",Bonheur Convivial,90,20,Alsace,Alsace,NA,Anne Krebiehl MW,@AnneInVino,Domaine Rieflé-Landmann 2015 Bonheur Convivial Pinot Noir (Alsace),Pinot Noir,Domaine Rieflé-Landmann
33684,Italy,"Made entirely from Chardonnay, this opens with yellow apple, Williams pear and white peach aromas that follow through to the palate. It's elegant and steeped in vanilla and hazelnut flavors, with fresh acidity that lifts its creamy texture.",Bianco Benefizio Riserva,90,45,Tuscany,Pomino,NA,Kerin O’Keefe,@kerinokeefe,Marchesi de' Frescobaldi 2015 Bianco Benefizio Riserva Chardonnay (Pomino),Chardonnay,Marchesi de' Frescobaldi
33760,France,"This wine, while rich, has all the minerality and crisp texture associated with the appellation. Wood aging adds spice. It needs some aging, not much, and will be ready to drink from 2019.",NA,90,86,Burgundy,Puligny-Montrachet,NA,Roger Voss,@vossroger,Jean-Luc and Paul Aegerter 2015  Puligny-Montrachet,Chardonnay,Jean-Luc and Paul Aegerter
33927,Italy,"This has aromas of hay, tropical fruit and a whiff of tomato vine. The bright, straightforward palate offers fruity flavors suggesting honeydew melon, white peach and citrus alongside zesty acidity.",Valle delle Lame,86,12,Central Italy,Verdicchio dei Castelli di Jesi,NA,Kerin O’Keefe,@kerinokeefe,Vignamato 2015 Valle delle Lame  (Verdicchio dei Castelli di Jesi),Verdicchio,Vignamato
33939,France,"This blend of Rolle, Ugni Blanc and Clairette is bright and tangy. It offers a definite herbal flavor as well as ripe yellow fruits integrated into a texture that is crisp and mineral. The wine is ready to drink.",Les Valentines,86,26,Provence,Côtes de Provence,NA,Roger Voss,@vossroger,Château les Valentines 2015 Les Valentines White (Côtes de Provence),Provence white blend,Château les Valentines
34192,US,"Aromas of white flowers, lychee and grapefruit peel lead to dry fruit flavors that seem to lack concentration, with a bitter note on the finish.",The Reserve Dry,85,22,Washington,Horse Heaven Hills,Columbia Valley,Sean P. Sullivan,@wawinereport,14 Hands 2015 The Reserve Dry Gewürztraminer (Horse Heaven Hills),Gewürztraminer,14 Hands
34328,France,"This is an extremely faint and subtle rosé, with delicate aromas and flavors of pineapple, tart cherry and orange rind. It's light-weight and thin on the palate, with a clean but fleeting finish.",Pot De Vin Syrah,84,13,Languedoc-Roussillon,Pays d'Oc,NA,Lauren Buzzeo,@laurbuzz,Château Guilhem 2015 Pot De Vin Syrah Rosé (Pays d'Oc),Rosé,Château Guilhem
34426,US,"Nicely ripe fruit flavors and a full rounded texture give this affordably priced wine more presence than most. The aroma is honeydew melon and the flavors are ripe apple and Anjou pear, while the acidity is on the soft side.",Vintner's Reserve,89,13,California,California,California Other,Jim Gordon,@gordone_cellars,Kendall-Jackson 2015 Vintner's Reserve Sauvignon Blanc (California),Sauvignon Blanc,Kendall-Jackson
