id,country,description,designation,points,price,province,region_1,region_2,taster_name,taster_twitter_handle,title,variety,winery
99744,Italy,"The nose isn't very expressive on this big, brawny wine but the chewy, full-bodied palate offers blackberry jam, raisin, licorice, chocolate and orange peel alongside smooth tannins. It still has enough fruit richness to carry off the hearty alcohol but drink sooner rather than later.",La Rossa,89,20,Piedmont,Barbera d'Alba Superiore,NA,Kerin O’Keefe,@kerinokeefe,Il Falchetto 2011 La Rossa  (Barbera d'Alba Superiore),Barbera,Il Falchetto
99768,France,"While big, ripe and jammy, this wine has firm tannins and a dense texture. There is concentration, but the freshness is missing.",Mon Ange,88,NA,Bordeaux,Castillon Côtes de Bordeaux,NA,Roger Voss,@vossroger,Château La Rose Poncet 2011 Mon Ange  (Castillon Côtes de Bordeaux),Bordeaux-style Red Blend,Château La Rose Poncet
99837,US,"An appealing wine with notes of orange peel, citrus and red fruit. It's medium-bodied with lively citrus flavors that display a soft feel.",Anna Marie,89,18,Oregon,Rogue Valley,Southern Oregon,Sean P. Sullivan,@wawinereport,Valley View 2011 Anna Marie Tempranillo (Rogue Valley),Tempranillo,Valley View
100107,Italy,"This would pair with cold cuts, oven-roasted pizza or bruschetta with wild mushrooms. It is simple, clean and redolent of wild berries and tart cherry.",NA,85,10,Veneto,Valpolicella Classico,NA,NA,NA,Stefano Accordini 2011  Valpolicella Classico,"Corvina, Rondinella, Molinara",Stefano Accordini
100126,Italy,"This full-bodied and savory blend of Chardonnay, Ribolla Gialla and Sauvignon opens with lovely aromas of hawthorne, apple and stone fruit. The vibrant palate delivers yellow peach, nectarine, Golden Delicious apple and candied citrus alongside bright acidity.",Bratinis,90,22,Northeastern Italy,Collio,NA,Kerin O’Keefe,@kerinokeefe,Gradis'ciutta 2011 Bratinis White (Collio),White Blend,Gradis'ciutta
100235,US,"Merlot, Cabernet and Syrah form the core of this wildly successful red blend from Ste. Michelle Wine Estates. Soft and juicy, it's packed with flavors of vanilla, pipe tobacco and cola, while keeping the stuffing and structure of a substantial wine. An appealing red blend, especially for consumers new to wine.",Hot To Trot,86,10,Washington,Columbia Valley (WA),Columbia Valley,Paul Gregutt,@paulgwine ,14 Hands 2011 Hot To Trot Red (Columbia Valley (WA)),Red Blend,14 Hands
100240,US,"Simple and direct, this wine is characterized by flavors of blackberry, currant, mocha and oak. It's a softly tannic Cabernet with a large production of 48,000 cases. Dry and spicy, it's ready to drink now.",NA,86,26,California,Paso Robles,Central Coast,NA,NA,Justin 2011 Cabernet Sauvignon (Paso Robles),Cabernet Sauvignon,Justin
100249,Austria,"Raspberry, blueberry and blackberry, with a hint of dark chocolate, are first apparent. On the palate, this is slender, fruity and fresh—a very charming and subtle Pinot Noir for light lunches or the picnic basket.",Raflerjoch,86,NA,Vienna,NA,NA,Anne Krebiehl MW,@AnneInVino,Stift Klosterneuburg 2011 Raflerjoch Pinot Noir (Vienna),Pinot Noir,Stift Klosterneuburg
100359,US,"A portion of the proceeds from sales of this dry sparkler helps support marine protected areas and sustainable fishing. Tart and doughy, it imparts a bite of vanilla biscuit, apple pie, orange peel and lime. A streak of minerality gives it plenty of life atop the medium body.",National Geographic Ocean Reserve Blanc de Blancs Estate Bottled,92,50,California,Green Valley,Sonoma,Virginie Boone,@vboone,Iron Horse 2011 National Geographic Ocean Reserve Blanc de Blancs Estate Bottled Chardonnay (Green Valley),Chardonnay,Iron Horse
100761,Italy,Here's a balanced and bright Chardonnay from a cool climate region in northern Italy that shows crisp aromas of peach and citrus followed by light shadings of spice and bitter almond. The wine is silky and smooth with more citrus on the close.,NA,88,38,Northwestern Italy,Valle d'Aosta,NA,NA,NA,Les Crêtes 2011 Chardonnay (Valle d'Aosta),Chardonnay,Les Crêtes
100804,South Africa,"A subtle smokiness lends an intriguing streak to the nose of this wine, partnering harmoniously with scents of crisp red apple, melon rind, green fig and orange zest. Well balanced and approachable, the medium-weight palate offers clean flavors of apple, lime and softly toasted brioche. Enjoy now.",NA,89,34,Stellenbosch,NA,NA,Lauren Buzzeo,@laurbuzz,Radford Dale 2011 Chardonnay (Stellenbosch),Chardonnay,Radford Dale
100901,Portugal,"A new wine in the Aveleda line-up, this is rich and rounded. It's aromatic, with a full mouthfeel and flavors of pear and green apple lifted by acidity. The finish is full and fruity.",Aveleda Branco,87,NA,Douro,NA,NA,Roger Voss,@vossroger,Aveleda 2011 Aveleda Branco White (Douro),Portuguese White,Aveleda
100915,Italy,"This opens with pretty scents of plum, blue flower, baking spice and a whiff of leather. The lean palate doesn't live up to the nose, showing raw sour cherry, orange peel and a hint of fennel seed accompanied by dusty, fleeting tannins that dry out the finish.",Riserva,86,30,Tuscany,Chianti Classico,NA,Kerin O’Keefe,@kerinokeefe,Castello di Selvole 2011 Riserva  (Chianti Classico),Red Blend,Castello di Selvole
101135,Austria,"Pure in character, this has a taut line of perfumed white fruits, with a nervy, tight character. It is young, needing several years of aging to bring out its complex flavors.",Gebling,91,22,Kremstal,NA,NA,Roger Voss,@vossroger,Hermann Moser 2011 Gebling Riesling (Kremstal),Riesling,Hermann Moser
101623,US,"This is a strong wine from this region just south of Temecula and north of San Diego. The nose offers smoked cigar, blackberry preserves, raw cut wood and pine-needle aromas, while the palate packs juniper and floral tea elements into a black-plum backbone. Hints of soy and burned caramel add action to the medium-weight mouthfeel.",33 Degrees North Gracie Hill Vineyard,89,33,California,South Coast,South Coast,Matt Kettmann,@mattkettmann,Fallbrook 2011 33 Degrees North Gracie Hill Vineyard Merlot (South Coast),Merlot,Fallbrook
101810,France,"This is a soft wine, with light green-plum and apple flavors, and an asparagus edge that comes through on the finish. Ready to drink. Screwcap.",Le Montarlet,87,NA,Loire Valley,Sancerre,NA,Roger Voss,@vossroger,Joseph Mellot 2011 Le Montarlet  (Sancerre),Sauvignon Blanc,Joseph Mellot
101878,US,"This is a lovely, balanced wine, combining grip, texture and elegant details. It starts with clean fruit flavors of berry and cherry, bringing in delicate notes of root beer, vanilla and clove. There's a suggestion of brine also, the whole delivering marvelous complexity.",Heather's Vineyard,91,65,Oregon,Chehalem Mountains,Willamette Valley,Paul Gregutt,@paulgwine ,Anam Cara 2011 Heather's Vineyard Pinot Noir (Chehalem Mountains),Pinot Noir,Anam Cara
101920,US,"One of the Steve and Chrystal Clifton's lively takes on this grape, this shows smashed black currants, boysenberry, gravel and dark spice on the nose. Allspice and cinnamon decorate the black-cherry core, which is not particular juicy or overly ripe, tightened up further by pencil shavings.",Alisos,89,40,California,Santa Barbara County,Central Coast,Matt Kettmann,@mattkettmann,Palmina 2011 Alisos Barbera (Santa Barbara County),Barbera,Palmina
102037,Italy,"This is a sweet and thin dessert wine with aromas of peach, pear and honey that are muddled at times. The price is pretty good, however, for those who want to try a late harvest Fiano Minutolo.",Cré Vendemmia Tardiva,84,20,Southern Italy,Salento,NA,NA,NA,Vetrère 2011 Cré Vendemmia Tardiva Fiano (Salento),Fiano,Vetrère
102050,US,"Made in a rich, ripe style, this Chenin Blanc-based blend has enough acidity for balance. It offers rich golden mango, orange and honey flavors.",White Elephant,84,18,California,California,California Other,NA,NA,Vinum 2011 White Elephant White (California),White Blend,Vinum
102084,Italy,"Made with 55% Cabernet Sauvignon, 25% Cabernet Franc, 15% Merlot and 5% Petit Verdot, this opens with aromas of black currant and baking spice. The evolved palate provides mature plum, oak and toast alongside gripping, rather drying tannins.",Salamartano,87,49,Tuscany,Toscana,NA,Kerin O’Keefe,@kerinokeefe,Fattoria Montellori 2011 Salamartano Red (Toscana),Red Blend,Fattoria Montellori
102384,France,"Very juicy and ripe, this is a fruity, blackberry flavored wine. The ripe feeling is cut through by acidity and solidified by tannins, making it a rich wine that will be ready to drink from 2016.",NA,86,NA,Bordeaux,Castillon Côtes de Bordeaux,NA,Roger Voss,@vossroger,Château Fongaban 2011  Castillon Côtes de Bordeaux,Bordeaux-style Red Blend,Château Fongaban
102553,France,"A wine with some depth, this is layered with fine tannins. The acidity and red cherry flavor are held up by its firm structure. It's also fruity enough to be consumed now.",NA,88,16,Beaujolais,Beaujolais-Villages,NA,Roger Voss,@vossroger,Domaine des Nugues 2011  Beaujolais-Villages,Gamay,Domaine des Nugues
102576,Argentina,"Briny raspberry aromas are a bit murky. This smacks down hard with acidity, while the flavors run toward earthy, generic plum and berry. A salty finish with animal notes is firm but struggles with cleanliness.",NA,82,8,Mendoza Province,Mendoza,NA,Michael Schachner,@wineschach,Casa de Campo 2011 Cabernet Sauvignon (Mendoza),Cabernet Sauvignon,Casa de Campo
102589,Argentina,"There's a strong dose of sawdust and faux vanilla on the nose of this flabby Malbec. Woody, minty flavors crowd out the fruit content, while the finish is resiny in feel, and consistent with the palate.",NA,82,12,Mendoza Province,Mendoza,NA,Michael Schachner,@wineschach,Rio Perdido 2011 Malbec (Mendoza),Malbec,Rio Perdido
102610,US,"The cold vintage seems to have affected this wine. It lacks its usual richness and instead, is acidic and lean, even vegetal.",NA,82,34,California,Sonoma Coast,Sonoma,NA,NA,MacRostie 2011 Pinot Noir (Sonoma Coast),Pinot Noir,MacRostie
102667,US,"An incredibly savory nose of hoisin-glazed barbecue, with a hint of tarragon, carries the bouquet. More fruit comes on the palate of jammy, mixed black berries, yet the mild acidity struggles to keep the balance.",NA,83,32,Nevada,Nevada,NA,Alexander Peartree,NA,Nevada Ridge 2011 Syrah (Nevada),Syrah,Nevada Ridge
102710,US,"Young, sharp, oaky and wound up tightly, this is a focused wine of medium concentration. Green and yellow apples hold down the core of fruit, and trail out with a hint of butter on the tongue.",NA,90,45,Oregon,Chehalem Mountains,Willamette Valley,Paul Gregutt,@paulgwine ,Rex Hill 2011 Chardonnay (Chehalem Mountains),Chardonnay,Rex Hill
102759,US,"Soft, supple plum envelopes an oaky structure in this Cabernet, supported by 15% Merlot. Coffee and chocolate complete the picture, finishing strong at the end, resulting in a value-priced wine of attractive flavor and immediate accessibility.",Mountain Cuvée,87,19,California,Napa Valley,Napa,Virginie Boone,@vboone,Kirkland Signature 2011 Mountain Cuvée Cabernet Sauvignon (Napa Valley),Cabernet Sauvignon,Kirkland Signature
102882,Israel,"A blend of Merlot, Cabernet Franc, Cabernet Sauvignon and Petit Verdot, this deep violet-red wine has a nose of black cherry, crème brulée and black pepper. Cool and fruity notes play well together on the palate, shored up by flavors of black cherry, orange zest, menthol, clove and a touch of seawater. Mevushal.",Mosaic,89,60,Judean Hills,NA,NA,Mike DeSimone,@worldwineguys,Shiloh Winery 2011 Mosaic Red (Judean Hills),Bordeaux-style Red Blend,Shiloh Winery
102970,Italy,"This elegantly structured red opens with aromas of dark-skinned berry, sunbaked earth, new leather, thyme and a whiff of pipe tobacco. The balanced, polished palate offers wild cherry, strawberry, vanilla, coffee and star anise alongside integrated tannins. It's already accessible and will offer fine drinking over the next several years. Drink through 2021.",La Casa,93,79,Tuscany,Brunello di Montalcino,NA,Kerin O’Keefe,@kerinokeefe,Caparzo 2011 La Casa  (Brunello di Montalcino),Sangiovese,Caparzo
103051,US,"This is a tannic, acidic, hard-to-appreciate wine due to the cold conditions of the 2011 vintage. But the wine, which is 100% Cabernet and was aged in 50% new French oak, still is a great success, testimony to skillful viticultural and winemaking practices. With a solid core of black currants, it wants until 2020 in the cellar.",Maxine's Vineyard,90,55,California,Yountville,Napa,NA,NA,Bardessono 2011 Maxine's Vineyard Cabernet Sauvignon (Yountville),Cabernet Sauvignon,Bardessono
103080,Italy,"Ros'Aura is one of the most delightful rosatos to come from southern Italy. It's a concentrated bright pink color, with fresh aromas of wild berry and pink grapefruit.",Ros'Aura,89,15,Southern Italy,Irpinia,NA,NA,NA,Feudi di San Gregorio 2011 Ros'Aura Aglianico (Irpinia),Aglianico,Feudi di San Gregorio
103162,US,"This blend of Sagemoor, Weinbau and Heather Hill vineyards displays barrel aromas of cocoa and woodspice followed by dark cherries. It's medium bodied with abundant dark cherry and barrel flavors backed by gruff tannins.",NA,88,35,Washington,Columbia Valley (WA),Columbia Valley,Sean P. Sullivan,@wawinereport,DaMa 2011 Cabernet Sauvignon (Columbia Valley (WA)),Cabernet Sauvignon,DaMa
103251,Bulgaria,"The result of a joint project between Michel Rolland and Jair Agopian, this Bulgarian Bordeaux-style blend has primary aromas of ripe blackberry, dark cherry and black plum that give way to intriguing secondary notes of saddle leather, tobacco leaf and graphite. It exhibits nice weight on the midpalate with juicy flavors of cassis, black raspberry and cherry vanilla. The tannins are firm yet velvety and there is a surprising burst of bright fruit in the finish.",Butterfly's Rock,91,25,Thracian Valley,NA,NA,Mike DeSimone,@worldwineguys,Castra Rubra 2011 Butterfly's Rock Red (Thracian Valley),Bordeaux-style Red Blend,Castra Rubra
103307,Italy,"Luca Bosio's pretty Moscato d'Asti opens with characteristic aromas of ginger, tangerine skin and acacia flower. This sweet sparkler presents a mouthful of creamy foam and bright bubbles.",NA,87,18,Piedmont,Moscato d'Asti,NA,NA,NA,Bosio 2011  Moscato d'Asti,Moscato,Bosio
103611,US,"Almost entirely varietal (3% Petit Verdot) with the fruit mostly split between Elephant Mountain and Alder Ridge vineyards, this wine is a bit aromatically locked up at present with notes of cherry, green herbs and blue fruit. It's medium bodied in feel, with the oak dialed back (33% new French), tart acids and a gentle squeeze of tannins with bitters on the finish. It should only improve with additional time in the bottle and has a lot life ahead of it.",NA,91,50,Washington,Columbia Valley (WA),Columbia Valley,Sean P. Sullivan,@wawinereport,Pamplin 2011 Cabernet Sauvignon (Columbia Valley (WA)),Cabernet Sauvignon,Pamplin
103639,US,"This appealingly jammy wine is rich in red cherries and raspberries. The fruitiness is the main attraction, fortunately balanced by crisp acidity, gentle tannins and the smoky structure that oak barrel aging brings. Drink this racy, silky Pinot now.",Clone 777,87,32,California,Arroyo Grande Valley,Central Coast,NA,NA,Laetitia 2011 Clone 777 Pinot Noir (Arroyo Grande Valley),Pinot Noir,Laetitia
103645,US,"Entirely estate-grown, 100% Merlot from old vines, this unfined wine is labeled vegan. Plush, briary, brambly fruit from the 30 year old vineyard brings an extra dimension to the wine, which shows a lovely balance of cranberry, raspberry, pie cherry and baking spice flavors. There's a hint of pastry crust in the finish, which is seamless and long. An absolute delight.",Seven Hills Vineyard,93,35,Washington,Walla Walla Valley (WA),Columbia Valley,Paul Gregutt,@paulgwine ,Seven Hills 2011 Seven Hills Vineyard Merlot (Walla Walla Valley (WA)),Merlot,Seven Hills
103664,France,"This is a dense, concentrated and expressive wine, although it's still young and promises more beauty and elegance with age. Aromas of African violets and cocoa nibs marry harmoniously with the fleshy black-fruit core. Jammy, ripe plum and cherry flavors lead the lush and slightly creamy palate, transitioning into notes of roasted coffee and chocolate, and finally ending on a sweet toasted-oak and baking-spice accent. It's richly delicious now, but patience will also be rewarded; try after 2016.",Tautavel Hommage aux Vignerons,93,35,Languedoc-Roussillon,Côtes du Roussillon Villages Tautavel,NA,Lauren Buzzeo,@laurbuzz,Gérard Bertrand 2011 Tautavel Hommage aux Vignerons Red (Côtes du Roussillon Villages Tautavel),Rhône-style Red Blend,Gérard Bertrand
103769,US,"Pulled together with fruit from a mix of estate vineyards, this wine boasts delicate flavors of raspberry and pomegranate with light accents of barrel toast, along with substantial acidity. It's tart, clean and simple.",Estate,87,30,Oregon,Willamette Valley,Willamette Valley,Paul Gregutt,@paulgwine ,Willamette Valley Vineyards 2011 Estate Pinot Noir (Willamette Valley),Pinot Noir,Willamette Valley Vineyards
103788,France,This is a structured wine that shows both solid tannins and juicy red-fruit acidity. It's a rich but balanced wine with a ripe aftertaste. Drink from 2015.,Château Charron,87,10,Bordeaux,Bordeaux,NA,Roger Voss,@vossroger,Caves de Rauzan 2011 Château Charron  (Bordeaux),Bordeaux-style Red Blend,Caves de Rauzan
103813,Austria,"Warm and creamy, this fills the palate with apple and pink grapefruit flavors. A touch of spice adds interest to this ripe, fruity effort that is ready to drink. Screwcap.",Falkensteiner Tradition,88,18,Niederösterreich,NA,NA,Roger Voss,@vossroger,Dürnberg 2011 Falkensteiner Tradition Grüner Veltliner (Niederösterreich),Grüner Veltliner,Dürnberg
103857,Austria,"Upon first pour, this only shows some earthy hints of evolution. With air, the aromas awaken and lovely notes hayflower notes emerge. The palate is laced with elderberry and dried oak leaf flavors and framed by smooth tannins. Just a little bottle age has given this an almost timeless elegance, proving a wine doesn't need power to shine, just depth. Drink now–2025.",NA,93,25,Carnuntum,NA,NA,Anne Krebiehl MW,@AnneInVino,Muhr-Van der Niepoort 2011 Blaufränkisch (Carnuntum),Blaufränkisch,Muhr-Van der Niepoort
104136,Argentina,"Crisp up front, but not overly aromatic or fruity. Feels kind of thick and chewy, with gummy, sweet berry flavors that suggest cherry and plum. Feels a little cloying and cooked on the finish, especially for a young 2011.",Rosé of Malbec,84,13,Mendoza Province,Mendoza,NA,Michael Schachner,@wineschach,Maipe 2011 Rosé of Malbec Rosé (Mendoza),Rosé,Maipe
104204,US,"Winemaker Kit Singh has tweaked this Right Bank-style blend, but it remains solidly anchored in 49% Merlot and 29% Cabernet Franc, with a small amount of Cabernet Sauvignon and Petit Verdot. Tart, young raspberry and pomegranate fruit flavors are set against vividly crisp mineral notes. Tannins are supple and proportionate and the flavors beautifully defined. On the finish, a delightful detail of carpaccio appears.",Cuvée Arlette,94,50,Washington,Columbia Valley (WA),Columbia Valley,Paul Gregutt,@paulgwine ,Lauren Ashton Cellars 2011 Cuvée Arlette Red (Columbia Valley (WA)),Bordeaux-style Red Blend,Lauren Ashton Cellars
104568,Italy,"Aromas include dark berry, blue flower, leather and a balsamic note. The palate delivers juicy black cherry, coffee, toast and mocha alongside chewy tannins.",Fondo Filara,90,15,Sicily & Sardinia,Cerasuolo di Vittoria Classico,NA,Kerin O’Keefe,@kerinokeefe,Nicosia 2011 Fondo Filara  (Cerasuolo di Vittoria Classico),Red Blend,Nicosia
104570,US,"This holds 60% Cabernet Sauvignon, 39% Zinfandel and 1% Petit Verdot. It satisfies in dusty dried cranberry and chocolate components, offering all-around balance with a shot of brawn, the latter most likely from the Cab's birthplace on Howell Mountain.",C Blend,90,52,California,Napa Valley,Napa,Virginie Boone,@vboone,Paraduxx 2011 C Blend Red (Napa Valley),Red Blend,Paraduxx
104621,US,"Lifted by 8% Carménère and Viognier, it's straight down the fairway with notes of blueberry, orange peel, pepper and brambly fruit. Lighter in style, it tapers toward the finish.",NA,86,15,Washington,Columbia Valley (WA),Columbia Valley,Sean P. Sullivan,@wawinereport,Waterbrook 2011 Syrah (Columbia Valley (WA)),Syrah,Waterbrook
104725,South Africa,"A refreshing and approachable wine, with forward notes of green plum, plantain, Granny Smith apple and lime on the nose and palate. There's a slight roundness to the midpalate, but a vibrant twang lifts the finish.",Chenin No. 5,86,11,Robertson,NA,NA,Lauren Buzzeo,@laurbuzz,Van Loveren 2011 Chenin No. 5 Chenin Blanc (Robertson),Chenin Blanc,Van Loveren
104836,US,"The cool 2011 vintage hit the Columbia Gorge especially hard, but winemaker Chris Dowsett has crafted an expressive, wonderfully fragrant old-vine Gewürztraminer. This is tart and saline, with notes of lemon, lime and grapefruit rind and flesh that combine to form a delicate, lingering, snappy and bracing style.",Celilo Vineyard,90,22,Washington,Columbia Gorge (WA),Washington Other,Paul Gregutt,@paulgwine ,Dowsett Family 2011 Celilo Vineyard Gewürztraminer (Columbia Gorge (WA)),Gewürztraminer,Dowsett Family
104908,Argentina,"Oily and almondy on the nose, but also layered and stacked. Feels lively, jumpy and pumped full of acidity, then tastes of classic lychee and green melon. Full and driving, with citrusy zest to the tail end.",Reserve,87,17,Other,Salta,NA,Michael Schachner,@wineschach,Nuna 2011 Reserve Torrontés (Salta),Torrontés,Nuna
104960,France,"From Château des Landes' old vines, this is a concentrated, solid wine. Dark tannins have dark chocolate and licorice flavors, with a structure that dominates the fruit and needs to soften. New wood aging was perhaps excessive, but give the wine time. Drink from 2017.",Cuvée Prestige,88,40,Bordeaux,Lussac Saint-Émilion,NA,Roger Voss,@vossroger,Château des Landes 2011 Cuvée Prestige  (Lussac Saint-Émilion),Bordeaux-style Red Blend,Château des Landes
104989,Italy,"An ideal Italian whites to pair with spaghetti alle vongole or fried fish. The bouquet is redolent of almond paste, stone fruit and citrus. There's a very well-defined streak of sassy spice on the crisp finish.",NA,88,20,Northeastern Italy,Alto Adige,NA,NA,NA,Andriano 2011 Pinot Grigio (Alto Adige),Pinot Grigio,Andriano
105257,Italy,"Made with Cabernet Sauvignon, Cabernet Franc, Merlot and Petit Verdot, this presents a subdued nose of dried blueberries, leather, espresso, oak and a whiff of exotic spices. On the palate, lithe tannins balance out blackberry, graphite and licorice flavors. Drink through 2016. Alliance Beverage, Terravino.",Villa Donoratico,88,28,Tuscany,Bolgheri,NA,Kerin O’Keefe,@kerinokeefe,Tenuta Argentiera 2011 Villa Donoratico  (Bolgheri),Red Blend,Tenuta Argentiera
105329,US,"This 100% varietal wine from this new winery offers up notes of vanilla, herb, cocoa, cherry and woodspice. An elegant, palate-coating mouthfeel comes along with structured, dry tannins and tart acidity. An attractive wine that can be enjoyed now or held through 2020.",Exordium,91,55,Washington,Wahluke Slope,Columbia Valley,Sean P. Sullivan,@wawinereport,Script 2011 Exordium Cabernet Sauvignon (Wahluke Slope),Cabernet Sauvignon,Script
105425,US,"All the parts are here to make a good Cabernet. Flavors of chocolate, blackberry jam, cassis and smoky oak are framed in rich tannins. But the wine needs a little time to knit together. Should be drinking well by spring 2014. It's a great value for the price, and easy to find with more than 15,000 cases produced.",Crazy Creek,90,20,California,Alexander Valley,Sonoma,NA,NA,Katherine Goldschmidt 2011 Crazy Creek Cabernet Sauvignon (Alexander Valley),Cabernet Sauvignon,Katherine Goldschmidt
105433,US,"Roughly two thirds Merlot and one third Cabernet Sauvignon, this is the finest O•S Red since their 2007 vintage. Dark fruits abound, soaked in flavors of espresso, cedar, licorice and clove. It's a splendid wine for the price, one to buy by the case.",NA,90,15,Washington,Columbia Valley (WA),Columbia Valley,Paul Gregutt,@paulgwine ,O•S Winery 2011 Red (Columbia Valley (WA)),Red Blend,O•S Winery
106138,US,"Pure Syrah from 14-year-old vines, this offers classic peppery aromatics, blue fruits, good concentration, and a hint of the Walla Walla funk that marks the better Syrahs of the region. It's lifted with excellent acidity and continues into a focused finish with highlights of coffee grounds.",Estate Seven Hills Vineyard,90,35,Washington,Walla Walla Valley (WA),Columbia Valley,Paul Gregutt,@paulgwine ,L'Ecole No. 41 2011 Estate Seven Hills Vineyard Syrah (Walla Walla Valley (WA)),Syrah,L'Ecole No. 41
106139,France,"Dense tannins dominate this firm and structured wine. Behind the dry surface lies fruitiness, bringing out red currant and berry flavors along  with acidity. The wine is potentially rich and deliciously perfumed. Drink from 2017.",Clos du Roy,90,36,Burgundy,Marsannay,NA,Roger Voss,@vossroger,Louis Jadot 2011 Clos du Roy  (Marsannay),Pinot Noir,Louis Jadot
106351,Italy,"Aromas of French oak, coconut, vanilla and spiced plum lead the nose on this powerfully structured wine. The oak sensations carry over to the warm palate along with cherry marinated in spirits, licorice and menthol. Bracing, close-grained tannins provide the framework and need time to unwind. Best after 2020.",Bricco Gattera,91,80,Piedmont,Barolo,NA,Kerin O’Keefe,@kerinokeefe,Cordero di Montezemolo 2011 Bricco Gattera  (Barolo),Nebbiolo,Cordero di Montezemolo
