id,country,description,designation,points,price,province,region_1,region_2,taster_name,taster_twitter_handle,title,variety,winery
31010,US,"Shows pure, pleasurable Chardonnay flavors of white peach, grape, nectarine, honey and vanilla, with no interference from oak. The acidity gives the wine a slight bite. The winemaker did a good job assembling the various lots into this three-appellation blend.",Un-Oaked,87,12,California,Sonoma County,Sonoma,NA,NA,River Road 2012 Un-Oaked Chardonnay (Sonoma County),Chardonnay,River Road
31037,US,"Rich and ripe, this intense wine is verging into tropical land with pineapple and mango, plus an overreaching expression of oak and vanilla. It offers medium- to full-bodied weight and a big finish.",NA,86,27,California,Russian River Valley,Sonoma,Virginie Boone,@vboone,Matrix 2012 Chardonnay (Russian River Valley),Chardonnay,Matrix
31039,US,"While the nose suggests hints of oxidation, the bright palate brims with fresh apple and pear flavors. It's plump and rich in mouthfeel, accented by streaks of caramel, toast and spice.",Reserve,86,20,New York,North Fork of Long Island,Long Island,Anna Lee C. Iijima,NA,Osprey's Dominion 2012 Reserve Chardonnay (North Fork of Long Island),Chardonnay,Osprey's Dominion
31186,France,"Rich, ripe and full-bodied, this is a Merlot/Cabernet Sauvignon/Malbec blend. Juicy acidity and berry fruits are integrated into the firm structure. A smoky, dry wood-laden background gives the wine good texture. Drink from 2016. Xavier Carreau, Alain Jourdan and Cyril Jourdan, the latest generation, run the family's five estates.",NA,90,45,Bordeaux,Blaye Côtes de Bordeaux,NA,Roger Voss,@vossroger,Château Barbé 2012  Blaye Côtes de Bordeaux,Bordeaux-style Red Blend,Château Barbé
31227,US,"Coming from one of the few vineyards between the coastal town of Cambria and Paso Robles, this brooding wine offers dark and dank aromas of black dirt, slate, charred meat and very black cherry. Once sipped, sagebrush and lavender herbals emerge, along with sour cherry. A promising effort for an area that may be its own appellation one day.",Gloria,90,40,California,San Luis Obispo County,Central Coast,Matt Kettmann,@mattkettmann,Cutruzzola 2012 Gloria Pinot Noir (San Luis Obispo County),Pinot Noir,Cutruzzola
31229,US,"The winery once made 30,000 cases of Chardonnay. With this release, it micro-sized that number down to 1,250, focusing on 30 vine rows to make a better wine. Mission accomplished—this medium-bodied wine offers a creamy texture, with concentrated fig and pear flavors around a mineral-laden finish.",DCV Estate Block 10,90,30,California,Russian River Valley,Sonoma,Virginie Boone,@vboone,Dry Creek Vineyard 2012 DCV Estate Block 10 Chardonnay (Russian River Valley),Chardonnay,Dry Creek Vineyard
31517,Austria,"Tight and spicy, it carries an underlying ripeness of apples and pears. A subtle Riesling, it shows breezy freshness and an acidity-spiked texture that makes it invigorating. The slighest suggestion of pineapple lingers on the finish.",Kapuzinerberg,89,NA,Niederösterreich,NA,NA,Anne Krebiehl MW,@AnneInVino,Fritsch 2012 Kapuzinerberg Riesling (Niederösterreich),Riesling,Fritsch
31569,US,"While the nose takes some time to open, crisp lemon, green apple and pear on the palate are vital and fresh here. It's a zingy, brut-style sparkling wine made entirely from Chardonnay with bold, mouthfilling foam. Delicate caramel and sugar cookie tones embellish a long finish.",Blanc de Blancs,90,44,New York,North Fork of Long Island,Long Island,Anna Lee C. Iijima,NA,Sparkling Pointe 2012 Blanc de Blancs Chardonnay (North Fork of Long Island),Chardonnay,Sparkling Pointe
31588,Italy,"The nose is rather closed but eventually reveals red berry, rose, cake spice and a whiff of leather. It's young but balanced, with bracing tannins and bright acidity that support the tart sour cherry, white pepper and sage flavors. It closes on a mocha note. Drink 2018–2027.",Rabajà,90,50,Piedmont,Barbaresco,NA,Kerin O’Keefe,@kerinokeefe,Castello di Verduno 2012 Rabajà  (Barbaresco),Nebbiolo,Castello di Verduno
31634,US,"From the Bokisch family's splendid Lodi vineyard comes this Sonoma-made Albariño, lemony with a touch of peach that's austere in texture and body, but rich in acidity, spicy herb and pepper.",Terra Alta Vineyard,89,28,California,Lodi,Central Valley,Virginie Boone,@vboone,En Garde 2012 Terra Alta Vineyard Albariño (Lodi),Albariño,En Garde
31683,France,"Light and neutral, it has some fresh fruit but there is an artificial candy juice feel to the acidity.",NA,82,NA,Alsace,Alsace,NA,Roger Voss,@vossroger,Domaine Specht 2012 Pinot Blanc (Alsace),Pinot Blanc,Domaine Specht
31748,US,"This is a very fine expression of Viognier, showing an intensity of flavors, but maintaining balance, elegance, and a dry profile. Waves of honeysuckle, oranges, limes, pears and oak are offset by minerality and acidity. Richly extracted, it will pair well with scallop, lobster and crab entrées.",NA,91,32,California,Russian River Valley,Sonoma,NA,NA,Kobler 2012 Viognier (Russian River Valley),Viognier,Kobler
31761,US,"Hunnicutt is known as a Cabernet specialist, but they know Chardonnay too, as evidenced by a string of successes since 2008. The 2012 is a rich, rewarding wine. It's extraordinarily ripe in peach, green apple and tropical fruit flavors. The grapes were sourced from cool Coombsville and warm Rutherford, giving the wine exceptional balance.",NA,91,45,California,Napa Valley,Napa,NA,NA,Hunnicutt 2012 Chardonnay (Napa Valley),Chardonnay,Hunnicutt
32053,Chile,"This SB is more plump and tropical than you might expect for Leyda, but it's still honest, grassy and quite good as a whole. Basic coastal aromas of grass and citrus give way to a round palate with honeyed citrus flavors and length. A focused, comfortable finish is perfectly good; drink right away.",Tributo Single Vineyard Block #Algarrobo,88,16,Leyda Valley,NA,NA,Michael Schachner,@wineschach,Caliterra 2012 Tributo Single Vineyard Block #Algarrobo Sauvignon Blanc (Leyda Valley),Sauvignon Blanc,Caliterra
32270,US,"Weighty and creamy in rich tones of just-picked pineapple and Key lime, this is round and expansive on the palate, with undertones of earth and herb. Complex layers of apple and almond interplay, before a finish of honey and spice lingers.",Susanna's Vineyard,93,55,California,Russian River Valley,Sonoma,Virginie Boone,@vboone,Lynmar 2012 Susanna's Vineyard Chardonnay (Russian River Valley),Chardonnay,Lynmar
32427,Italy,"The nose is initially closed but eventually reveals aromas of ripe berry, scorched earth and game. The palate is more expressive, showing fleshy black cherry, crushed raspberry and white pepper alongside tightly packed tannins that need to unwind. Drink 2018–2030.",Montersino,89,NA,Piedmont,Barbaresco,NA,Kerin O’Keefe,@kerinokeefe,Albino Rocca 2012 Montersino  (Barbaresco),Nebbiolo,Albino Rocca
32440,Italy,"Aromas of red berry, grilled herb and espresso come together on the nose. The taut palate offers dried black cherry, raspberry, tobacco and mocha alongside dusty, astringent tannins. A licorice note closes the finish.",NA,89,30,Piedmont,Barbaresco,NA,Kerin O’Keefe,@kerinokeefe,Piazzo Armando 2012  Barbaresco,Nebbiolo,Piazzo Armando
32614,US,"Soft, spicy and jammy, this is rich in clove and big-hearted blackberry fruit. Easy to like and pleasantly affordable, it'll pour well for parties and other occasions where a bold, crowd-pleasing red wine is in order.",Old Vine,87,12,California,Lodi,Central Valley,Virginie Boone,@vboone,Gnarly Head 2012 Old Vine Zinfandel (Lodi),Zinfandel,Gnarly Head
32726,US,"This is solidly anchored in its ripe cherry fruit, a rich mouthful that represents the best of the winery's 2012 lineup of reserve bottlings. Highlights of citrus fruits elevate the acids, and there is a pleasing hint of toast across the full midpalate.",Carlton Hill Vineyard Reserve,90,40,Oregon,Willamette Valley,NA,Paul Gregutt,@paulgwine ,Walnut City WineWorks 2012 Carlton Hill Vineyard Reserve Pinot Noir,Pinot Noir,Walnut City WineWorks
32733,US,"A 100% varietal wine from a prime Beckstoffer vineyard in the heart of the appellation, this aged in 100% new French oak. A robust, full-throttled wine, it's smoky in tar and baked fruit that could use some time in cellar to further develop the layers of cedar and blackberry.",Beckstoffer Vineyard  Georges III,90,75,California,Rutherford,Napa,Virginie Boone,@vboone,12C Wines 2012 Beckstoffer Vineyard  Georges III Cabernet Sauvignon (Rutherford),Cabernet Sauvignon,12C Wines
32740,Spain,"Deep, pure blackberry, cassis and minerally aromas are fresh, clean and authentic for Priorat. This is bold, chunky and ripe, with an acidic streak that maintains clarity. Plum and blackberry flavors are a bit woody and herbal, while pepper, mint, menthol and berry flavors drive a flush, satisfying finish. Drink through 2018.",Ceps Nous,90,22,Catalonia,Priorat,NA,Michael Schachner,@wineschach,Celler Pasanau 2012 Ceps Nous Red (Priorat),Red Blend,Celler Pasanau
32774,Argentina,"Tropical fruit and vanilla-cookie aromas come with a note of nectarine. This feels juicy, racy and citric, with flavors of tangerine and nectarine. Despite having tangy acidity, the wine turns heavy on the finish.",Serie A,84,15,Mendoza Province,Uco Valley,NA,Michael Schachner,@wineschach,Zuccardi 2012 Serie A Chardonnay (Uco Valley),Chardonnay,Zuccardi
32897,US,"Aromas of baked sour cherry tart precede pleasing wafts of violet and lavender. From a vineyard planted largely to a field selection of the Swan clone, it offers an expected earthiness and spiciness that intrigues around a core of balanced tension between fruit, acid and oak.",Stiling Vineyard,91,55,California,Russian River Valley,Sonoma,Virginie Boone,@vboone,Gary Farrell 2012 Stiling Vineyard Pinot Noir (Russian River Valley),Pinot Noir,Gary Farrell
32993,US,"This wine is ripe and lush in style, but hints of tart lemons and limes add brightness and an acidic edge. The finish is a tad candied.",Rivers Ranch,85,25,California,Napa Valley,Napa,NA,NA,Apsara 2012 Rivers Ranch Sauvignon Blanc (Napa Valley),Sauvignon Blanc,Apsara
33210,US,"Ripe black raspberry and cherry mark this lovely Pinot that is rich and concentrated. The oak is prominent, with a touch of meaty gaminess on the full palate. Balanced, the wine's acidity remains remarkably bright.",Doña Margarita Vineyard Mas Cavalls Unfiltered Estate Grown & Bottled,90,44,California,Sonoma Coast,Sonoma,Virginie Boone,@vboone,Marimar Estate 2012 Doña Margarita Vineyard Mas Cavalls Unfiltered Estate Grown & Bottled Pinot Noir (Sonoma Coast),Pinot Noir,Marimar Estate
33216,Italy,"Made with the Vermentino grape, Vento is a bit inexpressive but eventually reveals subdued floral and exotic fruit aromas. The palate offers banana, pineapple and peach flavors accompanied by bright acidity.",Vento,86,NA,Tuscany,Toscana,NA,Kerin O’Keefe,@kerinokeefe,Terre di Talamo 2012 Vento Vermentino (Toscana),Vermentino,Terre di Talamo
33248,US,"Smoky, spicy and midweight, this earthy, brooding Pinot maintains layers of minerality amid fresh red berry fruit. The texture opens up into silky waves in the glass, finishing with the right balance of cherry and spice.",NA,92,40,California,Sonoma Coast,Sonoma,Virginie Boone,@vboone,Evening Land 2012 Pinot Noir (Sonoma Coast),Pinot Noir,Evening Land
33264,France,"The wine is fresh, its baked apple and green plum fruit cut with intense citrus. The vineyard, with its pure chalk soil, shows strongly in the minerality and steely texture of the wine, promising aging. Drink this complex wine from 2016.",Mont de Milieu Premier Cru,92,40,Burgundy,Chablis,NA,Roger Voss,@vossroger,Simonnet-Febvre 2012 Mont de Milieu Premier Cru  (Chablis),Chardonnay,Simonnet-Febvre
33356,US,"Ripe and forward, this brings brambly berry fruit and plenty of Dr Pepper soda flavors front and center. It's a smooth ride to a quick finish. Both scents and flavors show a hint of pine needle.",Lia's Vineyard,88,27,Oregon,Chehalem Mountains,Willamette Valley,Paul Gregutt,@paulgwine ,Longplay 2012 Lia's Vineyard Pinot Noir (Chehalem Mountains),Pinot Noir,Longplay
33411,US,"This wine is a blend of 40% each Mourvèdre and Syrah along with 15% Petite Sirah and 5% Viognier. Aromas of orange zest, flowers, raw meat and peppery spices lead to a soft palate, full of citrus flavors that seem a bit out of balance but that still provide intrigue.",Harvest Moon,88,20,Idaho,NA,NA,Sean P. Sullivan,@wawinereport,Williamson Vineyard 2012 Harvest Moon Red,Red Blend,Williamson Vineyard
33527,US,"Wild strawberry and a soft layering of fresh earth form the core of this blend, based mostly on Cabernet Sauvignon, with a healthy dose of Merlot and then smaller supporting handfuls of Cabernet Franc, Malbec and Petit Verdot. Blackberries come to fore as the wine develops, along with a swathe of bittersweet chocolate.",Symmetry,86,55,California,Alexander Valley,Sonoma,Virginie Boone,@vboone,Rodney Strong 2012 Symmetry Meritage (Alexander Valley),Meritage,Rodney Strong
33736,Italy,This lovely rosato (made with the Montepulciano grape) would pair with spicy Indian dishes or Thai curry. The wine opens with a bright pink color and segues to ripe fruit and wild berry aromas.,NA,86,11,Central Italy,Montepulciano d'Abruzzo,NA,NA,NA,Talamonti 2012  Montepulciano d'Abruzzo,Montepulciano,Talamonti
33810,Spain,A ripe fruity set of berry and cassis aromas shows a slight hint of raisin. This is a stacked saturated wine with raw tannins and plenty of power. Blackberry and earthy notes finish stout and compact: this doesn't vary or waver on the back end. Best from 2019–2026.,Imperial Reserva,93,44,Northern Spain,Rioja,NA,Michael Schachner,@wineschach,CVNE 2012 Imperial Reserva  (Rioja),Tempranillo Blend,CVNE
33863,US,"The faintest waft of marshmallow lends a pleasantly confectionery note to stone-fruit and blossom aromas on this dry, medium-bodied Riesling. The palate is elegant with brisk herbal tones and zesty lime acidity.",Dry,87,18,New York,Finger Lakes,Finger Lakes,Anna Lee C. Iijima,NA,Silver Thread 2012 Dry Riesling (Finger Lakes),Riesling,Silver Thread
34034,France,"Strong wood aromas are more than compensated for by the ripe fruits and generous character of the wine. It is a solid effort, full of both fruit and rich texture. Drink from 2016.",Merlot de Sainte-Barbe,87,10,Bordeaux,Bordeaux,NA,Roger Voss,@vossroger,Château Sainte-Barbe 2012 Merlot de Sainte-Barbe  (Bordeaux),Bordeaux-style Red Blend,Château Sainte-Barbe
34056,US,"All varietal coming from Dwelley and Minnick Hills vineyards, this wine leads with aromas of black licorice, dates and green herbs. There's plenty of richness to the flavors, which are backed by a squeeze of grainy tannins.",Winemaker's Select,88,42,Washington,Walla Walla Valley (WA),Columbia Valley,Sean P. Sullivan,@wawinereport,Adamant Cellars 2012 Winemaker's Select Merlot (Walla Walla Valley (WA)),Merlot,Adamant Cellars
34247,Portugal,"This is a tight, mineral-driven wine that's very textured. Its fruitiness comes from quince and pear skins with a definite structure. It is young, most likely requiring aging over at least 18 months.",Quinta da Garrida Reserva Branco,88,14,Dão,NA,NA,Roger Voss,@vossroger,Caves Aliança 2012 Quinta da Garrida Reserva Branco White (Dão),Portuguese White,Caves Aliança
34273,Italy,"At once powerful and graceful, this delivers alluring aromas and flavors of ripe black cherry, raspberry compote, grilled herb, licorice and an intriguing tarry note. Fresh acidity and firm, velvety tannins provide balance and structure, while a hint of pipe tobacco closes the lingering finish. Drink 2020–2032.",NA,94,80,Tuscany,Brunello di Montalcino,NA,Kerin O’Keefe,@kerinokeefe,Lisini 2012  Brunello di Montalcino,Sangiovese,Lisini
34285,US,"An uber aromatic wine with notes of flowers, orange peel, jasmine and canned peaches. At 27.2 g/L residual sugar, it drinks medium sweet but overall, the acid keeps it in check.",Estate Grown Willow Crest Estate Vineyard,86,15,Washington,Yakima Valley,Columbia Valley,Sean P. Sullivan,@wawinereport,Willow Crest 2012 Estate Grown Willow Crest Estate Vineyard Riesling (Yakima Valley),Riesling,Willow Crest
34640,US,"This project led by founder Jocko Douglas makes small batches of compelling wine. This Pinot Noir offers aromas of blackberry-laced tea, mocha and spearmint. The palate shows juicy, plump raspberries and blackberries bolstered by clove, allspice and espresso elements.",NA,91,48,California,Santa Lucia Highlands,Central Coast,Matt Kettmann,@mattkettmann,Douglas Vineyards 2012 Pinot Noir (Santa Lucia Highlands),Pinot Noir,Douglas Vineyards
34772,US,"A healthy dose of Petite Sirah toughens this Zin, sourced from a benchland vineyard in the heart of the Dry Creek Valley. The wine opens with aromas of cinnamon bark and cranberry, a tugging mushroomy element standing by. Subtle notes of black pepper come into play on the finish.",NA,86,36,California,Dry Creek Valley,Sonoma,Virginie Boone,@vboone,Sebastiani 2012 Zinfandel (Dry Creek Valley),Zinfandel,Sebastiani
34784,Italy,"Delicate aromas of white spring flower and citrus fruit waft from the glass. The easy palate offers white peach, nectarine zest and a hint of almond alongside zesty acidity.",BDP Y,86,12,Sicily & Sardinia,Sicilia,NA,Kerin O’Keefe,@kerinokeefe,Baglio di Pianetto 2012 BDP Y Insolia (Sicilia),Insolia,Baglio di Pianetto
35102,Italy,"Aromas of beeswax, lychee and fragrant white flowers take center stage in this wine. The juicy palate offers ripe Bartlett pear and lemon drop alongside fresh acidity.",Rohracker,87,17,Northeastern Italy,Alto Adige,NA,Kerin O’Keefe,@kerinokeefe,Peter Zemmer 2012 Rohracker Riesling (Alto Adige),Riesling,Peter Zemmer
35178,US,"New oak figures prominently on the palate of this generous and ripe wine, an impression that's nicely offset by ample structure and juicy acidity. It's balanced and approachable, so enjoy now.",NA,90,35,California,Sonoma Coast,Sonoma,Virginie Boone,@vboone,Martin Ray 2012 Pinot Noir (Sonoma Coast),Pinot Noir,Martin Ray
35180,Italy,"Aromas of underbrush, leather, black-skinned fruit and tobacco lead the nose. The firm, structured palate offers mature blackberry, black cherry, coffee bean and licorice alongside a tannic backbone. It closes on a mineral note.",Essentia Loci,90,36,Southern Italy,Primitivo di Manduria,NA,Kerin O’Keefe,@kerinokeefe,Ognissole 2012 Essentia Loci  (Primitivo di Manduria),Primitivo,Ognissole
35186,US,"Richness and ripeness combine with a multilayered and tannic texture that frames the flavors, massages the palate and carries the expressive fruit character through a lingering finish. Ripe blackberries and raspberries accompany a subtle vein of spice and mineral flavors that add complexity.",Reposado,90,24,California,Amador County,Sierra Foothills,Jim Gordon,@gordone_cellars,Borjón 2012 Reposado Barbera (Amador County),Barbera,Borjón
35187,France,"Lightly wood-aged, this is a smooth and ripe wine. A touch of toast rounds out the fresh fruit flavor of juicy Golden Delicious apple. The wine is dry, crisp and fruity at the end, with bright acidity.",Les Illustres Sur Lie,90,19,Loire Valley,Muscadet Sèvre et Maine,NA,Roger Voss,@vossroger,Chateau de l'Oiselinière 2012 Les Illustres Sur Lie  (Muscadet Sèvre et Maine),Melon,Chateau de l'Oiselinière
35293,US,"Front-loaded with black cherry and blackberry jam flavors, this Merlot has thick tannins and good acidity. It's a simple wine, but easy to drink with everyday fare, like burgers and tacos.",NA,84,23,California,California,California Other,NA,NA,Bota Box 2012 Merlot (California),Merlot,Bota Box
35296,US,"New French oak dominates this Chardonnay, giving buttered toast, vanilla bean and butterscotch flavors the starring role. It's not very interesting, despite some good apricot, tangerine and tropical fruit.",NA,84,22,California,Chalk Hill,Sonoma,NA,NA,Rodney Strong 2012 Chardonnay (Chalk Hill),Chardonnay,Rodney Strong
35354,US,"Neil Collins goes for the classic five Rhône grapes in this bottling, blending 48% Mourvèdre, 21% Syrah, 11% Grenache, 11% Cinsault and 9% Counoise to elicit aromas of dried fennel, fresh lavender, white pepper and boysenberry jam. Tight but juicy blueberry and elderberry fruit show on the palate, bound together by upright tannins and lifted with asphalt, black peppercorns and potpourri spice.",Points West,92,35,California,Paso Robles,Central Coast,Matt Kettmann,@mattkettmann,Lone Madrone 2012 Points West Red (Paso Robles),Rhône-style Red Blend,Lone Madrone
35537,France,"This is a bold and ripe wine from the gravel soil of Lalande de Pomerol. It is now reaching maturity. It has rich blackberry fruits, layered with acidity. The tannic core is still firm giving the wine the chance to age further. Drink until 2022.",Château la Croix,87,30,Bordeaux,Lalande de Pomerol,NA,Roger Voss,@vossroger,Château Roc de Boissac 2012 Château la Croix  (Lalande de Pomerol),Merlot,Château Roc de Boissac
35667,Austria,"Still-subdued fruit signals that this needs time. The palate is tight and elegant, but riches of tart cherry fruit rest just beneath the surface and wait to emerge fully. There is acidic verve and velvety structure; nothing is overdone and it's very balanced. This fresh little number needs time to blossom.",NA,92,39,Leithaberg,NA,NA,Anne Krebiehl MW,@AnneInVino,Hillinger 2012 Blaufränkisch (Leithaberg),Blaufränkisch,Hillinger
35790,France,"With smoky tannins and tangy acidity, this wine is solid, dense and full of toasty wood. Over this structure, black currant notes are fragrant and attractive. Drink from 2018.",NA,90,NA,Bordeaux,Pessac-Léognan,NA,Roger Voss,@vossroger,Château le Thil 2012  Pessac-Léognan,Bordeaux-style Red Blend,Château le Thil
35796,Italy,"Aromas of cedar, grilled pepper, cut grass and mature dark-skinned fruit lead this blend of Cabernet Sauvignon, Merlot, Petit Verdot and Cabernet Franc. The concentrated palate doles out juicy blackberry, steeped plum, espresso and tobacco alongside assertive but fine-grained tannins. It ends on a licorice note.",NA,90,33,Tuscany,Bolgheri,NA,Kerin O’Keefe,@kerinokeefe,Donna Olimpia 1898 2012  Bolgheri,Red Blend,Donna Olimpia 1898
36139,US,"Fresh and fruity, this elegant Cab is supported by smaller percentages of Malbec and Petit Verdot. Firm tannins and a low imprint of oak allow the cinnamon-dusted black cherry and cassis to speak, girded by a fine structure and peppery finish.",NA,92,40,California,Napa Valley,Napa,Virginie Boone,@vboone,Flora Springs 2012 Cabernet Sauvignon (Napa Valley),Cabernet Sauvignon,Flora Springs
36149,US,"This producer is honing in on the unconventional, sourcing Pinot Noir grapes from unlikely Napa Valley spots like Spring Mountain and Atlas Peak. The resulting wines are surprising and unpredictable in their complexity of savory blithe spirit, light and clear with edgy red cherry and tea, plenty structured, with lurking tannin. The floral aspect on the nose is compelling, as is the cardamon finish.",NA,92,44,California,Napa Valley,Napa,Virginie Boone,@vboone,Brick & Mortar 2012 Pinot Noir (Napa Valley),Pinot Noir,Brick & Mortar
36195,US,"Even at this price, this Cab is hard to like. It's soft and somewhat vegetal, with bizarre sweet oak and cherry jam flavors.",NA,80,10,California,California,California Other,NA,NA,Coyote Creek 2012 Cabernet Sauvignon (California),Cabernet Sauvignon,Coyote Creek
36425,US,"There's a warm leathery character to the squeezed black cherry, black plum and violet notes on the nose of this wine from a vineyard on Paso's westside. Flavors are rustic and tart with barely ripe berries, showing balanced zing that lasts a long time as well as a grippy texture.",Hastings Ranch Vineyard,88,38,California,Paso Robles,Central Coast,Matt Kettmann,@mattkettmann,Anglim 2012 Hastings Ranch Vineyard Mourvèdre (Paso Robles),Mourvèdre,Anglim
36451,US,"This is a good, solid wine labeled to commemorate the 80th anniversary of the Parducci estate. It has robust flavors, full body and a rich layer of tannins to add texture. The flavors are like ripe plums and pomegranate juice. It also has good balance and develops an elegant mouth-feel.",Isabella,88,55,California,Mendocino,NA,Jim Gordon,@gordone_cellars,Parducci 2012 Isabella Cabernet Sauvignon (Mendocino),Cabernet Sauvignon,Parducci
36542,US,"A perfumed wine with notes of candied orange, peach and lavender. The palate is sweet and easy drinking. Chill down and enjoy.",Sweet,85,10,Washington,Washington,Washington Other,Sean P. Sullivan,@wawinereport,Paradise Peak 2012 Sweet Riesling (Washington),Riesling,Paradise Peak
36618,US,"This appellation is best known for its power but this wine shows it can just as easily demonstrate subtlety and nuance. Coffee, milk chocolate and cherry flavors lead to a textured palate that shows a lot of polish and detail. It's impossible to take a sip without wanting to take another.",NA,91,40,Washington,Red Mountain,Columbia Valley,Sean P. Sullivan,@wawinereport,Januik 2012 Cabernet Sauvignon (Red Mountain),Cabernet Sauvignon,Januik
36647,Spain,"Aromas of tree bark, braised turnip and smoky black plum are rooty. This feels gritty and borderline astringent due to massive drying tannins. Savory earthy tarry blackberry flavors end with a hard tannic clamp. Drink this hefty brute from 2018 through 2035.",Ángel,92,55,Northern Spain,Ribera del Duero,NA,Michael Schachner,@wineschach,Arrocal 2012 Ángel  (Ribera del Duero),Tinto Fino,Arrocal
