id,country,description,designation,points,price,province,region_1,region_2,taster_name,taster_twitter_handle,title,variety,winery
239,US,"A little rough and rugged, with jangly tannins and blackberry fruit so ripe it veers into raisins. Very dry, it's probably at its best now.",NA,85,36,California,Mendocino,NA,NA,NA,Dogwood 2005 Cabernet Sauvignon (Mendocino),Cabernet Sauvignon,Dogwood
989,Spain,"Mauro will always show you a lot, but frankly this 2005 seems soft and chunky. It has rich, baked, black-fruit aromas and then a mildly syrupy palate with huge blackberry and cassis flavors. The finish is wide and rich, but where are the tannins and structure that this wine is known for? Drink now for best results; it may not improve in the cellar. A Europvin, Christopher Cannan selection, imported by multiple importers, including Michael Skurnik Wines.",NA,88,53,Northern Spain,Vino de la Tierra de Castilla y León,NA,Michael Schachner,@wineschach,Mauro 2005 Red (Vino de la Tierra de Castilla y León),Tempranillo Blend,Mauro
1165,US,"From Gallo, a two-county blend with some real elegance and style. The Cab is dry, soft and full-bodied, with lingering blackberry, currant, licorice and spice flavors. Drink now.",NA,86,23,California,Napa-Sonoma,Napa-Sonoma,NA,NA,Ghost Pines 2005 Cabernet Sauvignon (Napa-Sonoma),Cabernet Sauvignon,Ghost Pines
1249,US,"Cabernet Sauvignon-dominated, the blend also includes about one third Merlot and a splash of Syrah. Tight and somewhat reductive when first opened, it slowly unwraps into a substantial effort, dense with berry, cherry and cassis concentrate. Some not-quite-integrated green tannins remain, and the buttery finish also wants more bottle age. But a good effort overall.",HVH Red Blend,88,20,Washington,Columbia Valley (WA),Columbia Valley,Paul Gregutt,@paulgwine ,Horan Estates 2005 HVH Red Blend Red (Columbia Valley (WA)),Red Blend,Horan Estates
1477,Chile,"A solid wine with a good mix of herbal, cola and red-fruit aromas. It deals spanking red fruit flavors and a sprinkle of vanilla and chocolate on the racy finish. For a short, fresh and clean wine, Aresti's Cab makes the grade.",Reserve,86,14,Rio Claro,NA,NA,Michael Schachner,@wineschach,Aresti 2005 Reserve Cabernet Sauvignon (Rio Claro),Cabernet Sauvignon,Aresti
1909,Australia,"A real crowd-pleaser, the 2005 Shingleback may not have quite the complexity of the 2004, but it's still a fun, approachable wine. Cola and coffee notes accent plum and blackberry flavors, while the broad texture coats the mouth with soft tannins. Drink now–2012.",NA,88,22,South Australia,McLaren Vale,NA,Joe Czerwinski,@JoeCz,Shingleback 2005 Cabernet Sauvignon (McLaren Vale),Cabernet Sauvignon,Shingleback
2068,US,"Much improved, with different vineyard sources than in 2004, this strong, varietal Cabernet mixes cassis, black cherry, light herb and hints of moist earth. Aging for 18 months in new French oak brings in coffee and chocolate, balanced and subtly displayed. Nice details of leaf and leather run richly into the tannins.",NA,90,36,Washington,Walla Walla Valley (WA),Columbia Valley,Paul Gregutt,@paulgwine ,Whitman Cellars 2005 Cabernet Sauvignon (Walla Walla Valley (WA)),Cabernet Sauvignon,Whitman Cellars
2928,US,"Dry, with thick tannins housing blackberry, herb and olive flavors. Drink now.",Heart Arrow Ranch,84,24,California,Mendocino,NA,NA,NA,Mendocino Farms 2005 Heart Arrow Ranch Cabernet Sauvignon (Mendocino),Cabernet Sauvignon,Mendocino Farms
2957,US,"Nice and drily balanced, this is pretty tannic, with blackberry, cherry, leather, carob, coffee and peppery spice flavors that finish with an intriguing touch of tangerine rind. Drink now.",Riverside Crossing,86,13,California,Sonoma County,Sonoma,NA,NA,Parkers Estate 2005 Riverside Crossing Syrah (Sonoma County),Syrah,Parkers Estate
2958,Australia,"This is a perfectly fine example of Clare Valley Cabernet, one that emphasizes refinement and elegance over sheer power and intensity. Cassis, tobacco and a hint of vanilla account for the bulk of the aromatic and flavor interest, and it turns mouthwatering on the finish. Should hold well through 2015.",NA,86,37,South Australia,Clare Valley,NA,Joe Czerwinski,@JoeCz,Pearson Vineyards 2005 Cabernet Sauvignon (Clare Valley),Cabernet Sauvignon,Pearson Vineyards
3110,Chile,"A lot of olive and herbs upfront, with cumin and other exotic, arguably unusual aromas. The palate is soft and a little low on structure, but the flavors are big and sweet, almost overripe and syrupy. There's cola, blackberry, coffee and mulchy herbal flavors from start to finish. A big wine that needs to be drunk now; it's not going to get better.",Microterroir de los Lingues,88,49,Colchagua Valley,NA,NA,Michael Schachner,@wineschach,Casa Silva 2005 Microterroir de los Lingues Carmenère (Colchagua Valley),Carmenère,Casa Silva
3149,Argentina,"An intense, forward style of Malbec. The nose oozes a mixture of mint, black-fruit extract and shoe polish, while the saturated palate is racy and just rich enough; the flavors of blackberry and plum are lively with coffee and mocha accents on the finish. A bit acidic and racy, but that won't hurt it if served with food.",Golden Reserve,89,20,Mendoza Province,Mendoza,NA,Michael Schachner,@wineschach,Trivento 2005 Golden Reserve Malbec (Mendoza),Malbec,Trivento
3980,US,"Light and fruity with pineapple, melon and apple. This fruit forward, food-friendly wine has natural acids and a delicate balance. For the money it is a fine choice to accompany seafood, poultry and pasta salads.",Quail Series,85,9,Washington,Columbia Valley (WA),Columbia Valley,Paul Gregutt,@paulgwine ,Covey Run 2005 Quail Series Chardonnay (Columbia Valley (WA)),Chardonnay,Covey Run
4831,US,"Very soft, with low acidity and a texture as creamy as pudding, this Petite Sirah is made for early drinking. It's frankly delicious, with blackberry, currant, cherry, raspberry, chocolate and pepper-spice flavors that flood the mouth with opulence.",NA,85,24,California,Sierra Foothills,Sierra Foothills,NA,NA,Ursa 2005 Petite Sirah (Sierra Foothills),Petite Sirah,Ursa
5606,US,"Beatifully pétillant with small, persistent beads, this hints of tangerine and lemons skins against a backdrop of fresh mushrooms and madacamia nuts. The foam is quite mouthfilling, but lemony acidity leads to a lingering finish.",Blanc de Blancs,88,42,New York,North Fork of Long Island,Long Island,Anna Lee C. Iijima,NA,Sparkling Pointe 2005 Blanc de Blancs Sparkling (North Fork of Long Island),Sparkling Blend,Sparkling Pointe
6949,US,"Fragrant, smoky, oaky and seductive, this toasty wine is immediately appealing, and has been given the all-star treatment. The young vineyard offers promising fruit; its flavors light and clean, tasting of raspberries and pie cherries. Lots of oak gives it a very chocolaty finish.",Gunselman Bench Vineyard,89,37,Washington,Horse Heaven Hills,Columbia Valley,Paul Gregutt,@paulgwine ,Robert Karl 2005 Gunselman Bench Vineyard Cabernet Sauvignon (Horse Heaven Hills),Cabernet Sauvignon,Robert Karl
7326,Spain,"Green, lemony and murky on the nose, this young wine shows that a good vintage in a renowned region doesn't always amount to a good wine. This is a funky, earthy specimen with burnt notes and a grassy aftertaste.",Vall Sanzo,81,13,Northern Spain,Ribera del Duero,NA,Michael Schachner,@wineschach,Valsanzo 2005 Vall Sanzo  (Ribera del Duero),Tempranillo,Valsanzo
7567,Romania,"An intriguing nose of tobacco, mint, cherry and spice leads this earthy red. Flavors of spice, tobacco, red berry and tea are supported by ageable tannins and good complexity.",Rosso di Valachia,85,12,Dealu Mare,NA,NA,Susan Kostrzewa,@suskostrzewa,Byzantium 2005 Rosso di Valachia Red (Dealu Mare),Red Blend,Byzantium
7944,France,"Very grassy, herbaceous aromas lead to a wine that is dominated by minerality and pink grapefruit. It is intense, ripe and concentrated, but there is an element of tension in its crisp aftertaste.",Mademoiselle de T,88,25,Loire Valley,Pouilly-Fumé,NA,Roger Voss,@vossroger,Château de Tracy 2005 Mademoiselle de T  (Pouilly-Fumé),Sauvignon Blanc,Château de Tracy
8192,US,"Stash this in the cellar for a while, because even though it's well over three years old, it's still a big, immature wine. Dry and tannic, it explodes with jammy blackberries, cherries, chocolate, cola, licorice, orange zest and pepper flavors, wrapped into sweet, smoky oak. The parts should begin to come together by the end of 2009.",Estate Bottled Reserve,91,58,California,Santa Ynez Valley,Central Coast,NA,NA,Sunstone 2005 Estate Bottled Reserve Syrah (Santa Ynez Valley),Syrah,Sunstone
8501,US,"After the scent of char blows off a bit, this first harvest Merlot opens sweetly to aromas of vanilla, cinnamon spice and plush, red plums. There's a hint of green stalks and leaves detectable on the palate amidst underripe black cherry and plum flavors, but bright acidity gives this wine a fresh character and the spiced plum finish is pleasant.",First Harvest,86,18,New York,North Fork of Long Island,Long Island,Anna Lee C. Iijima,NA,Comtesse Thérèse 2005 First Harvest Merlot (North Fork of Long Island),Merlot,Comtesse Thérèse
8513,US,"As sharp, fresh and fruity as a jar of raspberry, cherry and blackberry jam, melted into liquid and fortified with alcohol. Feels hot, too, despite an official alcohol reading of just 14%. The winery held this back for five years, an expensive investment in storage, but the wine just can't quite overcome its limitations.",Cupa Grandis Grand Barrel Reserve,86,60,California,Paso Robles,Central Coast,NA,NA,EOS 2005 Cupa Grandis Grand Barrel Reserve Petite Sirah (Paso Robles),Petite Sirah,EOS
8599,Italy,"There's a subtle candy-like element to this wine's pretty nose that recalls vanilla and cherries sprinkled with dried flowers and green herbs. The wine has a lean, compact feel in the mouth and refreshes the palate thanks to its blueberry flavors and crisp close.",Riserva,89,NA,Tuscany,Chianti Classico,NA,NA,NA,Tenuta di Lilliano 2005 Riserva  (Chianti Classico),Sangiovese,Tenuta di Lilliano
8722,Italy,"Ramitello is a beautiful wine (85% Prugnolo and 15% Aglianico for power and structure) with soft, lush aromas of chocolate, espresso, leather, clove and dense blackberry fruit. The wine is yielding and generous and has absolutely no sharp edges.",Ramitello,88,17,Southern Italy,Terra degli Osci,NA,NA,NA,Di Majo Norante 2005 Ramitello Red (Terra degli Osci),Red Blend,Di Majo Norante
9833,Italy,"The nice thing is how this wine delivers so much fruit, especially peach, apricot and mature pear. The mouthfeel is creamy and sophisticated but the overall emphasis is on the purity and intensity of the fruit fragrances. Grapes are harvested late, at the end of October, for extra flavor.",Vigna Solaria,89,NA,Central Italy,Falerio,NA,NA,NA,Velenosi 2005 Vigna Solaria White (Falerio),White Blend,Velenosi
9927,US,"This is perfumed with lovely violets and tight layers of mixed berries, currants and hints of truffle. It's young and muscular, with a pleasing chewy texture to the tannins. There is the sense that time will unfold the flavors and add nuances of herb and earth, capturing the varietal notes that can be   obliterated by over-ripe fruit and too much new oak.",NA,90,32,Washington,Columbia Valley (WA),Columbia Valley,Paul Gregutt,@paulgwine ,Tamarack Cellars 2005 Cabernet Sauvignon (Columbia Valley (WA)),Cabernet Sauvignon,Tamarack Cellars
10338,Italy,"Le Bruciate Riserva offers bright aromatic nuances of cola, root beer and a touch of shaved ginger backed by loads of black fruit and smooth spice. The wine shows great personality and persistency.",Le Bruciate Riserva,90,48,Tuscany,Brunello di Montalcino,NA,NA,NA,Canneta 2005 Le Bruciate Riserva  (Brunello di Montalcino),Sangiovese Grosso,Canneta
10508,France,"Creamy soft fruit, with the richness of 2005, hinting at some toast flavors. This wine is the second label from the Conti family, owners of Château Tour des Gendres, by far the best producer in Bergerac. It is a rounded, full wine, with fine, ripe white fruits, pears and nectarines, topped with light acidity.",Tour des Gendres Le Classique,87,12,Southwest France,Bergerac Sec,NA,Roger Voss,@vossroger,Château Tour des Gendres 2005 Tour des Gendres Le Classique White (Bergerac Sec),Bordeaux-style White Blend,Château Tour des Gendres
10515,Spain,"Smells mature and slightly baked, with granular, sweet, raisiny core aromas. The palate is full in size and smooth in feel, with ripe berry flavors fading to raisin and prune on the back palate and finish. Chunky, flavorful and ready to drink now.",Valdecampaña Crianza,88,16,Northern Spain,Ribera del Duero,NA,Michael Schachner,@wineschach,Recoletas 2005 Valdecampaña Crianza  (Ribera del Duero),Tempranillo,Recoletas
10758,Italy,"Saffredi is a beautiful wine, worthy of membership in an elite class of super Tuscan wines from Italy. The blend is Merlot, Cabernet Sauvignon, Alicante and a tiny percentage of Syrah and the overall result is that of plushness, softness and intensity. Aromas include spice, chocolate, blackberry and cherry.",Saffredi,94,130,Tuscany,Maremma,NA,NA,NA,Fattoria Le Pupille 2005 Saffredi  (Maremma),Red Blend,Fattoria Le Pupille
10861,France,"This blend of 85% Syrah, 10% Grenache and 5% Carignan is aging beautifully, and still shows great life ahead. Spice and toasted-oak notes are front and center, with supporting aromas and flavors of dense black-fruit preserves, crushed violet and cocoa powder. The texture is still firm and tight, with slightly chewy tannins and a long, earth- and wood-flavored finish.",Les Onze Terrasses,91,50,Languedoc-Roussillon,Côtes du Roussillon Les Aspres,NA,Lauren Buzzeo,@laurbuzz,Lafage 2005 Les Onze Terrasses Red (Côtes du Roussillon Les Aspres),Rhône-style Red Blend,Lafage
11169,US,"This variety is commonly used in Champagne but rarely vinified on its own. This wine shows why. It's like Pinot Noir in the silky texture, but feels jagged and harsh, and the fruit tastes a little baked and sugary.",NA,84,35,California,Carneros,Napa-Sonoma,NA,NA,Domaine Chandon 2005 Pinot Meunier (Carneros),Pinot Meunier,Domaine Chandon
11181,US,"From the pitch-black color you can tell this is an enormously extracted wine. It shows the stuffing of this famous vineyard's Zins, with blackberries, loganberries, cherries, licorice, leather and cocoa-laced coffee, and is quite tannic. But it's diminished by what tastes like notable sugar in the finish, even though the alcohol is over 15%.",Monte Rosso Vineyard Reserve,84,45,California,Sonoma Valley,Sonoma,NA,NA,Rosenblum 2005 Monte Rosso Vineyard Reserve Zinfandel (Sonoma Valley),Zinfandel,Rosenblum
11537,Italy,"Despite its young age, this beautiful expression of the Cannubi cru from Michele Chiarlo already shows a high level of evolution and sophistication. The wine blends mineral aromas with fresh fruit, spice and licorice. It finishes on the spicy side with a toasty aftertaste and drying tannins.",Cannubi,92,NA,Piedmont,Barolo,NA,NA,NA,Michele Chiarlo 2005 Cannubi  (Barolo),Nebbiolo,Michele Chiarlo
11549,Portugal,"Ripe and spicy, this is an impressive, solid, new wood-dominated wine. The tannins come from high toast as well as the concentrated blackberry juice fruits. That makes it dry, a wine that needs to soften. But it has all the intensity that are the hallmarks of top Douro wines, so try it again in a year.",Quinta das Tecedeiras Reserva,92,34,Douro,NA,NA,Roger Voss,@vossroger,Dão Sul 2005 Quinta das Tecedeiras Reserva Red (Douro),Portuguese Red,Dão Sul
11754,Italy,"This is a ripe and plump Brunello that could use two or three years of cellar aging to allow the oak notes to fully integrate. The quality of the fruit is excellent—cherry, blackberry and currants abound. Immediately behind those aromas, however, is loads of spice, smoke and tar. Drink after 2012.",Ugolforte,89,50,Tuscany,Brunello di Montalcino,NA,NA,NA,Tenuta San Giorgio 2005 Ugolforte  (Brunello di Montalcino),Sangiovese Grosso,Tenuta San Giorgio
12298,Italy,"Thanks to its dense clay soils, the Brunate cru delivers wines with high color saturation and aromatic caliber. This Barolo offers layers of black fruit, plum, spice, tobacco, cola and dark chocolate. The wine is firm and finely textured with power, dimension and personality on the long finish.",Bricco Rocche Brunate,94,88,Piedmont,Barolo,NA,NA,NA,Ceretto 2005 Bricco Rocche Brunate  (Barolo),Nebbiolo,Ceretto
13004,US,"A pretty floral nose and appetizing, juicy flavors of jammy fruit should recommend this wine, but there's a bitterness on the midplate and finish that make the wine a touch too angular. Pair with food to even it out.",Calvin Clarion,82,28,New Mexico,New Mexico,NA,Susan Kostrzewa,@suskostrzewa,Casa Rondeña Winery 2005 Calvin Clarion Red (New Mexico),Red Blend,Casa Rondeña Winery
13361,US,"From the warm Chiles Valley portion of Napa, this Zin is solidly in the New World, cult Cab style of softness and extreme ripeness. The flavors of milk chocolate flood the mouth, with fruit notes of cherries, currants and plums, as well as a mélange of spices in the finish.",Dalraddy Vineyard,85,27,California,Napa Valley,Napa,NA,NA,Tin Barn 2005 Dalraddy Vineyard Zinfandel (Napa Valley),Zinfandel,Tin Barn
14390,US,"Mushroom, tobacco, dried spice….this is a wine with unique character. It's distinctive but mellow on the palate, with red berry, pepper, cigarbox and smoke flavors. Pair with grilled meats, duck.",6025,84,40,New York,North Fork of Long Island,Long Island,Susan Kostrzewa,@suskostrzewa,Martha Clara 2005 6025 Red (North Fork of Long Island),Bordeaux-style Red Blend,Martha Clara
14593,US,"This winery has had a reputation for making Cabs in a leaner, more ageworthy style, but that is no longer true, to judge by this '05. It's as ripe and fruity as anything out there, and immediately drinkable for its beautiful blackberry, black currant, chocolate and cedar flavors. Still, the tannins are considerable, and the wine should easily negotiate the years. Best now and through 2013, at the least.",Kronos Vineyard,94,98,California,St. Helena,Napa,NA,NA,Corison 2005 Kronos Vineyard Cabernet Sauvignon (St. Helena),Cabernet Sauvignon,Corison
15107,Italy,"Give this oaky Amarone a few more years in the bottle to allow the wood elements to come into line. Cherry fruit does exist beyond the lavish layers of Spanish cedar and toast, and the wine comes together nicely in the mouth thanks to its velvety tannins and smooth feel.",Capitel de' Roari,87,30,Veneto,Amarone della Valpolicella Classico,NA,NA,NA,Luigi Righetti 2005 Capitel de' Roari  (Amarone della Valpolicella Classico),"Corvina, Rondinella, Molinara",Luigi Righetti
16288,Spain,"Hot, stalky aromas of red chili flake and weedy raspberry lead to a lean, tomatoey palate with flavors of tomato, dried berry, vanilla and especially dill weed. A saucy, woody finish confirms that this is now mostly oak and acid; drink through 2020.",Reserva,87,30,Northern Spain,Rioja,NA,Michael Schachner,@wineschach,Eduardo Garrido García 2005 Reserva  (Rioja),Tempranillo Blend,Eduardo Garrido García
16559,Italy,"This Sangiovese from the far away 2005 vintage shows aged aromas of spice, candied fruit and polished mineral. It's bright in the mouth in terms of acidity, but not much fresh fruit is left.",Rubbia al Colle Drumo,83,15,Tuscany,Toscana,NA,NA,NA,Fratelli Muratori 2005 Rubbia al Colle Drumo Sangiovese (Toscana),Sangiovese,Fratelli Muratori
17002,US,"This is a beautiful Zinfandel. It exhibits all the wild, exotic forest berry-cherry flavors you could want, flooded with briary spices and notes of currants and mint that go on forever in the finish. Yet it also has Napa's perfect tannins and the balance of a fine Cabernet Sauvignon. First-class Zin, a chef's dream to play with.",NA,92,26,California,Napa Valley,Napa,NA,NA,Madrigal 2005 Zinfandel (Napa Valley),Zinfandel,Madrigal
17004,Italy,"Barolo Bricco Gattera delivers a full palette of aromas that are characteristics of the Nebbiolo grape. You'll recognize luscious berry fruit, wet earth, leather, tobacco, licorice and white truffle. The wine boasts excellent concentration, good acidity, firm tannins and an elegant finish. Drink after 2012.",Bricco Gattera,92,75,Piedmont,Barolo,NA,NA,NA,Cordero di Montezemolo 2005 Bricco Gattera  (Barolo),Nebbiolo,Cordero di Montezemolo
17262,Greece,"The Rapsani Reserve starts with aromas of bitter cocoa, leather and tobacco, leading into savory sips of plum, chocolate, pepper and cinnamon. Intense and assertive, this wine will offer more generous black fruit as it ages. A serious wine that pairs with robust meat dishes.",Rapsani Reserve,89,19,Halkidiki,NA,NA,Susan Kostrzewa,@suskostrzewa,Tsantali 2005 Rapsani Reserve Red (Halkidiki),Red Blend,Tsantali
17442,US,"A little sharp, but easily the winery's best non-vineyard designated Cab since the '02. Shows a ripeness level that slam dunks cherries, blackberries, cola and oak onto the palate, yet maintains an elegant dryness.",NA,87,18,California,Napa Valley,Napa,NA,NA,Rutherford Ranch 2005 Cabernet Sauvignon (Napa Valley),Cabernet Sauvignon,Rutherford Ranch
18083,Italy,"Sweet oak notes are followed by cherry, chocolate and vanilla. This is a rich Cabernet Sauvignon with a modern and very pleasurable approach that puts emphasis on power, softness and intensity. Vibrant cherry flavors last many long minutes on the palate.",Coniale,91,45,Tuscany,Toscana,NA,NA,NA,Castellare di Castellina 2005 Coniale Cabernet Sauvignon (Toscana),Cabernet Sauvignon,Castellare di Castellina
18084,Italy,"Here's an inky, densely concentrated blend of Sangiovese, Merlot and Cabernet with intense aromas of chocolate, coffee, ripe berry, plum and spice. The wine is rich, well textured and offers enormous length on the close. Those bright cherry flavors leave a rich and long impression.",Rainero,91,NA,Tuscany,Toscana,NA,NA,NA,Castello di Meleto 2005 Rainero Red (Toscana),Red Blend,Castello di Meleto
18210,US,"Cherry, coffee and spicy cedar starts this masculine Cab from Penns Woods. On the palate, tobacco, red currant and pepper offer savory and sweet elements. The wine is balanced with good acidity and tannins. Pair with smoked ribs, hamburgers.",Reserve,85,46,Pennsylvania,Pennsylvania,NA,Susan Kostrzewa,@suskostrzewa,Penns Woods 2005 Reserve Cabernet Sauvignon (Pennsylvania),Cabernet Sauvignon,Penns Woods
19484,Germany,"Much lighter in weight than many Pinot Gris on the market, this is a pretty, fruit-driven rendering of the variety, blending tropical fruit with ripe apples and hints of pink grapefruit. It's crisp and clean on the finish.",Grauer Burgunder Kabinett Trocken,85,19,Pfalz,NA,NA,Joe Czerwinski,@JoeCz,Dr. Wehrheim 2005 Grauer Burgunder Kabinett Trocken Pinot Gris (Pfalz),Pinot Gris,Dr. Wehrheim
19573,US,"This is one of the sweetest white California dessert wines out there. It's addictively decadent, like an upscale Sauternes. Barrel fermentation in new French oak gives an opulent, palate-flattering honeyed vanilla richness to the apricot, peach, pineapple and crème brûlée flavors that are so rich and refined. Crisp acidity provide clean, vibrant balance. Just gorgeous, and worth the price.",Botrytised,95,55,California,Chalk Hill,Sonoma,NA,NA,Chalk Hill 2005 Botrytised Sémillon (Chalk Hill),Sémillon,Chalk Hill
20001,Italy,"Here's a simple but genuine Sangiovese from the Montepulciano area that delivers measured notes of blueberry, spice, tobacco and leather. It's a no-fuss red that is both lean and bright on the palate.",Capoverso,87,22,Tuscany,Toscana,NA,NA,NA,Capoverso 2005 Capoverso Sangiovese (Toscana),Sangiovese,Capoverso
20909,US,"Lovely, light, fresh and delicate, this Barbera is young, juicy and appealing. The fruit mixes light berry flavors with tart, tangy acids; the flavors seem to gather in the mid-palate, showing excellent concentration. No new oak is evident, nor is it missed. The alcohol remains comfortably below 14%, and the fruit is light but quite ripe, with no green edges.",Lonesome Spring Ranch,87,24,Washington,Columbia Valley (WA),Columbia Valley,Paul Gregutt,@paulgwine ,Viento 2005 Lonesome Spring Ranch Barbera (Columbia Valley (WA)),Barbera,Viento
21405,US,"A great Zin from Napa, this shows the classic structure of a claret, but with Zin's distinctive personality. Briary, brambly wild berries, mocha and masses of white pepper are the aromas and flavors.",Kilt Lifter Brown Vineyard,91,32,California,Napa Valley,Napa,NA,NA,Crauford 2005 Kilt Lifter Brown Vineyard Zinfandel (Napa Valley),Zinfandel,Crauford
21931,Portugal,"Taking the idea of its name from Sauternes producers, the second wine from Romaneira is rich, succulent and fruity. There are plenty of tannins, but they are soft, leaving the main flavors to black fruits, toast and spice.",R de Romaneira,90,21,Douro,NA,NA,Roger Voss,@vossroger,Quinta da Romaneira 2005 R de Romaneira Red (Douro),Portuguese Red,Quinta da Romaneira
21938,US,"This is an interesting and different wine. It's much lower in alcohol than most Cabs, but completely dry, with a tobacco and sage pull to the black currant flavors. The firm tannins suggest cellar possibilities.",Hyde Vineyard,90,60,California,Carneros,Napa-Sonoma,NA,NA,Bonneau 2005 Hyde Vineyard Cabernet Sauvignon (Carneros),Cabernet Sauvignon,Bonneau
22174,US,"With an edge of sweet red currants and slightly sugared herb tea, this Zin can't really be called completely dry. But the tannin-acid balance is very fine, and makes the wine balanced and enjoyable. Should be great with pasta with a marinara sauce.",NA,87,25,California,Fiddletown,Sierra Foothills,NA,NA,Renwood 2005 Zinfandel (Fiddletown),Zinfandel,Renwood
