id,country,description,designation,points,price,province,region_1,region_2,taster_name,taster_twitter_handle,title,variety,winery
98924,US,"A barrel selection from estate-grown grapes, this Pinot succeeds in rich red raspberry and an offering of strawberry-rhubarb pie, the texture velvety smooth. The oak builds through the finish, providing ample body and substance, yet the wine stays light and lilting on the palate, inviting one in for more.",Lone Tree Vineyard,94,60,California,Carneros,Napa-Sonoma,Virginie Boone,@vboone,Acacia 2012 Lone Tree Vineyard Pinot Noir (Carneros),Pinot Noir,Acacia
98929,Germany,"Exuberant floral tones persist from nose to finish in this luminously sweet Riesling. It's feather light on the palate, yet pineapple and mango flavors are unctuous and concentrated. A spray of tangerine acidity extends the finish endlessly.",Erdener Prälat Goldkap Beerenauslese,94,350,Mosel,NA,NA,Anna Lee C. Iijima,NA,Dr. Hermann 2012 Erdener Prälat Goldkap Beerenauslese Riesling (Mosel),Riesling,Dr. Hermann
99002,Italy,"Aromas of toast, coconut and oak-driven spice lead the nose and carry over to the palate along with licorice and a confectionary note. This lacks fruit richness while raspy tannins leave an astringent finish.",Nubiola,86,49,Piedmont,Barbaresco,NA,Kerin O’Keefe,@kerinokeefe,Pelissero 2012 Nubiola  (Barbaresco),Nebbiolo,Pelissero
99005,Portugal,"This is a rich wine, soft and juicy. Superripe—perhaps overripe—fruit gives a jammy character to the wine. The core woody flavor from aging in French and American oak is prominent and needs to round out. Drink from 2017.",Herdade dos Templários Grande Escolha,86,25,Tejo,NA,NA,Roger Voss,@vossroger,Quinta do Cavalinho 2012 Herdade dos Templários Grande Escolha Red (Tejo),Portuguese Red,Quinta do Cavalinho
99016,US,"Oak aromas pervade on the nose and palate, with charred blackberries, freshly-ground coffee and dark chocolate notes showing dominance. Full-bodied, rich and thick, this brooding red is supported by grippy tannins that build on the finish.",NA,86,30,Virginia,Monticello,NA,Alexander Peartree,NA,Michael Shaps 2012 Petit Verdot (Monticello),Petit Verdot,Michael Shaps
99032,US,"Coming from vines planted in 1910, this wine is very light in the glass and reserved on the nose, with hints of iron and red fruits. It's tart on the palate, without much ripe fruit, proving rather dainty but offering a decent grip for such a light wine.",Besson Vineyard Old Vines,87,21,California,Central Coast,Central Coast,Matt Kettmann,@mattkettmann,Birichino 2012 Besson Vineyard Old Vines Grenache (Central Coast),Grenache,Birichino
99041,US,"Made entirely from one vineyard source and one variety, this was barrel-fermented in half new French oak. Nonetheless it is marked most by its lightness and crisp, clean flavor of lemon, apple and passionfruit, the oak providing structure in the background only.",Martinelli Road Vineyard,87,40,California,Russian River Valley,Sonoma,Virginie Boone,@vboone,Krutz 2012 Martinelli Road Vineyard Chardonnay (Russian River Valley),Chardonnay,Krutz
99113,Germany,"Fresh orange peels lend a zesty vibe to summer melon and peach flavors in this decadent, sun-kissed Riesling. It's so delicate in texture, it's as if gossamer layers of acid and sweetness could dance on the palate, but the finish lingers long with a streak of honey, wax and lanolin. Delicious now, but it's components should meld gorgeously from 2017 and on.",Ürziger Würzgarten Auslese,92,55,Mosel,NA,NA,Anna Lee C. Iijima,NA,Dr. Hermann 2012 Ürziger Würzgarten Auslese Riesling (Mosel),Riesling,Dr. Hermann
99168,US,"Yeasty, like baked bread, this thick, leathery and peppery wine is surrounded by a wealth of burly tannins. The oak well integrated, it will nonetheless benefit from further aging to coax more of its dark raspberry and blackberry fruit. Cellar through 2020.",District Collection,90,85,California,Yountville,Napa,Virginie Boone,@vboone,Raymond 2012 District Collection Cabernet Sauvignon (Yountville),Cabernet Sauvignon,Raymond
99246,US,"A blend of 43% Grenache, 41% Mourvédre and 16% Syrah from two vineyard sites, one warmer than the other, this plummy red is bright on the palate. Smoky and not overly oaked, it contributes gamy twinges of black currant and cardamom to the long finish.",Turbine,88,28,California,Sonoma Valley,Sonoma,Virginie Boone,@vboone,Anaba 2012 Turbine Red (Sonoma Valley),Rhône-style Red Blend,Anaba
99473,US,"This full-bodied and assertive wine from hillside vineyards has earthy aromas, ripe but dry fruit flavors, and a dense texture due to mouth-coating tannins. It will need time in the bottle to round off, but should be delicious after 2018.",Estate,89,29,California,El Dorado,Sierra Foothills,Jim Gordon,@gordone_cellars,Cedarville Vineyard 2012 Estate Syrah (El Dorado),Syrah,Cedarville Vineyard
99776,Italy,"This soft, round wine opens with aromas of oak, vanilla and black fruit. It has big, ripe flavors of blackberry, plum, espresso and chocolate alongside smooth tannins. While it's not complex, it's delicious and ready to enjoy now.",NA,88,15,Central Italy,Umbria,NA,Kerin O’Keefe,@kerinokeefe,Falesco 2012 Merlot (Umbria),Merlot,Falesco
99850,Germany,"Dusty dried herbs accent bright notes of tangerine and white flower on this bold yet elegant wine. The palate is rich, round and heavy in feel, but striking lemon-lime acidity and a crush of oyster shells adds balance.",Casteller Schlossberg Trocken GG,89,76,Franken,NA,NA,Anna Lee C. Iijima,NA,Castell 2012 Casteller Schlossberg Trocken GG Silvaner (Franken),Silvaner,Castell
99965,Italy,"This opens with Pecorino's classic floral fragrance of acacia and hawthorne, accented by whiffs of stone fruit. On the palate, it delivers ripe peach and apple flavors, with notes of ginger, almond and a drop of honey. Energizing minerality marks the finish.",Merlettaie,89,17,Central Italy,Offida Pecorino,NA,Kerin O’Keefe,@kerinokeefe,Ciù Ciù 2012 Merlettaie  (Offida Pecorino),Pecorino,Ciù Ciù
100130,Italy,"Made from native grape Friulano and fermented in large casks, this full-bodied, sophisticated wine opens with delicate aromas that recall lemon blossom, acacia and walnut. The linear palate offers Bartlett pear, lemon zest and golden apple accented with notes of bitter almond. This will develop complexity over the next few years. Drink through 2018.",Col Livius,90,30,Northeastern Italy,Colli Orientali del Friuli,NA,Kerin O’Keefe,@kerinokeefe,La Tunella 2012 Col Livius Friulano (Colli Orientali del Friuli),Friulano,La Tunella
100131,US,"The subtle scent of vanilla soufflé translates as a soft mouthfeel and buttered toast flavors, resulting in a wine ready for meals both casual (roast chicken and mashed potatoes) or upscale (nut-crusted halibut atop polenta). There's ample acidity, but it still falls in the traditional California Chardonnay camp.",Jack's Hill,90,22,California,Monterey County,Central Coast,Matt Kettmann,@mattkettmann,Le P'tit Paysan 2012 Jack's Hill Chardonnay (Monterey County),Chardonnay,Le P'tit Paysan
100237,France,"Just lightly peppery, this is a rounded, smooth wine. It has a creamy texture with baked apple and spiced pear flavor. The acidity is just right, with juiciness on the finish. Drink now.",Tradition,86,14,Alsace,Alsace,NA,Roger Voss,@vossroger,Jean-Baptiste Adam 2012 Tradition Pinot Blanc (Alsace),Pinot Blanc,Jean-Baptiste Adam
100246,US,"Flavors of Meyer lemon, lime and grapefruit are accented with a tang of gooseberries in this wine. The finish is lively and dry, with a scour of mouthwatering acidity. Production was 2,500 cases.",NA,86,15,California,Napa Valley,Napa,NA,NA,Rutherford Ranch 2012 Sauvignon Blanc (Napa Valley),Sauvignon Blanc,Rutherford Ranch
100258,US,"Coffee aromas and some delicate raspberry fruit come up immediately. At first the fruit seems over-matched, but give it some hours of breathing time and it fills out nicely, bringing on sweet cherry nuanced with fresh herbs. The coffee-edged barrel flavors put a frame around the finish.",Ribbon Ridge Estate,93,55,Oregon,Ribbon Ridge,Willamette Valley,Paul Gregutt,@paulgwine ,Trisaetum 2012 Ribbon Ridge Estate Pinot Noir (Ribbon Ridge),Pinot Noir,Trisaetum
100368,Canada,"West of the Okanagan valley, Similkameen Valley is being touted as the next great Canadian wine region. If these first releases from Vanessa are typical, they are right on track. This Cabernet Sauvignon, Merlot and Cab Franc blend is a supple and sensuous wine, with well-integrated flavors of fig, black cherry, brambly berry, roasted coffee and mocha. It's sturdy, layered and balanced, with a hint of smoke from aging 18 months in a mix of French and American oak.",NA,92,32,British Columbia,Similkameen Valley,NA,Paul Gregutt,@paulgwine ,Vanessa 2012 Meritage (Similkameen Valley),Meritage,Vanessa
100427,US,"Dried raspberries and leathery blackberry fruit get added character from violets on the nose of this single-vineyard bottling from winemaker Bruce McGuire. The palate shows lots of peppercorns and mint in its aromatic core, which is laid across tightly restrained blackberry fruit flavor.",Hilltop Ranch Vineyard,92,28,California,Sta. Rita Hills,Central Coast,Matt Kettmann,@mattkettmann,Lafond 2012 Hilltop Ranch Vineyard Syrah (Sta. Rita Hills),Syrah,Lafond
100623,France,"Part of the domaine of the Gagey family that runs Louis Jadot, this dense, wood-dominated wine has an austere character at this stage. Ripe, potentially full of yellow and creamy white fruits, it will always have a serious side. Drink from 2018.",Le Clos Blanc Beaune Grèves Premier Cru,93,75,Burgundy,Beaune,NA,Roger Voss,@vossroger,Louis Jadot 2012 Le Clos Blanc Beaune Grèves Premier Cru  (Beaune),Chardonnay,Louis Jadot
100709,Italy,"This opens with aromas suggesting toast, menthol, mature berry, coffee and a balsamic note. On the full-bodied palate, notes of white pepper, cinnamon and powdered sage accent dried black cherry while firm, close-grained tannins provide the framework.",Bricco Ambrogio,89,60,Piedmont,Barolo,NA,Kerin O’Keefe,@kerinokeefe,Negretti 2012 Bricco Ambrogio  (Barolo),Nebbiolo,Negretti
100713,Italy,"Initially a bit shy, this slowly opens in the glass to reveal aromas of ripe berry, leather, baking spice and a hint of scorched earth. The palate offers suggestions of raspberry compote, dried black cherry, vanilla and licorice alongside tightly wound tannins. A marked espresso note closes the finish. Drink after 2019.",Terlo,89,55,Piedmont,Barolo,NA,Kerin O’Keefe,@kerinokeefe,Poderi Luigi Einaudi 2012 Terlo  (Barolo),Nebbiolo,Poderi Luigi Einaudi
100749,Spain,"This fresh, young Albariño is offering mild citrus and pear aromas. The palate is crisp, light in weight and good as a whole, with citrus, green apple and nectarine flavors. On the finish, peach and papaya flavors show a tinge of bitterness.",NA,88,22,Galicia,Rías Baixas,NA,Michael Schachner,@wineschach,Veiga da Princesa 2012 Albariño (Rías Baixas),Albariño,Veiga da Princesa
100772,Italy,This is a very beautiful and satisfying Brut expression of Prosecco Superiore that delivers dry sensations of talc powder and crushed stone backed by white flower and citrus. The close is steely crisp and bright.,Tre Venti Brut Millesimato,88,25,Veneto,Conegliano Valdobbiadene Prosecco Superiore,NA,NA,NA,Zardetto 2012 Tre Venti Brut Millesimato  (Conegliano Valdobbiadene Prosecco Superiore),Glera,Zardetto
100851,US,"Tar and black fruit emerge from the shadows of big tannins that pucker on the palate, begging for more time to soften. Robust and full bodied with a warm ripeness, it finishes flat.",Preston Vineyard,85,65,California,Napa Valley,Napa,Virginie Boone,@vboone,V. Sattui 2012 Preston Vineyard Cabernet Sauvignon (Napa Valley),Cabernet Sauvignon,V. Sattui
100973,US,"Done entirely in stainless steel tanks, this includes a percentage of fruit from Girardet's original 1971 plantings. It went through full malolactic, resulting in a broad, somewhat dilute wine with lightly spiced flavors of green and yellow apples. Notes of lemongrass and metal come up in the finish.",NA,85,20,Oregon,Umpqua Valley,Southern Oregon,Paul Gregutt,@paulgwine ,Girardet 2012 Chardonnay (Umpqua Valley),Chardonnay,Girardet
100989,Chile,"Smoky, cooked berry aromas lead to a full, flabby, rubbery-feeling palate with baked black-fruit flavors that suggest baking spices. A soft finish is low on verve and tastes a bit sugary and sweet.",Reserva,85,12,Colchagua Valley,NA,NA,Michael Schachner,@wineschach,Alto Los Romeros 2012 Reserva Cabernet Sauvignon (Colchagua Valley),Cabernet Sauvignon,Alto Los Romeros
101187,US,"Tropical notes rule the nose, with guava most prominent, yet white flowers present as well. There is lemon rind-driven acidity on the apple juice-laden palate, making for a pleasant wine for drinking with light fare.",Estate Grown & Bottled,87,35,California,Paso Robles,Central Coast,Matt Kettmann,@mattkettmann,Tablas Creek 2012 Estate Grown & Bottled Roussanne (Paso Robles),Roussanne,Tablas Creek
101196,France,"Rich and smooth, this solid, ripe wine offers a good sense of structure. It has weight, dense tannins and a creamy texture. Drink from 2015.",NA,87,15,Bordeaux,Bordeaux,NA,Roger Voss,@vossroger,Les Parcelles de Stéphane Derenoncourt 2012  Bordeaux,Bordeaux-style Red Blend,Les Parcelles de Stéphane Derenoncourt
101236,Argentina,"Ripe aromas of black plum, blueberry and charcoal lead to a palate that's muscular and full-bodied. Dark, peppery, slightly bitter flavors of toasted blackberry and prune end with burnt notes and black pepper along with grabby, rubbery tannins.",de Uco,89,18,Mendoza Province,Uco Valley,NA,Michael Schachner,@wineschach,DiamAndes 2012 de Uco Malbec (Uco Valley),Malbec,DiamAndes
101380,Italy,"This opens with subdued aromas of dark berry, cake spice, espresso and a whiff of pressed violet. On the straightforward palate, hints of white pepper and star anise add depth to dried morello cherry while solid tannins lend support.",San Carlo,88,29,Piedmont,Barolo,NA,Kerin O’Keefe,@kerinokeefe,Dezzani 2012 San Carlo  (Barolo),Nebbiolo,Dezzani
101443,Argentina,"Stalky aromas make for a sketchy opening. In the mouth, this is blocky and grabby in feel. Burnt, underripe flavors of berry fruits are herbal and finish with grassy notes.",Old Vine,83,11,Mendoza Province,Mendoza,NA,Michael Schachner,@wineschach,Diseño 2012 Old Vine Malbec (Mendoza),Malbec,Diseño
101976,US,"This wine starts with an enticing, perfumed spicy aroma. Once sipped, a big burst of dry tannins coats the mouth and makes the mild fruit flavors seem thin and spare in the middle. The structure and the texture seem to need more richness and depth from the flavors. Drink after 2020 to let the tannins mellow out.",San Andreas Fault,87,60,California,Sonoma Coast,Sonoma,Jim Gordon,@gordone_cellars,Hirsch 2012 San Andreas Fault Pinot Noir (Sonoma Coast),Pinot Noir,Hirsch
102077,US,"Aromas of dried and fresh herbs, whole green pepper and tobacco lead to tart savory cranberry and citrus flavors. It trails toward the finish.",Arena Valley Vineyard,87,20,Idaho,NA,NA,Sean P. Sullivan,@wawinereport,Snake River 2012 Arena Valley Vineyard Cabernet Franc,Cabernet Franc,Snake River
102264,US,"From a cool site, this is a viscous, oily white. Crisp in pear and almond, it drinks light and yet has enough heft on the mouthfeel to stay interesting and compatible with food. If Roussanne is a varietal of interest, this wine (made in small amounts) should be on the list of those to try.",Vivio Vineyard,90,42,California,Bennett Valley,Sonoma,Virginie Boone,@vboone,Red Car 2012 Vivio Vineyard Roussanne (Bennett Valley),Roussanne,Red Car
102302,US,"This unusual Walla Walla Valley-designated Sangiovese offers notes of vanilla, coffee and cranberry. It brings a rich, textured mouthfeel full of sweet cherry and plum flavors backed by a light grip of tannins. It doesn't seem varietally correct but it's undeniably delicious.",Danger Buoy,88,19,Washington,Walla Walla Valley (WA),Columbia Valley,Sean P. Sullivan,@wawinereport,Genoa 2012 Danger Buoy Sangiovese (Walla Walla Valley (WA)),Sangiovese,Genoa
102398,Portugal,"A warm, ripe and fruity wine that holds a mix of crisp apple acidity and richer yellow fruits. There is just enough acidity to give freshness while the wine has a richer, full character. It should age until 2015.",Branco,86,NA,Alentejano,NA,NA,Roger Voss,@vossroger,Herdade do Rocim 2012 Branco White (Alentejano),Portuguese White,Herdade do Rocim
102399,Portugal,"This attractive and fruity rosé is very dry and rich. With red fruits, a sense of texture and just a hint of tannin, this is a food rosé, firm and ready for summer 2014.",Olho de Mocho,86,NA,Alentejano,NA,NA,Roger Voss,@vossroger,Herdade do Rocim 2012 Olho de Mocho Rosé (Alentejano),Rosé,Herdade do Rocim
102422,US,"There's a mysteriously attractive aromatic profile to this winery's top-end Syrah bottling, with violet perfume blending into blueberry syrup, anise and spearmint. The flavors are bold but not over the top, with lavender, dried berry leather and espresso combining into a seriously memorable wine.",Angeli,92,68,California,Ballard Canyon,Central Coast,Matt Kettmann,@mattkettmann,Stolpman 2012 Angeli Syrah (Ballard Canyon),Syrah,Stolpman
102603,US,"An inexpensive Merlot packed in sweet vanilla and smoky oak that has 5% 2008 Dolcetto, 3% 2010 Syrah and 3% 2007 Cabernet Sauvignon.",NA,81,11,California,North Coast,North Coast,Virginie Boone,@vboone,Lapis Luna 2012 Merlot (North Coast),Merlot,Lapis Luna
102760,France,"This is a dry wine, very spicy, with a tight, taut texture and strongly mineral character layered with citrus as well as pepper. It's a food wine with its almost crisp aftertaste.",NA,87,30,Alsace,Alsace,NA,Roger Voss,@vossroger,Leon Beyer 2012 Gewurztraminer (Alsace),Gewürztraminer,Leon Beyer
102878,US,"There is nothing wimpy about this Bordeaux-style blend except the price. It way over-delivers, loading your palate with full-bodied, fruit-powered flavors of strawberry and raspberry jam, bolstered with bracing acidity. It's balanced and complete, with crisp, ripe tannins.",NA,89,12,Washington,Columbia Valley (WA),Columbia Valley,Paul Gregutt,@paulgwine ,Renegade 2012 Red (Columbia Valley (WA)),Bordeaux-style Red Blend,Renegade
102923,Italy,"This Tuscan red opens with aromas of red currant, cedar and espresso. The aromas carry over to the low-acid palate. The fruit is already drying up and the tannins are fleeting, so drink now.",Lucumone,86,30,Tuscany,Cortona,NA,Kerin O’Keefe,@kerinokeefe,Stefania Mezzetti 2012 Lucumone Cabernet Sauvignon (Cortona),Cabernet Sauvignon,Stefania Mezzetti
102955,Spain,"Berry and plum aromas start out aggressive before settling on earth tones and cinnamon spice notes. This feels juicy, ripe and well constructed. Flavors of raspberry, currant and plum are mildly peppery, while savory earth notes continue the wine's good vibes and solidity. Drink through 2020.",El Pacto Crianza,91,19,Northern Spain,Rioja,NA,Michael Schachner,@wineschach,Bodega Classica 2012 El Pacto Crianza  (Rioja),Tempranillo Blend,Bodega Classica
103004,Argentina,"Woody smelling up front, this is a thick, ripe Malbec with sweet plum and berry aromas and flavors. Despite feeling fat, this has adequate acidity to match resiny oak and jammy berry fruit. Wood spice is the dominant flavor on the finish.",505,85,13,Mendoza Province,Mendoza,NA,Michael Schachner,@wineschach,Casarena 2012 505 Malbec (Mendoza),Malbec,Casarena
103007,US,"A widely distributed wine that'll please in yeasty strawberry and blueberry flavor and a yeasty nose. Soft and straightforward, the tannins are tamed and the profile more juicy than earthy.",NA,85,15,California,California,California Other,Virginie Boone,@vboone,Spellbound 2012 Petite Sirah (California),Petite Sirah,Spellbound
103008,US,"An eccentric blend of 62% Rkatsiteli, 19% Chardonnay and 19% Sauvignon Blanc, this has scents of currant bud and sage, white grapefruit and white apricot. It's a medium-bodied effort that offers mild flavors and refreshing acids.",Charval,85,20,Virginia,Virginia,NA,NA,NA,Tarara 2012 Charval White (Virginia),White Blend,Tarara
103018,US,"An aromatic wine with notes of freshly cut red apple, overripe pear and jasmine. The palate drinks closer to dry than the aromas might suggest, with a phenolic feel.",Estate Grown,85,14,Oregon,Rogue Valley,Southern Oregon,Sean P. Sullivan,@wawinereport,Foris 2012 Estate Grown Riesling (Rogue Valley),Riesling,Foris
103049,US,"This is an oaky Chardonnay, but the oak has been nicely integrated. The buttered toast notes complement the tropical fruit, peach and lemon-lime contributions of the grapes. Excellent acidity completes the balance.",NA,90,22,California,Sonoma Coast,Sonoma,NA,NA,Les Voleurs 2012 Chardonnay (Sonoma Coast),Chardonnay,Les Voleurs
103050,Italy,"It opens with a delicate floral fragrance of white spring flowers accented by a whiff of apple and Alpine herbs. The steely, linear palate delivers juicy yellow apples together with a mineral note and lively acidity.",Penon,90,16,Northeastern Italy,Alto Adige,NA,Kerin O’Keefe,@kerinokeefe,Nals Margreid 2012 Penon Pinot Bianco (Alto Adige),Pinot Bianco,Nals Margreid
103159,South Africa,"Earthy notes of licorice, bark and bramble are prominent on the nose of this wine, framing the black berry, plum and boysenberry core. The mouthfeel is lush and ripe, with a subtle creaminess that's complemented by notes of baking spice and cocoa powder on the finish. Drink now–2018.",The Game Reserve,88,18,Western Cape,NA,NA,Lauren Buzzeo,@laurbuzz,Graham Beck 2012 The Game Reserve Pinotage (Western Cape),Pinotage,Graham Beck
103163,France,"Initially there is too much burnt wood flavor in this wine. It's only slowly that the red fruits begin to show, leaving a fresh, if lightweight character before attractive final acidity.",Clos Blanc Premier Cru,88,58,Burgundy,Pommard,NA,Roger Voss,@vossroger,Domaine A. Machard de Gramont 2012 Clos Blanc Premier Cru  (Pommard),Pinot Noir,Domaine A. Machard de Gramont
103196,US,"This wine is half Cabernet Sauvignon and 40% Syrah, finished off with Petit Verdot. The aromas and flavors of dried herbs, blackberry, tar and fresh flowers show multiple layers, with the palate displaying density and richness. It needs time to be at its best but will be worth the wait. Drink 2020–2027.",Callisto,93,39,Washington,Columbia Valley (WA),Columbia Valley,Sean P. Sullivan,@wawinereport,Baer 2012 Callisto Red (Columbia Valley (WA)),Red Blend,Baer
103240,US,"Coming from the Horse Heaven Hills region, this wine offers appealing aromas of cranberry, raspberry fruit leather, red currant and spice—all displaying a fine sense of purity. The tart fruit flavors are broad and generous but stay in balance.",Alder Ridge Vineyard,91,24,Washington,Columbia Valley (WA),Columbia Valley,Sean P. Sullivan,@wawinereport,Angel Vine 2012 Alder Ridge Vineyard Zinfandel (Columbia Valley (WA)),Zinfandel,Angel Vine
103257,US,"This wine is a unique blend of Malbec (60%), Syrah (20%), Merlot (15%) and Petit Verdot. It opens with brooding but alluring aromas of dark plum, asphalt, and a kiss of baking spice. The flavors are full bodied and palate coating, showing weight but also a sense of suppleness that charms the senses.",Mr. Owl's,91,34,Washington,Walla Walla Valley (WA),Columbia Valley,Sean P. Sullivan,@wawinereport,Reininger 2012 Mr. Owl's Red (Walla Walla Valley (WA)),Red Blend,Reininger
103742,Spain,"Dense fairly bold blackberry and dark plum aromas are backed by a plump palate that's braced by a beam of core acidity. Earthy berry flavors come with notes of vanilla, wild herbs and tobacco, while the finish is full and weighty but also juicy. Drink through 2020.",Reserva,90,20,Northern Spain,Rioja,NA,Michael Schachner,@wineschach,Burgo Viejo 2012 Reserva  (Rioja),Tempranillo Blend,Burgo Viejo
103781,Italy,"Coreno is a blend of Trebbiano and Malvasia grapes that hail from over fifty-year-old vines. It has aromas of stone fruit and pear, while the palate boasts flavors of peach, lemon cream, vanilla and well-integrated oak.",Coreno,87,19,Tuscany,Toscana,NA,Kerin O’Keefe,@kerinokeefe,Olivi 2012 Coreno White (Toscana),White Blend,Olivi
104178,Portugal,"This ripe wine is full of apple fruits with a tight streak of citrus acidity. It's a food wine, showing a creamy texture, a light texture and attractive acidity.",Coroa d'Ouro,87,12,Douro,NA,NA,Roger Voss,@vossroger,Poças 2012 Coroa d'Ouro White (Douro),Portuguese White,Poças
104191,US,"Despite the low alcohol, this is quite dry and tart, with a lemony base and some orange-pekoe flavors also. Not a complex Riesling, but light and pleasantly sippable.",Estate Exclusive,87,25,Oregon,Dundee Hills,Willamette Valley,Paul Gregutt,@paulgwine ,Stoller 2012 Estate Exclusive Riesling (Dundee Hills),Riesling,Stoller
104495,US,"Grippy in big, dry tannin and a weight of oak, this is a plummy and rich red wine. The palate veers into dusty layers of vanilla and chocolate, finishing leathery and peppery.",NA,88,32,California,Dry Creek Valley,Sonoma,Virginie Boone,@vboone,Rancho Maria 2012 Zinfandel (Dry Creek Valley),Zinfandel,Rancho Maria
104569,Italy,"Tilled earth, game, red berry and orange peel aromas lead the nose on this concentrated wine. The ripe, savory palate delivers fleshy sour cherry, crushed raspberry, notes of baking spice, mineral and a suggestion of game. It's delicious, with an earthy charm that gives it a distinct character.",Il Frappato,90,40,Sicily & Sardinia,Sicilia,NA,Kerin O’Keefe,@kerinokeefe,Occhipinti 2012 Il Frappato Frappato (Sicilia),Frappato,Occhipinti
