id,country,description,designation,points,price,province,region_1,region_2,taster_name,taster_twitter_handle,title,variety,winery
89991,Italy,"Aromas of dark fruit and cedar lead the nose and follow through to the warm, soft palate with peppercorn, licorice and dried blackcurrant. Velvety tannins provide the framework but it's shy on freshness, so enjoy soon.",Il Castagno,89,28,Tuscany,Cortona,NA,Kerin O’Keefe,@kerinokeefe,Fabrizio Dionisio 2011 Il Castagno Syrah (Cortona),Syrah,Fabrizio Dionisio
90363,South Africa,"This is a rich, well-balanced and layered white, with lots of aging potential. Notes of red apple, peach, melon and orange blossom mingle with spicy accents of toasted brioche, clove and vanilla bean. It's medium weight and crisp in acidity, with a long, evolving finish that ends decadent yet elegant. Drink now–2020.",The FMC,93,65,Stellenbosch,NA,NA,Lauren Buzzeo,@laurbuzz,Ken Forrester 2011 The FMC Chenin Blanc (Stellenbosch),Chenin Blanc,Ken Forrester
90567,US,"Here is a well-focused wine with appealing toastiness as soon as it's opened. Fruit flavors are still tight, but unfold into tangy raspberry. It spent 18 months in half new French oak, to good effect.",Roads End Estate Vineyard,88,45,Oregon,Willamette Valley,NA,Paul Gregutt,@paulgwine ,Carlton Cellars 2011 Roads End Estate Vineyard Pinot Noir,Pinot Noir,Carlton Cellars
90612,Spain,"This opens with vanilla and sweet, powdery aromas. In the mouth, it's bubbly and foamy, with a mix of pickled citrus and dry apple flavors. The finish is crisp and dry like a soda cracker.",Brut,83,15,Catalonia,Cava,NA,Michael Schachner,@wineschach,Tarantas 2011 Brut Sparkling (Cava),Sparkling Blend,Tarantas
90614,Italy,"Easy, thin and bright, this is a straightforward Pinot Grigio that makes for a totally informal, no-fuss drinking experience. It feels watery and thin in the mouth with mild tones of grapefruit and melon on the close.",NA,83,12,Northeastern Italy,Delle Venezie,NA,NA,NA,Antica Corte 2011 Pinot Grigio (Delle Venezie),Pinot Grigio,Antica Corte
90618,Italy,"This blend of Garganega (the grape that makes Soave wines) and Pinot Grigio, here is an easy and fast-drinking picnic wine from Northern Italy. The nose shows tones of stone fruit, melon and citrus.",NA,83,NA,Northeastern Italy,Delle Venezie,NA,NA,NA,Duca del Frassino 2011 White (Delle Venezie),White Blend,Duca del Frassino
91345,Italy,"Structured and loaded with finesse, this opens with a bouquet of blue flower, perfumed red berry and a whiff of cake spice. The silky, focused palate delivers creamy red cherry, ripe raspberry, cinnamon, licorice and mineral tones set in a framework of supple tannins. Drink through 2020.",Spanna Bernardo Vallana,91,25,Piedmont,Colline Novaresi,NA,Kerin O’Keefe,@kerinokeefe,Vallana 2011 Spanna Bernardo Vallana Nebbiolo (Colline Novaresi),Nebbiolo,Vallana
91416,Spain,"Iodine and celery aromas dominate the nose, which offers mild fruit-driven scents of apple and lime. This feels firm but nothing north of normal, with generic white-fruit flavors of lychee and apple mixed with green herbs. A cleansing finish can best be described as fresh.",NA,86,12,Northern Spain,Rueda,NA,Michael Schachner,@wineschach,Condesa Eylo 2011 Verdejo (Rueda),Verdejo,Condesa Eylo
91587,Argentina,"Grassy, herbal aromas contain little fruit, while this feels firm, with no give to the palate. Green, herbal flavors are low on fruit, and this ends with heat and scratchiness.",Petit Trez,83,18,Mendoza Province,Mendoza,NA,Michael Schachner,@wineschach,Deumayen 2011 Petit Trez Malbec (Mendoza),Malbec,Deumayen
91681,US,"This is a simple Sauvignon Blanc, with sugary-tasting apricot, orange and vanilla flavors, plus some vegetal notes.",NA,82,15,California,Russian River Valley,Sonoma,NA,NA,Sea Mist 2011 Sauvignon Blanc (Russian River Valley),Sauvignon Blanc,Sea Mist
91716,Chile,"GSM means Grenache, Syrah and Mourvèdre, while the T stands for Tempranillo. On the nose, it's spicy and a touch stalky and roasted. The mouthfeel is full and balanced, while flavors of baked plum cassis, cocoa and tea finish mellow, with mild tannins.",GSM+T,89,30,Marchigue,NA,NA,Michael Schachner,@wineschach,Polkura 2011 GSM+T Red (Marchigue),Red Blend,Polkura
91935,US,"Rhubarb, pie cherry and tart strawberries comprise the fruit component of this young, tangy Pinot Noir. The acidity is still pronounced, and suggests that further aging is a good idea. A nice dusting of cinnamon adds interest to the finish.",Coast Range Estate,89,55,Oregon,Willamette Valley,NA,Paul Gregutt,@paulgwine ,Trisaetum 2011 Coast Range Estate Pinot Noir,Pinot Noir,Trisaetum
91946,Germany,"Dusty minerals and dried herbs accent bright lemon-lime aromas on the nose of this delicately framed kabinett. A tickle of spritz on the palate adds to the wine's wispy, subtly sweet and fruity character. Finishes long and fresh, with intense citrus acidity.",Erdener Treppchen Kabinett,89,27,Mosel,NA,NA,Anna Lee C. Iijima,NA,Dr. Loosen 2011 Erdener Treppchen Kabinett Riesling (Mosel),Riesling,Dr. Loosen
92134,France,"93-95. Barrel sample. Dense and ripe, this wine boasts sweet tannins and flavors of ripe plums. With the vintage's tight, taut acidity, the aging potential is there.",Barrel Sample,94,NA,Bordeaux,Margaux,NA,Roger Voss,@vossroger,Château Kirwan 2011 Barrel Sample  (Margaux),Bordeaux-style Red Blend,Château Kirwan
92145,France,"93-95. Barrel sample. This wine is powerful and concentrated, with its tannins showing. It is perfumed, ripe and offers density that's impressive for the year.",Barrel Sample,94,NA,Bordeaux,Saint-Julien,NA,Roger Voss,@vossroger,Château Langoa Barton 2011 Barrel Sample  (Saint-Julien),Bordeaux-style Red Blend,Château Langoa Barton
92282,US,"A simple Merlot, thin and dry, whose cherry and red plum flavors are compromised by green, unripe notes.",NA,84,20,California,Carneros,Napa-Sonoma,NA,NA,Buena Vista 2011 Merlot (Carneros),Merlot,Buena Vista
92417,Spain,"Coffee grinds, raisin and baked aromas suggest overripeness. This is heavy, broad and a bit clumsy on the palate. Berry and prune flavors are solid but not overly fresh, while the finish is full and raisiny as it improves over time.",Negre,87,22,Catalonia,Montsant,NA,Michael Schachner,@wineschach,Jaspi 2011 Negre Red (Montsant),Red Blend,Jaspi
92617,US,"Refreshing and simple, this is dryish and spicy, with orange, apricot and peach flavors all accented with crisp acidity. It's easy to drink as a cocktail sipper, with little snacks, like tempura or cheesy puff pastries.",NA,86,10,California,California,California Other,NA,NA,McManis 2011 Pinot Grigio (California),Pinot Grigio,McManis
92864,Portugal,"A touch of wood goes well with the ripe fruit. It is full in the mouth, rich and needing to age another few months. Yellow fruits and a ripe texture give an imposing presence. Drink from the end of 2014.",Reserva Branco,90,13,Douro,NA,NA,Roger Voss,@vossroger,Quinta de Porrais 2011 Reserva Branco White (Douro),Portuguese White,Quinta de Porrais
92956,France,"This is a ripe, sweet wine that has all the exotic flavors of rich Gewurztraminer. It's rounded, smooth and spicy with flavors of tropical fruits and apricots and only a hint of acidity. Drink now.",Tradition,87,20,Alsace,Alsace,NA,Roger Voss,@vossroger,Sipp Mack 2011 Tradition Gewurztraminer (Alsace),Gewürztraminer,Sipp Mack
93204,Germany,"Intense smoke and crushed-stone notes linger from start to finish on this distinctly mineral beerenauslese, adding a savory tone to luscious honey and lemon flavors. Zesty lime and lemon notes offset sweetness on the palate, finishing with a touch of puckering astringency.",Bernkasteler Badstube Beerenauslese,86,46,Mosel,NA,NA,Anna Lee C. Iijima,NA,Dr. Pauly Bergweiler 2011 Bernkasteler Badstube Beerenauslese Riesling (Mosel),Riesling,Dr. Pauly Bergweiler
93210,France,"This wine is firm, solid and strongly tannic in nature. Juiciness is there, along with wood aging, spice and some concentration. The acidity is very present and needs to soften over the next year. Drink from 2015.",NA,86,26,Bordeaux,Côtes de Bordeaux,NA,Roger Voss,@vossroger,Château Valentin 2011  Côtes de Bordeaux,Bordeaux-style Red Blend,Château Valentin
93439,Germany,"Earthy shades of struck flint and petrol add focus to lusciously ripe stonefruit and white-floral notes on this intensely concentrated, yet delicate Riesling. Zippy with fruit and acid, it's delicious to the long, steely finish.",Ürziger Goldwingert Spätlese,90,30,Mosel,NA,NA,Anna Lee C. Iijima,NA,Peter Nicolay 2011 Ürziger Goldwingert Spätlese Riesling (Mosel),Riesling,Peter Nicolay
93446,Italy,"This single-vineyard wine from Dogliani, the spiritual home of Dolcetto, is made with wild yeasts. It's fragrant and structured, concluding with restrained wild-cherry, spice and mineral notes that come together with flair and finesse.",Sirì d'Jermu,90,18,Piedmont,Dogliani Superiore,NA,Kerin O’Keefe,@kerinokeefe,Pecchenino 2011 Sirì d'Jermu  (Dogliani Superiore),Dolcetto,Pecchenino
93460,France,"Mint flavors reflect the new wood aging in this smooth, ripe wine. It has a fine structure, ample acidity and blackberry fruit. This textured, structured wine is ready for 4–6 years of aging.",NA,90,15,Bordeaux,Bordeaux Supérieur,NA,Roger Voss,@vossroger,Château la Croix de Roche 2011  Bordeaux Supérieur,Bordeaux-style Red Blend,Château la Croix de Roche
94055,US,"Bright, fresh and fruity, this is loaded with citrus—especially grapefruit—goodness. There are layers of pears and peaches, making this a big, fruity, mouth-filling wine.",PGV,90,15,Washington,Washington,Washington Other,Paul Gregutt,@paulgwine ,Thurston Wolfe 2011 PGV White (Washington),White Blend,Thurston Wolfe
94221,US,"Lush and tasty, this is strikingly affordable for the alluring layers of aromas and flavors present. It begins with cherry pie on the nose alongside black licorice, bay leaf, roasting meats and mushrooms, and continues on the palate with soft and jammy berries. Yet it has a serious side too, with flavors of menthol and stewed tomatoes delivering the umami factor.",Wheelhouse,92,21,California,Paso Robles,Central Coast,Matt Kettmann,@mattkettmann,Sextant 2011 Wheelhouse Zinfandel (Paso Robles),Zinfandel,Sextant
94291,Italy,"This opens with subdued aromas suggesting sour berry, clove and a touch of leather. The accessible, straightforward palate offers morello cherry and a hint of star anise alongside polished tannins. Drink through 2019.",Signature Series,88,25,Tuscany,Brunello di Montalcino,NA,Kerin O’Keefe,@kerinokeefe,Kirkland Signature 2011 Signature Series  (Brunello di Montalcino),Sangiovese,Kirkland Signature
94323,US,"A fairly simple wine, it's rich in mouthwatering acidity, with ripe citrus, tropical fruit, melon and honey flavors. Unoaked, this should be versatile with a broad range of foods.",NA,85,12,California,California,California Other,NA,NA,Mirassou 2011 Sauvignon Blanc (California),Sauvignon Blanc,Mirassou
94499,Portugal,"Swathes of fruit come across this ripe wine. To balance, it has a gritty structure that is firm in its tannins. It's a ripe, lightly perfumed wine that will age. Drink from 2017.",Ribeiro Santo,89,NA,Dão,NA,NA,Roger Voss,@vossroger,Magnum Vinhos 2011 Ribeiro Santo Red (Dão),Portuguese Red,Magnum Vinhos
94608,US,"This is minty and light, with a soft texture and red cherry tones. The finish turns overtly earthy, even barnyard-like.",NA,81,12,California,California,California Other,Virginie Boone,@vboone,Chime 2011 Pinot Noir (California),Pinot Noir,Chime
95052,Spain,"This gorgeously crafted, full-bodied Tempranillo is a modern beauty. Marzipan, wood grain, baking spice and black-fruit aromas make for a spectacular bouquet, while a ripped, strapping palate is raring to go. Flavors of blackened toast, fine wood, black plum and blackberry finish with gusto and notes of licorice, baking spices and cracked black peppercorn linger on the finish. Hold until 2017, then drink through 2026.",Amancio,95,149,Northern Spain,Rioja,NA,Michael Schachner,@wineschach,Sierra Cantabria 2011 Amancio  (Rioja),Tempranillo,Sierra Cantabria
95205,US,"This is 58% Grenache, 39% Syrah, and 3% Tempranillo. It's a real fruit salad of a wine—fresh and loaded with strawberries, cherry candy, cola and cream. Forward and fruit-driven, it's enormously appealing and ready to drink right now.",Pont Brûlé,91,30,Washington,Columbia Valley (WA),Columbia Valley,Paul Gregutt,@paulgwine ,Burnt Bridge 2011 Pont Brûlé Red (Columbia Valley (WA)),Red Blend,Burnt Bridge
95248,Chile,"There's no shortage of funky wildness to the nose: leather, juniper and rubbery berry scents are all accounted for. The palate carries minimal tannic grip, while flavors of herbal berry fruits rekindle the juniper from the nose, leaving an herbal aftertaste.",Reserva,83,10,Maipo Valley,NA,NA,Michael Schachner,@wineschach,Santa Alicia 2011 Reserva Shiraz (Maipo Valley),Shiraz,Santa Alicia
95736,Portugal,"Old vines of Tinta Francisca have produced a generous, full and concentrated wine. It is packed with forward berry fruits and as well as soft tannins that are finely integrated. The end is fresh, and always fruity.",Carvalhas,89,60,Douro,NA,NA,Roger Voss,@vossroger,Quinta das Carvalhas 2011 Carvalhas Tinta Francisca (Douro),Tinta Francisca,Quinta das Carvalhas
95771,US,"This is intoxicating on the nose with scents of white flowers, fresh herbs and honey, layered with hints of smoke and pine needles. Just a shade off-dry, the palate boasts ample peach and pear flavors that are tinged with a bitter lime-skin note and bristling minerality.",Red Oak Vineyard,90,20,New York,Finger Lakes,Finger Lakes,Anna Lee C. Iijima,NA,Lamoreaux Landing 2011 Red Oak Vineyard Riesling (Finger Lakes),Riesling,Lamoreaux Landing
95829,Bulgaria,"Aromatic, with notes of orange blossom and lemon zest, this dry, bracing Chardonnay boasts surprising depth and minerality. Vibrant with lemony acidity, it finishes briskly, with a hint of lime-zest-like astringency.",Veni Vidi Vici,87,9,Thracian Valley,NA,NA,Anna Lee C. Iijima,NA,Vini 2011 Veni Vidi Vici Chardonnay (Thracian Valley),Chardonnay,Vini
95831,US,"Dry, acidic and a little earthy, this shows elegance and restraint. With a medium level of alcohol and subtle citrus and mineral flavors, this wine is ready to drink now with roasted chicken or grilled salmon.",Peters Vineyard,87,28,California,Russian River Valley,Sonoma,NA,NA,Kokomo 2011 Peters Vineyard Chardonnay (Russian River Valley),Chardonnay,Kokomo
95891,Italy,"The bouquet reveals subtle notes of honey, white flower and peach blossom. This sweet sparkler also shows a milky or creamy note on the finish, with a softly sweet endnote.",San Maurizio,84,9,Piedmont,Asti,NA,NA,NA,Cantina Vallebelbo 2011 San Maurizio Moscato (Asti),Moscato,Cantina Vallebelbo
95954,US,"Boundary Breaks is an exciting new project from the Finger Lakes, and the No. 239 is one of its best. While ebulliently fruity, almost tropical, on the nose, it's elegantly dry on the palate with a rich, creamy palate full of ripe grapefruit and peach flavors. Vibrant lemon-lime acidity, it finishes long with a hint of lime-skin pith.",No. 239 Dry,90,22,New York,Finger Lakes,Finger Lakes,Anna Lee C. Iijima,NA,Boundary Breaks 2011 No. 239 Dry Riesling (Finger Lakes),Riesling,Boundary Breaks
95965,South Africa,"This attractive, bright white opens with aromas of orange, green apple flesh and barely-ripe white peach. The light-weight mouth offers more of the same, alongside notes of melon rind and soft brioche. A slight creaminess is countered by brisk acidity, ending clean and refreshing. Drink now.",Estate,89,19,Simonsberg-Stellenbosch,NA,NA,Lauren Buzzeo,@laurbuzz,Morgenhof 2011 Estate Sauvignon Blanc (Simonsberg-Stellenbosch),Sauvignon Blanc,Morgenhof
96077,Chile,"Earthy aromas include notes of animal hide and leather along with herbal berry. This offers a good, round mouthfeel and bracing acidity, while flavors of berry and cassis are mildly green and herbal. A short finish is fresh in feel.",Gran Reserva,87,14,Colchagua Valley,NA,NA,Michael Schachner,@wineschach,Viu Manent 2011 Gran Reserva Cabernet Sauvignon (Colchagua Valley),Cabernet Sauvignon,Viu Manent
96088,France,"A wine that has a light, delicate sweetness, keeping total freshness as well as baked apple and honey flavors. Floral and aromatic, it's a wine more for apéritif than food, and ready to drink.",Les Deux Cèdres,87,15,Southwest France,Côtes de Gascogne,NA,Roger Voss,@vossroger,Domaine d'Arton 2011 Les Deux Cèdres Gros Manseng (Côtes de Gascogne),Gros Manseng,Domaine d'Arton
96107,Spain,"This is unusual in that it's heavily oaked, as evidenced by aromas of varnish, hard spice and resin. The mouthfeel is fresh on top of resiny, while flavors of dry oak, spice and mild apple and citrus operate in the background. While this wine has depth of body and acidic lift, it's dominated by the barrel.",Le Domaine Blanco de Guarda,87,40,Northern Spain,Vino de la Tierra de Castilla y León,NA,Michael Schachner,@wineschach,Abadia Retuerta 2011 Le Domaine Blanco de Guarda White (Vino de la Tierra de Castilla y León),White Blend,Abadia Retuerta
96321,France,"Made from 80-year-old vines from several parcels, this is a concentrated and dense wine. Red berry fruits give freshness, but it is the structure that counts. Drink from 2018.",Racines du Temps,92,NA,Burgundy,Gevrey-Chambertin,NA,Roger Voss,@vossroger,Domaine René Bouvier 2011 Racines du Temps  (Gevrey-Chambertin),Pinot Noir,Domaine René Bouvier
96334,US,"Numerous sites in the Horse Heaven Hills didn't produce fruit in 2011 due a late 2010 freeze. This wine bears witness to the glory of the vines that survived unscathed with its notes of huckleberry, dark coffee and smoked meat. The flavors are silky soft and glide along to a lingering, chocolate-filled finish.",Reserve Coyote Canyon Vineyard,92,30,Washington,Horse Heaven Hills,Columbia Valley,Sean P. Sullivan,@wawinereport,Columbia Crest 2011 Reserve Coyote Canyon Vineyard Syrah (Horse Heaven Hills),Syrah,Columbia Crest
96436,US,"The nose on this Sauvignon Blanc is an amalgam of white pepper, toast, white peach and pear aromas, highlighted by a squirt of kiwi juice. It feels plump but medium bodied, with a bitter hint of papaya seed and a touch of lime on the midpalate.",NA,84,24,Virginia,Virginia,NA,NA,NA,Doukénie 2011 Sauvignon Blanc (Virginia),Sauvignon Blanc,Doukénie
96747,Italy,"Aromas recall crushed raspberry, anisette, tilled earth and a whiff of cellar must. The soft palate doles out ripe black cherry, licorice and white pepper alongside polished tannins. It doesn't have much complexity but it's savory and already enjoyable. Drink through 2017.",NA,88,39,Piedmont,Barbaresco,NA,Kerin O’Keefe,@kerinokeefe,CarlindePaolo 2011  Barbaresco,Nebbiolo,CarlindePaolo
96905,US,"Coming from a reliable vineyard in the Los Alamos Valley, this wine presents aromas of dried violet, blackberry, leather and espresso. Brooding dried-cherry fruit directs the palate, which benefits further from roasted game and crushed oregano and thyme. The tannins are still prominent.",Black Oak Vineyard,88,42,California,Santa Ynez Valley,Central Coast,Matt Kettmann,@mattkettmann,Coquelicot 2011 Black Oak Vineyard Syrah (Santa Ynez Valley),Syrah,Coquelicot
96947,Italy,"Baked plum, roasted coffee bean, toast and a whiff of grilled herb lead the nose. The concentrated palate offers dried black cherry, blackberry jam and licorice alongside assertive tannins that leave a mouth-puckering finish. The fruit is showing signs of drying out so drink sooner rather than later.",NA,87,NA,Tuscany,Brunello di Montalcino,NA,Kerin O’Keefe,@kerinokeefe,Colombaio 2011  Brunello di Montalcino,Sangiovese,Colombaio
97108,France,"This wine seems rather unfocused with indistinct tannins and fruit. There is a soapy texture, and the red berry fruits seem awash with acidity.",NA,83,15,Bordeaux,Bordeaux,NA,Roger Voss,@vossroger,Château Bernés 2011  Bordeaux,Bordeaux-style Red Blend,Château Bernés
97297,Portugal,This is a good reminder that Touriga Nacional comes from originally from the Dão. The wine has power and dense tannins while also having a strongly textured character that shows up the granite soil of the region. The wine is just maturing and will be at its best from 2017.,Quinta da Gandara Reserva,92,25,Dão,NA,NA,Roger Voss,@vossroger,Caves da Montanha 2011 Quinta da Gandara Reserva Touriga Nacional (Dão),Touriga Nacional,Caves da Montanha
97486,US,"Shows the Morgan signature of full-bodied weight, concentrated raspberry and cherry fruit, brisk acidity, notable tannins and dryness that make their Pinots Noirs so enjoyable. Very nice to drink now and over the next 3–4 years.",Twelve Clones,88,32,California,Santa Lucia Highlands,Central Coast,NA,NA,Morgan 2011 Twelve Clones Pinot Noir (Santa Lucia Highlands),Pinot Noir,Morgan
97494,US,"Shows the bright acidity and pure fruit of the Santa Rita Hills, with lots of cherry pulp and bitter skin, red licorice and raspberry flavors. It's also moderate in alcohol. There's a troubling note of unripeness that may limit ageability, so drink up.",NA,88,44,California,Sta. Rita Hills,Central Coast,NA,NA,Dragonette 2011 Pinot Noir (Sta. Rita Hills),Pinot Noir,Dragonette
97780,US,"Tasty, medium bodied and well balanced, this offers gushing red cherry, plum and spicy oak in the aromas and a touch of red bell pepper in the flavors. A slight bite of tannin keeps it from being one dimensional.",Silvaspoons Vineyard,88,25,California,Lodi,Central Valley,Jim Gordon,@gordone_cellars,Fenestra 2011 Silvaspoons Vineyard Malbec (Lodi),Malbec,Fenestra
97794,US,"This wine offers aromas of jammy red fruit, golden raisins and abundant barrel spices. It's full bodied in style with rich cherry flavors, sharp-edged acids and barrel notes that run throughout and linger on the finish.",StoneTree Vineyard,88,37,Washington,Wahluke Slope,Columbia Valley,Sean P. Sullivan,@wawinereport,:Nota Bene 2011 StoneTree Vineyard Syrah (Wahluke Slope),Syrah,:Nota Bene
98044,France,"This is a dry, structured wine, with dry tannins and stalky fruit characteristics. However, it will develop into a fruity wine without great depth but with attractive berry flavors and acidity. Drink from 2016.",NA,87,24,Bordeaux,Haut-Médoc,NA,Roger Voss,@vossroger,Château Barreyres 2011  Haut-Médoc,Bordeaux-style Red Blend,Château Barreyres
98128,US,"Sweet-seeming oak aromas and spicy-sweet oak flavors bring excitement to this full-bodied wine. It smells like cedar and cinnamon, and tastes like blackberry jam on toast. A moderately tannic texture supports all that richness.",Grand Reserve,90,65,California,Amador County,Sierra Foothills,Jim Gordon,@gordone_cellars,Brooklyn West 2011 Grand Reserve Zinfandel (Amador County),Zinfandel,Brooklyn West
98197,France,"Firm and solid, this wine is more tannin than fruit at this stage. It does have some weight and acidity to it, showing potential for blackberry fruitiness with age.",NA,86,15,Bordeaux,Bordeaux,NA,Roger Voss,@vossroger,Château Bois Pertuis 2011  Bordeaux,Bordeaux-style Red Blend,Château Bois Pertuis
98217,South Africa,"The bouquet of this wine takes time to fully open, but eventually reveals a lush mélange of pineapple, honeydew, yellow apple, buttered popcorn and orange creamsicle. Ample acidity keeps the mouthfeel fresh and the palate lifted, giving levity to the ripe fruit flavors. A hint of flintiness lingers on the close. Drink now.",NA,88,23,Stellenbosch,NA,NA,Lauren Buzzeo,@laurbuzz,Meerlust 2011 Chardonnay (Stellenbosch),Chardonnay,Meerlust
98350,US,"This tastes sweet, with a honey-infused orange flavor. There's a crisp note of acidity for balance. Overall, this is easy to drink with almost anything calling for a white wine.",NA,85,14,California,Napa Valley,Napa,NA,NA,Honker Blanc 2011 Sauvignon Blanc (Napa Valley),Sauvignon Blanc,Honker Blanc
98363,US,"The price is right. It's soft and sweet, with jammy, candy flavors.",NA,81,8,California,California,California Other,NA,NA,The Original Dark Horse 2011 Cabernet Sauvignon (California),Cabernet Sauvignon,The Original Dark Horse
98414,US,"The Justine, a new, southern Rhône-style red blend from Avennia, is an expressive wine, with aromas of berries, plums and cassis. There's a whiff of smoked meat also, but the Grenache—roughly half of the blend—brings lovely fruit that trumps the rest. Delicious now, or cellar it for a few more years.",Justine,92,38,Washington,Columbia Valley (WA),Columbia Valley,Paul Gregutt,@paulgwine ,Avennia 2011 Justine Red (Columbia Valley (WA)),Rhône-style Red Blend,Avennia
98416,France,"An herbal and perfumed wine, its welcoming soft aromatic character comes from the Cabernet Franc in the blend. The wine has dusty tannins, rich and juicy black fruits and tamed Tannat structure, to give a ripe, full and opulent wine that will develop quickly. Drink now or, better, from 2015.",Aydie L'Origine,92,12,Southwest France,Madiran,NA,Roger Voss,@vossroger,Château d'Aydie 2011 Aydie L'Origine Tannat-Cabernet Franc (Madiran),Tannat-Cabernet Franc,Château d'Aydie
99191,Portugal,"Firm and tannic, this powerful wine is solid, foursquare and dense in structure. There is plenty of fruit as well, with the typical juiciness of Alicante Bouschet to give a ripe fruity character under the tannic structure. Drink this concentrated wine from 2017.",Dornas,90,22,Alentejano,NA,NA,Roger Voss,@vossroger,Espaço Rural 2011 Dornas Red (Alentejano),Portuguese Red,Espaço Rural
99282,South Africa,"A light and easy quaff with fresh notes of green apple, underripe peach and orangey citrus. Balanced and clean with a short finish. Drink now.",NA,84,14,Coastal Region,NA,NA,Lauren Buzzeo,@laurbuzz,Ernst Gouws & Co. 2011 Chardonnay (Coastal Region),Chardonnay,Ernst Gouws & Co.
