id,country,description,designation,points,price,province,region_1,region_2,taster_name,taster_twitter_handle,title,variety,winery
65444,Chile,"Spiced plum and raspberry aromas are on the full and dark side. This offers good volume and a medium-plus body with black cherry and black currant flavors. A dark-leaning, peppery finish tops off this full-fruited Pinot.",Hacienda Araucano Reserva,86,13,Central Valley,NA,NA,Michael Schachner,@wineschach,François Lurton 2012 Hacienda Araucano Reserva Pinot Noir (Central Valley),Pinot Noir,François Lurton
65524,US,"While savory on the nose with pungent whiffs of smoke and dried herb, this full-bodied Chardonnay is surprisingly forward with ripe, sunny peach and apricot flavors. Straightforward in style yet juicy and enjoyable.",Reserve,84,20,New York,Finger Lakes,Finger Lakes,Anna Lee C. Iijima,NA,Six Mile Creek 2012 Reserve Chardonnay (Finger Lakes),Chardonnay,Six Mile Creek
65583,France,"Always a dense, dark and concentrated selection, La Forge is a wine that is immediately attractive but would be best after a few years of cellaring. Notes of dark berry preserves, muddled boysenberry, raspberry sauce, cocoa, leather and truffle abound on the nose and palate. The mouthfeel is plush and creamy, with medium tannins and a texture like crushed velvet. The finish is long and spicy, offering notes of black pepper and charred oak spice.",La Forge,92,80,Languedoc-Roussillon,Corbières-Boutenac,NA,Lauren Buzzeo,@laurbuzz,Gérard Bertrand 2012 La Forge Carignan-Syrah (Corbières-Boutenac),Carignan-Syrah,Gérard Bertrand
65692,US,"Steely and crisp with lemon and lime, this Riesling would be ideal to sip while making a meal or at a picnic with friends. It's long on the finish with a texture that's weighty enough to go mano-a-mano with spicy sausage or seafood.",NA,87,18,California,Potter Valley,NA,Virginie Boone,@vboone,McFadden 2012 Riesling (Potter Valley),Riesling,McFadden
65910,US,"Cocoa, herb, raspberry, vanilla and spice aromas are out front on this wine. The blue and red fruit and barrel flavors are creamy in feel and carry through the finish.",NA,88,21,Washington,Columbia Valley (WA),Columbia Valley,Sean P. Sullivan,@wawinereport,Three Rivers 2012 Merlot (Columbia Valley (WA)),Merlot,Three Rivers
66016,US,"Oaky and full bodied, this conveys a strong impression of big berry fruit. Spice and herbal components are underplayed, letting the fruit come forth in all its glory. This is an attractive and ready-to-drink wine.",NA,90,34,California,Russian River Valley,Sonoma,Virginie Boone,@vboone,Fritz 2012 Pinot Noir (Russian River Valley),Pinot Noir,Fritz
66284,US,"This is an unusual blend of 41% Syrah, 20% Cabernet Franc, 18% Cabernet Sauvignon, 15% Malbec and 6% Mourvèdre from Phinny Hill and Rock Garden Estate vineyards. Aromas of green pepper, orange peel, earth, dried herbs and cherry lead to plump, mouthwatering savory flavors.",Wildebeest,87,25,Washington,Columbia Valley (WA),Columbia Valley,Sean P. Sullivan,@wawinereport,Buty 2012 Wildebeest Red (Columbia Valley (WA)),Red Blend,Buty
66355,New Zealand,"This is slightly Syrah-like in its aromas and flavors—which call to mind red cherries, cracked peppercorns and roasted meat—yet it's all Pinot Noir in terms of its weight and texture, finishing light and silky. Drink now.",Lumiere,88,24,Martinborough,NA,NA,Joe Czerwinski,@JoeCz,Alana Estate 2012 Lumiere Pinot Noir (Martinborough),Pinot Noir,Alana Estate
66500,Argentina,Roasted berry aromas are stalky at first but come around. This feels round but only marginally structured. Creamy ripe generic flavors of berry and cherry finish solid with some heat.,NA,86,15,Mendoza Province,Mendoza,NA,Michael Schachner,@wineschach,Tomero 2012 Cabernet Sauvignon (Mendoza),Cabernet Sauvignon,Tomero
66572,US,"From a vineyard just below Mt. Madonna, this bottling offers deep blackberry and black-pepper spice, with herbal oregano, thyme and touches of pasilla chile on the nose. It's quite herbaceous in that typical mountain style, with bay leaf and dried basil set against dry elderberry fruit.",Bates Ranch Vineyard,91,44,California,Santa Cruz Mountains,Central Coast,Matt Kettmann,@mattkettmann,Wrights Station 2012 Bates Ranch Vineyard Cabernet Sauvignon (Santa Cruz Mountains),Cabernet Sauvignon,Wrights Station
66900,Italy,"Intense rose aromas recall the fragrance found in many cold creams. The floral sensation carries over to the palate, along with candied fruit and baked pineapple, uplifted by a mineral note. Pair it with ripened cheeses.",Selezione,88,25,Northeastern Italy,Alto Adige,NA,Kerin O’Keefe,@kerinokeefe,Kössler 2012 Selezione Gewürztraminer (Alto Adige),Gewürztraminer,Kössler
66914,Portugal,"A wood-aged red Vinho Verde brings out some richness in the Vinhão grape. With its already-red juice, the wine has surprising weight and ripeness with black currant fruit to the fore. Drink now.",Aphros Tinto,88,NA,Vinho Verde,NA,NA,Roger Voss,@vossroger,Casal Paço Padreiro 2012 Aphros Tinto Vinhão (Vinho Verde),Vinhão,Casal Paço Padreiro
66951,US,"This wine offers dark coffee, green olive, savory notes and barrel spices. The flavors are lighter in style but with good concentration backed by firm, lipsmacking tannins.",Lawrence Vineyards,87,35,Washington,Columbia Valley (WA),Columbia Valley,Sean P. Sullivan,@wawinereport,Gård 2012 Lawrence Vineyards Cabernet Sauvignon (Columbia Valley (WA)),Cabernet Sauvignon,Gård
66972,US,"This biodynamically farmed wine comes from Steep Creek Ranch next to the winery facility and Nelson Vineyard on the shores of the Columbia River. It shows lots of intrigue, with pure notes of herbs, mulberry and mineral that are enjoyable yet elusive. It's clingy in feel, with elegant yet rich fruit flavors.",Estate Grown,87,60,Washington,Columbia Gorge (WA),Washington Other,Sean P. Sullivan,@wawinereport,Syncline 2012 Estate Grown Syrah (Columbia Gorge (WA)),Syrah,Syncline
67298,Greece,"Aromas of leather, cherry and plum lead this balanced red from Boutari. Ripe cherry, cedar and cinnamon flavors carry the palate, with soft tannins giving a sultry feel.",NA,89,17,Nemea,NA,NA,Susan Kostrzewa,@suskostrzewa,Boutari 2012 Agiorgitiko (Nemea),Agiorgitiko,Boutari
67341,US,"Threads of dark char, nuts and spice meander throughout this rich, deeply concentrated Bordeaux-style blend. Plump black cherry and cassis flavors are luscious on the palate, but invigorated by a bright flash of acidity and spice on the finish.",Optimus,89,25,New York,Finger Lakes,Finger Lakes,Anna Lee C. Iijima,NA,Swedish Hill 2012 Optimus Red (Finger Lakes),Bordeaux-style Red Blend,Swedish Hill
67443,US,"Here is a powerful young wine with concentrated plum and cherry fruit. It's beautifully built around perfectly ripened tannins that provide solid support without being intrusive. Compact and well proportioned, it lingers with highlights of espresso grounds, dark chocolate and black tea.",Abbott Claim,94,60,Oregon,Willamette Valley,NA,Paul Gregutt,@paulgwine ,Angela Estate 2012 Abbott Claim Pinot Noir,Pinot Noir,Angela Estate
67485,Australia,"The ample alcohol in this wine imparts a rich slightly syrupy feel to this wine that's not particularly Pinot-like, but still satisfying. Strawberry and raspberry notes carry a hint of tomato leaf, then finish with crisp acids.",The Feral Fox,88,32,South Australia,Adelaide Hills,NA,Joe Czerwinski,@JoeCz,D'Arenberg 2012 The Feral Fox Pinot Noir (Adelaide Hills),Pinot Noir,D'Arenberg
67530,Portugal,"An intense wine. it has a cool feel from its 900-foot-high vineyards. Plenty of acidity keeps it fresh and fruity, bringing out flavors of black currant as well as spicy wood. It could age a year, so wait until 2015.",Colleja,87,11,Douro,NA,NA,Roger Voss,@vossroger,Wines & Winemakers 2012 Colleja Red (Douro),Portuguese Red,Wines & Winemakers
67543,Italy,"A bold Sauvignon with aromas of crushed tomato vine, exotic fruit and cantaloupe. The forward, one-dimensional palate delivers ripe peach, apricot and honeydew melon.",NA,87,22,Northeastern Italy,Colli Orientali del Friuli,NA,Kerin O’Keefe,@kerinokeefe,La Tunella 2012 Sauvignon (Colli Orientali del Friuli),Sauvignon,La Tunella
67590,Italy,"Leather, earth, wild flower, cedar, red currant and wild cherry aromas lead the nose on this robust wine. The ripe, simple palate doles out rich black cherry, vanilla, cinnamon and clove alongside big, velvety tannins. Drink soon for freshness.",NA,88,15,Tuscany,Rosso di Montepulciano,NA,Kerin O’Keefe,@kerinokeefe,Poliziano 2012  Rosso di Montepulciano,Red Blend,Poliziano
67595,Austria,"This pale salmon-pink bubbly opens with frothy bubbles and an inviting note of hard candy. A rounded strawberry flavor unfolds on the palate and finishes dry, making this a lively, ideal party wine that will please many.",Brut Rosé,88,24,Österreichischer Sekt,NA,NA,Anne Krebiehl MW,@AnneInVino,Schlumberger Wein- und Sektkellerei 2012 Brut Rosé Sparkling (Österreichischer Sekt),Sparkling Blend,Schlumberger Wein- und Sektkellerei
67653,Italy,"Alluring aromas of pressed rose petal, menthol, woodland berry and a whiff of cedar follow over to the succulent palate along with crushed raspberry, tobacco and a sprinkling of white pepper. Fine-grained tannins provide an elegant structure while a licorice note wraps around the finish.",Le Vigne,94,155,Piedmont,Barolo,NA,Kerin O’Keefe,@kerinokeefe,Sandrone 2012 Le Vigne  (Barolo),Nebbiolo,Sandrone
67680,US,"This wine offers aromas of herbs, black cherry and spice, showing a bit of heat. The dark-fruit flavors have good intensity, with dry, astringent tannins backing them up.",NA,85,11,Washington,Columbia Valley (WA),Columbia Valley,Sean P. Sullivan,@wawinereport,Castle Rock 2012 Cabernet Sauvignon (Columbia Valley (WA)),Cabernet Sauvignon,Castle Rock
67744,Portugal,"With an extra year in bottle compared to the regular bottling of this wine, the wine has gained some extra depth and richness. It has spice, firm tannins and a juicy background of berry fruits. It's developing well and will be ready to drink from 2017.",Tagus Creek Reserva,89,15,Tejo,NA,NA,Roger Voss,@vossroger,Falua 2012 Tagus Creek Reserva Touriga Nacional-Cabernet Sauvignon (Tejo),Touriga Nacional-Cabernet Sauvignon,Falua
68068,Italy,"Fresh, firm and fragrant, this offers aromas of ripe berry, blue flower, chopped herb and a whiff of dark cooking spice. The round, savory palate delivers juicy black cherry, raspberry, clove and anise backed up by fresh acidity and smooth, polished tannins.",NA,91,NA,Piedmont,Barbera d'Alba Superiore,NA,Kerin O’Keefe,@kerinokeefe,Adriano Marco & Vittorio 2012  Barbera d'Alba Superiore,Barbera,Adriano Marco & Vittorio
68277,US,"Aromas of hot yet damp sandstone, very light Asian pear and scratched lemon emerge from this intriguing wine. Rounded nectarine and white flowers show on the bright and tight palate, boosted by lemon rinds and a fascinating minerality. It's perfect for lighter fare, from shellfish to chicken in cream sauce.",Honea Vineyard,90,20,California,Santa Ynez Valley,Central Coast,Matt Kettmann,@mattkettmann,Palmina 2012 Honea Vineyard Arneis (Santa Ynez Valley),Arneis,Palmina
68330,Italy,"This robust red opens with aromas of black-skinned berries, forest floor, herbs, cloves and balsamic notes. The brawny palate offers cherries marinated in spirits, licorice and espresso framed in firm polished tannins. You'll also the notice the heat of evident alcohol that throws the finish off balance.",NA,89,50,Tuscany,Brunello di Montalcino,NA,Kerin O’Keefe,@kerinokeefe,La Fortuna 2012  Brunello di Montalcino,Sangiovese,La Fortuna
68346,Italy,"Aromas of grilled porcini mushroom, scorched earth, dark spice and a whiff of crushed herb lead the nose. The brawny palate offers dried cherry, vanilla, prune and a hint of licorice alongside a backbone of bracing tannins. The heat of evident alcohol throws off the finish.",NA,89,80,Tuscany,Brunello di Montalcino,NA,Kerin O’Keefe,@kerinokeefe,Citille di Sopra 2012  Brunello di Montalcino,Sangiovese,Citille di Sopra
68354,France,"Fruit and more mature flavors are coming together, giving a structured wine with black-currant flavors balanced with mint, spice and a rounded texture. This stylish wine is almost ready to drink; just wait until summer 2016.",NA,90,65,Bordeaux,Saint-Émilion,NA,Roger Voss,@vossroger,Château de l'Annonciation 2012  Saint-Émilion,Bordeaux-style Red Blend,Château de l'Annonciation
68406,Austria,"Smooth red fruit notions of black and red cherry, tinged with some smokiness, characterize this easy red. Drink now.",Das Phantom,86,35,Burgenland,NA,NA,Anne Krebiehl MW,@AnneInVino,Kirnbauer 2012 Das Phantom Red (Burgenland),Red Blend,Kirnbauer
68619,Spain,"Stalky, damp aromas are low on freshness and fruit. This feels full and chunky but lacking in structure. Stalky, rubbery plum and berry flavors lead to a short, low-volume finish that tastes a bit salty.",Crianza,85,15,Northern Spain,Rioja,NA,Michael Schachner,@wineschach,Larchago 2012 Crianza  (Rioja),Tempranillo,Larchago
68641,US,"This blend of Cabernet Sauvignon, Malbec, Merlot and Petit Verdot is quite sizable on the palate. It explores where these varieties can go in terms of smokiness and deeper, more savory tastes of tobacco and clove.",Family Reserve Generations,85,60,California,Napa Valley,Napa,Virginie Boone,@vboone,Charles Krug 2012 Family Reserve Generations Red (Napa Valley),Cabernet Blend,Charles Krug
68762,US,"Blossoms and tangerines perfume this elegantly composed blend of Chardonnay, Viognier and Sauvignon Blanc. It's rich and creamy on the palate, with concentrated flavors of apple and quince, but finishes with a gorgeous sheen of salty oyster shells.",Gallery,88,60,New York,North Fork of Long Island,Long Island,Anna Lee C. Iijima,NA,Bedell 2012 Gallery White (North Fork of Long Island),White Blend,Bedell
68829,France,"This tastes jammy and very fruity, with tannins that are totally enveloped by the rich texture. Plummy and comfortable, it's all about ripe berries and currants. Smoky flavors come from the wood aging, and contrast with the Port-like lusciousness of the wine.",NA,92,NA,Bordeaux,Pauillac,NA,Roger Voss,@vossroger,Château Pontet-Canet 2012  Pauillac,Bordeaux-style Red Blend,Château Pontet-Canet
68993,US,"Lilacs and violets meet with black raspberries, blackberry pie and savory sage on the nose of this 42% Grenache, 38% Syrah and 20% Mourvèdre blend. The palate leans very savory, with tar, salt, anise and burned ends of roast beef combining for a hearty sipper.",Buona Derrata,91,50,California,Santa Maria Valley,Central Coast,Matt Kettmann,@mattkettmann,Mattina Fiore 2012 Buona Derrata G-S-M (Santa Maria Valley),G-S-M,Mattina Fiore
69133,US,"A perfect Pinot for a house wine, it does what it's supposed to do without a lot of frills. It shows ripe enough cherry and raspberry aromas, an appetizingly dry balance, firm acidity and moderate tannins to keep it lip-smacking and fresh.",NA,88,20,California,Anderson Valley,NA,Jim Gordon,@gordone_cellars,Navarro 2012 Pinot Noir (Anderson Valley),Pinot Noir,Navarro
69165,US,"Scents of caramelized grapefruit zest and tropical fruit take the fore. Lively acids frame the silky, medium-bodied palate.",NA,87,22,Virginia,Monticello,NA,NA,NA,Veritas 2012 Sauvignon Blanc (Monticello),Sauvignon Blanc,Veritas
69172,US,"Nearly purple in color, it is equally intense in flavor, almost like sipping a straight red wine, save for the low alcohol. This bottling, made by Turkish-born, former oil rig construction worker Ertugrul “Art” Sevtap, begins with candied pecans and other nutty aromas, then brings red apple, light herbals, and hazelnut to the palate. Pair with everything from cedar plank salmon to turkey burgers.",Awesome Rosé,87,22,California,Santa Ynez Valley,Central Coast,Matt Kettmann,@mattkettmann,Sevtap 2012 Awesome Rosé Sangiovese (Santa Ynez Valley),Sangiovese,Sevtap
69183,US,"Good for drinking now, it's bright in acidity, with long-lasting flavors of Meyer lemon, cantaloupe, vanilla bean and honey.",NA,87,24,California,Sonoma Valley,Sonoma,NA,NA,Lake Sonoma 2012 Sauvignon Blanc (Sonoma Valley),Sauvignon Blanc,Lake Sonoma
69436,US,"White apricot, spice and lemon flavors give character. Vibrant acidity lends the plump palate satisfying energy.",Neveah,87,35,Virginia,Virginia,NA,NA,NA,Tarara 2012 Neveah Chardonnay-Viognier (Virginia),Chardonnay-Viognier,Tarara
69579,Portugal,"A ripe, very fruity wine with enough softness to suggest sweetness. Smooth with red fruits and a touch of acidity, it's ready to drink now.",Tinto Reserva,84,8,Lisboa,NA,NA,Roger Voss,@vossroger,FVine 2012 Tinto Reserva Red (Lisboa),Portuguese Red,FVine
69587,US,"This is a dark, tannic Pinot Noir from a big vintage, hefty in dark berry fruit and a taste of leather. Affordable and widely distributed, it's a good choice for midweek meals.",Small Lot Blend,84,14,California,California,California Other,Virginie Boone,@vboone,Parducci 2012 Small Lot Blend Pinot Noir (California),Pinot Noir,Parducci
69641,Portugal,This wood-aged wine is full of toasty fruits and a mineral texture. Ripe apricots and sweet apples give a fruity aspect that is balanced by the toast and spice. Perfumed acidity finishes this wine that suggests further aging. Drink from 2016.,Monte Cascas Grande Reserva,89,NA,Douro,NA,NA,Roger Voss,@vossroger,Casca Wines 2012 Monte Cascas Grande Reserva White (Douro),Portuguese White,Casca Wines
69651,US,"This wine shows quite a bit of tropicality on the nose, with lychee and kiwi fruits, yet manages to remain restrained at the same time. It's soft on the palate, with white peach flesh, and shows a very intriguing herbal side, with tarragon and mint flavors, but not in a green pepper way at all.",NA,89,24,California,Santa Barbara County,Central Coast,Matt Kettmann,@mattkettmann,Consilience 2012 Viognier (Santa Barbara County),Viognier,Consilience
69672,US,"The aromas seem a bit stewed, with notes of tomato leaf and pickling spices. The blue-fruit flavors are high octane, showing some heat on the finish.",NA,86,30,Washington,Yakima Valley,Columbia Valley,Sean P. Sullivan,@wawinereport,Coach House 2012 Syrah (Yakima Valley),Syrah,Coach House
69734,US,"This is the first release of this new vineyard site for the producer, from a cool property planted by the producer with the help of local grower Jim Pratt, who also supplies Pinot Noir under the Pratt Vineyard name. Still working things out, the wine is earthy and intense, a tightly wound expression of tart cherry and pomegranate, with layers of intriguing clove and dried herbs.",Mardikian Estate,90,85,California,Sonoma Coast,Sonoma,Virginie Boone,@vboone,MacPhail 2012 Mardikian Estate Pinot Noir (Sonoma Coast),Pinot Noir,MacPhail
69955,France,"Tightly herbaceous and very crisp, grassy and citrusy, this is the epitome of cool, fresh Sauvignon Blanc. It's a light, bright, easy-drinking wine that's ready to go now.",NA,86,11,Southwest France,Côtes de Gascogne,NA,Roger Voss,@vossroger,Domaine Uby 2012 Sauvignon Blanc (Côtes de Gascogne),Sauvignon Blanc,Domaine Uby
69969,US,"This youthful rosé spent 16 hours on the skins, then was fermented and aged in stainless steel. It's light and tart, best enjoyed well-chilled on a hot summer day.",Rosé,85,18,Washington,Columbia Valley (WA),Columbia Valley,Paul Gregutt,@paulgwine ,Castillo De Feliciana 2012 Rosé Tempranillo (Columbia Valley (WA)),Tempranillo,Castillo De Feliciana
69970,France,"This is a ripe wine, its herbaceous character tempered by green plum and pineapple flavors. It's full in the mouth, with a hint of steeliness to give texture. Great to drink this summer.",NA,85,12,Southwest France,Côtes de Gascogne,NA,Roger Voss,@vossroger,Domaine de l'Herré 2012 Sauvignon Blanc (Côtes de Gascogne),Sauvignon Blanc,Domaine de l'Herré
69981,Austria,"This fresh, fragrant wine is buoyed by citrus acidity and green apples. It's all fruit—light and bright—finishing with a tangy lemon-zest character. Screwcap.",Strauss White,85,12,Steiermark,NA,NA,Roger Voss,@vossroger,Strauss 2012 Strauss White White (Steiermark),Austrian white blend,Strauss
70062,US,"A candied, buttery aroma, ripe fruit flavors and full body characterize this wine. It seems to have a strong spicy influence that comes with firm tannins and an almost-sweet character.",Estate,86,38,California,Livermore Valley,Central Coast,Jim Gordon,@gordone_cellars,Las Positas 2012 Estate Tempranillo (Livermore Valley),Tempranillo,Las Positas
70119,US,"Peppery, grapey flavors, full body and a rich fine-grained texture make this wine distinctive to taste and soothing to drink. It's a very good example of a GSM, capturing the fullness and generosity of this type of blend made from Grenache, Syrah and Mourvèdre grapes.",C'est Si Bon Naggiar Vineyard,89,28,California,Sierra Foothills,Sierra Foothills,Jim Gordon,@gordone_cellars,Elyse 2012 C'est Si Bon Naggiar Vineyard Red (Sierra Foothills),Red Blend,Elyse
70457,Italy,"Juicy red berry, brimstone, leather, licorice, mint and thyme are just some of the aromas and flavors of this powerfully structured wine. Despite the muscular build, it's also loaded with finesse, boasting firm but noble tannins that accompany the layers of savory flavors. Drink 2016–2022.",Contrada C,92,54,Sicily & Sardinia,Terre Siciliane,NA,Kerin O’Keefe,@kerinokeefe,Passopisciaro 2012 Contrada C Nerello Mascalese (Terre Siciliane),Nerello Mascalese,Passopisciaro
70462,Portugal,"Foot trodden in traditional open granite lagars, this is an elegant wine. Ripe black plum jelly flavors are balanced by firm tannins and a fresher edge. It's a wine that will develop over a long time, although with its fruit it's almost ready to drink now. Ideally, though, keep it until 2025.",Adelaide Vintage,92,110,Port,NA,NA,Roger Voss,@vossroger,Quinta do Vallado 2012 Adelaide Vintage  (Port),Port,Quinta do Vallado
70480,Argentina,Candied cherry and red-plum aromas precede an edgy palate and herbal flavors of plum and berry that are slightly hot and spicy. Raspberry and red-currant flavors on the finish are dilute.,NA,84,13,Mendoza Province,Mendoza,NA,Michael Schachner,@wineschach,Tercos 2012 Malbec (Mendoza),Malbec,Tercos
70482,US,"There's a salinity to this wine, which is grown to the west of Gilroy on the lower foothills of the Santa Cruz Mountains. Aromas are brackish and suggest sweet lemons, while the palate offers apples, squeezed citrus and a waxy character.",Estate,84,20,California,Santa Clara Valley,Central Coast,Matt Kettmann,@mattkettmann,Sarah's Vineyard 2012 Estate Grenache Blanc (Santa Clara Valley),Grenache Blanc,Sarah's Vineyard
70508,US,"From the well-known Zinfandel producer, this floral Chardonnay is high in balanced minerality and marked by darker, riper pear and apple fruit. The finish is swathed in vanilla bean and toast.",NA,90,55,California,Napa Valley,Napa,Virginie Boone,@vboone,Brown Estate 2012 Chardonnay (Napa Valley),Chardonnay,Brown Estate
70681,US,"From the Wits' End estate vineyard's best lots, this offers a complex fruit mix running from orange and pineapple into raspberry and cherry. A suggestion of Dr Pepper soda is in play also, and the wine shines with excellent texture and freshness.",Private Stash #10,90,75,Oregon,Chehalem Mountains,Willamette Valley,Paul Gregutt,@paulgwine ,Roco 2012 Private Stash #10 Pinot Noir (Chehalem Mountains),Pinot Noir,Roco
70731,US,"Herb and spice aromas mix with volatile notes. The flavors are light and elegant, but seem a bit faint.",NA,83,40,Washington,Walla Walla Valley (WA),Columbia Valley,Sean P. Sullivan,@wawinereport,Tucannon 2012 Syrah (Walla Walla Valley (WA)),Syrah,Tucannon
70781,Spain,"Candied, jammy red-fruit aromas come with a whiff of animal fur. This feels standard at best, loose and flabby at worst. Raspberry, plum and grapy flavors finish plump and fruity but with no real complexity.",Sila,85,16,Galicia,Monterrei,NA,Michael Schachner,@wineschach,Pazos del Rey 2012 Sila Mencía (Monterrei),Mencía,Pazos del Rey
70929,US,"Evergreen and herb notes accompany fresh apple and lemon flavors in this dry, medium-bodied wine. The palate is brisk with focused acidity and an invigorating lime-zest astringency on the finish.",Dry,89,17,New York,Finger Lakes,Finger Lakes,Anna Lee C. Iijima,NA,Red Newt Cellars 2012 Dry Riesling (Finger Lakes),Riesling,Red Newt Cellars
71136,Spain,This leesy wine has a lot of vanilla on the nose and a tan color. It shows only modest intensity on the palate along with distant flavors of apple and melon. A soft finish says drink this immediately because it may not last long into 2014.,NA,85,12,Galicia,Rías Baixas,NA,Michael Schachner,@wineschach,Pazo Serantellos 2012 Albariño (Rías Baixas),Albariño,Pazo Serantellos
71142,US,"This is a savory wine whose price makes it a decent value. It's crisp in acidity, with off-dry lemon, lime, tangerine and honey flavors. Easy to drink with almost anything that calls for a slightly sweet white wine.",Estate Grown,85,18,California,Oak Knoll District,Napa,NA,NA,Materra Cunat Family Vineyards 2012 Estate Grown Sauvignon Blanc (Oak Knoll District),Sauvignon Blanc,Materra Cunat Family Vineyards
71197,Italy,"Opening with an alluring fragrance of acacia flower, Spanish broom and beeswax, this boasts fleshy peach and juicy pineapple flavors, along with mineral notes and a drop of honey. It has lovely depth and should evolve more complexity over the next 2–3 years.",Versiano,90,18,Central Italy,Verdicchio dei Castelli di Jesi Classico Superiore,NA,Kerin O’Keefe,@kerinokeefe,Vignamato 2012 Versiano  (Verdicchio dei Castelli di Jesi Classico Superiore),Verdicchio,Vignamato
