id,country,description,designation,points,price,province,region_1,region_2,taster_name,taster_twitter_handle,title,variety,winery
55541,US,"This electric-pink-colored wine is a saignée-blend of Merlot, Malbec, Cabernet Sauvignon, Sangiovese and Barbera. Aromas of cherry and herb lead to broad off-dry tangy cherry flavors that don't seem fully connected together.",180 Degrees,82,35,Washington,Columbia Valley (WA),Columbia Valley,Sean P. Sullivan,@wawinereport,Mellisoni 2016 180 Degrees Rosé (Columbia Valley (WA)),Rosé,Mellisoni
55728,US,"Matchstick aromas are joined by a fleshy tropical character that defines this wine, which is aged in stainless steel drums, neutral French oak and a touch of new Acacia. Robust and ripe, it offers a boldness of vanilla and melon.",Virginia's Block Jane's Vineyard,86,25,California,Russian River Valley,Sonoma,Virginie Boone,@vboone,Davis Bynum 2016 Virginia's Block Jane's Vineyard Sauvignon Blanc (Russian River Valley),Sauvignon Blanc,Davis Bynum
55729,Argentina,"Smoky plum aromas give way to a crisp palate with sheer acidity. Flavors of tomato, plum and cherry are more raw than voluptuous. On the finish, this racy Cab displays enamel-peeling acidity and a can't-miss sense of freshness.",Made With Organically Grown Grapes,86,13,Mendoza Province,Tupungato,NA,Michael Schachner,@wineschach,Domaine Bousquet 2016 Made With Organically Grown Grapes Cabernet Sauvignon (Tupungato),Cabernet Sauvignon,Domaine Bousquet
55819,Italy,"This juicy wine opens with intense violet, red-skinned berry and white pepper aromas. The savory palate delivers red cherry and cooking spice flavors while polished tannins provide support. It's made to be enjoyed young, so drink soon.",NA,88,20,Piedmont,Dolcetto d'Alba,NA,Kerin O’Keefe,@kerinokeefe,Giuseppe Cortese 2016  Dolcetto d'Alba,Dolcetto,Giuseppe Cortese
55830,France,The wine is light and crisp with lemon acidity and with a zesty bright texture. There is a touch of minerality and a clean lively aftertaste. Drink now.,Domaine de la Grenaudière Sur Lie,87,10,Loire Valley,Muscadet Sèvre et Maine,NA,Roger Voss,@vossroger,Ollivier Frères 2016 Domaine de la Grenaudière Sur Lie  (Muscadet Sèvre et Maine),Melon,Ollivier Frères
56113,US,"Almost mauve in color, this widely distributed wine (named after the time the winemaking crew pops open their bottles at home) shows candied strawberry, watermelon Jolly Rancher and a touch of slate on the nose. Tons of tongue-tingling acidity and a expertly grippy texture cut through the watermelon and raspberry flavors.",515 Vine Select,89,15,California,Central Coast,Central Coast,Matt Kettmann,@mattkettmann,Noble Vines 2016 515 Vine Select Rosé (Central Coast),Rosé,Noble Vines
56250,US,"Subtle savory mineral flavors and an impressive mouth-filling texture give a unique personality to this medium-bodied wine. An unusual blend of Sauvignon Blanc and Marsanne, it has tangy acidity offset by hints of richness while lemon and crisp apple flavors light up the palate.",Variations on a Theme,91,35,California,California,California Other,Jim Gordon,@gordone_cellars,Monochrome 2016 Variations on a Theme White (California),White Blend,Monochrome
56424,US,"This well-made wine is concise and focused, with pinpoint flavors of cut pear holding the core. Hints of thin red berry and a whiff of tea-tree oil animate the nose. It's unusual and well made.",Terroir Series,91,32,Oregon,Willamette Valley,Willamette Valley,Paul Gregutt,@paulgwine ,Alexana 2016 Terroir Series Pinot Gris (Willamette Valley),Pinot Gris,Alexana
56697,US,"Robust in body and alcohol, this lavish Pinot Noir rosé offers juicy blackberry and cherry flavors. Dry in style with a rich, slightly dense texture, it suggests pairing with a full meal rather than enjoying as an apéritif.",Reserve Pinot Noir,87,35,New York,Finger Lakes,Finger Lakes,Anna Lee C. Iijima,NA,Heron Hill 2016 Reserve Pinot Noir Rosé (Finger Lakes),Rosé,Heron Hill
56877,France,"Light to medium in body, this rosé is crisper and tauter than many coming out of the Southern Rhône. Zest citrus aromas lead into flavors of grapefruit, with crushed stone notes reverberating on the finish. Drink now.",Loubié,86,17,Rhône Valley,NA,NA,Joe Czerwinski,@JoeCz,Domaine de Mourchon 2016 Loubié Rosé,Rosé,Domaine de Mourchon
57372,US,"The maraschino cherry-like aromas of this pink wine evoke a delicious Shirley Temple cocktail, with touches of lemon-lime soda and raspberry. There is solid acidity and grip to the palate, as well as red apple and wet slate flavors.",NA,89,25,California,Happy Canyon of Santa Barbara,Central Coast,Matt Kettmann,@mattkettmann,Dragonette 2016 Rosé (Happy Canyon of Santa Barbara),Rosé,Dragonette
57658,France,"Mainly made from the local star Négrette, this is a rounded ripe wine. It has spice and attractive caramel flavors as well as plenty of fruity acidity. Made to drink young, it is ready for the summer.",L'Allégresse,87,14,Southwest France,Fronton,NA,Roger Voss,@vossroger,Château Bellevue la Forêt 2016 L'Allégresse Rosé (Fronton),Rosé,Château Bellevue la Forêt
57660,France,"One of a pair of wines from this producer paying homage to neighboring regions, this wine references the Malbec of Cahors. It is softer than some Malbecs, bringing out the grape's fruitiness and acidity rather than its structure. That makes it a candidate for drinking young, starting from early 2018.",NA,87,12,Southwest France,NA,NA,Roger Voss,@vossroger,Château Coutinel 2016 Malbec,Malbec,Château Coutinel
57668,France,"This is a round full style of rosé. As a result, it is also soft and rich. The balance between the ripe strawberry fruits and the crisper acidity is just right. Drink this wine now.",NA,87,13,Provence,Côtes de Provence La Londe,NA,Roger Voss,@vossroger,Domaine des Fouques 2016 Rosé (Côtes de Provence La Londe),Rosé,Domaine des Fouques
59028,Italy,"Savory and intriguing, this opens with heady scents suggesting ripe apricot, honeydew melon and Spanish broom. The round enveloping palate doles out juicy peach, ripe pear, bitter almond and a hint of honey. Mouthwatering acidity and a blast of tangerine give it a mouthwatering close.",Vigna Rocca,91,15,Central Italy,Romagna,NA,Kerin O’Keefe,@kerinokeefe,Tre Monti 2016 Vigna Rocca Albana (Romagna),Albana,Tre Monti
59373,Austria,"Slightly creamy blossom and peach hints mark the nose of this wine. The palate is gently fruited—dry and light with a lovely aromatic aura of honeysuckle, jasmin, peach and lemon. Lithe and bright, it's perfect for a summer night.",Kapellenweg,91,22,Niederösterreich,NA,NA,Anne Krebiehl MW,@AnneInVino,Stadlmann 2016 Kapellenweg Gelber Muskateller (Niederösterreich),Gelber Muskateller,Stadlmann
60061,Chile,"Oaky, nutty, slightly oily aromas lead to a regular-feeling palate with resiny weight. Salty, lightly oaked flavors of stone fruits don't change much on a finish with melony flavors and light barrel notes.",NA,86,10,Casablanca Valley,NA,NA,Michael Schachner,@wineschach,Veramonte 2016 Chardonnay (Casablanca Valley),Chardonnay,Veramonte
60079,US,"Contemporary Grenache Blanc expressions lean tight and bright, but this bottling takes an extremely tropical approach, showing honeydew, banana cream and bubblegum on the nose. It's restrained upon first sip before overpowering tropical waves take hold. A well-made wine, it will find fans who crave this flowery style.",NA,86,28,California,Santa Barbara County,Central Coast,Matt Kettmann,@mattkettmann,Curran 2016 Grenache Blanc (Santa Barbara County),Grenache Blanc,Curran
60081,France,"Grapefruit spiciness and fruit is promised on the nose. The palate does not quite keep the zesty promise, diluting that freshness a little. But there is enough focus to take this to a dry fresh finish.",Granit,86,NA,Alsace,Alsace,NA,Anne Krebiehl MW,@AnneInVino,Domaine Charles Frey 2016 Granit Riesling (Alsace),Riesling,Domaine Charles Frey
61740,Argentina,"Gritty rubbery aromas are low on fruit and suggestive of tire rubber. A choppy palate shows lean peppery spicy plum flavors, while this tastes herbal and slightly tomatoey on the finish, sort of like pizza.",Cameleon Made With Organically Grown Grapes,85,15,Mendoza Province,Tupungato,NA,Michael Schachner,@wineschach,Domaine Bousquet 2016 Cameleon Made With Organically Grown Grapes Cabernet Sauvignon (Tupungato),Cabernet Sauvignon,Domaine Bousquet
63658,Portugal,"Part of a series that showcases major grape varieties, this wine brings out the creamy, green and apple-fruit character of the Chardonnay. It conveys hints of tropical fruits and a ripe apricot flavor. Balanced acidity lifts all this rich fruitiness. Drink from late 2017.",Grand'Arte,88,13,Lisboa,NA,NA,Roger Voss,@vossroger,DFJ Vinhos 2016 Grand'Arte Chardonnay (Lisboa),Chardonnay,DFJ Vinhos
63666,France,"This Burgundian producer has made a lightly wood-aged, ripe wine. It shows sophisticated balance between ripe fruit and spicy acidity and is smooth, generous and ready to drink.",NA,88,15,France Other,Vin de France,NA,Roger Voss,@vossroger,Doudet Naudin 2016 Chardonnay (Vin de France),Chardonnay,Doudet Naudin
63991,US,"The aromas seem a bit off, with volatile notes along with lees, orange peel and peach. The palate is lightly creamy but still somewhat lean in style, not able to hold all of the flavors together.",NA,85,25,Washington,Walla Walla Valley (WA),Columbia Valley,Sean P. Sullivan,@wawinereport,Bontzu 2016 Viognier (Walla Walla Valley (WA)),Viognier,Bontzu
65071,US,"Incorporating 30% of the variety in Musqué clone, this wine offers fresh flavors of green apple, grass and pea shoots, as well as a distinct notion of oak. Aged in both new and neutral Acacia, as well as stainless, it has a spicy quality akin to lemongrass that lingers on the finish.",Lizzy's Vineyard,86,32,California,Oakville,Napa,Virginie Boone,@vboone,Tamber Bey 2016 Lizzy's Vineyard Sauvignon Blanc (Oakville),Sauvignon Blanc,Tamber Bey
65079,France,"This crisp, citrus-flavored wine has bright acidity and a touch of vanilla. It has great fruitiness, dominated by lemon with the tang of orange zest. It is ready to drink.",NA,86,15,Burgundy,Bourgogne,NA,Roger Voss,@vossroger,Château de Pizay 2016  Bourgogne,Chardonnay,Château de Pizay
66162,France,"This wine is tight and closed at this stage, although it has great potential. The fruit is lively and crisp, just waiting to burst out with citrus and sliced apple fruitiness. Wait until late 2017.",NA,88,15,Bordeaux,Bordeaux Blanc,NA,Roger Voss,@vossroger,Château de Lussac 2016  Bordeaux Blanc,Bordeaux-style White Blend,Château de Lussac
67147,US,"Fresh and fruity without overdoing it, this medium-bodied wine has light notes of apple, banana, peach and cherry in the aromas and the flavors, and a good snappy texture to balance them out. Perfect for the cocktail hour.",3 Graces Blanc,88,25,California,Shenandoah Valley (CA),Sierra Foothills,Jim Gordon,@gordone_cellars,Bella Grace 2016 3 Graces Blanc White (Shenandoah Valley (CA)),Rhône-style White Blend,Bella Grace
68233,Austria,"The understated but alluring perfume of ripe pear peel leads the nose of this wine. Its concentrated body has the lovely, peppery, yeasty midpalate feel that we always hope for in Grüner. Subtle, light, savory and fresh, it finishes dry and zesty.",Freiheit,91,20,Niederösterreich,NA,NA,Anne Krebiehl MW,@AnneInVino,Nigl 2016 Freiheit Grüner Veltliner (Niederösterreich),Grüner Veltliner,Nigl
68243,Austria,"A tender, floral aroma hovers over the glass in this typical Viennese field blend. The fresh, brightly toned palate sings with a host of flavors: crisp green apple, fragrant grape, zesty citrus and juicy yellow pear. A phenolic, spicy edge gives it depth and appeal. A real glassful of Vienna that's dry and delicious.",NA,91,23,Wiener Gemischter Satz,NA,NA,Anne Krebiehl MW,@AnneInVino,Stift Klosterneuburg 2016 White (Wiener Gemischter Satz),White Blend,Stift Klosterneuburg
68851,Italy,"This informal red shows subdued iris and baking spice aromas. It's easygoing on the palate, with raspberry fruit, a bitter almond note and smooth tannins. Enjoy soon.",Furèt,86,15,Piedmont,Dolcetto d'Alba,NA,Kerin O’Keefe,@kerinokeefe,Villadoria 2016 Furèt  (Dolcetto d'Alba),Dolcetto,Villadoria
71224,Italy,"Aromas of bread crust and lime follow over to the lean bone-dry palate along with a suggestion of pear. It's lightly sparkling and crisp, with some brisk acidity.",Col Fondo,87,22,Veneto,Prosecco,NA,Kerin O’Keefe,@kerinokeefe,De Stefani 2016 Col Fondo  (Prosecco),Glera,De Stefani
71228,US,"Made by the saignée process, where the juice is bled from the principal ferment to concentrate the Pinot Noir, this rosé is blocky and simple. Light flavors of strawberry and cherry are finished dry and fade quickly. Drink this well chilled before the next vintage appears.",Rosé of,87,22,Oregon,Dundee Hills,Willamette Valley,Paul Gregutt,@paulgwine ,Winter's Hill 2016 Rosé of Pinot Noir (Dundee Hills),Pinot Noir,Winter's Hill
71231,US,"Aromas of ripe apple, sliced pear and white flowers lead to tart, lighter-side-of-medium-bodied fruit flavors. Spices notes fill out the finish. It delivers easy-drinking enjoyment and is very varietal.",Daisy,87,13,Washington,Washington,Washington Other,Sean P. Sullivan,@wawinereport,Bieler Family 2016 Daisy Pinot Grigio (Washington),Pinot Grigio,Bieler Family
71545,US,"Made from tank-fermented Pinot Noir and Cabernet Sauvignon, saignée-method, this wine is lightly floral and crisp in acidity, subtle in ripeness. Cherry and vanilla flavor meld together well, providing understated refreshment.",NA,87,15,California,Napa Valley,Napa,Virginie Boone,@vboone,Emerald Hare 2016 Rosé (Napa Valley),Rosé,Emerald Hare
71777,France,"This estate wine is packed with attractive fruit. With grapefruit and orange-zest flavors, it is tightly crisp. Set against that are the ripe red-currant and berry fruitiness, layers of acidity and a pinch of pepper. Drink this refreshing wine now.",NA,90,25,Provence,Côtes de Provence,NA,Roger Voss,@vossroger,Château les Valentines 2016 Rosé (Côtes de Provence),Rosé,Château les Valentines
72449,Portugal,"This warm, ripe wine is full of great, easy fruitiness. With lemon zest and fine acidity, the wine is refreshing and lively. This is a great apéritif style, poised between really crisp and soft.",Quartilho,87,15,Tejo,NA,NA,Roger Voss,@vossroger,Quinta do Casal Branco 2016 Quartilho Fernão Pires (Tejo),Fernão Pires,Quinta do Casal Branco
72983,Australia,"Lemon, blossoms and a slight kerosene nose lead into a prickly, slippery texture, with lemon-lime and wet stone flavors. A classic example of Clare Valley Riesling.",St. Andrews,89,40,South Australia,Clare Valley,NA,NA,NA,Wakefield 2016 St. Andrews Riesling (Clare Valley),Riesling,Wakefield
73952,France,"This crisply herbal wine also introduces some richer apricot flavors. A joint venture between négociant Schröder & Schÿler and the Barton family of Léoville and Langoa Barton, it's attractive, fruity and full in the mouth. Drink now.",La Croix Barton,85,16,Bordeaux,Bordeaux Blanc,NA,Roger Voss,@vossroger,Schröder & Schÿler 2016 La Croix Barton  (Bordeaux Blanc),Sauvignon Blanc,Schröder & Schÿler
73962,Portugal,"This is a soft wine, a blend of Aragonez and Merlot. It has a ripe rounded character that is lightly cut with acidity. It is an easy wine, perfumed and ready to drink.",NA,85,22,Alentejano,NA,NA,Roger Voss,@vossroger,Cortes de Cima 2016 Rosé (Alentejano),Rosé,Cortes de Cima
73969,US,"This Vidal Blanc has intriguing aromas of honeysuckle, peach and powdered ginger. On the palate it is reminiscent of a sugar cookie. This is an easy-drinking wine, light in body and complexity.",NA,85,17,Virginia,Virginia,NA,Carrie Dykes,NA,Gray Ghost 2016 Vidal Blanc (Virginia),Vidal Blanc,Gray Ghost
74021,US,"Zesty and fresh, this bristling Grüner Veltliner offers pristine tangerine, lime and melon flavors. While delicate in concentration, vibrant acidity and crisp lime pith notes reverberate on the finish. Drink now through 2019.",NA,89,15,New York,Finger Lakes,Finger Lakes,Anna Lee C. Iijima,NA,Dr. Konstantin Frank 2016 Grüner Veltliner (Finger Lakes),Grüner Veltliner,Dr. Konstantin Frank
74514,US,"Steely and firm, this is taut to the point of muscular. Its tart apple fruit is accented with lemon rind flavors, suggesting some prolonged skin contact. Drink now through 2022.",NA,89,19,Oregon,Willamette Valley,Willamette Valley,Paul Gregutt,@paulgwine ,Elk Cove 2016 Pinot Blanc (Willamette Valley),Pinot Blanc,Elk Cove
74627,Spain,"Punchy pyrazine and citrus aromas suggest austere Sauvignon Blanc. This feels tight and lean, while boxed-in flavors of grapefruit and bitter citrus pith finish short but with vitality.",Vendimia Nocturna,84,13,Northern Spain,Vino de la Tierra de Castilla y León,NA,Michael Schachner,@wineschach,Pradorey 2016 Vendimia Nocturna Verdejo (Vino de la Tierra de Castilla y León),Verdejo,Pradorey
74630,France,"An earthy aroma comes from this vivid dark red wine. It is gently soft, not quite dry and with black-plum fruits. The aftertaste is soft, very fruity and ready to drink.",Tarani,84,12,Southwest France,NA,NA,Roger Voss,@vossroger,Vinovalie 2016 Tarani Malbec,Malbec,Vinovalie
74765,Spain,"Dry aromas of pithy citrus fruits come with a hint of fresh-cut grass. This feels steely and pure, with flavors of citrus fruits, nectarine and green apple. A racy finish offers tropical fruit flavors and a spot of bitterness.",Edición Especial 10 Años,90,14,Galicia,Rías Baixas,NA,Michael Schachner,@wineschach,Valmiñor 2016 Edición Especial 10 Años Albariño (Rías Baixas),Albariño,Valmiñor
75289,Portugal,"This stalky wine has a green character that gives a bell pepper taste. That comes through the tight tannins and acidity, contrasting with the black-currant fruit. Drink now.",Fonte da Serrana,84,9,Alentejano,NA,NA,Roger Voss,@vossroger,Monte da Ravasqueira 2016 Fonte da Serrana Red (Alentejano),Portuguese Red,Monte da Ravasqueira
75804,France,"This is a warm, fruity wine with a flavor profile that fluctuates between citrus and pear qualities. It has vanilla, almond and attractive spice accents, finishing balanced and ready to drink.",NA,87,10,France Other,Vin de France,NA,Roger Voss,@vossroger,Maison de la Villette 2016 Chardonnay (Vin de France),Chardonnay,Maison de la Villette
75809,Argentina,"This cloudy, unfiltered Sauvignon Blanc charts new territory for Argentina. Ripe flavors of peach, pear and melon turn more bitter on the finish, which isn't long due to modest acidity.",Breva,87,42,Mendoza Province,Luján de Cuyo,NA,Michael Schachner,@wineschach,Alpamanta 2016 Breva Sauvignon Blanc (Luján de Cuyo),Sauvignon Blanc,Alpamanta
75823,France,"This is a delightfully fruity wine from one of the old estates in Muscadet. With crisp apple flavors and lively acidity, it is cool, clean, full of zesty fruitiness. Drink now.",Sur Lie,87,16,Loire Valley,Muscadet Sèvre et Maine,NA,Roger Voss,@vossroger,Chateau de l'Oiselinière 2016 Sur Lie  (Muscadet Sèvre et Maine),Melon,Chateau de l'Oiselinière
76788,Austria,"A creamy, rounded note hits the nose first, followed by aromas of green apple and pear. The palate presents lemony freshness that makes this an easy, dry and refreshing white with a lovely green-apple finish.",NA,88,15,Weinland Österreich,NA,NA,Anne Krebiehl MW,@AnneInVino,H. & M. Hofer 2016 Grüner Veltliner (Weinland Österreich),Grüner Veltliner,H. & M. Hofer
77053,France,"This is all light fruit and crisp acidity. Bright and light, brimming with citrus and apples, the wine is ready to drink. It comes from the western end of the Muscadet vineyards near the Lac de Grand-Lieu.",Les Parcelles Sur Lie,87,12,Loire Valley,Muscadet Côtes de Grandlieu,NA,Roger Voss,@vossroger,Domaine les Hautes Noëlles 2016 Les Parcelles Sur Lie  (Muscadet Côtes de Grandlieu),Melon,Domaine les Hautes Noëlles
77059,Portugal,"This juicy wine is ripe with black fruits cut with acidity. A firm tannic core sustains this rich fruitiness, giving the wine enough structure to age further. Drink from 2018.",Alves Vieira,87,12,Alentejano,NA,NA,Roger Voss,@vossroger,Herdade do Rocim 2016 Alves Vieira Red (Alentejano),Portuguese Red,Herdade do Rocim
77068,US,"One of the producer's three different rosés, this was also made using the saignée method. Its light strawberry and watermelon fruit flavors come through, with ample orange- and citrus-like acidity.",Coelho Estates Pinot Noir,86,23,Oregon,Willamette Valley,Willamette Valley,Paul Gregutt,@paulgwine ,Coelho 2016 Coelho Estates Pinot Noir Rosé (Willamette Valley),Rosé,Coelho
77191,US,"Very light in the glass and fresh on the nose, this bottling by Chumash tribe descendant Tara Gomez offers aromas of lemon blossom and honeydew rind. There is good tension to the sip, which is very much focused on texture, with flashes of green apple skins and lime peels, proving quite tight and zesty.",Camp 4 Vineyard,90,24,California,Santa Ynez Valley,Central Coast,Matt Kettmann,@mattkettmann,Kitá 2016 Camp 4 Vineyard Sauvignon Blanc (Santa Ynez Valley),Sauvignon Blanc,Kitá
77539,France,"Fruity, crisp with red-currant and citrus flavors, this is a bright, vivacious wine. There is a tight mineral edge that contrasts with the fruitiness and turns this into a food friendly wine. Drink now.",Elodie,88,25,Provence,Côtes de Provence,NA,Roger Voss,@vossroger,Vignobles Raymond 2016 Elodie Rosé (Côtes de Provence),Rosé,Vignobles Raymond
79139,France,"The mountains rise quickly behind the French Riviera. They are the origin of this wine. It has an attractive cool feel, while keeping plenty of fruit and a ripe caramel character. It is bright with plenty of acidity at the end. Drink now.",Les Hauts Plateaux,85,11,Provence,NA,NA,Roger Voss,@vossroger,Les Vins Bréban 2016 Les Hauts Plateaux Rosé,Rosé,Les Vins Bréban
79251,France,"High acidity marks this wine, giving it a crisp character with subdued fruitiness. That should change over the next few months, so drink from late 2017.",NA,86,15,Bordeaux,Bordeaux Rosé,NA,Roger Voss,@vossroger,Château la Verrière 2016 Rosé (Bordeaux Rosé),Rosé,Château la Verrière
79293,Portugal,"Intense perfumes give this fine apéritif wine an exotic character. Its crisp texture balances this, showcasing fine lime and grapefruit flavors as well as a touch of lychee. The acidity at the end is lively and refreshing. Drink now.",Escada Reserva,88,12,Lisboa,NA,NA,Roger Voss,@vossroger,DFJ Vinhos 2016 Escada Reserva Arinto (Lisboa),Arinto,DFJ Vinhos
79295,France,"This soft, spicy wine is attractive, fruity and immediately accessible. Blackberry fruit, balanced acidity and a crisp texture all point to drinking it now.",NA,88,10,Southwest France,Côtes de Gascogne,NA,Roger Voss,@vossroger,Domaine de Ménard 2016 Merlot-Cabernet Sauvignon (Côtes de Gascogne),Merlot-Cabernet Sauvignon,Domaine de Ménard
79304,Portugal,"This superrich wine is full of intense yellow fruit and passion-fruit flavors. The fruit is underlined with wood aging, with toast and spice. The aftertaste, smooth and creamy, shows the wine is ready to drink.",Colheita Seleccionada,88,30,Alentejano,NA,NA,Roger Voss,@vossroger,Herdade Grande 2016 Colheita Seleccionada White (Alentejano),Portuguese White,Herdade Grande
79810,France,"This wine has a good balance between spice and ripe yellow and apple fruits. The taut, mineral texture will allow it to age well. Touches of toast support the rich fruits. Drink from late 2017.",Cuvée Passion,89,29,Bordeaux,Bordeaux Blanc,NA,Roger Voss,@vossroger,Château Tour de Mirambeau 2016 Cuvée Passion  (Bordeaux Blanc),Bordeaux-style White Blend,Château Tour de Mirambeau
80781,US,"For a wine that can often be found for less than its $15 asking price, this is a very solid sipper. Ripe raspberry, red cherry and crushed slate show on the nose, while the light palate offers easy flavors of fruit punch and an herbal depth.",NA,87,14,California,Monterey County,Central Coast,Matt Kettmann,@mattkettmann,Hahn 2016 Pinot Noir (Monterey County),Pinot Noir,Hahn
81497,US,"The aromas leap out of the glass, with notes of freshly peeled tangerine, white flowers, jasmine and honeysuckle. It drinks quite sweet but manages to stay in balance. It's a delicious example of this variety. Enjoy it for dessert.",Reserve Late Harvest,88,30,Washington,Columbia Valley (WA),Columbia Valley,Sean P. Sullivan,@wawinereport,Columbia Crest 2016 Reserve Late Harvest Muscat Canelli (Columbia Valley (WA)),Muscat Canelli,Columbia Crest
81688,Austria,"A touch of spritz enlivens the nose of green pear. The palate shows riper flavors of yellow apple and is light and fresh. A juiciness and ease suggests this should be drunk soon to relish the dry, easy fun.",Löss,88,20,Niederösterreich,NA,NA,Anne Krebiehl MW,@AnneInVino,Hiedler 2016 Löss Grüner Veltliner (Niederösterreich),Grüner Veltliner,Hiedler
82341,Austria,"Conference pear and yellow Mirabelle plum notes make an appearance in this wine. The palate, which has some noticeable spritz, evokes more green citrus with its dry slenderness. Yet, it finishes full-fruited.",Ziesel,90,20,Kremstal,NA,NA,Anne Krebiehl MW,@AnneInVino,Unger 2016 Ziesel Grüner Veltliner (Kremstal),Grüner Veltliner,Unger
82553,France,"This generous, ripe wine, with its rich apple flavors, is crisp, perfumed and well balanced between acidity and ripeness. Delicious and full bodied, it's ready to drink now.",1769,88,NA,France Other,Corse,NA,Roger Voss,@vossroger,Clos Venturi 2016 1769 Vermentino (Corse),Vermentino,Clos Venturi
