id,country,description,designation,points,price,province,region_1,region_2,taster_name,taster_twitter_handle,title,variety,winery
94304,US,"While the nose is intensely oaky, wafting of dark toast, smoked nuts and spice, the palate of this Chardonnay is surprisingly fresh with crisp apple and pear flavors. It's a rounded, voluptuous wine that neatly balances the richness and complexity of oak against fruit. Drink now through 2021.",NA,88,16,New York,Finger Lakes,Finger Lakes,Anna Lee C. Iijima,NA,Rooster Hill 2015 Chardonnay (Finger Lakes),Chardonnay,Rooster Hill
94376,US,"Within an intense cradling of oak, this wine offers big flavors of green apple and toasted vanilla. Full bodied and richly concentrated, it settles into a balanced mineral-laden place of gravelly texture.",Estate Grown,90,26,California,Carneros,Napa-Sonoma,Virginie Boone,@vboone,Cuvaison 2015 Estate Grown Chardonnay (Carneros),Chardonnay,Cuvaison
94474,US,Green and invigorating peppery tones accent this lemony Sauvignon Blanc. It's not a deeply complex penetrating wine but is vivaciously fresh through the finish.,Sawmill Creek Vineyards,87,16,New York,Finger Lakes,Finger Lakes,Anna Lee C. Iijima,NA,Billsboro 2015 Sawmill Creek Vineyards Sauvignon Blanc (Finger Lakes),Sauvignon Blanc,Billsboro
94648,Germany,"Hints of caramelized sugar and dried raspberries abound from nose to finish in this Pinot Noir vinified like a white wine. Dry on the palate, its rounded texture is augmented by soft, yielding acidity. Drink now.",Blanc de Noir,87,20,Mosel,NA,NA,Anna Lee C. Iijima,NA,Von Schleinitz 2015 Blanc de Noir Pinot Noir (Mosel),Pinot Noir,Von Schleinitz
94659,France,"Although labeled as Viognier, the wine also has a small amount of Chardonnay. But it is the perfumed Viognier, with its yellow-fruit flavor, that dominates and gives a rich, spicy and generous texture. Drink now.",NA,87,12,Provence,Var,NA,Roger Voss,@vossroger,Château Routas 2015 Viognier (Var),Viognier,Château Routas
94944,France,"Solid tannins mark this out as a wine that will need to age. Its structure dominates its black fruit, hiding it beneath a smoky, spicy character. Give it until 2020 before opening.",NA,88,18,Bordeaux,Castillon Côtes de Bordeaux,NA,Roger Voss,@vossroger,Château Castegens 2015  Castillon Côtes de Bordeaux,Bordeaux-style Red Blend,Château Castegens
94949,France,This perfumed wine is ripe with exuberant black fruit and hints of wood aging. It's juicy with spice and pepper notes as well as bold red fruit. Drink from 2020.,Tradition,88,13,Bordeaux,Blaye Côtes de Bordeaux,NA,Roger Voss,@vossroger,Château la Croix Saint-Pierre 2015 Tradition  (Blaye Côtes de Bordeaux),Bordeaux-style Red Blend,Château la Croix Saint-Pierre
94963,France,"A blend that includes Gros Manseng along with Colombard and Sauvignon Blanc, this wine is light as a feather—crisp and with just an edge of honey. It is lively with a herbal character that is refreshing and lightly perfumed.",Haut-Marin Cuvée Marine,85,11,Southwest France,Côtes de Gascogne,NA,Roger Voss,@vossroger,Domaine de Ménard 2015 Haut-Marin Cuvée Marine White (Côtes de Gascogne),White Blend,Domaine de Ménard
94966,France,"Light tannins give this wine an attractive texture. It has bright cherry fruits along with glittering acidity. It's a fruity, fresh wine that is ready to drink.",NA,85,12,Beaujolais,Beaujolais,NA,Roger Voss,@vossroger,Patriarche Père et Fils 2015  Beaujolais,Gamay,Patriarche Père et Fils
94977,Spain,"Basic plum and black cherry aromas come with hints of baking spices and cinnamon. This feels a bit high in acidity and pinchy. While a quick wash of grapy, black-fruit flavors finishes without much noise.",Old Vine,85,10,Northern Spain,Cariñena,NA,Michael Schachner,@wineschach,Beso de Vino 2015 Old Vine Garnacha (Cariñena),Garnacha,Beso de Vino
95031,Germany,"Waxy lemon-rind and orange blossom notes waft from the nose of this fresh, easy-drinking Riesling. Sumptuous grapefruit and tangerine flavors are cut by a rejuvenating bite of lime acidity on the finish. Drink now through 2019.",Semidry,89,15,Mosel,NA,NA,Anna Lee C. Iijima,NA,Pflücken 2015 Semidry Riesling (Mosel),Riesling,Pflücken
95099,Spain,"This is not a cookie-cutter Cava. It opens with apple juice aromas along with yeast and white-bread scents. In the mouth, this feels a bit bready and soft. Yeasty flavors of papaya, green banana and melon see a white-bread note return on the finish. This is 100% Xarello (Pansa Blanca).",Privat Bruant Organic,89,33,Catalonia,Cava,NA,Michael Schachner,@wineschach,Alta Alella 2015 Privat Bruant Organic Sparkling (Cava),Sparkling Blend,Alta Alella
95176,NA,Aromatic hints of tomato leaf and pea shoots make for a highly appetizing nose. The concentrated body adds lovely notions of ripe mirabelle plums and combines fulsome fruit with ample zest. The midpalate maximizes these flavors and leaves you with a very refreshing finish.,Klausen,91,38,NA,NA,NA,Anne Krebiehl MW,@AnneInVino,Neumeister 2015 Klausen Sauvignon Blanc,Sauvignon Blanc,Neumeister
95333,US,"This is a delicious expression of the genre, medium bodied and forcefully crisp, with delicate lacings of cherry, apricot and peach. The underlying hint of vanilla gives it a welcome succulence and touch of sweetness though the wine otherwise presents dry.",Rosé of,91,28,California,Russian River Valley,Sonoma,Virginie Boone,@vboone,Kobler 2015 Rosé of Pinot Noir (Russian River Valley),Pinot Noir,Kobler
95674,US,"Aromas like honeydew melon and flavors recalling sweet cucumber create a very fruity profile for this medium-bodied, lightly sweet wine.","Estate Grown, Produced & Bottled",87,23,California,Sierra Foothills,Sierra Foothills,Jim Gordon,@gordone_cellars,"Naggiar 2015 Estate Grown, Produced & Bottled Muscat Canelli (Sierra Foothills)",Muscat Canelli,Naggiar
96165,Germany,"While slender in frame, this vibrantly zesty, herbal wine offers loads of intensity and vibe. Tart tangerine and apricot flavors are piercing and fresh, building in concentration and richness through a long, penetrating finish. It seems closed in its youth still, but should gain texture and complexity from 2020–2030.",Kaseler Nies'chen Trocken,92,50,Mosel,NA,NA,Anna Lee C. Iijima,NA,Reichsgraf von Kesselstatt 2015 Kaseler Nies'chen Trocken Riesling (Mosel),Riesling,Reichsgraf von Kesselstatt
96226,France,"This is a lightly honeyed wine with attractive almond and apple fruits. It comes from vines owned by the Saget family since 2002. With final crisp acidity and a tangy texture, it is ready to drink.",Château de la Mulonnière M de Mulonnière,85,15,Loire Valley,Anjou,NA,Roger Voss,@vossroger,Saget la Perrière 2015 Château de la Mulonnière M de Mulonnière Chenin Blanc (Anjou),Chenin Blanc,Saget la Perrière
96264,US,"This is a medium-bodied, crisp and tangy wine with fresh parsley aromas and lemon and Granny Smith apple flavors. It's well balanced, restrained and will be very versatile with food.",Echo Ridge,89,10,California,Lodi,Central Valley,Jim Gordon,@gordone_cellars,Fetzer 2015 Echo Ridge Sauvignon Blanc (Lodi),Sauvignon Blanc,Fetzer
96311,France,"The wine comes from a single vineyard in the large 90-acre Château de Chamirey estate. It is beautifully balanced, rich and generous. Great red-plum fruits are there along with acidity and finely textured tannins. This is going to be a warm wine with a fine future. Drink from 2022.",Château de Chamirey Clos du Roi Premier Cru,92,50,Burgundy,Mercurey,NA,Roger Voss,@vossroger,Domaines Devillard 2015 Château de Chamirey Clos du Roi Premier Cru  (Mercurey),Pinot Noir,Domaines Devillard
96347,Portugal,"This is a serious blend of Alfrocheiro, Syrah and Touriga Nacional from the Lagoalva estate. Spice and wood go with dark tannins and firm red fruits. It is still a young wine with fine potential. Drink from 2019.",Lagoalva Reserva,90,18,Tejo,NA,NA,Roger Voss,@vossroger,Quinta da Lagoalva de Cima 2015 Lagoalva Reserva Red (Tejo),Portuguese Red,Quinta da Lagoalva de Cima
96497,Spain,"Clear and lucid to the eye, this Verdejo shows pine, grapefruit, orange and apple aromas along with oily pith. The mouthfeel is more plump and wet than defined, while lychee and melon flavors are offset by tolerable bitter pyrazines and grapefruit flavors.",NA,85,10,Northern Spain,Rueda,NA,Michael Schachner,@wineschach,Nebla 2015 Verdejo (Rueda),Verdejo,Nebla
96986,US,"Crisp apple perfume builds on the palate, suggesting unusually lifted notes of raspberry, strawberry and cherry in this semidry Riesling. It's a plush, slightly rounded white with easy, juicy fruit and a brisk finish.",Semi-Dry,87,15,New York,Finger Lakes,Finger Lakes,Anna Lee C. Iijima,NA,Highland Cellars 2015 Semi-Dry Riesling (Finger Lakes),Riesling,Highland Cellars
96993,France,"This is a tight, textured wine, with plenty of acidity to balance the ripe fruit. It has the generous texture typical of the vintage and ripe yellow fruits, with an attractive crisp aftertaste. Drink now.",Le Clos Reyssie,87,38,Burgundy,Pouilly-Fuissé,NA,Roger Voss,@vossroger,Marcel Couturier 2015 Le Clos Reyssie  (Pouilly-Fuissé),Chardonnay,Marcel Couturier
97100,US,"This medium-bodied wine has an abundance of spices in its aromas and flavors, along with a smooth texture and good balance between acidity and ripeness. The fruit flavors are plummy and straightforward and the easy drinkability is undeniable.",Vintner's Reserve,88,20,California,California,California Other,Jim Gordon,@gordone_cellars,Kendall-Jackson 2015 Vintner's Reserve Pinot Noir (California),Pinot Noir,Kendall-Jackson
97418,Austria,"Some flinty reduction still hovers over the glass, underneath, riper, appetizing fruit like peach and yellow plum shimmers. There is a fresh, textured phenolic edge and brightening acidity which pulls everything in to a clear, taut focus. This is full of flavor and depth.",Furth-Palt,92,22,Kremstal,NA,NA,Anne Krebiehl MW,@AnneInVino,Malat 2015 Furth-Palt Riesling (Kremstal),Riesling,Malat
97428,Austria,"Hayflowers and savory lovage and arugula notes, inflected with piquant lime zest create an irresistibly spicy palate of such lightness and ease, there is a spring in the step of this light but intensely flavoured wine. If you want spicy refreshment, look no further.",Höhlgraben,92,27,Kremstal,NA,NA,Anne Krebiehl MW,@AnneInVino,Malat 2015 Höhlgraben Grüner Veltliner (Kremstal),Grüner Veltliner,Malat
97463,US,"Made in a careful, non-intrusive, natural style, this combines wild strawberry and peppery herb flavors. It offers moderate tannins and a strongly herbal finish.",NA,89,24,Oregon,Eola-Amity Hills,Willamette Valley,Paul Gregutt,@paulgwine ,Franchere 2015 Pinot Noir (Eola-Amity Hills),Pinot Noir,Franchere
97561,France,"This rare intrusion of Sauvignon Blanc into Burgundy is in the small northern vineyard of Saint-Bris, close to Chablis. This wine is fruity with a herbal character that is balanced by the crisp citrus and melon flavors. Drink the wine now.",NA,86,19,Burgundy,Saint-Bris,NA,Roger Voss,@vossroger,Bailly-Lapierre 2015  Saint-Bris,Sauvignon Blanc,Bailly-Lapierre
97664,France,"This vibrant red opens with scents of small red berries and cherries, accented by touches of vanilla bean and black pepper. The medium-weight palate is well balanced and approachable, with fruit-skin flavors that harmonize with the fine tannins. A kiss of cocoa graces the finish.",NA,87,11,France Other,Vin de France,NA,Lauren Buzzeo,@laurbuzz,La Châsse 2015 Syrah (Vin de France),Syrah,La Châsse
97682,Spain,"Fresh for the summer season is this tutti-frutti Navarran Garnacha. Pink in color and pumped up, this tastes of pink grapefruit, nectarine and citrus pith. It's all about freshness and drinkability.",Edición Rosa,87,18,Northern Spain,Navarra,NA,Michael Schachner,@wineschach,Príncipe de Viana 2015 Edición Rosa Grenache (Navarra),Grenache,Príncipe de Viana
97684,France,"This bold, ripe blend even contains some Muscat that gives richness and a touch of honey and spice to what is otherwise a dry rosé. The acidity acts as a balance to this attractive wine.",Jas des Vignes,87,10,Provence,NA,NA,Roger Voss,@vossroger,Ravoire et Fils 2015 Jas des Vignes Rosé,Rosé,Ravoire et Fils
97721,US,"A focused line of lemon balm meets with gardenia, soft jasmine, light butterscotch and green tea on the nose of this county blend by Colombian-born, French-trained Winemaker Bibiana González Rave. Lemon, light vanilla and a touch of warm pastry show on the palate.",NA,91,25,California,Sonoma County,Sonoma,Matt Kettmann,@mattkettmann,Alma de Cattleya 2015 Chardonnay (Sonoma County),Chardonnay,Alma de Cattleya
97734,US,"A velvety texture and extremely concentrated black-fruit flavors make this full-bodied wine delicious to savor. It has beautiful big tannins that are well integrated, luxurious blackberry, sage and cedar flavors, plus great length on the finish.",NA,91,20,California,Amador County,Sierra Foothills,Jim Gordon,@gordone_cellars,Easton 2015 Zinfandel (Amador County),Zinfandel,Easton
97986,US,"Honeyed crème brûlée flavor is the highlight of this salty, moderately structured wine that's fairly priced and simple in its approach.",NA,86,20,California,Russian River Valley,Sonoma,Virginie Boone,@vboone,Raeburn 2015 Chardonnay (Russian River Valley),Chardonnay,Raeburn
97997,Chile,"Mild volatility and dry herbal scratchy aromas of nondescript berry fruits lead to a somewhat soft palate. Flavors of generic berry fruits and chocolate finish ripe and chunky, with leftover notes of chocolate.",Riscos de Puquillay Alto,86,13,Colchagua Valley,NA,NA,Michael Schachner,@wineschach,Luis Felipe Edwards 2015 Riscos de Puquillay Alto Cabernet Sauvignon (Colchagua Valley),Cabernet Sauvignon,Luis Felipe Edwards
98071,South Africa,"This is quite oaky upfront, with bold scents of baked apple, toasted hazelnut and vanilla bean. The palate offers more of the same, in addition to a bright yet decadent lemon-custard flavor. Honey-drizzled apple pie comes to the fore on the finish, with just enough acidity to keep the opulence in check.",Bayten,89,20,Constantia,NA,NA,Lauren Buzzeo,@laurbuzz,Buitenverwachting 2015 Bayten Chardonnay (Constantia),Chardonnay,Buitenverwachting
98305,France,"Red-berry fruits and a full-bodied texture form the hallmark of this ripe wine. It has spice, a rich character that is generous and fruity. The wine is ready to drink.",NA,88,14,Beaujolais,Beaujolais-Villages,NA,Roger Voss,@vossroger,Louis Jadot 2015  Beaujolais-Villages,Gamay,Louis Jadot
98509,France,This attractive fruity wine is full of young black-currant and red-berry fruits. The tannins mingle with spice to give a contrast to the aura of fruitiness surrounding the wine. Drink from 2019.,NA,86,23,Bordeaux,Bordeaux,NA,Roger Voss,@vossroger,Château Haut Pasquet 2015  Bordeaux,Bordeaux-style Red Blend,Château Haut Pasquet
98620,US,"This is an unusual blend of principally Syrah, Malbec, Tempranillo and Souzao, along with bits of Petit Verdot, Merlot, and Cabernet Sauvignon. Aromas of cocoa, vanilla and green herb lead to tart cherry flavors that seem underripe. The finish comes up short.",Estate Grown Ora Proprietary,86,30,Washington,Wahluke Slope,Columbia Valley,Sean P. Sullivan,@wawinereport,Desert Wind 2015 Estate Grown Ora Proprietary Red (Wahluke Slope),Red Blend,Desert Wind
98701,Austria,Very ripe pear and plum notions dominate the nose. The palate has concentration and drive but still blossoms with generous fleshy fruit of great purity. This is an expression of joy and ripeness—of ready overflowing fruit kept taut and in focus by ripe orange freshness. The long finish has a touch of earth.,Loibenberg,92,40,Wachau,NA,NA,Anne Krebiehl MW,@AnneInVino,Rainer Wess 2015 Loibenberg Riesling (Wachau),Riesling,Rainer Wess
98816,France,"While this dense wine has plenty of firm tannins, it also has fine, ripe fruit. Rich blackberry flavors and smoky aromas dominate. Drink from 2020.",NA,91,14,Bordeaux,Castillon Côtes de Bordeaux,NA,Roger Voss,@vossroger,Château Haut Dina 2015  Castillon Côtes de Bordeaux,Bordeaux-style Red Blend,Château Haut Dina
98911,US,"There's a strong green-peppercorn tinge to the nose of this bottling, along with hints of ancho chile and cedar. The palate shows oregano, thyme and dill, proving quite Old World in style, with only the slightest presence of blackberry fruit.",Flood Family Vineyard,87,22,California,Santa Barbara County,Central Coast,Matt Kettmann,@mattkettmann,Rancho Sisquoc 2015 Flood Family Vineyard Merlot (Santa Barbara County),Merlot,Rancho Sisquoc
99441,US,"Savory flavors like salt, peppered roast beef and rosemary shape the taste of this medium-bodied, velvet-textured and nicely concentrated wine. It has fine-grained tannins to support the mouthfeel, but not enough to overwhelm.",NA,88,22,California,North Coast,North Coast,Jim Gordon,@gordone_cellars,B.R. Cohn 2015 Cabernet Sauvignon (North Coast),Cabernet Sauvignon,B.R. Cohn
99450,France,"With the potential of a good structure and fruit, this is a warm ripe wine that has concentration and dense black fruits. The acidity at the end gives it a lift. Wait until 2019 to drink this Hervé Lhuillier wine.",NA,88,16,Bordeaux,Bordeaux Supérieur,NA,Roger Voss,@vossroger,Château Fleur Haut Gaussens 2015  Bordeaux Supérieur,Bordeaux-style Red Blend,Château Fleur Haut Gaussens
99484,France,"With a caramel character and light, bright acidity, this is a soft, not-quite-dry wine. It has a warm, open and accessible feel to it, light and fruity on the finish.",NA,86,12,Provence,Côtes de Provence,NA,Roger Voss,@vossroger,Sables d'Azur 2015 Rosé (Côtes de Provence),Rosé,Sables d'Azur
100197,US,"This producer's light take on the variety continues to impress with this vintage. Anise and oak hints combine on the nose to invite one in for an elegant taste of bright, juicy acidity and refined lemon and green apple flavors.",Durell Vineyard,92,50,California,Sonoma Coast,Sonoma,Virginie Boone,@vboone,Lutum 2015 Durell Vineyard Chardonnay (Sonoma Coast),Chardonnay,Lutum
100220,US,"This bottling smells much like a bundle of freshly cleared sagebrush, with hints of fennel, charred tomato, wood, cola and wild black cherry. Its extremely soft mouthfeel massages the tongue with lush tannins, and its black cherry richness is cut by tart pomegranate-like acidity and lifted by cocoa, coffee and ginger spice notes.",3 Clone,92,56,California,Santa Lucia Highlands,Central Coast,Matt Kettmann,@mattkettmann,Boekenoogen 2015 3 Clone Pinot Noir (Santa Lucia Highlands),Pinot Noir,Boekenoogen
100313,US,"This 100% varietal wine leads with appealing blue fruit, herb, jalapeño, toast and spice aromas followed by soft, supple fruit and barrel flavors. It's a very enjoyable expression of this often green variety.",Margaret's Vineyard,91,55,Washington,Walla Walla Valley (WA),Columbia Valley,Sean P. Sullivan,@wawinereport,JM Cellars 2015 Margaret's Vineyard Carmenère (Walla Walla Valley (WA)),Carmenère,JM Cellars
100337,US,"There's a lot to like in this youthful, concentrated white, from its tartness of green apple and lime to its mineral-laden acidity. Full bodied, it never loses that sense of verve on the palate, which helps rein in the ripeness.",Suzanne's Blend,88,36,California,Russian River Valley,Sonoma,Virginie Boone,@vboone,Gracianna 2015 Suzanne's Blend Chardonnay (Russian River Valley),Chardonnay,Gracianna
100495,France,"While it is still young, the wine is showing great fruit and soft tannins. Juicy black cherries are ripe and full, a sign of the fine vintage. With the acidity and the dry core, the wine should age. Drink from 2018.",La Réserve d'Amélie,88,22,Beaujolais,Moulin-à-Vent,NA,Roger Voss,@vossroger,Domaine Gerard Charvet 2015 La Réserve d'Amélie  (Moulin-à-Vent),Gamay,Domaine Gerard Charvet
100513,Germany,"Fragrant tangerine skins are glazed by an earthen streak of wax on the nose of this brisk, light-footed Riesling. Zesty and dry, the palate balances refreshing lime and lemon flavors against more savory elements of pollen and earth. Finishes crisp and clean.",Estate Dry,88,16,Mosel,NA,NA,Anna Lee C. Iijima,NA,Von Schleinitz 2015 Estate Dry Riesling (Mosel),Riesling,Von Schleinitz
100873,US,"This is a fun, complex wine, a blend of 79% Sauvignon Blanc, 18% Muscat Canelli and 3% Viognier, all mountain-grown. Orange blossom and jasmine permeate the inviting entry before waves of creamy tangerine and peach play on the palate, lifted by lively acidity.",Wow Oui,91,27,California,Pine Mountain-Cloverdale Peak,Sonoma,Virginie Boone,@vboone,Imagery 2015 Wow Oui White (Pine Mountain-Cloverdale Peak),White Blend,Imagery
100878,US,"Pale pink in color, this wine offers nice touches of bubblegum and watermelon, with lively white pepper for a complex twist. Clean and lovely lines of pink strawberry, rocky minerality and more of that intriguing pepper spice continue on the palate that leaves the mouth watering. It's a great pink.",Rose of,91,22,California,Santa Ynez Valley,Central Coast,Matt Kettmann,@mattkettmann,Koehler 2015 Rose of Grenache (Santa Ynez Valley),Grenache,Koehler
100928,Portugal,"This is a Sauvignon Blanc in a ripe, tropical fruit style. It is soft with only the faintest herbal, citrus tang. The fruit is smooth, rounded allowing just the right space for the acidity to finish the wine with a lift. Drink now.",Lagoalva,86,15,Tejo,NA,NA,Roger Voss,@vossroger,Quinta da Lagoalva de Cima 2015 Lagoalva Sauvignon Blanc (Tejo),Sauvignon Blanc,Quinta da Lagoalva de Cima
100929,Portugal,"Because it comes from vines in one of the coolest parts of the Douro, high on the plateau north of the river, this is a fresh, fruity wine. It has crisp apple acidity that is made richer by touches of apricot and light spice. The wine is tight, a straight line of clean acidity. Drink from the end of 2016.",Porrais,86,11,Douro,NA,NA,Roger Voss,@vossroger,Quinta de Porrais 2015 Porrais White (Douro),Portuguese White,Quinta de Porrais
100958,US,"This proprietary blend combines 63% Pinot Grigio from Carneros, 22% Traminer from Carneros and a small percentage of Moscato Giallo from Lodi. Together they harmonize in a light, crisp and floral bouquet of apricot, ginger and lemon, never becoming overly fussy and instead focusing entirely on refined refreshment.",Zelo Bianco,90,24,California,Carneros,Napa-Sonoma,Virginie Boone,@vboone,Uvaggio 2015 Zelo Bianco White (Carneros),White Blend,Uvaggio
101156,US,"Candied red cherry fruit meets wild herb and wet slate aromas on the nose of this bottling from a vineyard planted in 1988. Boisterous acidity kicks off the palate, where raspberry and tart strawberry fruit flavors lead to round red plum and a slate-like rockiness. The finish is bright with acidity.",Keefer Ranch,92,40,California,Russian River Valley,Sonoma,Matt Kettmann,@mattkettmann,Sandler 2015 Keefer Ranch Pinot Noir (Russian River Valley),Pinot Noir,Sandler
101674,US,"Kudos to Brian and Stephy Terrizzi for introducing this fascinating grape from southern Italy to Paso Robles. Rich white peach and poached pear aromas are edged with sharper mineral scents and boosted by vanilla undertones. The palate leads with bright acidity then explores red apple, cantaloupe and stone fruit flavors, proving easy to like but also tempered with restraint.",NA,90,25,California,Paso Robles,Central Coast,Matt Kettmann,@mattkettmann,Giornata 2015 Fiano (Paso Robles),Fiano,Giornata
101720,Argentina,"Powdery aromas of acacia blossom and bath oil come prior to a slightly oily feeling palate. Pithy citrus, melon and papaya flavors finish with a touch of greenness.",Serie A,86,15,Other,Salta,NA,Michael Schachner,@wineschach,Zuccardi 2015 Serie A Torrontés (Salta),Torrontés,Zuccardi
102069,France,"The cru wine is soft, full of cherry fruits and with a light touch of tannin. With its fruit, it is open and generous with a crisp aftertaste. Drink now.",Domaine Du Riaz,87,20,Beaujolais,Côte de Brouilly,NA,Roger Voss,@vossroger,Georges Duboeuf 2015 Domaine Du Riaz  (Côte de Brouilly),Gamay,Georges Duboeuf
102086,France,"From the smallest of the Beaujolais crus, this wine is structured, layering tannins with black fruits and acidity. It is a wine to age at least for a couple of years. Drink from 2018.",NA,87,20,Beaujolais,Chénas,NA,Roger Voss,@vossroger,Henry Fessy 2015  Chénas,Gamay,Henry Fessy
102232,Chile,"Heavy, generic cherry aromas are a touch volatile. This feels full and bouncy, with juicy acidity. Flavors of black fruits are ripe but lack complexity, while this is hot and raspy on the finish.",Araucano Humo Blanco Edicion Limitada,85,14,Lolol Valley,NA,NA,Michael Schachner,@wineschach,François Lurton 2015 Araucano Humo Blanco Edicion Limitada Pinot Noir (Lolol Valley),Pinot Noir,François Lurton
102238,US,"Subtle, intricate aromas and equally sophisticated flavors of baking spices, tamarind and cherries make this a fascinating wine to taste. It's full bodied but lithe. Energizing acidity and firm tannins give it great structure and help carry the complex flavors through a lingering finish.",Helluva vineyard,93,35,California,Anderson Valley,NA,Jim Gordon,@gordone_cellars,Betwixt 2015 Helluva vineyard Pinot Noir (Anderson Valley),Pinot Noir,Betwixt
102382,US,"Thoroughly oaky and spicy, this full-bodied wine smells toasty and smoky. Flavors suggest nutmeg, cinnamon and smoked meat, followed by tangy and fresh black cherry.",NA,87,10,California,California,California Other,Jim Gordon,@gordone_cellars,McManis 2015 Merlot (California),Merlot,McManis
