id,country,description,designation,points,price,province,region_1,region_2,taster_name,taster_twitter_handle,title,variety,winery
44928,Austria,"Fruity, immediately appealing berry flavors dominate this wine. It has an edge of wood, but that simply smoothes out the fruit rather than adding tannins. Lively, delicious, drinkable now.",Ried Hochberg,88,23,Mittelburgenland,NA,NA,Roger Voss,@vossroger,Hans Igler 2005 Ried Hochberg Blaufränkisch (Mittelburgenland),Blaufränkisch,Hans Igler
45131,Italy,"Il Drappo is a ripe, smokey and chewy expression of Nero d'Avola with plump fruit notes backed by blackberry and cherry nuances. The mouthfeel is rich, velvety and very soft. Pair this wine with spicy pork with barbecue sauce.",Il Drappo,90,40,Sicily & Sardinia,Sicilia,NA,NA,NA,Benanti 2005 Il Drappo Nero d'Avola (Sicilia),Nero d'Avola,Benanti
45148,Spain,"Opens with tight black cherry and raspberry aromas, but also a whiff of pine and chemical. The palate is round, full and tannic, with snappy berry flavors accented by balasmic notes, oak resin and vanilla. Finishes with traditional vanilla-dill notes and a slight stemminess.",Crianza,86,23,Northern Spain,Ribera del Duero,NA,Michael Schachner,@wineschach,Abadía la Arroyada 2005 Crianza  (Ribera del Duero),Tempranillo,Abadía la Arroyada
45197,Israel,"Concentrated and rich with strong kirsch and raspberry jam flavors that fill the medium-weight mouth. A touch of spice appears on the close, but otherwise this is a straightforward and easygoing quaff.",Yarden Kosher,84,25,Galilee,NA,NA,Lauren Buzzeo,@laurbuzz,Golan Heights Winery 2005 Yarden Kosher Syrah (Galilee),Syrah,Golan Heights Winery
46209,US,"Good evocation of a cool-climate Petite Sirah, in all its fruity glory. Dry, crisp and dense in tannins, the flavors are of jammy blackberries, tobacco and plums, with a spicy finish.",NA,87,12,California,Russian River Valley,Sonoma,NA,NA,Castle Rock 2005 Petite Sirah (Russian River Valley),Petite Sirah,Castle Rock
46636,US,"A good, sound wine, but far from a success for the Artist Series. In fact it shows rustic tannins and the slightly sweet softness you might find in, say, a Paso Robles Cab. Disappointing.",Artist Series,85,69,California,Sonoma County,Sonoma,NA,NA,Kenwood 2005 Artist Series Cabernet Sauvignon (Sonoma County),Cabernet Sauvignon,Kenwood
46795,Austria,"Dark berries dominate here, but there is also an intriguing edge of tight spiced minerality. With its strong acidity and important tannins, this is always going to be a wine with an austere side. But the weight is all there, as is the final black berry fruit.",Leithaberg,91,45,Burgenland,NA,NA,Roger Voss,@vossroger,Nittnaus Anita und Hans 2005 Leithaberg Blaufränkisch (Burgenland),Blaufränkisch,Nittnaus Anita und Hans
46805,Italy,"Sweet oak notes are followed by cherry, chocolate and vanilla. This is a rich Cabernet Sauvignon with a modern and very pleasurable approach that puts emphasis on power, softness and intensity. Vibrant cherry flavors last many long minutes on the palate.",Coniale,91,45,Tuscany,Toscana,NA,NA,NA,Castellare di Castellina 2005 Coniale Cabernet Sauvignon (Toscana),Cabernet Sauvignon,Castellare di Castellina
47939,Italy,"Morellino di Scansano is an up-and-coming red wine from Southern Tuscany that is easy and fun to drink. This ruby-colored expression delivers fresh tones of cherry and red currants and it has a soothing, soft texture in the mouth thanks to one year of oak aging.",Riserva,88,24,Tuscany,Morellino di Scansano,NA,NA,NA,Val delle Rose 2005 Riserva  (Morellino di Scansano),Sangiovese,Val delle Rose
47940,US,"Bellissima Rossa is 77% Cabernet Sauvignon, 15% Merlot, 5% Cabernet Franc and 3% Malbec. The Cabernet Sauvignon is muscular and taut; blackberry and cassis, mineral and smoke come up as aromas, then follow as flavors. Good legs show the weight of the wine, which hits the palate tight and shows a bit of chalky acid, then opens into more lush milk chocolate barrel flavors.",Bellissima Rossa,88,28,Washington,Columbia Valley (WA),Columbia Valley,Paul Gregutt,@paulgwine ,Tsillan Cellars 2005 Bellissima Rossa Red (Columbia Valley (WA)),Red Blend,Tsillan Cellars
48279,France,"A beautiful wine that floats its minerality, white flower aromas and white currant fruits over a foundation of toast. Freshness dominates this crisp wine, with intensity to finish.",Séchet Premier Cru,92,44,Burgundy,Chablis,NA,Roger Voss,@vossroger,Domaine Vincent Dauvissat 2005 Séchet Premier Cru  (Chablis),Chardonnay,Domaine Vincent Dauvissat
48284,Australia,"Jim Barry's Cab program is on a roll, turning out a consistent set of wines from Clare and Coonawarra. Named in honor of the Australian cricket team, The First Eleven boasts a kaledioscopic range of berry fruit, accented by mint and darker notes of coffee, cocoa and cola. It's full-bodied and dense on the palate without being heavy, and finishes long, with impressive intensity and dusty tannins. Drink now–2020.",First Eleven,92,60,South Australia,Coonawarra,NA,Joe Czerwinski,@JoeCz,Jim Barry 2005 First Eleven Cabernet Sauvignon (Coonawarra),Cabernet Sauvignon,Jim Barry
48291,France,"Surprisingly open for a 2005, this shows wood through its intense green fruit. It is rounded, generous, almost opulent with tropical fruits as well as plums, and shot through with citrus. This will develop faster than other Brocard Grand Crus.",Les Preuses Grand Cru,92,NA,Burgundy,Chablis,NA,Roger Voss,@vossroger,Jean-Marc Brocard 2005 Les Preuses Grand Cru  (Chablis),Chardonnay,Jean-Marc Brocard
48646,US,"The vineyard has been a consistent source of good to great Pinot Noirs for Paraiso winery. Now La Rochelle dips into it, with successful results. It's a dry, elegantly silky but complex wine, with an array of cherry, raspberry, rose flower, cinnamon spice and smoky vanilla flavors, heightened with crisp acidity. Drink now.",Paraiso Vineyard,90,40,California,Santa Lucia Highlands,Central Coast,NA,NA,La Rochelle 2005 Paraiso Vineyard Pinot Noir (Santa Lucia Highlands),Pinot Noir,La Rochelle
48899,France,"A supremely integrated wine, its richness and beautiful fruit just part of a story that starts with intense aromas and segues on the palate into a balance of tannins, dark red fruits, enveloping acidity and a beautifully orchestrated finale of berries, spice and aching freshness.",NA,97,95,Burgundy,Corton-Pougets,NA,Roger Voss,@vossroger,Louis Jadot 2005  Corton-Pougets,Pinot Noir,Louis Jadot
49568,US,"This Bordeaux blend is a complex and sappy red with plenty of raspberry, cherry and cassis fruit flavor, tangy acids and ripe tannins. Young and tart, it is structured for age, compact and quite young. The oak brings in hints of butter and caramel.",Inspiration Reserve Red,91,48,Washington,Horse Heaven Hills,Columbia Valley,Paul Gregutt,@paulgwine ,Robert Karl 2005 Inspiration Reserve Red Red (Horse Heaven Hills),Red Blend,Robert Karl
49625,Spain,"A tough wine to enjoy. The nose has a cheesy top layer, while the base aromas are of bell pepper and lettuce. It's very tangy and juicy in the mouth, with searing red-cherry flavors and green accents. Snappy and whispy to the max.",Crianza,82,9,Northern Spain,Navarra,NA,Michael Schachner,@wineschach,Príncipe de Viana 2005 Crianza Red (Navarra),Tempranillo Blend,Príncipe de Viana
50554,Chile,"Approachable and stately. Aromas of toast, bacon and reduced berries get it going in the right direction, while blueberry and cassis flavors control the palate. This is a ripped yet stylish wine with texture and chewy, integrated tannins. Congratulations to MontGras and chief consultant Paul Hobbs for making a serious Cabernet (with 2% Malbec) that most folks can actually afford.",Ninquén Mountain Vineyard,91,35,Colchagua Valley,NA,NA,Michael Schachner,@wineschach,Ninquén 2005 Ninquén Mountain Vineyard Cabernet Sauvignon (Colchagua Valley),Cabernet Sauvignon,Ninquén
50620,US,"Very polished and pure, if a bit direct and obvious in appeal. A beautiful wine, with pure flavors of currants and cedar. Drinkable now, and should hold through the decade.",Pluribus,91,275,California,Napa Valley,Napa,NA,NA,BOND 2005 Pluribus Red (Napa Valley),Bordeaux-style Red Blend,BOND
53047,South Africa,"This stylish white offers delicate peach and lemon aromas and a combination of zippy citrus and warming spice on the palate. Approachable but complex, the wine offers power and grace.",Babylons Toren,87,30,Paarl,NA,NA,Susan Kostrzewa,@suskostrzewa,Backsberg 2005 Babylons Toren Viognier (Paarl),Viognier,Backsberg
53263,Spain,"Blocky and brambly on the nose, with a fair amount of funk. The palate is crisp, semitart and lean-bodied, and with tight acidity it's a little scouring. Lots of red-fruit character but not a lot of mouthfeel.",Single Estate Garnacha - Merlot,83,11,Northern Spain,Cariñena,NA,Michael Schachner,@wineschach,Reula 2005 Single Estate Garnacha - Merlot Red (Cariñena),Red Blend,Reula
53264,US,"This Bordeaux blend from Sunstone has been getting softer, sweeter and more melted over the years. This latest bottling is almost like a dessert wine, with pastry-like cherry, currant, cocoa, anise and vanilla flavors. It lacks structure and full dryness.",Eros,83,52,California,Santa Ynez Valley,Central Coast,NA,NA,Sunstone 2005 Eros Red (Santa Ynez Valley),Bordeaux-style Red Blend,Sunstone
53282,Italy,"Red apple skin and applesauce dominate the nose of this Primitivo from Puglia and make it hard to find the wine's natural berry fruit. You will detect some chocolate and spice, but it's not easy behind the apple cider. The wine is sour, thick and dense.",NA,82,12,Southern Italy,Salento,NA,NA,NA,Cantine Due Palme 2005 Primitivo (Salento),Primitivo,Cantine Due Palme
54200,Italy,"This beautiful Riserva Brunello is characterized by very good balance, enduring sensations of richness and aromatic generosity. The wine's natural density and bright berry flavors carry forth over the long finish.",Riserva,93,90,Tuscany,Brunello di Montalcino,NA,NA,NA,Donatella Cinelli Colombini 2005 Riserva  (Brunello di Montalcino),Sangiovese Grosso,Donatella Cinelli Colombini
54853,US,"Made from Merlot and Cabernet Sauvignon, this wine tastes like it was treated to the most modern winemaking techniques designed for maximum extraction. It's soft and gentle, with jammy, pie-filling flavors of cherries, blackberries, currants and black raspberries.",Angels' Peak,85,50,California,Napa Valley,Napa,NA,NA,Terlato 2005 Angels' Peak Red (Napa Valley),Bordeaux-style Red Blend,Terlato
56340,Italy,"This is a gorgeous Cabernet Sauvignon from Sicily with intense aromas of black pepper, exotic spice, green curry leaves and chocolate fudge. It has depth and personality and would pair with succulent cuts of beef.",Schietto Cabernet Sauvignon,91,40,Sicily & Sardinia,Sicilia,NA,NA,NA,Principi di Spadafora 2005 Schietto Cabernet Sauvignon Cabernet Sauvignon (Sicilia),Cabernet Sauvignon,Principi di Spadafora
56445,US,"Very rich and juvenile now, with exotic cherry, blackberry, gingerbread, tangerine, herb tea, vanilla oak and spice flavors, this Zin has a thick, tannic intensity that needs time to mature. The power and concentration must come from the mountain vineyard, on the eastern side of the valley. Hold this dramatic, high-alcohol Zinfandel until mid-2008, at least.",Arrowhead Mountain Vineyard,92,35,California,Sonoma Valley,Sonoma,NA,NA,JC Cellars 2005 Arrowhead Mountain Vineyard Zinfandel (Sonoma Valley),Zinfandel,JC Cellars
57265,Spain,"Funky and smelling of pine and tarragon. That aromatic sharpness carries straight to the palate, where the feel is narrow and the flavors are short and tangy, with little to no big-time berry fruit. Simply an acceptable underperformer that's tough and sharp.",Barrica,83,19,Northern Spain,Ribera del Duero,NA,Michael Schachner,@wineschach,Finca La María 2005 Barrica  (Ribera del Duero),Tempranillo,Finca La María
58213,US,"This is Walla Walla Vintners' signature wine, and it is a classic: rich and oaky, sculpted but also chewy, with big cherry and baking chocolate flavors. There is an unusual flavor streak running through that tastes a bit like Thanksgiving turkey, believe it or not, but it's good. Tannins are polished and the toffee and chocolate finish ends things on a sweet and creamy note.",NA,91,25,Washington,Columbia Valley (WA),Columbia Valley,Paul Gregutt,@paulgwine ,Walla Walla Vintners 2005 Cabernet Franc (Columbia Valley (WA)),Cabernet Franc,Walla Walla Vintners
58224,US,"An excellent trio of vineyards—Minnick Hills, Pepper Bridge, and Alder Ridge—contribute to this substantial effort. The fruit is dense and lively, with spicy, tangy mixed berry, currant and cherry character. The tannins have been nicely polished, and the acids provide the underpinning that gives the wine its lift. Despite its power, the wine keeps the alcohol in check, without a trace of heat or burn.",NA,90,32,Washington,Walla Walla Valley (WA),Columbia Valley,Paul Gregutt,@paulgwine ,Fort Walla Walla 2005 Cabernet Sauvignon (Walla Walla Valley (WA)),Cabernet Sauvignon,Fort Walla Walla
58252,US,"When Russian River Zinfandel succeeds, and this one does, it marries the variety's wild, feral personality to the valley's perfect terroir to produce distinctive wines. Ottimino's 2005 Von Weidlich is very tannic, but classic in presentation, showing blackberry, currant and intense black pepper aromas and flavors. Might tempt you to cellar it, but it's best over the next year for sheer exuberance.",Von Weidlich Vineyard,92,36,California,Russian River Valley,Sonoma,NA,NA,Ottimino Vineyards 2005 Von Weidlich Vineyard Zinfandel (Russian River Valley),Zinfandel,Ottimino Vineyards
58554,South Africa,"A floral nose of violets offers an intriguing start to a wine that's both a value and a fun find. On the palate, red wild berry, spice and smoke are balanced, and though this has a rusticity that tells of its terroir, overall, it's simply pretty. Imported by Cape Wine Ventures, LLC.",NA,85,8,Western Cape,NA,NA,Susan Kostrzewa,@suskostrzewa,Tall Horse 2005 Shiraz (Western Cape),Shiraz,Tall Horse
58557,Australia,"In a flight of inexpensive Australian Merlot, this wine stood out for its density and concentration. Which is not to say it's a big wine, but it does offer plenty of mixed berry fruit and hints of chocolate in a medium-bodied wine. Picks up some savory olive and coffee notes on the mouthwatering finish.",NA,85,12,Australia Other,South Eastern Australia,NA,Joe Czerwinski,@JoeCz,McWilliam's Hanwood Estate 2005 Merlot (South Eastern Australia),Merlot,McWilliam's Hanwood Estate
58579,Italy,"This Riserva blend of Negroamaro, Montepulciano and Malvasia Nera delivers very ripe and rich notes of strawberry jam and fruit preserves. The mouthfeel is polished and well-structured, but the wine exhibits a mature taste profile.",Riserva Vigna Flaminio,85,15,Southern Italy,Puglia,NA,NA,NA,Agricole Vallone 2005 Riserva Vigna Flaminio Red (Puglia),Red Blend,Agricole Vallone
58705,US,"Hard in tannins, with a baked, pie-filling quality to the blackberry and black cherry fruit, this bone-dry Syrah is made for drinking now with robust foods, like burgers or lasagna.",England Crest,83,18,California,Sonoma Valley,Sonoma,NA,NA,Wellington 2005 England Crest Syrah (Sonoma Valley),Syrah,Wellington
59127,France,"This is a very sweet, perfumed wine, showing spice and lychee notes, touched by honey. Not for aging.",Steingrubler Grand Cru,85,NA,Alsace,Alsace,NA,Roger Voss,@vossroger,Wunsch & Mann 2005 Steingrubler Grand Cru Gewurztraminer (Alsace),Gewürztraminer,Wunsch & Mann
59445,France,"A lean, fresh style of Bordeaux, with red fruits balancing on dry tannins and a top layer of acidity. It is almost austere, but it's rescued by the freshness of the fruit and underlying structure.",NA,85,12,Bordeaux,Bordeaux Supérieur,NA,Roger Voss,@vossroger,Château Trocard 2005  Bordeaux Supérieur,Bordeaux-style Red Blend,Château Trocard
59896,US,"A blend of seven different vineyards, the name is French for spoon. This is a softer, less tannic wine than most of the other Torii Mor 2005s, but is not quite what you would call silky. Mixed red fruits, light scents suggesting flower as well as berry, and a feminine elegance characterize this Pinot. It's been carefully crafted to emphasize the subtle herbs and spices, without hiding behind the more obvious flavors of new oak.",La Cuillère Member's Reserve,90,55,Oregon,Willamette Valley,Willamette Valley,Paul Gregutt,@paulgwine ,Torii Mor 2005 La Cuillère Member's Reserve Pinot Noir (Willamette Valley),Pinot Noir,Torii Mor
60167,Italy,"Heat and power emerge immediately from the nose of this slightly brownish Montepulciano. Dig deep and you'll find prunes, blackberry, tobacco and resin. The wine is simple overall with gritty tannins.",NA,84,10,Central Italy,Montepulciano d'Abruzzo,NA,NA,NA,Montipagano 2005  Montepulciano d'Abruzzo,Montepulciano,Montipagano
60266,Germany,"This wine comes out of the bottle a little cranky, but give it some time in the glass and the initial stink gives way to notes of lime, apple and peach. It's plump in feel, with some dusty minerality and dried spices adding nuance to the sweet fruit.",Brauneberger Juffer Kabinett,90,18,Mosel-Saar-Ruwer,NA,NA,Joe Czerwinski,@JoeCz,Willi Haag 2005 Brauneberger Juffer Kabinett Riesling (Mosel-Saar-Ruwer),Riesling,Willi Haag
60290,US,"Buena Vista's been trying hard to get this cool-climate, single-vineyard wine right, and they've been succeeding inch by inch in building in layers of complexity. The '05 is rich and ripe in blackberry, pepper and new oak flavors, and is very dry and tannic. It will benefit from 3–4 years in the cellar.",Ramal Vineyard,90,37,California,Carneros,Napa-Sonoma,NA,NA,Buena Vista 2005 Ramal Vineyard Syrah (Carneros),Syrah,Buena Vista
60552,Australia,"Starts with scents of pear and melon, butter and spice, but takes on an ever-larger oak presence in the mouth, adding more and more wood spice and cedar. Not sure if this will ever completely integrate, so the best bet seems to be drinking earlier rather than later.",M3 Vineyard,88,30,South Australia,Adelaide Hills,NA,Joe Czerwinski,@JoeCz,Shaw and Smith 2005 M3 Vineyard Chardonnay (Adelaide Hills),Chardonnay,Shaw and Smith
60568,US,"Six Sigma's Cabernet is entirely unproven, but this one shows great promise. With a heavy rusticity, it has a way to go, but the blackberry and currant fruit is so rich, the tannin-acid balance so fine, that it's just a matter of time before this estate lands on the coveted map.",NA,88,42,California,Lake County,NA,NA,NA,Six Sigma Ranch 2005 Cabernet Sauvignon (Lake County),Cabernet Sauvignon,Six Sigma Ranch
60776,US,"Either there's some residual sugar or the high alcohol, 15.8%, gives this wine a sweet taste, or both. Either way, it tastes like liquified raspberry, cherry and blackberry jam, with a squeeze of chocolate syrup. One-third new oak adds caramel and butterscotch.",Marian's Vineyard,84,28,California,Lodi,Central Valley,NA,NA,St. Amant 2005 Marian's Vineyard Zinfandel (Lodi),Zinfandel,St. Amant
62166,Italy,"Here's a beautifully evolved Brunello di Montalcino (from Agricoltori del Geografico) that shows both elegance and harmony within layers of fruit, spice and earth. The wine articulates many of the most pleasurable characteristics associated with Sangiovese Grosso: elegance and liveliness.",NA,90,NA,Tuscany,Brunello di Montalcino,NA,NA,NA,Geografico Castello Tricerchi 2005  Brunello di Montalcino,Sangiovese Grosso,Geografico Castello Tricerchi
62307,Spain,"Deep and dark, with cola, blackberry and mossy aromas. This is full-bodied, tight and tannic, with hardness that will only be tempered by food and/or more time in bottle. Tastes bold, chunky and ripe, with chocolate and licorice along with heat and tannic fire. Drink now through 2017.",Prestigio,91,70,Northern Spain,Ribera del Duero,NA,Michael Schachner,@wineschach,Matarromera 2005 Prestigio  (Ribera del Duero),Tempranillo,Matarromera
63206,Portugal,"A big bruiser of a wine that hits you with its big, rich fist of blackberry fruits and sweetness. Maybe it is not elegant, but there is no denying the force behind this wine, the spice to go with the velvet texture.",NA,87,19,Alentejano,NA,NA,Roger Voss,@vossroger,Herdade do Esporão 2005 Syrah (Alentejano),Syrah,Herdade do Esporão
63801,Argentina,"Rhubarb and vinegar on the nose are ominous signs. The wine maintains a briary, sharp personality in the mouth, where red-fruit flavors have an extra juicy feel. Fresh as a cold winter's morning, but is that really what you want from Malbec?",Oak Roble,82,17,Mendoza Province,Mendoza,NA,Michael Schachner,@wineschach,Aconcagua 2005 Oak Roble Malbec (Mendoza),Malbec,Aconcagua
64385,Spain,"Inviting aromas of tobacco, earth, cedar and bacon give weight to racy berry scents. It's stripped and tight as a drum on the palate, with fiery acidity creating tangy raspberry and plum flavors accented by notes of tobacco, wood spice and citrus. This is best enjoyed with food; on its own it's a bit sharp.",Terra Incognita,89,70,Northern Spain,Ribera del Duero,NA,Michael Schachner,@wineschach,Viña Vilano 2005 Terra Incognita  (Ribera del Duero),Tempranillo,Viña Vilano
64748,US,"Dry and crisp and with some complexity. The oak is 50% new and very evident in the smoky caramel, while the fruit veers toward peaches and pineapples. As is often the case with Napa Chard, there's a sweet, herbal quality. Drink now through 2009.",NA,89,36,California,Napa Valley,Napa,NA,NA,Patz & Hall 2005 Chardonnay (Napa Valley),Chardonnay,Patz & Hall
65485,France,"There's a fine balance here between minerality and rich toast. The result is a very pure but ripe wine, dominated by a good mix of ripe white fruits and honey.",Montmains Premier Cru,90,40,Burgundy,Chablis,NA,Roger Voss,@vossroger,William Fèvre 2005 Montmains Premier Cru  (Chablis),Chardonnay,William Fèvre
66041,Chile,"Lively on the nose, with a strong whiff of Pine Sol but also some mulchy leaves. The palate is chunky and solid in terms of feel, with short berry and plum flavors mixed with green, mossy, drying tannins. A bit funky but not out of the realm of what's normal for Carmenère.",Reserva,84,14,Rapel Valley,NA,NA,Michael Schachner,@wineschach,El Toqui 2005 Reserva Carmenère (Rapel Valley),Carmenère,El Toqui
66176,France,"Medium weight with soft, dusty tannins, this wine is easily approachable now. Juicy and jammy flavors of red berry preserves are complemented by nuances of iris. A straightforward wine that will pair nicely with most game-based dishes.",NA,85,10,Languedoc-Roussillon,Minervois,NA,Lauren Buzzeo,@laurbuzz,Château de Landure 2005 Red (Minervois),Rhône-style Red Blend,Château de Landure
66184,US,"Here's a solid Merlot for early drinking. Soft and spicy, it shows flavors of cherries and red currants, with a distinct, briny note of corned beef.",Estate,85,80,California,San Francisco Bay-Livermore Valley,Central Coast,NA,NA,Picazo 2005 Estate Merlot (San Francisco Bay-Livermore Valley),Merlot,Picazo
66412,France,"A soft, ripe, open wine with yellow fruit flavors. There is opulent concentration, velvet in texture. Only on the finish is there freshness and real acidity. Screwcap.",Les Vaillons Premier Cru,89,37,Burgundy,Chablis,NA,Roger Voss,@vossroger,Domaine Laroche 2005 Les Vaillons Premier Cru  (Chablis),Chardonnay,Domaine Laroche
67336,US,"This is a sweet and round and forward Merlot, at least upon entry. Then it takes a right angle turn, adding more astringent flavors of rock and earth and green tea. It's not quite Jekyll & Hyde, but it's not entirely pulled together. It needs a substantial piece of grilled meat to help soften those finishing tannins.",NA,87,27,Washington,Columbia Valley (WA),Columbia Valley,Paul Gregutt,@paulgwine ,Bergevin Lane 2005 Merlot (Columbia Valley (WA)),Merlot,Bergevin Lane
67837,Chile,"This mature wine is a touch gritty and baked on the nose, and the palate has some scratch and choppiness to the mouthfeel. But core flavors of stewed berry, baked plum and cherry are good, and the finish of molasses, brown sugar and ripe berry fruit has its merits. Drink now.",Reserve Marchigüe Estate,88,28,Colchagua Valley,NA,NA,Michael Schachner,@wineschach,El Huique 2005 Reserve Marchigüe Estate Cabernet Sauvignon (Colchagua Valley),Cabernet Sauvignon,El Huique
70389,US,"Made from a warmer inland area, and blended with some Syrah and Grenache, this is a soft, fruity wine that offers immediate pleasure. It floods the mouth with blackberry, cherry, chocolate, leather and coffee flavors that finish in a sprinkling of cinnamon, white pepper and nutmeg.",L'Intruse,87,39,California,Santa Barbara County,Central Coast,NA,NA,Vie Winery 2005 L'Intruse Mourvèdre (Santa Barbara County),Mourvèdre,Vie Winery
71516,Italy,"This 70-30 blend of Montepulciano and Nero di Troia offers vibrant aromas of plum cake, molasses, blueberry and blackberry jam. The wine is rich and ripe in flavors with dark fruit nuances and smooth tannins.",Rupìcolo,86,11,Southern Italy,Castel del Monte,NA,NA,NA,Rivera 2005 Rupìcolo Red (Castel del Monte),Red Blend,Rivera
72116,US,"Superextracted in jammy fruit, this Bordeaux blend has flavors of cherries, blackberries, licorice, mocha and peppery spices. It's very rich, and probably at its best now and for a couple of years.",Devils' Peak,86,50,California,Napa Valley,Napa,NA,NA,Terlato 2005 Devils' Peak Red (Napa Valley),Bordeaux-style Red Blend,Terlato
