id,country,description,designation,points,price,province,region_1,region_2,taster_name,taster_twitter_handle,title,variety,winery
66886,Italy,"Enticing scents of wild rose, violet, perfumed berry and a whiff of aromatic herb unfold on this full-bodied red. The firm palate offers juicy black cherry, crushed raspberry, white pepper, clove and anise framed in assertive but ripe tannins and fresh acidity. Better after 2019.",San Lorenzo di Verduno,92,66,Piedmont,Barolo,NA,Kerin O’Keefe,@kerinokeefe,Fratelli Alessandria 2011 San Lorenzo di Verduno  (Barolo),Nebbiolo,Fratelli Alessandria
66888,Italy,"Juicy and savory, this boasts aromas of baked cherry pie, dried rose, leather, dark baking spice and a whiff of menthol. The rich, chewy palate offers juicy black cherry, orange zest, crushed strawberry, white pepper and cinnamon alongside big, ripe tannins and surprisingly fresh acidity for the hot vintage. Drink through 2026.",San Carlo Riserva,92,NA,Piedmont,Roero,NA,Kerin O’Keefe,@kerinokeefe,Valdinera 2011 San Carlo Riserva  (Roero),Nebbiolo,Valdinera
66946,Spain,"Aromas of blackberry, dark spices and herbs are intriguing but oaky and closed right now. An intense, tannic, drawing palate is home to coffee and smoky dark-berry flavors. A massive, highly tannic finish tastes of espresso, bitter chocolate, savory berry and plum. Drink from 2020–2036.",Malleolus de Sanchomartin,94,179,Northern Spain,Ribera del Duero,NA,Michael Schachner,@wineschach,Emilio Moro 2011 Malleolus de Sanchomartin  (Ribera del Duero),Tempranillo,Emilio Moro
67191,Italy,"Rose, violet, mint, sun-baked earth and red berry aromas emerge on this elegantly structured wine. The firm palate offers mature wild cherry, white pepper, chopped herb and star anise while tightly wound but polished tannins provide support. Let the tannins unwind then enjoy. Drink 2018–2026.",Rombone,92,50,Piedmont,Barbaresco,NA,Kerin O’Keefe,@kerinokeefe,Nada Fiorenzo 2011 Rombone  (Barbaresco),Nebbiolo,Nada Fiorenzo
67192,Italy,"Aromas of wild berry, spice, aromatic herb, leather and a balsamic note are some of the aromas you'll discover on this firm red. The structured, savory palate offers mature black raspberry, sour cherry, black pepper, aniseed and mint alongside youthfully assertive, polished tannins. Drink 2018–2025.",Mompissano Riserva,92,NA,Piedmont,Roero,NA,Kerin O’Keefe,@kerinokeefe,Cascina Cà Rossa 2011 Mompissano Riserva  (Roero),Nebbiolo,Cascina Cà Rossa
67283,France,"A small wine region close to the city of Lyon, Coteaux du Lyonnais produces the wine for the city's bars. This is soft, rounded, a delicious cherry flavored wine. It has a light structure and attractive final acidity.",Fleurieux,85,18,Beaujolais,Coteaux du Lyonnais,NA,Roger Voss,@vossroger,Signé Vigneron 2011 Fleurieux  (Coteaux du Lyonnais),Gamay,Signé Vigneron
67360,US,"The 2011 vintage was challenging for Washington in general and for the Walla Walla Valley in particular. This wine puts that aside with notes of dried cranberries and cherries along with vanilla and dry chocolate accents. The tart fruit flavors are elegant, with dry, grainy tannins along with vanilla flavors that carry through on the finish.",Estate Bottled,89,38,Washington,Walla Walla Valley (WA),Columbia Valley,Sean P. Sullivan,@wawinereport,Dumas Station 2011 Estate Bottled Cabernet Sauvignon (Walla Walla Valley (WA)),Cabernet Sauvignon,Dumas Station
67527,US,"This is a Captain America-sized Zin, muscular and strong in walls of huge, dusty dark fruit. Firm in tannins, juicy and swirling in vanilla and cinnamon toast flavors, it spent 22 months swaddled in French oak, an imprint that lets itself be known in the wine. Lay this baby down until 2015 or so, or let it breathe before enjoying with racks of ribs.",Lizzy James Vineyard,88,35,California,Lodi,Central Valley,Virginie Boone,@vboone,Harney Lane 2011 Lizzy James Vineyard Zinfandel (Lodi),Zinfandel,Harney Lane
67633,France,"A small parcel of vines produces this crisp, fragrant and very fruity wine. With its apple fruits and lightly oaked character, it's a bright wine, it's more taut texture showing some aging potential. Drink from 2015.",Le Grand Bois,87,NA,Burgundy,Chablis,NA,Roger Voss,@vossroger,Romain Bouchard 2011 Le Grand Bois  (Chablis),Chardonnay,Romain Bouchard
68124,France,"This is full, soft and a little heavy. It's condensed with sweetness from the rich fruit and misses some crispness.",NA,84,17,Provence,Côtes de Provence,NA,Roger Voss,@vossroger,Château Pas du Cerf 2011 Rosé (Côtes de Provence),Rosé,Château Pas du Cerf
68137,Spain,"Flourescent pink in color, like Day-Glo paint. It smells of sweet plum and berry; the palate is crisply acidic, with citrus and tart red-fruit flavors. The finish is crisp and cleansing but regular.",Garnacha Negra-Syrah,84,NA,Catalonia,Terra Alta,NA,Michael Schachner,@wineschach,Bogatell 2011 Garnacha Negra-Syrah Rosé (Terra Alta),Rosé,Bogatell
68218,Italy,"This opens with earthy aromas that recall mature berry, game, baked soil, menthol and leather. The bracing palate offers dark berry, toast, sage, dark cooking spices and a balsamic note alongside youthfully assertive tannins. Drink after 2019.",Le Coste di Monforte,90,NA,Piedmont,Barolo,NA,Kerin O’Keefe,@kerinokeefe,Pecchenino 2011 Le Coste di Monforte  (Barolo),Nebbiolo,Pecchenino
68289,Italy,"This full-bodied wine opens with earthy aromas of game, leather, ripe black fruit, clove and a balsamic note. Bracing tannins that still need to unwind support the concentrated blackberry, raspberry, tobacco and licorice flavors. The warmth of alcohol shows on the close. Drink 2017–2023.",Marchesa Riserva,90,55,Tuscany,Morellino di Scansano,NA,Kerin O’Keefe,@kerinokeefe,Terenzi 2011 Marchesa Riserva  (Morellino di Scansano),Sangiovese,Terenzi
68542,South Africa,"A light, bright and easygoing wine with clean notes of citrus, fresh-cut grass and lime zest. Lively acidity keeps the palate vibrant and refreshing, ending with a mouthwatering, tart green-plum flavor. Drink up.",Nr 3,86,18,Walker Bay,NA,NA,Lauren Buzzeo,@laurbuzz,Hermanuspietersfontein 2011 Nr 3 Sauvignon Blanc (Walker Bay),Sauvignon Blanc,Hermanuspietersfontein
68559,US,"Fairly standard Pinot, but with some silky qualities of interest. It's dry and tart, but with ripe cranberry, raspberry, vanilla and spice flavors. A very tasty wine for drinking now.",NA,86,26,California,Carneros,Napa-Sonoma,NA,NA,Robert Mondavi 2011 Pinot Noir (Carneros),Pinot Noir,Robert Mondavi
68973,US,"From the historic Uvas Creek area between Gilroy and Morgan Hill comes this solid bottling that shows black cherry, leather, dust and a slightly green element of oregano and green peppercorns on the nose. The palate is restrained and herbaceous, with elderberry fruit and woody sagebrush flavors.",Estate,91,34,California,Santa Clara Valley,Central Coast,Matt Kettmann,@mattkettmann,Jason-Stephens 2011 Estate Meritage (Santa Clara Valley),Meritage,Jason-Stephens
69135,Chile,"Raspberry and cherry aromas come with touch of floral perfume and smoke. This feels tight, juicy and slightly tannic. Flavors of black plum and wild berries are matched by chocolaty oak, while the finish is sweet in flavor, with ripe, mellow tannins.",Single Vineyard,88,17,Maule Valley,NA,NA,Michael Schachner,@wineschach,Oveja Negra 2011 Single Vineyard Syrah (Maule Valley),Syrah,Oveja Negra
69237,Italy,"Focused and bright, this northern Italian Pinot Bianco shows intense aromas of stone fruit and white rose. The mouthfeel, however, is what sets it apart thanks to the beautiful balance between its crisp acidity and that touch of sweet softness at the back.",NA,88,19,Northeastern Italy,Alto Adige,NA,NA,NA,Andriano 2011 Pinot Bianco (Alto Adige),Pinot Bianco,Andriano
69404,Italy,"This 100% Syrah offers aromas of mature black currant, charred earth and a whiff of cedar. The palate delivers dried black cherries, clove, ground pepper and powdered sage alongside raspy tannins that leave a drying, astringent finish.",Marchesale,87,70,Tuscany,Toscana,NA,Kerin O’Keefe,@kerinokeefe,Terre del Marchesato 2011 Marchesale Syrah (Toscana),Syrah,Terre del Marchesato
69667,Spain,"Cidery, yeasty, grassy aromas are the opening on this round Cava that could use a bit more cut. Cidery, briny stone-fruit and apple flavors come with a celery note, finishing dry and with a white pepper accent.",Tantum Ergo Brut Nature,86,59,Catalonia,Cava,NA,Michael Schachner,@wineschach,Bodegas Hispano Suizas 2011 Tantum Ergo Brut Nature Sparkling (Cava),Sparkling Blend,Bodegas Hispano Suizas
69726,Italy,"Subdued aromas of scorched earth, dark cooking spice, black currant and a whiff of game emerge in the glass. The ripe palate offers mature dark-skinned berry, vanilla, tobacco and toast alongside mellow tannins. Drink through 2018.",Kastelaz Riserva,89,45,Northeastern Italy,Alto Adige,NA,Kerin O’Keefe,@kerinokeefe,Elena Walch 2011 Kastelaz Riserva Merlot (Alto Adige),Merlot,Elena Walch
70087,US,"Petit Barone changes the blend signficantly from vintage to vintage. Here it's a Bordeaux-style mix of 49% Cabernet Sauvignon, 32% Merlot, 17% Cab Franc and 2% Petit Verdot, aged two years in half new French and American barrels. The oak comes through with strong flavors of licorice, espresso and char, along with some fairly stiff, chalky tannins. But there is generous fruit—black cherry and cassis—and the wine delivers a lot of big, powerful flavor for the modest tariff.",Petit Barone,89,22,Washington,Columbia Valley (WA),Columbia Valley,Paul Gregutt,@paulgwine ,Barons 2011 Petit Barone Red (Columbia Valley (WA)),Bordeaux-style Red Blend,Barons
70115,Moldova,"This Moldovan Cabernet Sauvignon has aromas of cherry vanilla, plum and cassis. In the mouth it has soft flavors of black currants, prunes and fresh black plums before the persistent finish.",Taraboste Rezerva,89,25,Moldova,NA,NA,Jeff Jenssen,@worldwineguys,Château Vartely 2011 Taraboste Rezerva Cabernet Sauvignon (Moldova),Cabernet Sauvignon,Château Vartely
70293,Italy,"Refermented in the bottle, this fragrant, salmon-colored Lambrusco offers delicate scents of wild rose, dried berry and baking spice. The elegant palate offers raspberry, strawberry, nectarine zest and ginger alongside an ultrafine mousse.",Rosé del Cristo,90,18,Central Italy,Lambrusco di Sorbara,NA,Kerin O’Keefe,@kerinokeefe,Cavicchioli 2011 Rosé del Cristo  (Lambrusco di Sorbara),Lambrusco,Cavicchioli
70484,US,"A blend of Cabernet Sauvignon, Merlot, Syrah and Cabernet Franc, this conveys tire rubber, smoke, green herbs and chocolate. The palate is off dry with blackberry and cherry flavors.",Treasure Valley Reserves,84,25,Idaho,NA,NA,Sean P. Sullivan,@wawinereport,Ste. Chapelle 2011 Treasure Valley Reserves Red,Red Blend,Ste. Chapelle
70504,Slovenia,"This orange-style wine is dark straw in color and has jasmine and vanilla tones on the nose, while flavors of canned apricots and fresh peaches drive the palate. There's a soft and sensuous finish, due to the 18 month barrels aging.",Grganja,90,23,Kras,NA,NA,Jeff Jenssen,@worldwineguys,Štoka 2011 Grganja Vitovska (Kras),Vitovska,Štoka
70690,Italy,"This accessible Barbaresco opens with ripe red berry, rose, leather and earthy aromas. The fresh palate offers dark cherry, ripe raspberry and black pepper alongside firm tannins and bright acidity. Drink now–2019.",NA,90,30,Piedmont,Barbaresco,NA,Kerin O’Keefe,@kerinokeefe,Villadoria 2011  Barbaresco,Nebbiolo,Villadoria
70819,Argentina,"Round, earthy blackberry aromas are dressed up in dry spice and oak. A fleshy, pure palate has bounce to its step, while oaky, toasty flavors of baked black fruits, cocoa and spice finish with just the right amount of cutting acidity and flavors of baking spices. Drink this Cabernet Franc-led blend through 2020.",Gran Enemigo,93,90,Mendoza Province,Mendoza,NA,Michael Schachner,@wineschach,El Enemigo 2011 Gran Enemigo Red (Mendoza),Bordeaux-style Red Blend,El Enemigo
70930,Italy,"It conveys a lightly floral, herbaceous fragrance. The palate is more restrained than exuberant, offering juicy pineapple, citrus, pink grapefruit and mineral accented with sage and rosemary.",NA,89,25,Southern Italy,Fiano di Avellino,NA,Kerin O’Keefe,@kerinokeefe,Rocca del Principe 2011  Fiano di Avellino,Fiano,Rocca del Principe
71149,US,"Straightforward aromas of crisp apple and pear dominate this Viognier's nose. This is a medium-bodied, easygoing selection that would pair well with casual fare like chicken salad sandwiches and baked cod.",NA,85,30,Virginia,Virginia,NA,NA,NA,Chateau Morrisette 2011 Viognier (Virginia),Viognier,Chateau Morrisette
71336,Italy,"This slowly reveals aromas of pressed rose, star anise, ripe berry and a menthol note. On the firm, straightforward palate, hints of licorice and clove add interest to dried black cherry. Give the bracing tannins a few more years to unclench and then drink up to capture the remaining fruit.",NA,87,40,Piedmont,Barolo,NA,Kerin O’Keefe,@kerinokeefe,Collina San Ponzio 2011  Barolo,Nebbiolo,Collina San Ponzio
71348,Argentina,"Brushy aromas of field herbs blend with scents of oaky vanilla, plastic and stalky berry fruits. This feels saturated and rubbery. A salty flavor profile holds onto the bouquet's stalky character, while the finishing flavors are peppery and herbal, with a hint of sweet plastic derived from oak.",La Primera,87,22,Mendoza Province,Mendoza,NA,Michael Schachner,@wineschach,Revancha 2011 La Primera Malbec (Mendoza),Malbec,Revancha
71568,France,"Light and very fresh for a Gewurztraminer, this is a wine with as much crisp apple as spice. It's off dry, laced with acidity and very ready to drink.",Cuvée Particulière,85,18,Alsace,Alsace,NA,Roger Voss,@vossroger,Klipfel 2011 Cuvée Particulière Gewurztraminer (Alsace),Gewürztraminer,Klipfel
71615,US,"After years of producing a basic Sonoma County Pinot, the winery turns to the coast for this blend of several vineyards. The results are wonderful. The wine is rich and expressive in raspberries and cherries, with touches of bacon, cola and the sweetness of new French oak. Drink this silky wine now.",NA,90,24,California,Sonoma Coast,Sonoma,NA,NA,Chateau St. Jean 2011 Pinot Noir (Sonoma Coast),Pinot Noir,Chateau St. Jean
71670,Italy,"This easy blend of Friulano (60%) and Malvasia opens with subtle tones of exotic fruit and peach followed by bright citrus and tangerine skin. The wine's lean, watery finish makes it perfect for appetizers or finger foods.",Borgo Crosaris Bianco dello Stella,86,16,Northeastern Italy,Venezia Giulia,NA,NA,NA,Tenute Grandi & Gabana 2011 Borgo Crosaris Bianco dello Stella White (Venezia Giulia),White Blend,Tenute Grandi & Gabana
71702,US,"The nose on this Long Island Syrah is rich and ruddy, with aromas of stewed plum and chocolate, but the palate is surprisingly fresh and primary in black cherry flavor. Green, herbal notes linger from start to finish for added refreshment.",NA,86,22,New York,North Fork of Long Island,Long Island,Anna Lee C. Iijima,NA,Suhru 2011 Shiraz (North Fork of Long Island),Shiraz,Suhru
71715,Chile,"Jammy berry aromas are slightly exotic. The palate has a wide yet acidic feel that lacks depth and structure. Blocky flavors of plum and berry are tangy and simple, while the finish fails to evolve past chunky and static.",Vitral Reserva,86,10,Rapel Valley,NA,NA,Michael Schachner,@wineschach,Viña Maipo 2011 Vitral Reserva Red (Rapel Valley),Red Blend,Viña Maipo
71815,Croatia,"Aromas include black cherry, cranberry, pomegranate, bramble and a light touch of eucalyptus. It's fruit forward and juicy on the lips yet pleasantly restrained in the midpalate. It would be an enjoyable wine at a barbecue.",NA,90,18,Istria,NA,NA,Jeff Jenssen,@worldwineguys,Kozlović 2011 Teran (Istria),Teran,Kozlović
71829,US,"Very dry and fairly tannic, it's severe on first sip and hard to appreciate, although there are some good black cherry, cola, leather, oak and black pepper flavors. It's complex in its own way, and gets better as it breathes in the glass. Give it a good, long decanting, and drink it now through 2018. The blend is Mourvèdre, Grenache, Syrah and Counoise, in that order.",Esprit de Tablas,90,55,California,Paso Robles,Central Coast,NA,NA,Tablas Creek 2011 Esprit de Tablas Red (Paso Robles),Rhône-style Red Blend,Tablas Creek
71866,US,"This will satisfy your Chardonnay sweet tooth with its flavors of orange and apricot jam, pineapple and vanilla-cream. It's pretty basic, but benefits from crisp acidity.",NA,83,17,California,Sonoma County,Sonoma,NA,NA,Shiloh Road 2011 Chardonnay (Sonoma County),Chardonnay,Shiloh Road
71998,Italy,"Roasted coffee bean, baked plum, charred earth, toast, vanilla and menthol aromas come together on this. The palate is firm but rather evolved, offering dried, dark-skinned berry, mocha, anise and a confectionary note wrapped in assertive close-grained tannins that dry out the finish.",NA,87,50,Tuscany,Brunello di Montalcino,NA,Kerin O’Keefe,@kerinokeefe,Madonna Nera 2011  Brunello di Montalcino,Sangiovese,Madonna Nera
72137,US,"This 100% varietal wine displays aromas of coffee, pipe tobacco and spice. The dark fruit and espresso flavors show a mixture of elegance and richness, with a textured mouthfeel providing appeal. It's a high-quality example from this cool vintage.",NA,90,45,Washington,Walla Walla Valley (WA),Columbia Valley,Sean P. Sullivan,@wawinereport,Bunchgrass 2011 Cabernet Sauvignon (Walla Walla Valley (WA)),Cabernet Sauvignon,Bunchgrass
72188,US,"A leaner style of Cabernet, this tastes of chocolate and coffee, chewy and dusty with a streak of black pepper. It's one of the winery's upper-tier offerings, hailing from Howell Mountain fruit rather than Napa's valley floor.",Family Reserve,88,75,California,Howell Mountain,Napa,Virginie Boone,@vboone,Charles Krug 2011 Family Reserve Cabernet Sauvignon (Howell Mountain),Cabernet Sauvignon,Charles Krug
72490,Italy,"This casual wine shows aromas of lemon soda, cut grass and ripe peach. The mouthful is simple and fresh.",NA,85,10,Veneto,Veneto,NA,NA,NA,Natale Verga 2011 Pinot Grigio (Veneto),Pinot Grigio,Natale Verga
72713,Italy,"This opens with aromas of black berries, toasted oak and spice. On the palate, notes of espresso, roasted coffee bean and vanilla back up ripe black cherry but drying wood tannins give it an abrupt finish.",San Cristoforo,87,52,Piedmont,Barbaresco,NA,Kerin O’Keefe,@kerinokeefe,Pietro Rinaldi 2011 San Cristoforo  (Barbaresco),Nebbiolo,Pietro Rinaldi
72769,Italy,"Lightly hued and luminous, this opens with aromas of wild cherry, blue flower, chopped herb and a balsamic note. The structured, refined palate offers dried cherry, ripe strawberry, white pepper, cinnamon and a hint of clove set against a backbone of firm, polished tannins. Drink 2018–2026.",Villero,93,150,Piedmont,Barolo,NA,Kerin O’Keefe,@kerinokeefe,Mascarello Giuseppe e Figlio 2011 Villero  (Barolo),Nebbiolo,Mascarello Giuseppe e Figlio
72817,Italy,"Baked earth, pressed rose, coffee, cocoa and plum aromas emerge on this full-bodied red. The round, hearty palate doles out mature black cherry, juicy blackberry, licorice and baking spice alongside velvety tannins. You'll also notice the warmth of alcohol on the close. Drink sooner rather than later to capture freshness and fruit richness.",Generala,89,40,Piedmont,Barbera d'Asti Superiore Nizza,NA,Kerin O’Keefe,@kerinokeefe,Bersano 2011 Generala  (Barbera d'Asti Superiore Nizza),Barbera,Bersano
72904,Portugal,"Fine tannins and attractive acidity set the scene for a wine that is structured and rich in perfumed berry fruits, with a dry, dark core. It is an impressive, ripe wine, still developing and filling out. Drink from 2018.",Palmer,91,NA,Port,NA,NA,Roger Voss,@vossroger,Barão de Vilar 2011 Palmer  (Port),Port,Barão de Vilar
72905,US,"Black and white pepper mix with black cherry, roasted fig, plum and grape aromas on this wine by master sommelier Paolo Barbieri, who built some of Las Vegas' top wine lists. The palate is juicy with blackberries but also shows a gravelly minerality and harder black spice.",Colson Canyon Vineyard,91,38,California,Santa Barbara County,Central Coast,Matt Kettmann,@mattkettmann,Barbieri 2011 Colson Canyon Vineyard Syrah (Santa Barbara County),Syrah,Barbieri
72951,US,"The wine was blended with a little Roussanne. It's full-bodied, oaky and rather warm, with orange, papaya, peach, vanilla custard and butterscotch flavors.",Claudia Cuvée Estate,88,32,California,Paso Robles,Central Coast,NA,NA,Alta Colina 2011 Claudia Cuvée Estate Marsanne (Paso Robles),Marsanne,Alta Colina
73080,US,"Barrel flavors of toast and chocolate cover light strawberry fruit. It's pleasant enough, but the flavors have not yet jelled. Give it until 2016 to age.",Red Willow Vineyard,86,25,Washington,Yakima Valley,Columbia Valley,Paul Gregutt,@paulgwine ,Eight Bells 2011 Red Willow Vineyard Merlot (Yakima Valley),Merlot,Eight Bells
73127,Italy,"Underbrush, blackberry, blue flower and mocha lead the nose on this blend of Sangiovese, Cabernet Sauvignon and Syrah. The dense palate offers cassis, black cherry, black pepper, espresso and licorice alongside youthfully assertive tannins. Drink 2016–2021.",Riserva,90,33,Tuscany,Morellino di Scansano,NA,Kerin O’Keefe,@kerinokeefe,Morisfarms 2011 Riserva  (Morellino di Scansano),Red Blend,Morisfarms
73130,US,"A bouquet of spicy cinnamon and clove opens up this tightly woven wine, with perceptible tannins and rustic leather-bound elements to the nose and palate. With noticeable acidity and a crispness of cranberry, it develops an intensity on the finish, along with a taste of dried cherry.",Stagecoach Vineyard,90,98,California,Atlas Peak,Napa,Virginie Boone,@vboone,Patland 2011 Stagecoach Vineyard Cabernet Sauvignon (Atlas Peak),Cabernet Sauvignon,Patland
73249,US,"A shock of white pepper remains memorable throughout this wine, which hails from a high-elevation vineyard overlooking the Pacific Ocean. Pinot Noir-like in its leanness and silky mouthfeel, it's prickly with feral jolts of cinnamon and tobacco.",Estate Vineyard,92,55,California,Fort Ross-Seaview,Sonoma,Virginie Boone,@vboone,Red Car 2011 Estate Vineyard Syrah (Fort Ross-Seaview),Syrah,Red Car
73373,Italy,"This is a blend of Trebbiano, Malvasia and Grechetto. The mildness of its fruity bouquet and the leanness of its mouthfeel suggest that it should be paired with tuna salads or steamed dumplings.",Donna Patrizia,85,10,Tuscany,Toscana,NA,NA,NA,Buccia Nera 2011 Donna Patrizia White (Toscana),White Blend,Buccia Nera
73847,Italy,"A blend of Sangiovese, Merlot and Cabernet aged in barriques, this opens with aromas that recall perfumed berry, wild violet and a balsamic note. The dense, ripe palate doles out ripe black plum, crushed wild cherry, toast and roasted coffee bean alongside soft acidity and chewy tannins. Drink through 2016.",Riserva,87,20,Tuscany,Chianti,NA,Kerin O’Keefe,@kerinokeefe,Fattoria Petriolo 2011 Riserva  (Chianti),Red Blend,Fattoria Petriolo
74115,US,"This is dry, acidic and a little underripe, with a New Zealand-like touch of gooseberry. A respectable wine, this has a bright core of lemon, lime and tropical fruit.",NA,86,16,California,Napa Valley,Napa,NA,NA,Mason Cellars 2011 Sauvignon Blanc (Napa Valley),Sauvignon Blanc,Mason Cellars
74121,Italy,"This is a lovely Sauvignon that opens with huge aromatic intensity and flavors of stone fruit, chopped basil and citrus. Expressive and bright, it's true to the semi-aromatic variety. Screwcap.",NA,90,30,Northeastern Italy,Collio,NA,NA,NA,Livio Felluga 2011 Sauvignon (Collio),Sauvignon,Livio Felluga
74238,US,"The most immediately accessible of Will's three Horse Heaven Hills wines, it brings notes of scorched earth, herbs, incense, toast and abundant dark fruit. The palate is densely packed with dark fruit, tart acids and firm, tightly coiled tannins with a beautiful sense of balance. A classically styled wine that should have a healthy life in front of it.",Champoux Vineyard,93,52,Washington,Horse Heaven Hills,Columbia Valley,Sean P. Sullivan,@wawinereport,Andrew Will 2011 Champoux Vineyard Red (Horse Heaven Hills),Bordeaux-style Red Blend,Andrew Will
74254,Austria,"A sheen of lifted lemon oil surrounds this BA, whose palate oscillates between feisty, candied lemon peel and more hazy notions of passion fruit. There is something elixir-like about its immense precision and perfect balance.",Beerenauslese Cuvée,92,34,Burgenland,NA,NA,Anne Krebiehl MW,@AnneInVino,Kracher 2011 Beerenauslese Cuvée White (Burgenland),White Blend,Kracher
74321,France,"This fruity, wood-aged wine has plenty of potential. Its stone fruit flavors are full and rich, a contrast to the herbaceous edge. A smooth texture is just showing through. Keep for 2–3 years.",NA,89,20,Bordeaux,Graves,NA,Roger Voss,@vossroger,Château Haut Selve 2011  Graves,Bordeaux-style White Blend,Château Haut Selve
74477,France,"Now prizes for guessing C de B stands for Côte de Brouilly. Now perfectly mature, this is a soft, black cherry fruited wine. It is ripe, with a fine, dense texture that is lifted by the acidity and the light tannic structure. The wine is so deliciously ready to drink.",C de B,91,20,Beaujolais,Côte de Brouilly,NA,Roger Voss,@vossroger,Domaine Dumas 2011 C de B  (Côte de Brouilly),Gamay,Domaine Dumas
74657,Italy,"This opens with aromas of stewed plum, cherry marinated in spirits, cellar floor and a hint of soy sauce. The aromas carry over to the dense palate along with licorice and a hint of orange peel.",Roggeri,87,62,Piedmont,Barolo,NA,Kerin O’Keefe,@kerinokeefe,Ciabot Berton 2011 Roggeri  (Barolo),Nebbiolo,Ciabot Berton
74697,Italy,"Trebbiano, Malvasia and a tiny percent of Chardonnay are blended to produce a sticky, slightly soft wine with lush tones of peachy fruit, cantaloupe and honey.",Nobilvite,84,10,Central Italy,Circeo,NA,NA,NA,Villa Gianna 2011 Nobilvite  (Circeo),White Blend,Villa Gianna
