id,country,description,designation,points,price,province,region_1,region_2,taster_name,taster_twitter_handle,title,variety,winery
71,US,"Big oak defines this robustly dense and extracted red, swimming in vanilla and cherry flavor. Full-bodied and gravelly in texture, it's a rustically pleasant wine for pizza nights and crowds.",Old Vine,86,40,California,Alexander Valley,Sonoma,Virginie Boone,@vboone,Eco Terreno 2013 Old Vine Cabernet Sauvignon (Alexander Valley),Cabernet Sauvignon,Eco Terreno
536,US,"Merlot (63%) takes the lead on this blend followed by Cabernet Sauvignon (23%) and Cabernet Franc. The aromas seem somewhat wound up at present, with notes of wood spice, vanilla and fresh herb. The palate is über-smooth, showing a fine sense of balance and polish.",NA,91,50,Washington,Walla Walla Valley (WA),Columbia Valley,Sean P. Sullivan,@wawinereport,Northstar 2013 Red (Walla Walla Valley (WA)),Bordeaux-style Red Blend,Northstar
582,US,"The aromas are so light you need to strain to get at them, with notes of vanilla, coffee and cherry. The palate brings plentiful coffee and cherry flavors that show a pleasing sense of texture. One wants more aromatically, but the palate delivers.",NA,89,18,Washington,Wahluke Slope,Columbia Valley,Sean P. Sullivan,@wawinereport,Seven Falls 2013 Merlot (Wahluke Slope),Merlot,Seven Falls
633,Australia,"This full-bodied wine is rich without ever seeming overdone. Subtle smoke notes frame bold fruit—tangerine, pineapple and apricot—and gingery spice, while the finish is long, peppery and refreshing. Drink now–2020.",NA,92,60,Victoria,Yarra Valley,NA,Joe Czerwinski,@JoeCz,Yeringberg 2013 Viognier (Yarra Valley),Viognier,Yeringberg
647,Portugal,"This is an impressive, powerful wine. It speaks of the hard landscape of the Douro Superior, with its structure and dark tannins. At the same time, ripe dark fruits push through the still-young tannins giving the potential for a rich, black fruit dominated wine. Predominantly Touriga Nacional (60 percent), this wine is a new venture created by João Nicolau d'Almeida (who has run Ramos-Pinto for many years) and his family. Drink from 2018.",NA,92,80,Douro,NA,NA,Roger Voss,@vossroger,Quinta do Monte Xisto 2013 Red (Douro),Portuguese Red,Quinta do Monte Xisto
655,US,"This is one of the best balanced and most elegant Zins around. Very fresh in aroma, it's slightly yeasty like freshly fermented wine, and with subtly gorgeous cherry and blackberry flavors layered with light cedar and cocoa spiciness. Not only is the finish lingering, but the wine still tasted great two days after pulling the cork.",Lodi Native Marian's Vineyard,92,30,California,Mokelumne River,Central Valley,Jim Gordon,@gordone_cellars,St. Amant 2013 Lodi Native Marian's Vineyard Zinfandel (Mokelumne River),Zinfandel,St. Amant
656,US,"This cuvée is made with the oldest Pommard clones in the estate vineyard. It's a sharp-edged, reserve-level wine with a defining streak of peppery herb. The black fruits and barrel flavors of licorice, espresso and dark chocolate promise further depth as it ages. Drink 2020–2030.",Nancy's,92,70,Oregon,Dundee Hills,Willamette Valley,Paul Gregutt,@paulgwine ,Stoller 2013 Nancy's Pinot Noir (Dundee Hills),Pinot Noir,Stoller
658,US,"This full-bodied wine has a voluptuous entry that's slightly tropical in pineapple and Asian pear, as well as vanilla-layered oak. The expansive beginning segues smoothly into a higher-wire act of minerality, finishing fleshy and fresh.",NA,90,40,California,Los Carneros,Napa-Sonoma,Virginie Boone,@vboone,Vine Cliff 2013 Chardonnay (Los Carneros),Chardonnay,Vine Cliff
669,US,"All varietal, this wine offers unique aromas of toast, fig, dried herb and exotic spice. The purple fruit flavors are deft in style with a pleasing sense of balance, length and texture.",McClellan Estate Vineyard,90,30,Washington,Walla Walla Valley (WA),Columbia Valley,Sean P. Sullivan,@wawinereport,Seven Hills 2013 McClellan Estate Vineyard Malbec (Walla Walla Valley (WA)),Malbec,Seven Hills
820,Spain,"Cherry and cassis aromas are a touch flat and jammy. This shows grabby tannins as well as loamy, earthy, lightly bitter flavors of black fruits. The finish lumbers along with size and tannic grip, but overall this blend of 65% Tempranillo, 25% Graciano and 10% Garnacha shows well.",Made With Organic Grapes,86,12,Northern Spain,Rioja,NA,Michael Schachner,@wineschach,Navardia 2013 Made With Organic Grapes  (Rioja),Tempranillo Blend,Navardia
1039,Spain,"Varietally correct aromas of peach and melon form a good opening to this mostly fresh but fading Albariño. Flavors of melon, papaya and peach are typical for the grape, and the finish is holding on but showing signs of maturation. Drink immediately.",NA,87,15,Galicia,Rías Baixas,NA,Michael Schachner,@wineschach,Pazo Torrado 2013 Albariño (Rías Baixas),Albariño,Pazo Torrado
1134,France,"This wine is structured and stalky without the fruit weight, reflecting the difficult vintage. A smoky character comes through the acidity to leave a dry aftertaste. Through 2016, it will soften a little, although always missing the fruit. The blend is 55% Merlot, 25% Cabernet Ssauvignon and 20% Cabernet Franc.",NA,84,15,Bordeaux,Bordeaux Supérieur,NA,Roger Voss,@vossroger,Château Vrai Caillou 2013  Bordeaux Supérieur,Bordeaux-style Red Blend,Château Vrai Caillou
1223,US,"After three years en tirage, this well-evolved wine is heady and floral, made to highlight and celebrate diversity. Creamy and lush on the palate, it has a rounded richness of stone fruit. Made predominantly from Pinot Noir, it has an accentuated taste of strawberry shortcake.",Rainbow Cuvée,93,65,California,Green Valley,Sonoma,Virginie Boone,@vboone,Iron Horse 2013 Rainbow Cuvée Sparkling (Green Valley),Sparkling Blend,Iron Horse
1297,Italy,"From what are considered as the highest vineyards in Europe, this vibrant, elegant white reveals lovely fragrances of honeysuckle, jasmine and alpine herb. The linear palate delivers yellow apple, citrus, thyme and a hint of mineral alongside brisk acidity.",Tradizionale Blanc de Morgex et de La Salle,89,20,Northwestern Italy,Valle d'Aosta,NA,Kerin O’Keefe,@kerinokeefe,Cave du Vin Blanc de Morgex et de la Salle 2013 Tradizionale Blanc de Morgex et de La Salle Prié Blanc (Valle d'Aosta),Prié Blanc,Cave du Vin Blanc de Morgex et de la Salle
1303,Germany,"Taut and cool with swathes of fresh tarragon and crisp melon rind, this elegant dry Riesling has a nervous vitality throughout. The palate is zesty and bright, highlighting tart flavors of tangerine and apricot before fading into a dusty mineral finish.",Hochheimer Hölle Kabinett Trocken,89,28,Rheingau,NA,NA,Anna Lee C. Iijima,NA,Domdechant Werner 2013 Hochheimer Hölle Kabinett Trocken Riesling (Rheingau),Riesling,Domdechant Werner
1411,Portugal,"The dark color and high acidity of this wine are both typical of the Sousão grape which is normally found only in Douro blends. It is ripe, fruity and juicy although with tight acidity and black currant fruits. The wine's tannins suggest it needs to age, so drink from 2017.",NA,88,40,Douro,NA,NA,Roger Voss,@vossroger,Quinta do Vallado 2013 Sousão (Douro),Sousão,Quinta do Vallado
1456,US,"From a 22-acre site in the middle of the appellation, this is an impressive wine, softened by the addition of 6% Merlot. It boasts crushed rock, black currant and licorice flavors, with an attractive sanguine note. Pencil shavings, black pepper and cigar accents are present throughout.",Cabernet Bosché,94,150,California,Rutherford,Napa,Virginie Boone,@vboone,Freemark Abbey 2013 Cabernet Bosché Cabernet Sauvignon (Rutherford),Cabernet Sauvignon,Freemark Abbey
1597,France,"This second wine of Château Potensac is soft, fruity with a hint of firmer structure. Juicy Cabernet gives the wine its shape and freshness. It is already drinkable, fruity and fresh.",Chapelle de Potensac,88,NA,Bordeaux,Médoc,NA,Roger Voss,@vossroger,Château Potensac 2013 Chapelle de Potensac  (Médoc),Bordeaux-style Red Blend,Château Potensac
1601,US,"Pure butterscotch aromas seem to leap from the glass, yet the flavors are dry and rather reserved, not nearly as obvious as the smell. The balance leans toward tartness, the flavors are lean and the finish lemony.",Walraven Vineyard,88,55,California,Anderson Valley,NA,Jim Gordon,@gordone_cellars,Domaine Anderson 2013 Walraven Vineyard Chardonnay (Anderson Valley),Chardonnay,Domaine Anderson
1737,US,"Ian Brand explores fringe growing regions to deliver well-priced and fun wines for this label. This shows aromas of tight nectarine and Granny Smith apple, and the flavors are laser-focused with apple skins, yellow grapefruit pith and steely gunmetal. Its intense energy is a little wound up now, but will blossom with time.",Jack's Hill,92,22,California,Monterey County,Central Coast,Matt Kettmann,@mattkettmann,Le P'tit Paysan 2013 Jack's Hill Chardonnay (Monterey County),Chardonnay,Le P'tit Paysan
1850,US,"Toasted sourdough bread and briny lemon show on the nose and palate, with dusty oak and slightly burnt toast on the finish.",Estate Reserve Barrel Fermented,83,25,New Jersey,Outer Coastal Plain,NA,Alexander Peartree,NA,Heritage 2013 Estate Reserve Barrel Fermented Chardonnay (Outer Coastal Plain),Chardonnay,Heritage
2000,Italy,The nose isn't very expressive but reveals white flower and tropical fruit. The simple palate delivers pineapple and lemon zest alongside brisk acidity.,Baglio del Sole,84,12,Sicily & Sardinia,Sicilia,NA,Kerin O’Keefe,@kerinokeefe,Feudi del Pisciotto 2013 Baglio del Sole Inzolia (Sicilia),Inzolia,Feudi del Pisciotto
2323,France,"With plenty of weight to support the ripe fruits, this is a balanced, perfumed wine. It has structure and tannins, along with fresh black currant flavors in the 80/20 Merlot/Cabernet Sauvignon blend. Drink from 2016.",NA,85,15,Bordeaux,Bordeaux Supérieur,NA,Roger Voss,@vossroger,Château Roc Montalon 2013  Bordeaux Supérieur,Bordeaux-style Red Blend,Château Roc Montalon
2340,US,"Light aromas of herbs, woodspice, tire rubber and red fruit lead to jammy raspberry and spice flavors that provide easy drinking pleasure.",NA,85,10,Washington,Columbia Valley (WA),Columbia Valley,Sean P. Sullivan,@wawinereport,Sagelands 2013 Merlot (Columbia Valley (WA)),Merlot,Sagelands
2342,US,"Buoyantly aromatic, this blossomy Traminette sparkling wine stands out in a line up of traditional Champagne-style sparklers. Heady rose and gardenia tones feel perfumey on the palate, but brisk acidity and soft, pillowy foam are pleasant.",Freelings Creek Reserve Sparkling,85,18,New York,Lake Erie,Finger Lakes,Anna Lee C. Iijima,NA,Johnson Estate 2013 Freelings Creek Reserve Sparkling Traminette (Lake Erie),Traminette,Johnson Estate
2399,US,"Made in the style of a southern Rhône blend (half Viognier and one quarter each Marsanne and Roussanne), this is lightly lemony, with a bit more fat in the middle. None of the three grapes overpowers the others, but the flavors feel a bit generic. Though fermented in stainless steel, it's gold in color and shows some hints of toast.",Leverage,87,28,Oregon,Rogue Valley,Southern Oregon,Paul Gregutt,@paulgwine ,Simple Machine 2013 Leverage White (Rogue Valley),Rhône-style White Blend,Simple Machine
2556,US,"Simultaneously light yet earthy, this shows cherry pie, concentrated pomegranate, whole nutmeg, buttery crust and intriguing brown spices on the nose. There is a bit less action on the palate, but still plenty of tart cherries, tobacco and brown spice elements.",Sebastiano Vineyard,89,45,California,Sta. Rita Hills,Central Coast,Matt Kettmann,@mattkettmann,Pace 2013 Sebastiano Vineyard Pinot Noir (Sta. Rita Hills),Pinot Noir,Pace
2764,US,"This medium-bodied wine has an earthy aroma, muted cherry flavors and a smooth enough texture. It is good and drinkable.","Hundred Point, Estate Bottled",84,50,California,Anderson Valley,NA,Jim Gordon,@gordone_cellars,"Greenwood Ridge 2013 Hundred Point, Estate Bottled Pinot Noir (Anderson Valley)",Pinot Noir,Greenwood Ridge
2820,Italy,"Aromas of underbrush, toast and dark-skinned fruit lead the nose of this easy-drinking red. The bright, informal palate offers red cherry, pomegranate and a hint of white pepper alongside zesty acidity.",Al Canapo,86,15,Tuscany,Chianti Colli Senesi,NA,Kerin O’Keefe,@kerinokeefe,Bindi Sergardi 2013 Al Canapo  (Chianti Colli Senesi),Sangiovese,Bindi Sergardi
2857,US,"This wine is made in a ripe forward style, with lightly volatile aromas of apple, plum and dark raspberries. It's full bodied and pulls no punches as generous red and black-fruit flavors with cocoa accents show some warmth on the finish.",Reserve Northridge Vineyard,88,35,Washington,Wahluke Slope,Columbia Valley,Sean P. Sullivan,@wawinereport,Ryan Patrick 2013 Reserve Northridge Vineyard Grenache (Wahluke Slope),Grenache,Ryan Patrick
3184,US,"This is an estate-grown blend of 61% Malbec, 33% Cabernet Sauvignon, 3% Petit Verdot and 3% Syrah. It sizzles in a mix of huckleberry and blueberry, full-bodied and dusty in tannin. Its juicy and lifted by moderate acidity, with oaky accents of vanilla, nutmeg and clove.",19 Block Mountain Cuvée,90,38,California,Mount Veeder,Napa,Virginie Boone,@vboone,Hess Collection 2013 19 Block Mountain Cuvée Red (Mount Veeder),Red Blend,Hess Collection
3247,US,"This tradition-bucking blend of 61% Chenin Blanc, 31% Viognier and 8% Roussanne offers soft aromas of sweet apple blossoms and peach, with a hint of barrel smoke. The palate offers a similar blend of peaches, pears and apples, warmed up with some oak influence.",White Elephant,86,18,California,California,California Other,Matt Kettmann,@mattkettmann,Vinum 2013 White Elephant White (California),White Blend,Vinum
3362,US,"This is a rich, peppery and generously tannic and full-bodied expression of the grape, both powerful and brimming in grace. Soft and mellow on the midpalate, it builds up ripeness and texture toward the finish, ending with a satisfying bite of graham cracker and chocolate.",Cask 23 Estate,92,260,California,Napa Valley,Napa,Virginie Boone,@vboone,Stag's Leap Wine Cellars 2013 Cask 23 Estate Cabernet Sauvignon (Napa Valley),Cabernet Sauvignon,Stag's Leap Wine Cellars
3376,US,"From century-old vines, this wine is potent and focused, with powerful, ripe fruit flavors and a texture that feels polished and precise. The aromas favor black cherry and black pepper, the flavors are fresh and mouth-filling, and the wine has firm acidity and tannins that make the texture appetizing.",Big River Ranch Vineyard Series,92,45,California,Alexander Valley,Sonoma,Jim Gordon,@gordone_cellars,Bella 2013 Big River Ranch Vineyard Series Zinfandel (Alexander Valley),Zinfandel,Bella
3398,US,"Pruney and somewhat reduced, this thick offering of chocolate and blackberry jam needs food to mellow it out, preferably meat covered thickly in sauce.",NA,84,32,California,Napa County-Sonoma County,Napa-Sonoma,Virginie Boone,@vboone,Michael-Scott 2013 Zinfandel (Napa County-Sonoma County),Zinfandel,Michael-Scott
3404,US,Faint notes of yuzu rise over underripe peach in this unoaked Chardonnay. The light-bodied palate shows a mild concentration of lemon leading to a short but clean finish.,Unoaked,84,32,Michigan,Lake Michigan Shore,NA,Alexander Peartree,NA,Three Fires 2013 Unoaked Chardonnay (Lake Michigan Shore),Chardonnay,Three Fires
3417,US,"Balsamic aromas and strong pruney flavors combine for a heavy-handed taste in this full-bodied wine. It seems to be well-aged already, so drink it soon if you like this style.",England-Shaw Vienyard,83,24,California,Solano County,North Coast,Jim Gordon,@gordone_cellars,Pat Paulsen Vineyards 2013 England-Shaw Vienyard Syrah (Solano County),Syrah,Pat Paulsen Vineyards
3435,US,"Smooth and polished, this medium-bodied wine has attractive fruit and cinnamon aromas, generous dark-fruit flavors, and light touches of baking spices.",NA,88,28,California,Yorkville Highlands,North Coast,Jim Gordon,@gordone_cellars,Meyer Family Cellars 2013 Syrah (Yorkville Highlands),Syrah,Meyer Family Cellars
3443,Portugal,Red-berry fruits and soft tannins give a wine with some juicy acidity and spice. The firm aftertaste shows that it is still needs time. Drink from 2018.,Dona Matilde Reserva,88,39,Douro,NA,NA,Roger Voss,@vossroger,Quinta Dona Matilde 2013 Dona Matilde Reserva Red (Douro),Portuguese Red,Quinta Dona Matilde
3520,US,"A field mix of seven varieties, this is a sanguine, thick and rich wine, softly layered in licorice, fig and cranberry, with a big presence on the palate. Dusty and leathery, it begs emphatically to be paired with pizza.",Tinto,88,45,California,St. Helena,Napa,Virginie Boone,@vboone,Casa Nuestra 2013 Tinto Red (St. Helena),Red Blend,Casa Nuestra
3781,New Zealand,"A rather pungent, slightly sweaty nose presages a wine that offers loads of passion fruit flavor. While it lacks a bit of dimension and complexity, this medium-bodied offering will work fine alongside citrusy ceviches and the like.",NA,86,16,Marlborough,NA,NA,Joe Czerwinski,@JoeCz,Wairau River 2013 Sauvignon Blanc (Marlborough),Sauvignon Blanc,Wairau River
3793,US,"In just a few years 14 Hands Riesling production has jumped from around 15,000 to more than 700,000 cases. Clearly the brand is doing something that consumers love. This is a fairly dry style, with forward, fruity flavors of ripe orange, apple and apricot. The length and concentration are spot on.",NA,88,10,Washington,Washington,Washington Other,Paul Gregutt,@paulgwine ,14 Hands 2013 Riesling (Washington),Riesling,14 Hands
3802,US,"Just a smidge over the edge into off dry, this is a big, juicy wine with a luscious mix of tropical candy fruit flavors. It's like tasting an entire roll of tropical Life Savers all in a glass. The residual sugar is offset with balancing acidity, and it's a versatile wine that can accompany a wide range of slightly spicy foods.",NA,88,12,Washington,Yakima Valley,Columbia Valley,Paul Gregutt,@paulgwine ,Mercer 2013 Riesling (Yakima Valley),Riesling,Mercer
3901,US,"Closed and youthful, this wine is medium in build and subtle in oak. It conveys a briny streak throughout the palate, and a distinct taste of candied lemon.",NA,87,22,California,Sonoma County,Sonoma,Virginie Boone,@vboone,Previous 2013 Chardonnay (Sonoma County),Chardonnay,Previous
3922,Portugal,"A juicy, fruity wine that is named after the Knights Templar who built a magnificent castle and convent in the local city of Tomar. It is fresh with red berry acidity and some perfumed tannins. It should be ready to drink soon, but wait until the end of 2016 for the best results.",Templários Colheita Seleccionada,87,18,Tejo,NA,NA,Roger Voss,@vossroger,Quinta do Cavalinho 2013 Templários Colheita Seleccionada Red (Tejo),Portuguese Red,Quinta do Cavalinho
4013,US,"The aromas are surprisingly light for the variety with notes of ripe pear and peach. It's full bodied with sweet fruit flavors and a rounded, creamy feel leading to a warm finish.",NA,88,15,Washington,Wahluke Slope,Columbia Valley,Sean P. Sullivan,@wawinereport,Jones of Washington 2013 Viognier (Wahluke Slope),Viognier,Jones of Washington
4041,US,"Aromas of herb, pear, apple skin are followed by spritely fruit flavors that linger on the finish.",Blanc de Noir,88,70,Washington,Lake Chelan,Columbia Valley,Sean P. Sullivan,@wawinereport,Karma Vineyards 2013 Blanc de Noir Sparkling (Lake Chelan),Sparkling Blend,Karma Vineyards
4103,US,"Baked pear and honeysuckle combine around a floral, perfumy vibe, the wine medium in weight, texture and body. A crisp and lemony finish rounds it out, the wine structured and soft.",NA,86,22,California,Napa Valley,Napa,Virginie Boone,@vboone,Markham 2013 Chardonnay (Napa Valley),Chardonnay,Markham
4187,US,"Salted grapefruit skins, browned butter and a toasted-nut element arise on the nose of this wine from a vineyard near the tiny Salinas Valley town of San Ardo. It offers acidic energy and tight minerality on the palate, with ripe aromatic apples showing midway through the sip.",NA,87,14,California,Monterey County,Central Coast,Matt Kettmann,@mattkettmann,Paris Valley Road Cellars 2013 Chardonnay (Monterey County),Chardonnay,Paris Valley Road Cellars
4215,Germany,"Blackberry and cherry notes are approachable but slightly muted in this straightforward, medium-bodied red wine. It's a touch herbal and green, with a tart finish marked by fine tannins. Drink now.",Made With Organic Grapes,87,12,Rheinhessen,NA,NA,Anna Lee C. Iijima,NA,Schlink Haus 2013 Made With Organic Grapes Dornfelder (Rheinhessen),Dornfelder,Schlink Haus
4579,Portugal,This softly perfumed wine has red-fruit flavors and plenty of acidity. It is jammy and juicy with succulent red berries. Drink now.,Paxis,85,10,Lisboa,NA,NA,Roger Voss,@vossroger,DFJ Vinhos 2013 Paxis Pinot Noir (Lisboa),Pinot Noir,DFJ Vinhos
4725,Argentina,"Earthy slightly grassy infusions work their way onto a hot energetic bouquet. This feels racy, drawing and a bit clampy, while woody spicy flavors of rubbery berry fruits finish bold and hot like the beginning.",NA,87,20,Mendoza Province,Uco Valley,NA,Michael Schachner,@wineschach,Tiza 2013 Malbec (Uco Valley),Malbec,Tiza
4884,Greece,"White peach, tropical fruit and citrus typify this curvy white punctuated by fragrant Viognier. The rounded fruit is buoyed by Assyrtiko's brisk acidity.",Claudia Viognier-Assyrtiko,87,25,Chalkidiki,NA,NA,Susan Kostrzewa,@suskostrzewa,Claudia Papayianni 2013 Claudia Viognier-Assyrtiko White (Chalkidiki),White Blend,Claudia Papayianni
5063,Portugal,"An instantly enjoyable, balanced rosé. It's fresh, clean and full of red berry fruits, with a crisp finish. Drink now.",Periquita,87,11,Península de Setúbal,NA,NA,Roger Voss,@vossroger,José Maria da Fonseca 2013 Periquita Rosé (Península de Setúbal),Rosé,José Maria da Fonseca
5077,France,"The wine is all juicy fruit, black cherries with just a modicum of tannin to hold it together. It's fresh, ripe and immediately attractive. Ready to drink now, but with those tannins it should also age 2016–2017.",Le Grand Bouqueteau,87,16,Loire Valley,Chinon,NA,Roger Voss,@vossroger,Château du Coudray Montpensier 2013 Le Grand Bouqueteau  (Chinon),Cabernet Franc,Château du Coudray Montpensier
5139,US,"The producer sources primarily from its historic Rhinefarm Estate Vineyard for this wine, a rich expression of the variety opaque in color. Meat, black pepper, leather and tobacco give it a velvety lushness and concentration buoyed by complex, savory components. The lengthy finish is all about bittersweet chocolate.",NA,92,50,California,Sonoma Valley,Sonoma,Virginie Boone,@vboone,Gundlach Bundschu 2013 Cabernet Sauvignon (Sonoma Valley),Cabernet Sauvignon,Gundlach Bundschu
5252,US,"From a p of Sonoma Mountain exposed to the Petaluma Gap, this wine is spicy in cinnamon and cola, its oak profile reduced and intense. Roses and cherries provide the floral and the fruit around deeper, darker tendencies into Asian spice and black tea. Drink now through 2021.",Silver Pines Vineyard,91,44,California,Sonoma Mountain,Sonoma,Virginie Boone,@vboone,Bailiwick 2013 Silver Pines Vineyard Pinot Noir (Sonoma Mountain),Pinot Noir,Bailiwick
5254,US,"This unique and interestingly yummy wine shows the exuberance of carbonic maceration. A light-bodied beauty, it offers grenadine and kirsch-like exoticness, buoyed by a tang of rose petals and orange zest.",NA,91,40,California,Napa Valley,Napa,Virginie Boone,@vboone,Castrucci 2013 Pinot Noir (Napa Valley),Pinot Noir,Castrucci
5733,US,"From an appellation better known for Zin, this blend of 41% Cabernet Sauvignon, 26% Cabernet Franc, 21% Malbec, 8% Merlot and 4% Petit Verdot works well—a study in chocolate-covered blackberry and blueberry with a powerful firmness balanced by moderate acidity.",Cab 5 Rockpile Ridge,90,65,California,Rockpile,Sonoma,Virginie Boone,@vboone,Davis Family 2013 Cab 5 Rockpile Ridge Red (Rockpile),Bordeaux-style Red Blend,Davis Family
5761,Romania,"This late harvest Sauvignon Blanc is honey gold in color, with tantalizing aromas of honeysuckle, white flowers and lanolin. It is generous on the palate, with flavors of apricot and tinned peaches supported by floral notes. Its sweetness is enhanced by a pleasing level of acidity on the finish.",Conocul Ambrozy,92,28,Recas,NA,NA,Jeff Jenssen,@worldwineguys,Cramele Recas 2013 Conocul Ambrozy Sauvignon Blanc (Recas),Sauvignon Blanc,Cramele Recas
5765,France,"Flinty reduction still dominates the nose but this is only a sign of youth in this nuanced wine. It discloses tentative pear blossom and fruit, plus notions of wet earth and candied lime. Above all, a zesty spine of acidity and freshness directs all the attention to a profound, stony core. There is life force here and you know this will continue to evolve.",Calcaire,92,55,Alsace,Alsace,NA,Anne Krebiehl MW,@AnneInVino,Domaine Zind-Humbrecht 2013 Calcaire Pinot Gris (Alsace),Pinot Gris,Domaine Zind-Humbrecht
5809,Portugal,"A wine that is so soft, its texture only just brushes the palate. White fruits and lemon juice give a gentle, balanced character that is light and quite ready to drink.",Serras de Azeitão Seleção do Enólogo Branco,84,11,Península de Setúbal,NA,NA,Roger Voss,@vossroger,Bacalhôa Wines of Portugal 2013 Serras de Azeitão Seleção do Enólogo Branco White (Península de Setúbal),Portuguese White,Bacalhôa Wines of Portugal
5820,Argentina,"Aromas are leafy and scratchy, also suggesting cement. This feels resiny and creamy in the mouth. Flavors of woody, generic berry fruits finish hot and scratchy.",Misterio,84,9,Mendoza Province,Mendoza,NA,Michael Schachner,@wineschach,Finca Flichman 2013 Misterio Malbec (Mendoza),Malbec,Finca Flichman
