id,country,description,designation,points,price,province,region_1,region_2,taster_name,taster_twitter_handle,title,variety,winery
53825,France,"From its origin in 1789, the Barthe family vineyards were in the hands of sons. In 1991, Véronique Barthe took over and is now developing sustainable vineyards. This vintage is perfumed with touches of fruit candies that will probably integrate better as the wine settles down. Behind this confected front, there is good fruit, crisp acidity and a lively, bright aftertaste. Wait until late 2016 to drink.",NA,86,13,Bordeaux,Bordeaux Blanc,NA,Roger Voss,@vossroger,Château la Freynelle 2015  Bordeaux Blanc,Bordeaux-style White Blend,Château la Freynelle
53907,France,"A French version of a brand that is more familiar in Chile as Viña San Esteban, this wine has more stylistically to do with South America than southwest France. It is soft, juicy, rounded and with attractive ripe tannins. The wine is ready to drink.",Réserve,85,9,Southwest France,NA,NA,Roger Voss,@vossroger,Vino San Esteban 2015 Réserve Malbec,Malbec,Vino San Esteban
53961,Portugal,"This lightly wood-aged wine is rich, with an attractive acidity to go with the citrus and green-fruit flavors. A delicious tang gives lemon and orange-zest flavors and some minerality. Drink from mid-2017.",Vila Santa Branco Reserva,90,20,Alentejano,NA,NA,Roger Voss,@vossroger,J. Portugal Ramos 2015 Vila Santa Branco Reserva White (Alentejano),Portuguese White,J. Portugal Ramos
54129,US,"Lovely structure amplifies all the best qualities of this estate-grown wine. A tight core of pear, lemon and tangerine fruit sets up a long finish. The acidity is clean and in perfect proportion, with no chalkiness. Drink now through 2027.",Clos du Soleil Vineyard,93,75,Oregon,Dundee Hills,Willamette Valley,Paul Gregutt,@paulgwine ,Domaine Serene 2015 Clos du Soleil Vineyard Chardonnay (Dundee Hills),Chardonnay,Domaine Serene
54170,US,"This voluptuous wine offers concentrated golden honey, baked apricot and pear notes, with integrated oak. Made in a full-bodied, creamy style that's hard to resist, it has a looming acidity that works behind the scenes to provide balance.",Estate Grown,90,36,California,Sonoma Mountain,Sonoma,Virginie Boone,@vboone,Belden Barns 2015 Estate Grown Chardonnay (Sonoma Mountain),Chardonnay,Belden Barns
54177,Italy,"Aromas of citrus blossom, white stone fruit and a whiff of wet flint float from the glass. Fresh and savory, the juicy palate delivers ripe Bartlett pear, yellow apple, nectarine and lemon drop alongside bright acidity. Notes of almond and ginger add depth.",Rive Alte,90,25,Northeastern Italy,Friuli Isonzo,NA,Kerin O’Keefe,@kerinokeefe,Ronco del Gelso 2015 Rive Alte Pinot Grigio (Friuli Isonzo),Pinot Grigio,Ronco del Gelso
54230,US,"Finished quite dry, this brings tart rhubarb and sour berry fruit to bear, backed with ample acidity. It was whole cluster pressed, blended with Pinot Noir saignée, and cold fermented in stainless steel. It's a good picnic rosé, ready for cured meats and soft cheeses.",Divertimento Estate Vineyard Pinot Noir,86,20,Oregon,Willamette Valley,Willamette Valley,Paul Gregutt,@paulgwine ,Coelho 2015 Divertimento Estate Vineyard Pinot Noir Rosé (Willamette Valley),Rosé,Coelho
54245,France,"From the area known as Pierres Dorées because of the gold-colored stone used in buildings, this wine is soft and fruity. It carries a touch of tannin along with red-cherry crispness. The wine is ready to drink.",Salamandre d'Or,86,15,Burgundy,Coteaux Bourguignons,NA,Roger Voss,@vossroger,Vignerons des Pierres Dorées 2015 Salamandre d'Or  (Coteaux Bourguignons),Gamay,Vignerons des Pierres Dorées
55003,Germany,"Musky, floral perfume introduces this bright, candied Riesling full of sweet pink grapefruit and tangerine flavors. Crisp acidity freshens the mid palate but the finish is a touch caramelized. Drink now.",Dr. H,89,19,Mosel,NA,NA,Anna Lee C. Iijima,NA,Dr. Hermann 2015 Dr. H Riesling (Mosel),Riesling,Dr. Hermann
55140,France,"From vines around the medieval castle, this wine has brilliant cherry flavors that give fruitiness and balancing acidity. There is a refreshing juicy character that is sustained by the subtle touch of tannin. Drink the wine now.",Château de Chanzé,87,18,Beaujolais,Beaujolais,NA,Roger Voss,@vossroger,Vignerons des Pierres Dorées 2015 Château de Chanzé  (Beaujolais),Gamay,Vignerons des Pierres Dorées
55376,Portugal,"A dense wine that is structured and concentrated, it has black fruits and dusty tannins under juicy acidity. With hints of the wood aging and fine berry fruits, the wine will be ready to drink from 2017.",NA,88,14,Tejo,NA,NA,Roger Voss,@vossroger,Fiuza 2015 Touriga Nacional (Tejo),Touriga Nacional,Fiuza
55537,Chile,"Off the bat this smells weedy, with a hint of generic red-berry fruit to help things along. A green-tasting wiry palate finishes with burnt underripe berry notes.",Reserva,82,10,Colchagua Valley,NA,NA,Michael Schachner,@wineschach,Sombras del Sol 2015 Reserva Merlot (Colchagua Valley),Merlot,Sombras del Sol
55647,Portugal,"Open-tank fermentation gives this wine a ripe, jammy character that is balanced by the intense black fruits and acidity. Together they form a rich, structured, juicy and firm wine that is likely to age. Drink from 2019.",Rapariga da Quinta Reserva,93,25,Alentejano,NA,NA,Roger Voss,@vossroger,Luis Duarte 2015 Rapariga da Quinta Reserva Red (Alentejano),Portuguese Red,Luis Duarte
56013,France,"Structured, tight and mineral, this wine comes from a selection of old vines in a northwest-facing vineyard on the Rimauresq estate. It offers a tang, along with a firm structure and concentration. A fruitier aftertaste will show through more strongly by late 2016.",R de Rimauresq,92,25,Provence,Côtes de Provence,NA,Roger Voss,@vossroger,Château Rimauresq 2015 R de Rimauresq Rosé (Côtes de Provence),Rosé,Château Rimauresq
56242,US,"A blend of Syrah, Cabernet Sauvignon, Malbec, Grenache and Merlot, this delicious red is juicy in blackberry and vanilla swirls of flavor. Tar, sage and tobacco add savory touches that work within its soft rounded frame.",Red C,91,44,California,Sonoma County,Sonoma,Virginie Boone,@vboone,Covenant 2015 Red C Red (Sonoma County),Red Blend,Covenant
56637,Austria,"Fresh, even vigorous pear and lemon zest notes make a promising opening. The palate is light but has a concentrated, almost fizzing core of peppery, citrussy freshness and delivers lots of verve. This is a collaborative effort between a German star chef and an Austrian winemaker to celebrate this variety's endless versatility with imaginative cooking. I think they've done themselves justice.",Edition Witzigmann,90,17,Niederösterreich,NA,NA,Anne Krebiehl MW,@AnneInVino,Türk 2015 Edition Witzigmann Grüner Veltliner (Niederösterreich),Grüner Veltliner,Türk
56646,US,"Fresh green herbs on the nose accumulate fruit and floral notes on the palate of this pretty but robust rosé. A blend of Merlot, Cabernet Franc, Chardonnay and Gewürztraminer, it offers intense red berry and watermelon fruitiness along with a pleasantly clingy, silken mouthfeel.",Summer in Bottle,90,24,New York,North Fork of Long Island,Long Island,Anna Lee C. Iijima,NA,Wölffer 2015 Summer in Bottle Rosé (North Fork of Long Island),Rosé,Wölffer
56881,Spain,"Roasted, leathery and rubbery berry aromas are gritty and short on brightness. This feels rugged but good. Jammy cassis and cherry flavors show notes of cocoa and herbs.",Hacienda Lopez de Haro,86,10,Northern Spain,Rioja,NA,Michael Schachner,@wineschach,Bodega Classica 2015 Hacienda Lopez de Haro  (Rioja),Tempranillo,Bodega Classica
57118,US,"Luscious raspberry and red-cherry flavors are concentrated in this bright, fruity rosé. Made predominantly from Cabernet Sauvignon, it's marked by bristles of bramble and herb that lend complexity to the palate. The finish is brisk and refreshingly saline.",NA,90,15,New York,North Fork of Long Island,Long Island,Anna Lee C. Iijima,NA,Osprey's Dominion 2015 Rosé (North Fork of Long Island),Rosé,Osprey's Dominion
57654,Spain,"Light aromas of mango, melon and lime are quiet but clean. This is a simple but fresh white with a crisp stony mouthfeel. Easygoing flavors of melon and apple finish with a note of lime as well as a hint of wheaty yeast.",X,87,13,Catalonia,Catalunya,NA,Michael Schachner,@wineschach,Bohigas 2015 X Xarel-lo (Catalunya),Xarel-lo,Bohigas
57737,US,"Baked blackberries, nutmeg and star anise aromas make for a dense and full but not overly powerful or rich nose on this bottling. It's fairly thick and soft in body, but with some textural grip, showing flavors of black plum skins, graphite and sandalwood, before finishing on a eucalyptus kick.",Heritage Edna Ranch,91,32,California,Edna Valley,Central Coast,Matt Kettmann,@mattkettmann,Tolosa 2015 Heritage Edna Ranch Pinot Noir (Edna Valley),Pinot Noir,Tolosa
58019,France,"Heady notes of dried Damask rose petals rise straight from the glass. The palate has the same strong aromatic impact, countered with pleasantly bitter texture. This is an unusually powerful and highly concentrated Muscat and comes with a medium body. This is best showcased next to strong cheeses. The finish is clean.",NA,90,23,Alsace,Alsace,NA,Anne Krebiehl MW,@AnneInVino,Domaine Charles Baur 2015 Muscat (Alsace),Muscat,Domaine Charles Baur
58029,France,"A fresh nose suggests both green and yellow pears. The palate shines with the freshness of both fruits—crisp, sunny, light and very fruity. The finish is clean and very refreshing.",Vieilles Vignes,90,32,Alsace,Alsace,NA,Anne Krebiehl MW,@AnneInVino,Jean-Baptiste Adam 2015 Vieilles Vignes Auxerrois (Alsace),Auxerrois,Jean-Baptiste Adam
58463,France,"Produced at a Domaine that is run by the Arnoux family, the wine has both a rich side and a firm side. The rich side is expressed in the bold red fruits, while the firm side comes through in the tannins and structure that will allow the wine to age. Drink this dense wine from 2020.",Vieilles Vignes,91,40,Burgundy,Savigny-lès-Beaune,NA,Roger Voss,@vossroger,Domaine Des Meix Porons 2015 Vieilles Vignes  (Savigny-lès-Beaune),Pinot Noir,Domaine Des Meix Porons
58465,France,"Produced by Dominique Piron in association with the Lameloise family, this wine from strong granite soil reveals a firm texture and dense tannins. The fruit suggests very ripe, concentrated black plums and damsons. It is wine to age, drink from 2019.",Quartz,91,25,Beaujolais,Chénas,NA,Roger Voss,@vossroger,Domaines Dominique Piron 2015 Quartz  (Chénas),Gamay,Domaines Dominique Piron
58473,New Zealand,"With a melody of earth, ripe strawberry, dried leaves, iron, and coffee tones on the nose, the palate of this wine is backed by silky tannins, plush red fruit and a long meaty finish. Drink around a campfire on the first chilly night in fall.",Devil's Staircase,92,30,Central Otago,NA,NA,NA,NA,Rockburn 2015 Devil's Staircase Pinot Noir (Central Otago),Pinot Noir,Rockburn
58486,France,"A fresh orange note dominates the nose of this exuberantly fruity wine. The palate is a fruity little number of more soft orange with hints of quince and pear peel, giving a tangy, textured and slightly earthy edge. The merest touch of residual sugar bolsters the fruit notes and adds extra playfulness. The finish is dry and zesty.",Schoenenbourg Grand Cru,92,45,Alsace,Alsace,NA,Anne Krebiehl MW,@AnneInVino,Pierre Sparr 2015 Schoenenbourg Grand Cru Riesling (Alsace),Riesling,Pierre Sparr
58523,France,"Produced from a small vineyard in Pouilly Fuissé, this rich wine is full of ripe, generous fruit. Spice and yellow-fruit flavors blend seamlessly with the soft texture and perfumed acidity. It is developing into a very fine wine, ready to drink from 2017.",Aux Chailloux,92,28,Burgundy,Pouilly-Fuissé,NA,Roger Voss,@vossroger,Domaine Pascal et Mireille Renaud 2015 Aux Chailloux  (Pouilly-Fuissé),Chardonnay,Domaine Pascal et Mireille Renaud
58666,Portugal,"From the homeland of Alvarinho in the Monção region in the north of Vinho Verde, the wine is rich and mineral with touches of wood fermentation adding spice. It is textured, full of juicy fruit at the end. Drink now.",NA,89,16,Vinho Verde,NA,NA,Roger Voss,@vossroger,J. Portugal Ramos 2015 Alvarinho (Vinho Verde),Alvarinho,J. Portugal Ramos
58722,US,"A deeply tawny gold color, this offers slightly oxidized, dusty peach and pear fruit, with a bit of residual sugar (20g/L) to round off the rough edges. Drink now through the end of 2017.",NA,86,16,Oregon,Elkton Oregon,Southern Oregon,Paul Gregutt,@paulgwine ,Bradley 2015 Riesling (Elkton Oregon),Riesling,Bradley
59364,Austria,"A wonderfully herbal lift of mint precedes ripe cherry fruit on the nose of this wine. The palate brims with lusciously ripe plum, while supple tannins provide a velvety but firm background against which the mellow fruit can play. It's fresh, juicy and full-bodied.",Carnuntum Cuvée,91,17,Carnuntum,NA,NA,Anne Krebiehl MW,@AnneInVino,Netzl 2015 Carnuntum Cuvée Red (Carnuntum),Red Blend,Netzl
59449,US,"This blend of Merlot, Cabernet Franc and Pinotage is complex yet restrained from start to finish. Aromas of red cherry, cranberry and grape fold into vanilla, smoke, fig presserves and a sanguine character. On the palate, these are met with a smooth tannic structure and a rooibos tea note. It is lush and silky in mouthfeel and boasts a long, harmonious finish.",Josie's Knoll Rotunda,90,20,Virginia,Monticello,NA,Carrie Dykes,NA,Lovingston 2015 Josie's Knoll Rotunda Red (Monticello),Red Blend,Lovingston
59497,South Africa,"Soft notes of straw and honeycomb grace the orange and red apple fruit tones. The mouthfeel is round and a touch flat on the midpalate, finishing with a bitter almond flavor. Drink now.",Seriously Cool,84,20,Stellenbosch,NA,NA,Lauren Buzzeo,@laurbuzz,Waterkloof 2015 Seriously Cool Chenin Blanc (Stellenbosch),Chenin Blanc,Waterkloof
60011,US,"This rich and voluptuous wine wins one over with its baked pear and vanilla sumptuousness, etched with an apple blossom aroma. Robust and velvety on the palate, it's balanced by fresh citrus and wet stone nuances. The lifted acidity provokes both succulence and complexity.",Brumaire,95,40,California,Russian River Valley,Sonoma,Virginie Boone,@vboone,EnRoute 2015 Brumaire Chardonnay (Russian River Valley),Chardonnay,EnRoute
60025,US,"With its high-toned sparkle of lemon zest and orange, this lovely wine evolves to show rich oak and apple pie notes, evoking baked Gravenstein apple, cinnamon and nutmeg. Medium-bodied, it wears its concentration of flavor and texture well, finding a well-earned balance through the lengthy finish.",Old Wente,95,55,California,Russian River Valley,Sonoma,Virginie Boone,@vboone,Lynmar 2015 Old Wente Chardonnay (Russian River Valley),Chardonnay,Lynmar
60258,France,"An earthy hint comes with the bright lemon flavors of this dry, tart wine. The palate reveals a glimpse of riper fruit but lime freshness rules. It finishes totally clean.",Tradition,87,23,Alsace,Alsace,NA,Anne Krebiehl MW,@AnneInVino,Vieil Armand 2015 Tradition Riesling (Alsace),Riesling,Vieil Armand
60655,Portugal,"Melon and ripe pear flavors give some richness to this lightly citrus flavored wine. With attractive acidity, it is crisp, clean and tangy at the end. Drink now.",Cabo da Roca,86,10,Douro,NA,NA,Roger Voss,@vossroger,Casca Wines 2015 Cabo da Roca White (Douro),Portuguese White,Casca Wines
60663,France,The wine is bright and fruity. It has crisp acidity and a light touch of citrus to go with the lively acidity. Its blend brings out the herbal flavor of Colombard with just a touch of honey from Gros Manseng. Drink now.,Colombard-Ugni Blanc-Gros Manseng-Sauvignon,86,10,Southwest France,Côtes de Gascogne,NA,Roger Voss,@vossroger,Domaine la Taste 2015 Colombard-Ugni Blanc-Gros Manseng-Sauvignon White (Côtes de Gascogne),White Blend,Domaine la Taste
60665,France,"From the Ferraud family's estate in Vaux en Beaujolais, this wine is ripe and full bodied. It has a touch of pepper as well as raspberry and red-currant flavors. Lively and full of fruitiness, it is ready to drink.",Les Merrains,86,NA,Beaujolais,Beaujolais-Villages,NA,Roger Voss,@vossroger,Ferraud et Fils 2015 Les Merrains  (Beaujolais-Villages),Gamay,Ferraud et Fils
61742,France,"This is one of several wines from this producer that are created to give lie to the tannic Malbec. This is soft, ripe and full of the young fruitiness that demands to be drunk now.",Les Comtes de Cahors,85,12,Southwest France,Cahors,NA,Roger Voss,@vossroger,Georges Vigouroux 2015 Les Comtes de Cahors Malbec (Cahors),Malbec,Georges Vigouroux
61758,US,"Pristine Asian pear and lemon perfume on the nose of this full bodied Chardonnay take a slightly darker savory tone on the palate. The mouthfeel is rich and textured, but brambly slightly vegetal notes and a bite of astringency distract on the finish.",Unoaked Ingle Vineyard,85,19,New York,Finger Lakes,Finger Lakes,Anna Lee C. Iijima,NA,Heron Hill 2015 Unoaked Ingle Vineyard Chardonnay (Finger Lakes),Chardonnay,Heron Hill
61799,France,"Produced in the west of Gascony, with a strong oceanic influence, this Chardonnay is cool, fruity and with bright acidity. It does have a creamy texture that fills out the fruitiness. It is an attractive, ripe wine that is ready to drink.",La Galope,85,15,Southwest France,Côtes de Gascogne,NA,Roger Voss,@vossroger,Domaine de l'Herré 2015 La Galope Chardonnay (Côtes de Gascogne),Chardonnay,Domaine de l'Herré
61804,France,This gentle blend of Aligoté and Chardonnay shows yellow fruit flavors. It has a crisp edge to its round smoothness. Drink now.,NA,85,12,Burgundy,Coteaux Bourguignons,NA,Roger Voss,@vossroger,Pierre Gruber 2015  Coteaux Bourguignons,White Blend,Pierre Gruber
62135,Italy,Aromas of honeysuckle and tropical fruit lead the nose while the lively palate doles out pear and juicy nectarine. A touch of bitter almond adds interest.,NA,86,22,Southern Italy,Irpinia,NA,Kerin O’Keefe,@kerinokeefe,Agricola Bellaria 2015 Falanghina (Irpinia),Falanghina,Agricola Bellaria
62141,France,"Owner Daniel Barcelo produces a wine that is soft, fruity and with a forward crispness and red fruit flavor that is generous and fresh. It is a bright, lively and refreshing wine.",NA,86,10,France Other,Ile de Beauté,NA,Roger Voss,@vossroger,Domaine Barcelo 2015 Rosé (Ile de Beauté),Rosé,Domaine Barcelo
62151,France,"Made from the local Sciaccarellu grape, this is a delicious, light and perfumed wine. It has tight acidity to go with the red currant flavors and the crisp texture. The wine is poised and refreshing.",NA,86,10,France Other,Ile de Beauté,NA,Roger Voss,@vossroger,Union de Vignerons de l'Île de Beauté 2015 Rosé (Ile de Beauté),Rosé,Union de Vignerons de l'Île de Beauté
62321,US,"Exotically floral on the nose, the prettiness of this wine follows through on the palate, salty and high in acidity, with a tang of lemon peel and lemon verbena. Focused and fresh, it has body and weight within that context, ultimately finding a balance that persists on the lengthy finish.",Dutton Ranch Dutton Hill Vineyard,94,50,California,Russian River Valley,Sonoma,Virginie Boone,@vboone,Lucie 2015 Dutton Ranch Dutton Hill Vineyard Chardonnay (Russian River Valley),Chardonnay,Lucie
62362,Spain,"Oaky, concentrated black-fruit aromas feature notes of graphite and savory earth. This Monastrell is deep, jammy and textured on a full-bodied palate. Spicy oak and black-plum flavors finish toasty, with hints of baking spices and dried herbs. Drink through 2019.",La Finca Selección Monastrell,90,35,Levante,Jumilla,NA,Michael Schachner,@wineschach,Baica 2015 La Finca Selección Monastrell Monastrell (Jumilla),Monastrell,Baica
62416,Germany,"Pristine honey and tangerine sweetness falls on the palate in a delicate filigree here. It's breathtakingly light in body, yet unctuous and concentrated. Sunny citrus acidity leads a long, slightly spicy finish.",Berncasteler Doctor Auslese,92,50,Mosel,NA,NA,Anna Lee C. Iijima,NA,Dr. H. Thanisch (Erben Müller-Burggraef) 2015 Berncasteler Doctor Auslese Riesling (Mosel),Riesling,Dr. H. Thanisch (Erben Müller-Burggraef)
62442,US,"This top tier effort captures all the most distinctive characteristics of good Oregon Pinot Noir. Black cherry fruit, a liberal dash of cola, a touch of sassafras and a dusting of baking spice combine in a burst of flavor. Delicious already, it will drink well for another half decade or longer.",Bella Vida Vineyard,92,65,Oregon,Dundee Hills,Willamette Valley,Paul Gregutt,@paulgwine ,Fullerton 2015 Bella Vida Vineyard Pinot Noir (Dundee Hills),Pinot Noir,Fullerton
62653,US,"Rose-petal perfume and pink-grapefruit notes lend a classic nobility to this delicately off-dry Gewürztraminer. It's bold in alcohol but balanced, juxtaposing voluptuous, mouth-filling texture against bright citrusy acidity. Fresh and floral, it finishes long with a lingering tea-tannin astringency.",NA,90,17,New York,Finger Lakes,Finger Lakes,Anna Lee C. Iijima,NA,Keuka Spring 2015 Gewürztraminer (Finger Lakes),Gewürztraminer,Keuka Spring
63467,France,"Annick and Jean-Marc Lafont's three acres on the slopes below the chapel of la Madone give a firm and concentrated cru wine that will repay aging. There are layers of red-berry fruits that are cut with solid tannins and a dry core. The wine will age, so drink from 2018.",Granits Rosés,90,21,Beaujolais,Fleurie,NA,Roger Voss,@vossroger,Domaine de Bel Air 2015 Granits Rosés  (Fleurie),Gamay,Domaine de Bel Air
65064,France,There is an attractive orange-zest tang to this rounded wine. It brings out ripe yellow fruits that have acidity to add to the mineral texture of this balanced wine. It is ready to drink.,Collection,86,30,Burgundy,Saint-Véran,NA,Roger Voss,@vossroger,L. Tramier & Fils 2015 Collection  (Saint-Véran),Chardonnay,L. Tramier & Fils
65150,Argentina,"Jammy, stewy berry aromas are accented by brick dust and sweet oak that smells like plastic. Saturated, jammy and clumsy in feel, this tastes of baked, peppery black fruits and oak. Finishing notes of chocolate, herbs and licorice are chunky and a touch hot.",NA,85,19,Mendoza Province,Mendoza,NA,Michael Schachner,@wineschach,Mas 2015 Malbec (Mendoza),Malbec,Mas
65266,France,"The subdued nose leads to a fresh, bright, easy-drinking palate dominated by lemony acidity. This is clean and refreshing. Drink soon.",NA,86,20,Alsace,Alsace,NA,Anne Krebiehl MW,@AnneInVino,Helfrich 2015 Riesling (Alsace),Riesling,Helfrich
65835,France,"This is a ripe, red fruit and caramel flavored wine. With its strawberry flavor, balanced acidity and touch of spice, it is soft and rounded yet finishes with a fresh touch.",Aramis,86,10,France Other,Vin de France,NA,Roger Voss,@vossroger,Famille Laplace 2015 Aramis Rosé (Vin de France),Rosé,Famille Laplace
65847,France,"A deep purple color, this ripe selection leads with lush aromas of raspberry jam, blueberry and boysenberry, all of which carry through to the fruit-forward palate. Medium tannins and ample acidity provide good framing to the fruity richness, resulting in a crushed velvet texture. Drink now.",NA,86,10,France Other,Vin de France,NA,Lauren Buzzeo,@laurbuzz,La Vieille Ferme 2015 Red (Vin de France),Rhône-style Red Blend,La Vieille Ferme
65857,Turkey,"The color of soft pink, this wine has a nose of grapefruit and lemon rind. It is bright at first sip, with refreshing flavors of pink grapefruit, lemon sorbet, peach and jasmine.",Rosé,86,19,Cappadocia,NA,NA,Mike DeSimone,@worldwineguys,Turasan 2015 Rosé Kalecik Karasi (Cappadocia),Kalecik Karasi,Turasan
65945,France,"From one of the high-quality Premier Crus that have much of the reflected glory of the Vosne-Romanée grand crus, the beautiful wine is ripe and packed with great red fruits. Its wood aging is a rich support to this opulent wine with considerable potential. Drink from 2025.",Domaine du Clos Frantin Les Malconsorts Premier Cru,95,195,Burgundy,Vosne-Romanée,NA,Roger Voss,@vossroger,Albert Bichot 2015 Domaine du Clos Frantin Les Malconsorts Premier Cru  (Vosne-Romanée),Pinot Noir,Albert Bichot
65983,US,"The aromas are light, with notes of herb and stone fruit that don't seem to have fully ripened. The palate is full and broad but seems to lack a sense of clarity.",NA,88,35,Washington,Red Mountain,Columbia Valley,Sean P. Sullivan,@wawinereport,DeLille 2015 Roussanne (Red Mountain),Roussanne,DeLille
66156,US,"Crisp nectarine and apricot aromas meet hints of butter and lime in this clean and easy appellation blend from seven vineyards and four counties. The flavors are also familiar and pleasant, with key lime and lemon peel and a building acidity that carries those flavors deep into the finish.",NA,88,20,California,Central Coast,Central Coast,Matt Kettmann,@mattkettmann,Calera 2015 Chardonnay (Central Coast),Chardonnay,Calera
66613,France,"This wine is fruity, crisp and packed with clean, bright red fruits. The inland location of the vineyard gives the wine a cool feeling that is crisp and fresh at the end.",NA,87,NA,Provence,Côtes de Provence,NA,Roger Voss,@vossroger,Château des Sarrins 2015 Rosé (Côtes de Provence),Rosé,Château des Sarrins
66778,France,"This wine is as light as a feather. It's crisp with citrus acidity and is totally ready to drink. It is clean, perfumed with an attractive, fruity aftertaste.",NA,85,10,Loire Valley,Muscadet Sèvre et Maine,NA,Roger Voss,@vossroger,Sauvion 2015  Muscadet Sèvre et Maine,Melon,Sauvion
67132,US,"Concentrated oak aromas and flavors are the hallmarks of this medium-bodied, full-flavored and attractively priced wine. Lush plum and black-cherry notes vie for attention, but oaky accents like cedar, nutmeg and cinnamon stay in the forefront from the aroma through the soft texture to the finish.",NA,88,13,California,California,California Other,Jim Gordon,@gordone_cellars,Chime 2015 Pinot Noir (California),Pinot Noir,Chime
