id,country,description,designation,points,price,province,region_1,region_2,taster_name,taster_twitter_handle,title,variety,winery
83994,France,"Light in color and bright in taste, this is a lightly fruity wine. It's the epitome of the French Riviera—hinting at red currants and with plenty of acidity. It is an immediately drinkable wine with a refreshing crisp aftertaste.",La Riviera,88,17,Provence,Côtes de Provence,NA,Roger Voss,@vossroger,Domaine de la Sanglière 2016 La Riviera Rosé (Côtes de Provence),Rosé,Domaine de la Sanglière
83998,Austria,"This wine's nose is rather subdued, but the palate comes in with hints of green pear and lemon. Dry, light and clean, with the tiniest bit of enlivening spritz, it's as thirst-quenching as its name (Getränk, which translates to “beverage”) suggests.",Getränk,88,14,Weinland Österreich,NA,NA,Anne Krebiehl MW,@AnneInVino,Dürnberg 2016 Getränk Grüner Veltliner (Weinland Österreich),Grüner Veltliner,Dürnberg
84541,US,"Pale salmon in color, this delivers mineral, strawberry and cherry aromas. It's dry on the palate, with tart, lightly concentrated sour cherry and citrus rind flavors.",Eternal Beauty,88,21,Washington,Walla Walla Valley (WA),Columbia Valley,Sean P. Sullivan,@wawinereport,Eternal 2016 Eternal Beauty Rosé (Walla Walla Valley (WA)),Rosé,Eternal
84900,Italy,"This wine's delicate pear, apple and beeswax aromas carry over to the simple, enjoyable palate, along with a citrus note. It's refreshing, with bright acidity.",Monte Foscarino,86,10,Veneto,Soave Classico,NA,Kerin O’Keefe,@kerinokeefe,Santa Sofia 2016 Monte Foscarino  (Soave Classico),Garganega,Santa Sofia
85759,Germany,"Whiffs of candle wax and crushed minerals lend depth to the concentrated tangerine and honey flavors in this sun-kissed, citrusy kabinett. It's forward and fruity yet zippy and fresh, showing balanced acidity and a cool, mineral finish.",Juffer Brauneberg Kabinett,90,20,Mosel,NA,NA,Anna Lee C. Iijima,NA,Willi Haag 2016 Juffer Brauneberg Kabinett Riesling (Mosel),Riesling,Willi Haag
85773,US,"Quite light aromas of talc, lemon zest and mineral along with whiffs of tropical fruit lead to sleek, bright, focused and lemony flavors backed by zippy acidity. It should shine paired with ceviche or oysters.",Feral,90,20,Washington,Ancient Lakes,Columbia Valley,Sean P. Sullivan,@wawinereport,Efeste 2016 Feral Sauvignon Blanc (Ancient Lakes),Sauvignon Blanc,Efeste
85932,Portugal,"This is a finely balanced, rich wine. Bringing together Antão Vaz, Arinto and Roupeiro, the wine is packed with white fruits and a citrus twist. It has a crisp edge and bright acidity although with an underlying richness that makes the wine ideal for spicy foods. Drink now.",Esporão Reserva,88,20,Alentejo,NA,NA,Roger Voss,@vossroger,Herdade do Esporão 2016 Esporão Reserva White (Alentejo),Portuguese White,Herdade do Esporão
86631,US,"Bright and fresh aromas of Key lime, cantaloupe, light honey and crushed chalk show on the nose of this rarely planted variety, which was bottled by star sommelier Diego Barbieri. It's very dry and tight on the sip, with apple and Asian-pear flavors upheld by a riverstone minerality.",NA,89,28,California,Santa Barbara County,Central Coast,Matt Kettmann,@mattkettmann,Barbieri 2016 Vermentino (Santa Barbara County),Vermentino,Barbieri
86980,France,"Lively, appetizing aromas of ripe pear rise immediately. The palate follows in a similarly fruity, easy and juicy vein. Some residual sweetness helps to round out the generous fruit even more, but lemony freshness balances all and lets this finish clean and dry. Drink while aromas are at their peak.",Pfaff Tradition,89,19,Alsace,Alsace,NA,Anne Krebiehl MW,@AnneInVino,La Cave des Vignerons de Pfaffenheim 2016 Pfaff Tradition Pinot Gris (Alsace),Pinot Gris,La Cave des Vignerons de Pfaffenheim
86993,Portugal,"This is a rich wine, a reminder of the warmth of the Alentejo. That's reinforced by the cork label made from the other major product of the region. It is perfumed, smooth and with hints of apricots as well as brighter pear flavors. Drink now.",São Miguel do Sul,89,11,Alentejano,NA,NA,Roger Voss,@vossroger,Casa Agricola Alexandre Relvas 2016 São Miguel do Sul White (Alentejano),Portuguese White,Casa Agricola Alexandre Relvas
87935,US,"Aromas of overripe, slightly bruised red apple, ale and apple skin are at the fore. It brings a spritz to the off-dry apple-juice flavors, seeming to have not fully settled into the glass.",NA,85,15,Washington,Columbia Valley (WA),Columbia Valley,Sean P. Sullivan,@wawinereport,Kiona 2016 Chenin Blanc (Columbia Valley (WA)),Chenin Blanc,Kiona
88958,US,"The nose on this bottling is full of fresh Asian pear aromas along with hints of guava and ripe oranges, showing restraint from a warmer climate. There's a good sizzle of acidity to start the sip, with flavors of poached pear, apple cream and citrus rinds rounding out the palate.",NA,88,29,California,Paso Robles Willow Creek District,Central Coast,Matt Kettmann,@mattkettmann,Midnight 2016 Chardonnay (Paso Robles Willow Creek District),Chardonnay,Midnight
88961,US,A pronounced herb and spice aroma continues in the flavors of this full-bodied and mouth-filling wine. It has a soothing viscosity that carries the spicy grassy notes in a harmonious way.,NA,88,22,California,Lake County,NA,Jim Gordon,@gordone_cellars,Mt. Konocti Winery 2016 Viognier (Lake County),Viognier,Mt. Konocti Winery
89026,US,"The “S” in this late harvest wine's name may stand for sweet or Spätlese, and its flavors are appropriately succulent and robust for the designation. Fresh and natural-tasting peach, melon and herb components from its core; the finish is clean and lingering.",S,90,25,Oregon,Eola-Amity Hills,Willamette Valley,Paul Gregutt,@paulgwine ,Paetra 2016 S Riesling (Eola-Amity Hills),Riesling,Paetra
89030,Portugal,"This wood-aged wine is spicy, ripe, packed with rich yellow fruits and finished with acidity. It is beautifully balanced, the spice and toast well integrated with the fruit. Drink this still-young, tangy wine from late 2018.",Poento Reserva Branco,90,38,Alentejano,NA,NA,Roger Voss,@vossroger,Espaço Rural 2016 Poento Reserva Branco White (Alentejano),Portuguese White,Espaço Rural
89714,US,"Light green-apple aromas and crisp, almost neutral flavors leave this wine with a bland personality. It is dry and clean on the palate.",Family Reserve,83,9,California,California,California Other,Jim Gordon,@gordone_cellars,Oak Grove 2016 Family Reserve Pinot Grigio (California),Pinot Grigio,Oak Grove
89724,Portugal,"This is a fat wine with ripe fruits and a strawberry flavors. The palate is dry, with a soft texture. Drink now.",Colheita,81,10,Douro,NA,NA,Roger Voss,@vossroger,Adega Vila Real 2016 Colheita Rosé (Douro),Rosé,Adega Vila Real
90204,Portugal,"Produced from old vines, this is a crisp, bright wine. Its caramel and perfumes give it an exotic edge while acidity keeps everything lively. It is ready to drink.",Lua Cheia em Vinhas Velhas,84,14,Douro,NA,NA,Roger Voss,@vossroger,Wines & Winemakers 2016 Lua Cheia em Vinhas Velhas Rosé (Douro),Rosé,Wines & Winemakers
90208,Portugal,"This smooth wine with a creamy texture also features a light shot of acidity as well as apple fruits. It is lively, crisp with acidity at the end and ready to drink.",Alon Seasons Collection Blanco C,84,7,Tejo,NA,NA,Roger Voss,@vossroger,Fiuza 2016 Alon Seasons Collection Blanco C Chardonnay (Tejo),Chardonnay,Fiuza
90395,US,"The aromas bring light notes of corn husk and apple. This wine is broad in feel, with a lightly creamy texture full of roasted-corn flavors.",Estate Grown,86,15,Washington,Wahluke Slope,Columbia Valley,Sean P. Sullivan,@wawinereport,Desert Wind 2016 Estate Grown Chardonnay (Wahluke Slope),Chardonnay,Desert Wind
90397,France,"With its crisp red-currant fruits and strongly herbal character, this is a ripe wine with intense acidity. It is crisply textured and concentrated. Drink now.",Les Landelles,86,12,Loire Valley,Touraine,NA,Roger Voss,@vossroger,Marquis de Goulaine 2016 Les Landelles Sauvignon Blanc (Touraine),Sauvignon Blanc,Marquis de Goulaine
90878,Italy,"This opens with tropical fruit and white flower fragrance while the palate offers honeydew melon, ripe pear and citrus flavors. A hint of white almond leaves a pleasant bitter finish.",Altavilla,89,NA,Southern Italy,Greco di Tufo,NA,Kerin O’Keefe,@kerinokeefe,Villa Matilde 2016 Altavilla  (Greco di Tufo),Greco,Villa Matilde
91643,US,"Extremely tight, clean and minerally aromas of chalk, citrus pith and lemongrass make for a very crisp and fresh nose on this white wine bottling of the typically red Grenache grape. The palate is just as zesty, with apple skin, green papaya and underripe mango flavors, showing flashes of tropicality while remaining light and tight.",Identity Crisis,92,20,California,Santa Barbara County,Central Coast,Matt Kettmann,@mattkettmann,Babcock 2016 Identity Crisis Grenache (Santa Barbara County),Grenache,Babcock
92359,Chile,"Gritty, oily, nutty aromas lead to a tight citric palate. Salty narrow flavors of passion fruit and grapefruit finish steady and briny. Overall, this is basic in every way.",NA,84,10,Casablanca Valley,NA,NA,Michael Schachner,@wineschach,Veramonte 2016 Sauvignon Blanc (Casablanca Valley),Sauvignon Blanc,Veramonte
92911,US,"Crafted from a mix of 48% Syrah, 45% Grenache and 7% Mourvèdre, this aromatic rosé is spicy and bursting with star fruit, citrus, apple, pear, apricot and more. It's a lively full-bodied wine with a smooth finish.",NA,89,16,Oregon,Rogue Valley,Southern Oregon,Paul Gregutt,@paulgwine ,Quady North 2016 Rosé (Rogue Valley),Rosé,Quady North
92916,New Zealand,"Attractive hints of celery leaf add complexity to this wine's melon and citrus flavors. It's medium bodied, with a long, mouthwatering finish.",Old Coach Road,89,16,Nelson,NA,NA,Joe Czerwinski,@JoeCz,Seifried 2016 Old Coach Road Sauvignon Blanc (Nelson),Sauvignon Blanc,Seifried
93082,Austria,"Friendly, lemony freshness plays on the nose and palate, where it's joined by spicy grapefruit peel notes. That zestiness pervades the taut, straight-lined and utterly refreshing palate. This is concentrated, clean and full of citrusy verve.",Katharina,92,20,Wagram,NA,NA,Anne Krebiehl MW,@AnneInVino,Josef Bauer 2016 Katharina Grüner Veltliner (Wagram),Grüner Veltliner,Josef Bauer
94928,US,"Zippy and fresh, this wine also offers deeper layers of papaya and guava that provide a confectionery complement to the fruit. With a stony and gravelly texture on the palate, it spent time in both neutral French oak and stainless steel, and finishes up with honeydew melon flavor.",Aveta,88,26,California,Napa Valley,Napa,Virginie Boone,@vboone,Stag's Leap Wine Cellars 2016 Aveta Sauvignon Blanc (Napa Valley),Sauvignon Blanc,Stag's Leap Wine Cellars
94934,Portugal,"The wine has blackberry fruits that give attractive acidity and add to the light structure. It is fruity, juicy and ready to drink.",Capitão Rayeo,88,10,Alentejano,NA,NA,Roger Voss,@vossroger,Wines & Winemakers 2016 Capitão Rayeo Red (Alentejano),Portuguese Red,Wines & Winemakers
95105,France,"This small appellation is an enclave in the middle of Côtes de Provence. Its style is very similar and this wine, named after the owner, is a structured blend of Syrah and Grenache. The wine from organic grapes has a pepper and spice edge over the crisp acidity of the red fruits. Drink now.",Patricia Ortelli,89,35,Provence,Coteaux Varois en Provence,NA,Roger Voss,@vossroger,Château la Calisse 2016 Patricia Ortelli Rosé (Coteaux Varois en Provence),Rosé,Château la Calisse
95115,US,"Made in a deliberately trim and delicate style from Rhône grape varieties, this wine has a pleasant light pink-peach color and canteloupe aromas that lead to a crisp palate of light body and fresh, tart lemon and cranberry flavors.",Bricks and Roses,89,15,California,Lodi,Central Valley,Jim Gordon,@gordone_cellars,Klinker Brick 2016 Bricks and Roses Rosé (Lodi),Rosé,Klinker Brick
95119,France,This is a blend of Syrah and Cinsault. That gives the wine structure as well as bright fruits. It is an elegant fruity wine with a creamy ripe texture along with red-currant and raspberry fruits. Drink the wine now.,Cuvée G,89,16,Provence,Côtes de Provence,NA,Roger Voss,@vossroger,Les Vignobles Gueissard 2016 Cuvée G Rosé (Côtes de Provence),Rosé,Les Vignobles Gueissard
95211,Chile,"Foxy berry and currant flavors carry a note of wet dog fur. This is clampy and saucy feeling on the palate, with herbal flavors of plum, berry and tomato sauce. A hollow finish tastes slightly green.",120 Reserva Especial,84,8,Central Valley,NA,NA,Michael Schachner,@wineschach,Santa Rita 2016 120 Reserva Especial Merlot (Central Valley),Merlot,Santa Rita
95223,France,This is spicy with a strong floral character. Its red-berry fruits are shot through with acidity. The crispness and attractiveness of the wine are spoiled just by the hint of candy and caramel. Drink now.,NA,84,13,Provence,Côtes de Provence,NA,Roger Voss,@vossroger,Fabre en Provence 2016 Rosé (Côtes de Provence),Rosé,Fabre en Provence
95365,US,"Made from Tempranillo and Syrah grapes from Stagecoach Vineyard, this inaugural release is unctuous yet light. Six months of aging in mostly French oak has added complexity and a touch of weight. Its orange and peach flavors are juicy and substantial.",The Damsel,90,38,California,Napa Valley,Napa,Virginie Boone,@vboone,Krupp Brothers 2016 The Damsel Rosé (Napa Valley),Rosé,Krupp Brothers
95614,Austria,"An aromatic nose suggests fresh green pear, a touch of yeast and both citrus flesh and foliage: think lemon and lime. The palate has a stonger impression of yeast, giving an almost-salty texture, with a bright lemon streak of freshness. It's taut, dry, slender and refreshing.",Stein a.d. Donau,91,25,Kremstal,NA,NA,Anne Krebiehl MW,@AnneInVino,Salomon-Undhof 2016 Stein a.d. Donau Riesling (Kremstal),Riesling,Salomon-Undhof
95620,France,"The cave cooperative in Tavel is hitting on all cylinders, turning out numerous consistent, top-rated examples. Différent doesn't have the spicy nuances of the very best Tavels, but it offers a bold, ripe mouthful of raspberry and cherry fruit, ample weight and richness and a long, slightly dusty-textured finish. Drink now–2018.",Différent,91,18,Rhône Valley,Tavel,NA,Joe Czerwinski,@JoeCz,Les Vignerons de Tavel 2016 Différent  (Tavel),Rosé,Les Vignerons de Tavel
96129,Argentina,Buttercup and tropical fruit aromas are related to the 80% Torrontés in this blend (Viognier and Chardonnay are 10% each). This is plump but also high in acidity. Salty flavors of tropical fruits and pink grapefruit are retained on the finish.,Amado Sur,87,15,Mendoza Province,Mendoza,NA,Michael Schachner,@wineschach,Trivento 2016 Amado Sur White (Mendoza),White Blend,Trivento
96231,France,"This Mediterranean blend of Syrah and Grenache is soft and open. It has the lightest touch of tannin, adding texture to its blackberry fruit and crisp acidity. It finishes with an attractive perfumed character.",Appetit de France,85,10,France Other,Vin de France,NA,Roger Voss,@vossroger,Vinadeis 2016 Appetit de France Red (Vin de France),Red Blend,Vinadeis
96992,France,"This tangy, ripe and fruity wine is crisp with acidity. It's attractively brimming with fruit and ready to drink.",NA,87,19,Burgundy,Mâcon-Villages,NA,Roger Voss,@vossroger,Louis Max 2016  Mâcon-Villages,Chardonnay,Louis Max
97043,France,"This soft wine has attractive red-berry flavors. They are given a lift by the bright acidity. It is a gentle wine, ideal for an apéritif with just the lightest tang at the end.",Arbaude,88,18,Provence,Côtes de Provence,NA,Roger Voss,@vossroger,Mas de Cadenet 2016 Arbaude Rosé (Côtes de Provence),Rosé,Mas de Cadenet
97081,Argentina,"Jammy plum and berry aromas are tempered by notes of red fruits and currant. This is vibrant on the palate, with saucy red-plum and currant flavors that aren't overextended. Tomato and dry spice flavors mark the crisp finish.",NA,88,13,Mendoza Province,Luján de Cuyo,NA,Michael Schachner,@wineschach,Nieto Senetiner 2016 Bonarda (Luján de Cuyo),Bonarda,Nieto Senetiner
97090,US,"This bottling will please many palates, as the very light wine offers cool and crisp aromas of Gala apple, gardenia and scratched pomelo skin. It's clean and crisp on the palate at first, and then come waves of riper yellow-apple and Anjou pear flavors, making it a Pinot Grigio with some body to chew on.",NA,88,24,California,Temecula Valley,South Coast,Matt Kettmann,@mattkettmann,Robert Renzoni 2016 Pinot Grigio (Temecula Valley),Pinot Grigio,Robert Renzoni
97099,France,This warm fruity wine is rounded and ripe with flavors of vanilla as well as red-berry fruits. It is soft with just a light tang of orange zest and finishing acidity. Drink this attractive wine now.,Domaine des Grandes Perrières,88,24,Loire Valley,Sancerre,NA,Roger Voss,@vossroger,Jérôme Gueneau 2016 Domaine des Grandes Perrières Rosé (Sancerre),Rosé,Jérôme Gueneau
97719,Austria,"An aromatic nose combines jasmine and white blossom with creamy tangerine and citrus notes. The palate still has a touch of yeastiness, a lovely textural element and a dry, brisk freshness. It provides a charming combination of whistle-clean citrus notes on a very slender body.",Ried Weinzierlberg,91,16,Kremstal,NA,NA,Anne Krebiehl MW,@AnneInVino,Aigner 2016 Ried Weinzierlberg Riesling (Kremstal),Riesling,Aigner
97844,Austria,"Almost luscious pear aromas and notes of peardrop make for a very fruity nose. The palate has a fruity, lemony ease, while the body is slender, dry and has some spritz. The lemon freshness is vivid, brightening everything on this easy, fruity summer wine.",GV,89,13,Niederösterreich,NA,NA,Anne Krebiehl MW,@AnneInVino,Winzer Krems 2016 GV Grüner Veltliner (Niederösterreich),Grüner Veltliner,Winzer Krems
98003,France,"Pithy zesty notes rise from the glass. The palate has the same lifted, pithy, and slightly bitter edge but some residual sweetness rounds the pear apparent on the palate into fluid fruitiness. The bitter edge remains and the wine finishes dry.",NA,86,18,Alsace,Alsace,NA,Anne Krebiehl MW,@AnneInVino,Allimant-Laugner 2016 Pinot Gris (Alsace),Pinot Gris,Allimant-Laugner
98596,US,"A rich texture and good, fruity flavors make this light-bodied, low-alcohol wine easy to enjoy. Apple and white peach aromas meet apple flavors and a soft mouthfeel.",Artisan Collection,86,12,California,California,California Other,Jim Gordon,@gordone_cellars,HandCraft 2016 Artisan Collection Pinot Grigio (California),Pinot Grigio,HandCraft
98606,Spain,"Grapefruit, peach and flowery aromas amount to a pleasant wine. This varietal Macabeo feels oily but it also has citric snap. Pineapple, grapefruit and salty flavors finish lemony fresh.",Blanco,86,9,Levante,Jumilla,NA,Michael Schachner,@wineschach,Casa de la Ermita 2016 Blanco Macabeo (Jumilla),Macabeo,Casa de la Ermita
98884,France,"Red fruit aromas dominate this youthful wine. On the palate, it's still tight, with fine red berry fruit flavors interlaced with tannins. The structure and acidity suggest it will age, so drink from 2019.",NA,87,18,Bordeaux,Côtes de Bourg,NA,Roger Voss,@vossroger,Château Noblet 2016  Côtes de Bourg,Bordeaux-style Red Blend,Château Noblet
99201,US,"One of several Rieslings from this producer, this low-alcohol effort has some residual sugar, though not enough to seem off-dry. It displays peach and melon fruit, with hints of rock candy. Fermented in stainless steel with native yeast, it's a fine all-purpose white.",K,88,20,Oregon,Willamette Valley,Willamette Valley,Paul Gregutt,@paulgwine ,Paetra 2016 K Riesling (Willamette Valley),Riesling,Paetra
99217,France,This ripe wine with acidity and citrus flavors has an attractive mineral texture and lively acidity. It is crisp with a fine tang of orange and lemon zest. Drink now.,NA,88,26,Loire Valley,Sancerre,NA,Roger Voss,@vossroger,Villebois 2016  Sancerre,Sauvignon Blanc,Villebois
100213,US,"This big wine has everything required of the variety and more. It starts with vivid citrus, herb and melon aromas, then lays on ripe white peach, honeydew and mineral notes that fill out the palate and lend mouthfilling texture. Layering, complexity and diverse flavors make it special.",Reserve Collection,92,19,California,Livermore Valley,Central Coast,Jim Gordon,@gordone_cellars,Ruby Hill Winery 2016 Reserve Collection Sauvignon Blanc (Livermore Valley),Sauvignon Blanc,Ruby Hill Winery
101269,France,"Fronton's Négrette grape is found in few other places. Made 100% from the single variety, this wine displays the grape's juicy character as well as the spice and violet aromas and damson flavors. The wine is made to be drunk young.",On l'appelle,86,15,Southwest France,Fronton,NA,Roger Voss,@vossroger,Château Coutinel 2016 On l'appelle Negrette (Fronton),Negrette,Château Coutinel
101555,France,Honey and quince aromas and apricot and spice flavors bring out the medium sweetness of this finely balanced wine. There's plenty of acidity to balance its great fruitiness and honeyed succulence. Drink now.,Aramis Petit Manseng-Sauvignon,86,14,France Other,Vin de France,NA,Roger Voss,@vossroger,Famille Laplace 2016 Aramis Petit Manseng-Sauvignon White (Vin de France),White Blend,Famille Laplace
101562,France,"It's no wonder this wine is called Kaleidoscope: a blend of Viognier, Gewürztraminer, Riesling and Muscat, it's unique and multifaceted. The varieties have come together very satisfactorily, giving perfumed and plenty of ripe fruitiness. With its touches of lychee, apricot and spice and crisp, tight acidity, it's ready to drink now.",San de Guilhem Kaléidoscope,86,11,Southwest France,NA,NA,Roger Voss,@vossroger,Lionel Osmin & Cie 2016 San de Guilhem Kaléidoscope White,White Blend,Lionel Osmin & Cie
103023,Austria,"Savory sage- and cress-like herbal notes mingle with ripe pear and yellow plum fruit on the nose of this winie. The palate delivers that rich fruit in a slender frame, making for a juicy, refreshing experience.",NA,89,17,Kamptal,NA,NA,Anne Krebiehl MW,@AnneInVino,Steininger 2016 Grüner Veltliner (Kamptal),Grüner Veltliner,Steininger
103027,Austria,"This wine's nose is shy but fresh. The palate shows taut, tart fruit, with hints of red apple and citrus. This is very slender and light with a clean, dry finish.",Strasser,89,14,Niederösterreich,NA,NA,Anne Krebiehl MW,@AnneInVino,Weixelbaum 2016 Strasser Rosé (Niederösterreich),Rosé,Weixelbaum
103573,New Zealand,"this medium-bodied Sauvignon Blanc shows only a bit of grassiness. Rather than green, it offers predominantly pineapple, grapefruit and even a touch of stone fruit, finishing with a citrusy flourish.",NA,88,15,New Zealand,NA,NA,Joe Czerwinski,@JoeCz,Tussock Jumper 2016 Sauvignon Blanc (New Zealand),Sauvignon Blanc,Tussock Jumper
103576,France,"Fruity, crisp with red-currant and citrus flavors, this is a bright, vivacious wine. There is a tight mineral edge that contrasts with the fruitiness and turns this into a food friendly wine. Drink now.",Elodie,88,25,Provence,Côtes de Provence,NA,Roger Voss,@vossroger,Vignobles Raymond 2016 Elodie Rosé (Côtes de Provence),Rosé,Vignobles Raymond
103868,US,"Lightly reduced aromas of pear, apple and herb lead to a bright, crisp, clean palate. The aromas don't all seem in harmony at present but the palate brings plenty of enjoyment.",Shard Unoaked Stillwater Creek,88,25,Washington,Columbia Valley (WA),Columbia Valley,Sean P. Sullivan,@wawinereport,Baer 2016 Shard Unoaked Stillwater Creek Chardonnay (Columbia Valley (WA)),Chardonnay,Baer
103872,US,"The nose on this bottling is quite reductive at first, with cut grass and damp herb aromas mixing up with dried seaweed and light lemon peel. There is a tart green-grass flavor to the palate, but also a slightly riper Anjou pear component, with a salty freshness emerging toward the finish.",Zabala Vineyard,88,24,California,Arroyo Seco,Central Coast,Matt Kettmann,@mattkettmann,Mercy 2016 Zabala Vineyard Sauvignon Blanc (Arroyo Seco),Sauvignon Blanc,Mercy
103958,US,"Light and nutty, this combines a majority of Grenache with Zinfandel, Mourvèdre and Tempranillo. Fermented in stainless steel tanks, it maintains fresh acidity with its lightly ripe strawberry and watermelon fruit.",NA,87,21,California,California,California Other,Virginie Boone,@vboone,Smoke Tree 2016 Rosé (California),Rosé,Smoke Tree
103963,France,"Crisp and with good acidity, this is a light, fruity and forward wine. Lively, balanced and with plenty of taut fruitiness at the end, it is very ready to drink.",NA,87,15,Bordeaux,Bordeaux Blanc,NA,Roger Voss,@vossroger,Trocard 2016  Bordeaux Blanc,Bordeaux-style White Blend,Trocard
103965,France,"Pay attention to the Tutiac winemakers north of Bordeaux, who have produced another good wine. Bright red fruits give it a crisp character, packed with acidity and lively fruitiness. It's a great summer apéritif wine. Drink now.",Carrelet d'Estuaire,87,16,Bordeaux,Bordeaux Rosé,NA,Roger Voss,@vossroger,Vignerons de Tutiac 2016 Carrelet d'Estuaire Rosé (Bordeaux Rosé),Rosé,Vignerons de Tutiac
104116,France,"Just north of Saint-Tropez, this large estate has produced a rounded fruity wine. It has a soft crushed strawberry flavor that is balanced by attractive generous acidity. The wine is ready to drink.",Domaine d'Astros Cuvée Prestige,87,15,Provence,NA,NA,Roger Voss,@vossroger,Château d'Astros 2016 Domaine d'Astros Cuvée Prestige Rosé,Rosé,Château d'Astros
104314,Portugal,"This crisply fruity wine is primarily composed of the local Loureiro grape. It is light, bright, dry and full of citrus flavors. Drink now.",Animus Branco,87,11,Vinho Verde,NA,NA,Roger Voss,@vossroger,Vicente Faria Vinhos 2016 Animus Branco White (Vinho Verde),Portuguese White,Vicente Faria Vinhos
