id,country,description,designation,points,price,province,region_1,region_2,taster_name,taster_twitter_handle,title,variety,winery
194,Italy,"Here's a traditional Chianti Classico with pretty aromas of cherry cola, mesquite, almonds and violets. The wine is compact and elegant in the mouth and offers crisp berry flavors on the close.",NA,87,NA,Tuscany,Chianti Classico,NA,NA,NA,Campomaggio 2005  Chianti Classico,Sangiovese,Campomaggio
776,France,"The extra age on this bone-dry wine has paid off, as the taut character of a young wine has been tempered with toast, creating a round feeling. It is perfectly in harmony now, beautiful and crisp.",Oenophile Premier Cru Blanc de Blancs Extra Brut,92,72,Champagne,Champagne,NA,Roger Voss,@vossroger,Pierre Gimonnet et Fils 2005 Oenophile Premier Cru Blanc de Blancs Extra Brut Chardonnay (Champagne),Chardonnay,Pierre Gimonnet et Fils
1001,Italy,"Nerello Mascalese, a grape native to the volcanic slopes of Mount Etna, delivers fresh berry notes that recall raspberry, blueberry and mulberry backed by toasted almond. There are pretty mineral nuances woven within its texture and the wine ends with polished tannins and menthol freshness. It is aged 12 months in oak, but you hardly taste the wood.",Il Monovitigno,88,41,Sicily & Sardinia,Etna,NA,NA,NA,Benanti 2005 Il Monovitigno  (Etna),Nerello Mascalese,Benanti
1168,US,"In keeping with the winery's other red wine releases, the Cedarosa matches tart berry fruits to lush barrel flavors of butter and toast. It's approachable and somewhat monolithic.",Cedarosa,86,26,Washington,Columbia Valley (WA),Columbia Valley,Paul Gregutt,@paulgwine ,Lost River 2005 Cedarosa Red (Columbia Valley (WA)),Bordeaux-style Red Blend,Lost River
1244,US,"Tasted at the age of 38 months, Erba's Bordeaux blend is a dense, tannicly dry wine. It has well-ripened flavors of blackberries, currants, mocha and cedar. If you drink it now, decant. Best before 2011, before the fruit falls out.",Mountainside Vineyards Proprietary Red Wine,88,50,California,Napa Valley,Napa,NA,NA,Erba 2005 Mountainside Vineyards Proprietary Red Wine Red (Napa Valley),Bordeaux-style Red Blend,Erba
1494,US,"Made from authentic Port varieties, this dessert wine is quite sweet. The residual sugar is about 9.5%, giving a honeyed finish to the blackberry and chocolate flavors. It doesn't have the complexity for aging, so drink now.",Vintage Port,85,34,California,Paso Robles,Central Coast,NA,NA,Robert Hall 2005 Vintage Port Port (Paso Robles),Port,Robert Hall
1893,US,"This hugely ripe Chardonnay is just a little too big for absolute balance. Any more powerful, and it would be over the line. As it is, it flirts with it, with gobs of jammy apricots, yellow pears, citrine and Meyer lemondrop, as well as barrel influences ranging from creamy lees to buttered toast, roasted hazelnuts and smoky honey. The alcohol is over 15%.",Hawk Hill Vineyard,89,46,California,Russian River Valley,Sonoma,NA,NA,Williams Selyem 2005 Hawk Hill Vineyard Chardonnay (Russian River Valley),Chardonnay,Williams Selyem
1901,France,"This is a cool cru, which shows even in this great year with its structure, austerity and steely character. It makes it old-style Chablis, with its green fruits and lively, poised freshness.",Côte de Léchet Premier Cru,89,28,Burgundy,Chablis,NA,Roger Voss,@vossroger,La Chablisienne 2005 Côte de Léchet Premier Cru  (Chablis),Chardonnay,La Chablisienne
2302,South Africa,"The nose has a ripe plum and savory spice character in this sophisticated red. On the palate, cedar, mocha and pepper give it a rich, brooding quality. Tannins are fine but ageable. The finish is lingering and spicy. Pair now with richer meat dishes; give it a few years to age and it will be even better.",Mill Race,90,20,Stellenbosch,NA,NA,Susan Kostrzewa,@suskostrzewa,Vergelegen 2005 Mill Race Cabernet Sauvignon-Merlot (Stellenbosch),Cabernet Sauvignon-Merlot,Vergelegen
2316,US,"Ripe, fruity and delicious. Flatters with deep, long flavors of blackberries, black currants, cassis and cedar, with a lush, tannic mouthfeel and long finish. Nice now, and should develop beyond 2012.",Chicken Ranch Vineyard,90,30,California,Rutherford,Napa,NA,NA,Trinchero 2005 Chicken Ranch Vineyard Cabernet Sauvignon (Rutherford),Cabernet Sauvignon,Trinchero
2626,US,"With 15.5% alcohol, this wine is too hot for balance. It also tastes unnecessarily sweet, with sugared raspberry, cherry and blackberry flavors.",Stone,82,27,California,Alexander Valley,Sonoma,NA,NA,Mazzocco 2005 Stone Zinfandel (Alexander Valley),Zinfandel,Mazzocco
2689,US,"This brut-style bubbly is comprised of 67% Pinot Noir and 33% Chardonnay and shows aspects of both varieties. It's fairly full bodied, with raspberry, strawberry, lime, brioche, vanilla and toast flavors. Feels elegant, complex and lush in the mouth, and should develop additional bottle notes over the next six years.",Royal Cuvée,90,32,California,Carneros,Napa-Sonoma,NA,NA,Gloria Ferrer 2005 Royal Cuvée Sparkling (Carneros),Sparkling Blend,Gloria Ferrer
3108,Italy,"Here's a new producer from Valpolicella who presents a sharp and angular Amarone with fine aromas of spice, wild berry, black tobacco and tea leaf. The wine is bright and compact with soft tannins and natural freshness.",NA,88,NA,Veneto,Amarone della Valpolicella,NA,NA,NA,Falezza 2005  Amarone della Valpolicella,"Corvina, Rondinella, Molinara",Falezza
3154,Spain,"Torres' Celeste debuted in 2003, and the '05 is the best vintage to date. The wine has penetrating berry and spice aromas and an accent of animal leather. The palate is healthy and polished, with plum, blackberry and herbal notes. Comes together well and should be good in the cellar through 2012.",Celeste Crianza,89,22,Northern Spain,Ribera del Duero,NA,Michael Schachner,@wineschach,Torres 2005 Celeste Crianza  (Ribera del Duero),Tempranillo,Torres
3309,Italy,"The idea here is to present a more structured and sophisticated Brut with emphasis on the nutty tones and mature peach. The wine succeeds in this regard but the whole point of Prosecco is to be light and fun; this ultimately lacks those sharp, well-defined fruit tones you might expect.",Brut Millesimato Motus Vitae,87,37,Veneto,Prosecco di Valdobbiadene,NA,NA,NA,Bortolomiol 2005 Brut Millesimato Motus Vitae  (Prosecco di Valdobbiadene),Prosecco,Bortolomiol
3311,US,"There's a sweetmeat, salty leatheriness to this Pinot, like beef jerky. Give it a year or so to mellow out and let the smoky oak integrate with the ripe cherry, cola and raspberry flavors. Decant for an hour or two if you pop it open now.",Sangiacomo Vineyards,87,32,California,Carneros,Napa-Sonoma,NA,NA,Castle 2005 Sangiacomo Vineyards Pinot Noir (Carneros),Pinot Noir,Castle
4324,Australia,"Lifted and juicy, this impressive effort from Western Australia shows woodsy, cedary notes on a restrained nose. The palate is drenched in gorgeous cassis and cherry cordial fruit framed by gentle tannins. The crisp finish will cut through steak or pork dishes. Imported by America Uncorked.",Awakening,89,25,Western Australia,Margaret River,NA,NA,NA,Watershed 2005 Awakening Cabernet Sauvignon (Margaret River),Cabernet Sauvignon,Watershed
4830,US,"A little tough and gritty, but with rich, forward flavors of berry and cherry jam, cocoa, clove and anise flavors. A Merlot-based Bordeaux blend.",Range 30 West,85,30,California,Santa Ynez Valley,Central Coast,NA,NA,Foxen 2005 Range 30 West Red (Santa Ynez Valley),Bordeaux-style Red Blend,Foxen
4983,France,"A touch funky and green at first, that soon blows off to reveal a dark and wonderfully concentrated wine that shows some serious promise with age. Cassis, plum, black cherry, spice and tobacco fill the palate, with a long, smoky finish sealing the deal. Drink after 2010. Imported by The Portfolio Group.",Old Vine,88,36,Languedoc-Roussillon,Minervois La Liviniere,NA,Lauren Buzzeo,@laurbuzz,Château Maris 2005 Old Vine Syrah (Minervois La Liviniere),Syrah,Château Maris
4994,Italy,"Tedeschi's Ripasso offers unique aromas that recall forest berry, bramble, green spice and crushed bay leaf. It's a succulent and slightly sweet tasting wine with bursting fruit flavors and thick, chewy density.",Capitel San Rocco,88,23,Veneto,Rosso del Veronese,NA,NA,NA,Tedeschi 2005 Capitel San Rocco Red (Rosso del Veronese),Red Blend,Tedeschi
5579,Italy,"One of the most attractive aspects of this fresh white blend is its structure: The wine is silky and smooth and seemingly weightless at the same time. That kind of structure is a good platform for flavors of pear, exotic fruit, honey and almond. Try it with grilled shrimp in a cilantro pesto sauce.",Cà del Magro,87,16,Veneto,Custoza Superiore,NA,NA,NA,Monte del Frá 2005 Cà del Magro  (Custoza Superiore),White Blend,Monte del Frá
6160,US,"This has been a good bottling for Brassfield. It shows classic mountain intensity, with explosive currant, wild berry, mocha, pine cone, anise and pepper flavors, tucked into firm, sweet tannins. Could benefit from 2 or 3 years in the cellar.",Round Mountain Volcano,89,22,California,High Valley,NA,NA,NA,Brassfield 2005 Round Mountain Volcano Zinfandel (High Valley),Zinfandel,Brassfield
6787,Spain,"Youthful and bouncy right from the get-go. The nose is bright and fruity, with no boundaries to its verve. Lively in the mouth as well, with fresh, forward berry and cherry flavors. A little racy and juvenile, but with lots of high-quality fruit and some aging potential. Drink now through 2011.",Crianza,89,34,Northern Spain,Ribera del Duero,NA,Michael Schachner,@wineschach,Pago de los Capellanes 2005 Crianza  (Ribera del Duero),Tempranillo Blend,Pago de los Capellanes
6959,France,"A new wood aged selection of vines from Château Haut Beyzac, a property being restored by Pennsylvanian Daren Miller and his French in-laws. It is delicious, elegant, offering classic black currant flavors of Bordeaux, but with an extra depth and richness. Fine, elegant acidity to finish.",I Second Haut Beyzac,89,27,Bordeaux,Haut-Médoc,NA,Roger Voss,@vossroger,Château Haut Beyzac 2005 I Second Haut Beyzac  (Haut-Médoc),Bordeaux-style Red Blend,Château Haut Beyzac
7083,US,"Simple and sweet, this Primitivo has jammy flavors of black raspberries, cherries and chocolate. It's a little heavy and soft.",Contento Vineyard,82,20,California,Mendocino,NA,NA,NA,Brutocao 2005 Contento Vineyard Primitivo (Mendocino),Primitivo,Brutocao
7084,US,"This is light and seems a little sparkly, as if there is a hint of secondary fermentation going on. For Cab Franc it's light and generic, without the spice or substance of the grape.",NA,82,20,Washington,Columbia Valley (WA),Columbia Valley,Paul Gregutt,@paulgwine ,Maryhill 2005 Cabernet Franc (Columbia Valley (WA)),Cabernet Franc,Maryhill
7325,Israel,"Though a touch green on the nose, that's countered by plenty of wood and vanilla. Hints of plum, faded cherry and licorice appear in the mouth, with a sweet, cedary finish. Drink now.",16 Months Barrel Aged Kosher,81,22,Samson,NA,NA,Lauren Buzzeo,@laurbuzz,Barkan 2005 16 Months Barrel Aged Kosher Tempranillo (Samson),Tempranillo,Barkan
7699,Spain,"For a basic Tempranillo from Rueda, there's nothing not to like about this wine. It's snappy and fresh, maybe a bit sharp, but not spiky. The flavors are of berry and cherry, and the feel is tight but solid, with some juicy depth. Drink it like you might Beaujolais.",Viña Sanzo,86,9,Northern Spain,Rueda,NA,Michael Schachner,@wineschach,Valsanzo 2005 Viña Sanzo Tempranillo (Rueda),Tempranillo,Valsanzo
7948,US,"The grapes sure got ripe even in this cool, balanced vintage, so that the wine is jammy in cherry, black raspberry and cola flavors. It's delicious and crisply elegant, with a silky texture, but a little direct and forward. Probably at its best now.",Sangiacomo Vineyards,88,48,California,Sonoma Coast,Sonoma,NA,NA,Tandem 2005 Sangiacomo Vineyards Pinot Noir (Sonoma Coast),Pinot Noir,Tandem
8578,Chile,"There's a lot of good about this small-production blend. The nose and color are nice, with asphalt and charcoal mixing with black-fruit sweetness. The palate has a nice, healthy texture housing slightly herbal plum and berry flavors. Finishing notes of burnt toast, coconut and mint announce a serious barrel regimen. Drink now–2009.",Aliara,89,35,Central Valley,NA,NA,Michael Schachner,@wineschach,Odfjell 2005 Aliara Red (Central Valley),Red Blend,Odfjell
9014,Italy,"Firriato's blend of Nero d'Avola and Syrah is a youthful wine with aromas of fresh blueberry, plum and prune. The wine offers rich density and very good harmony that makes it both approachable and a pleasure to drink.",Santagostino Baglio Sorìa,88,30,Sicily & Sardinia,Sicilia,NA,NA,NA,Firriato 2005 Santagostino Baglio Sorìa Red (Sicilia),Red Blend,Firriato
9218,US,"Here's a rich, densely layered Cab. It's showing complex flavors of black currants, dark chocolate and cedar. The tannins are a little edgy, giving the wine an astringent bite that could mellow out with mid-term aging.",NA,87,30,California,Napa Valley,Napa,NA,NA,Tamayo Family 2005 Cabernet Sauvignon (Napa Valley),Cabernet Sauvignon,Tamayo Family
9764,France,"This monopole (wholly-owned vineyard) is in the heart of the village of Aloxe-Corton. The 2005 is structured and wood-dominated at this stage; the dense fruit and the sweet, ripe, red berry acidity are waiting to develop into a wine that will be rich, smooth and velvety. Give it 6 years at least.",Le Château,92,NA,Burgundy,Aloxe-Corton,NA,Roger Voss,@vossroger,Corton André 2005 Le Château  (Aloxe-Corton),Pinot Noir,Corton André
9828,Australia,"Cassis and chocolate notes dominate, but there's enough minty, eucalypt character to impart complexity, all framed by some firm, dusty tannins. Finishes long and mouthwatering; drink now–2015. Multiple U.S. importers.",The Villain,89,24,South Australia,McLaren Vale,NA,Joe Czerwinski,@JoeCz,Hugh Hamilton 2005 The Villain Cabernet Sauvignon (McLaren Vale),Cabernet Sauvignon,Hugh Hamilton
9837,Argentina,"Broquel always offers a little more elegance and pedigree than most value Malbecs, and the 2005 has body, a silky feel and aromas and flavors of tobacco, baked blackberries and leather. It's a ripe, moderately tannic wine that's best for near-term drinking.",Broquel,88,15,Mendoza Province,Mendoza,NA,Michael Schachner,@wineschach,Trapiche 2005 Broquel Malbec (Mendoza),Malbec,Trapiche
10777,Italy,"This rich dessert nectar from Tuscany is made from a blend of Trebbiano and Malvasia grapes. It delivers typical Vin Santo aromas and flavors of maple syrup, dried apricot and candied oranges. Dense and sweet, it's a perfect match for traditional cantucci biscuits or to sip on its own after dinner.",NA,90,25,Tuscany,Vin Santo del Chianti Rufina,NA,Kerin O’Keefe,@kerinokeefe,Fattoria di Grignano 2005  Vin Santo del Chianti Rufina,White Blend,Fattoria di Grignano
10870,Italy,"This lovely metodo classico sparkling wine is made entirely from Chardonnay grapes. It has a creamy texture that delivers sensations of peach and honey, with notes of cream-filled pastries and almond. It finishes crisp and clean.",Flavio Riserva,91,35,Northeastern Italy,Trento,NA,Kerin O’Keefe,@kerinokeefe,Rotari 2005 Flavio Riserva Chardonnay (Trento),Chardonnay,Rotari
11547,Italy,"You pay, dearly, for quality, but rest assured you get it with Gaja. What sets this Barbaresco apart is the quality of its mouthfeel, which is lush, soft and penetrating without being one-dimensional or too obvious. The wine offers intrigue and complexity with seamless integration of fruit, mineral and toast. Drink after 2015.",NA,92,210,Piedmont,Barbaresco,NA,NA,NA,Gaja 2005  Barbaresco,Nebbiolo,Gaja
12454,US,"This wine has a nose of black fruits, mocha and toffee, and on the palate, warming spices, tart cherry and a touch of sweetness. The flavors aren't overly complex, but the wine is appealing, and the finish lingering.",NA,84,35,New York,Finger Lakes,Finger Lakes,Susan Kostrzewa,@suskostrzewa,Shaw 2005 Cabernet Sauvignon (Finger Lakes),Cabernet Sauvignon,Shaw
12771,France,"A generous wine, but one with good backbone and structure. The black fruits are beginning to meld into the sweet tannins and flavors of black cherry compote and spices. It is approaching maturity, but could age another 2–3 years.",Arthus,90,NA,Bordeaux,Côtes de Castillon,NA,Roger Voss,@vossroger,D & R Dubois 2005 Arthus  (Côtes de Castillon),Bordeaux-style Red Blend,D & R Dubois
12865,US,"This Bordeaux-style blend, which this year contains a bit of Syrah, seems to vary vintage to vintage. The '05 is based on Cabernet Franc. It shows a fine structure and is very dry and tannic, but needs time to soften. However, the oak-infused black cherry, black currant, violet and anise flavors are impressive. Best after 2010.",Proprietary Red Wine,91,55,California,Napa Valley,Napa,NA,NA,Corley 2005 Proprietary Red Wine Red (Napa Valley),Red Blend,Corley
13030,US,"Chimney Rock continues a successful string of vintages with this powerful '05. It's a distinguished wine that calls to mind the description of Stags Leap Cabernet as an iron fist in a velvet glove. Rich and full-bodied, it has lush flavors of black currants and smoky new oak. Easy to find, with 28,000 cases produced. Drink now through 2012.",NA,92,58,California,Stags Leap District,Napa,NA,NA,Chimney Rock 2005 Cabernet Sauvignon (Stags Leap District),Cabernet Sauvignon,Chimney Rock
13341,France,"Soft and fruity, with tobacco and smoke aromas, and fresh, vibrant red fruits, topped with fruit tannins and fresh acidity. There's the possibility of aging for 2–3 years.",NA,86,20,Bordeaux,Premieres Côtes de Blaye,NA,Roger Voss,@vossroger,Château la Bretonnière 2005  Premieres Côtes de Blaye,Bordeaux-style Red Blend,Château la Bretonnière
13347,South Africa,"This screwcapped Cab means business from the start, with its arresting blast of delicious black pepper, coffee and spice. On the palate, it's a little less grounded and tends toward a less complex, fruity character, but overall, offers good, standard Cabernet flavors at a palatable price.",NA,85,10,Lutzville Valley,NA,NA,Susan Kostrzewa,@suskostrzewa,Diamond River 2005 Cabernet Sauvignon (Lutzville Valley),Cabernet Sauvignon,Diamond River
13669,Portugal,"A lean, edgy wine, which shows bramble fruits, red berries and tense tannins. There's fine structure and, given a few months, the acidity will turn this into a good food wine.",Cortello,86,8,Estremadura,NA,NA,Roger Voss,@vossroger,Quinta do Gradil 2005 Cortello Syrah (Estremadura),Syrah,Quinta do Gradil
13817,US,"Shows some vegetal unripeness throughout, along with cherry and currant flavors enhanced with the usual smoky oak. A disappointment.",NA,84,27,California,Napa Valley,Napa,NA,NA,Clos Pegase 2005 Merlot (Napa Valley),Merlot,Clos Pegase
14724,Spain,"Smacky and hard right away, with compact black cherry aromas. Shows lots of gusto in the mouth but no elegance or touch. Tastes short and condensed, a blah mix of red berry and burnt candy.",Cartesius,82,26,Northern Spain,Empordà,NA,Michael Schachner,@wineschach,Celler Arché Pagès 2005 Cartesius Red (Empordà),Red Blend,Celler Arché Pagès
15109,US,"This is the first Tempranillo from Zefina (just 60 cases made) from vines planted at the Alder Ridge vineyard in 1999. It is soft, fruity and dark, with some pretty spice showing in the nose. There are attractive floral notes, sweet herbs and a mix of light red fruits to follow. The tannins are soft and the acids are well under control, leading into a lightly chocolaty finish.",NA,87,25,Washington,Horse Heaven Hills,Columbia Valley,Paul Gregutt,@paulgwine ,Zefina 2005 Tempranillo (Horse Heaven Hills),Tempranillo,Zefina
15756,Italy,"Here is a distinctive “super Calabrian” blend of Gaglioppo and Cabernet Sauvignon that delivers black olive and capers beyond subtle notes of blackberry and cherry. It has sharp, crisp dimension in the mouth with good structure and should be paired with a cream-  or butter-based dish for balance.",Gravello,88,33,Southern Italy,Val di Neto,NA,NA,NA,Librandi 2005 Gravello Red (Val di Neto),Red Blend,Librandi
15767,Portugal,"A second wine from the Pintas range of Jorge Serodio and Sandra Tavares, this is a big, forward wine, pushing out ripe red plum and strawberry fruits. It's almost sweet in its ripeness.",Pintas Character,88,38,Douro,NA,NA,Roger Voss,@vossroger,Wine & Soul 2005 Pintas Character Red (Douro),Portuguese Red,Wine & Soul
17012,Italy,"Vietti offers a concentrated and super rich expression of Barbaresco with solid aromas of black berry fruit and toasted oak that create a solid, almost syrupy whole. The wine is luscious and concentrated with opulent notes of dark chocolate, espresso, cured meat and licorice. It tastes fresh and succulent now and needs at least five more years of bottle aging.",Masseria,92,NA,Piedmont,Barbaresco,NA,NA,NA,Vietti 2005 Masseria  (Barbaresco),Nebbiolo,Vietti
17443,US,"If anyone can make converts to Lemberger, Washington's one-time answer to Zinfandel, it's talented winemaker Don Townshend. This bright, tangy, raspberry-laden wine comes across as a stable-mate to Grenache or a light Dry Creek Zin, but it really occupies a niche all its own. Barrel-aged and ripened to a moderate 13.5% alcohol, it screams out for pizza.",NA,87,15,Washington,Yakima Valley,Columbia Valley,Paul Gregutt,@paulgwine ,Townshend 2005 Lemberger (Yakima Valley),Lemberger,Townshend
18195,Italy,"Made with 80% Malvasia-Trebbiano and 20% Sangiovese, this classic Tuscan dessert wine conveys aromas of pastry and nut. The palate delivers chestnut honey, dried apricot, citrus zest and a smooth, lingering finish. Imported by Wine Warehouse, Polaner Selections.",NA,90,52,Tuscany,Vin Santo del Chianti Classico,NA,Kerin O’Keefe,@kerinokeefe,Felsina 2005  Vin Santo del Chianti Classico,White Blend,Felsina
18473,Spain,"Opens with a warm, baked nose of raisin, roasted plum and tobacco. The palate is scouring and crisp due to sharp acids, and thus the flavors follow suit in that they're lean and tart and focus on pie cherry and red plum. Lean, zesty and lively Rioja to drink now.",Vendimia Seleccionada Crianza,86,17,Northern Spain,Rioja,NA,Michael Schachner,@wineschach,Bodegas Muriel 2005 Vendimia Seleccionada Crianza  (Rioja),Tempranillo,Bodegas Muriel
18960,US,"A lovely young Pinot, filled with fresh fruits and spices, wrapped into a fine, silky texture. The flavors of raspberries, cherries and cola have a rich, meaty, leathery edge that adds complexity and earthiness. Good now, and should hold for several years.",NA,89,30,California,Sonoma Coast,Sonoma,NA,NA,Castle 2005 Pinot Noir (Sonoma Coast),Pinot Noir,Castle
18970,France,"It's impressive how exciting old vine Carignan can be, and what an underrated grape it is. Here's proof that it makes big, perfumed wines, layered with dark tannins and wild flavors of herbs and dark berries.",Vieilles Vignes,89,16,Languedoc-Roussillon,NA,NA,Roger Voss,@vossroger,Domaine de Nizas 2005 Vieilles Vignes Carignan,Carignan,Domaine de Nizas
18971,US,"Captures the essence of Russian River Chard with its crisp acids that boost and brighten an explosion of taste. The tropical fruit and spice flavors are enriched by toasty oak, while sur lie aging adds a creaminess to the texture of this deliciously dry wine.",NA,89,32,California,Russian River Valley,Sonoma,NA,NA,J Vineyards & Winery 2005 Chardonnay (Russian River Valley),Chardonnay,J Vineyards & Winery
19179,US,"Walla Walla Vintners wines generally offer a sophisticated blend of vineyard sources and mixed varietals, and this Cab includes modest proportions of Merlot, Cab Franc, Carmenère, Malbec and Petit Verdot. It rounds out into a broadly flavorful bowl of chocolate-covered cherries, with a whiff of tobacco and forest coming through as well. Powerful and seductive, it will please those who love ripe black fruits and plenty of sweet and creamy new oak.",NA,91,35,Washington,Walla Walla Valley (WA),Columbia Valley,Paul Gregutt,@paulgwine ,Walla Walla Vintners 2005 Cabernet Sauvignon (Walla Walla Valley (WA)),Cabernet Sauvignon,Walla Walla Vintners
19193,Australia,"This medium- to full-bodied wine manages to be mouthfilling and round without being excessively soft or syrupy. A savory, meaty, coffee-like note complements the ripe blackberry fruit, which persists a good long time on the finish. Drink now–2015.",Killerman's Run,91,20,South Australia,South Australia,NA,Joe Czerwinski,@JoeCz,Kilikanoon 2005 Killerman's Run Shiraz (South Australia),Shiraz,Kilikanoon
19489,Germany,"Frankly sweet and almost flabby, with plenty of sugar, petrolly minerality and ripe pear flavors, but this wine lacks the buoyant citrusy zest needed for balance and length.",Westhofener Kirchspiel Spätlese,85,32,Rheinhessen,NA,NA,Joe Czerwinski,@JoeCz,Groebe 2005 Westhofener Kirchspiel Spätlese Riesling (Rheinhessen),Riesling,Groebe
19567,US,"A soft, medicinal and uninteresting wine, marked by harshness and green flavors that barely suggest cherries.",NA,80,12,California,Paso Robles,Central Coast,NA,NA,Buzzard Tree 2005 Zinfandel (Paso Robles),Zinfandel,Buzzard Tree
19589,Portugal,"A fine and impressively complex wine, rich, packed with sultanas and dark chocolate. Very firm, this is worth aging but drinkable now.",Late Bottled Vintage,89,NA,Port,NA,NA,Roger Voss,@vossroger,Quinta do Passadouro 2005 Late Bottled Vintage  (Port),Port,Quinta do Passadouro
19707,US,"Give this lush young wine a year or two to come around. That should give all the elements time to meld. It's a juicy, ripe wine, bursting with jammy cherry and cassis flavors, with a strong note of white pepper and clove that dissolves into a tannic finish.",Las Madres Vineyard,88,35,California,Carneros,Napa-Sonoma,NA,NA,Eno 2005 Las Madres Vineyard Syrah (Carneros),Syrah,Eno
