id,country,description,designation,points,price,province,region_1,region_2,taster_name,taster_twitter_handle,title,variety,winery
34352,France,92-94. Barrel sample. Herbaceous aromas are followed by nutmeg and crisp fruit. This has the great ripe fruit of the year without the huge intensity; it's a wine that has subtlety as well as complexity.,Barrel Sample,93,NA,Bordeaux,Barsac,NA,Roger Voss,@vossroger,Château Doisy-Daëne 2011 Barrel Sample  (Barsac),Bordeaux-style White Blend,Château Doisy-Daëne
34663,US,"This wine delivers aromas of molten-lava chocolate cake with black cherry syrup and a mint leaf on top. The palate shows bacon fat, blackberry extract, dark chocolate and freshly ground espresso, with a peppery roast-beef crust on the finish. It's a touch hot, but the wondrous flavors are worth it.",NA,93,35,California,Paso Robles,Central Coast,Matt Kettmann,@mattkettmann,Ancient Peaks 2011 Petite Sirah (Paso Robles),Petite Sirah,Ancient Peaks
34690,Italy,"This brawny red opens with aromas suggesting resin, stewed prune, blue flower, cooking spice and leather. The robust palate offers raisin, blackberry extract, cinnamon and mocha while solid, velvety tannins provide support.",NA,92,59,Veneto,Amarone della Valpolicella Classico,NA,Kerin O’Keefe,@kerinokeefe,San Rustico 2011  Amarone della Valpolicella Classico,Red Blend,San Rustico
34766,US,"It must be challenging to grow Pinot Noir in this warm region, but this bottling shows some promise. Raspberry fruit lingers behind tarry rubber and black olives scents, and the palate blends bitter and sour with a bit of spice, trending toward the forest-floor style with hints of pine, soy sauce and seared fruits.",NA,86,35,California,Temecula Valley,South Coast,Matt Kettmann,@mattkettmann,Zilaro Cellars 2011 Pinot Noir (Temecula Valley),Pinot Noir,Zilaro Cellars
34783,Argentina,"Bold, gritty, balsamic berry aromas are rubbery and saucy in nature. Edgy and grating on the palate, but also full of spunk, this tastes salty. Modest red-berry flavors finish oaky and rustic, with a lasting note of aged balsamic vinegar.",Reserva,86,13,Mendoza Province,Mendoza,NA,Michael Schachner,@wineschach,Fat Gaucho 2011 Reserva Malbec (Mendoza),Malbec,Fat Gaucho
34925,France,"Fruity and apple flavored, it has a creamy texture, followed by an attractive hint of spice and a tight line of crisp acidity.",NA,86,NA,Alsace,Alsace,NA,Roger Voss,@vossroger,André Blanck et ses Fils 2011 Riesling (Alsace),Riesling,André Blanck et ses Fils
35281,France,"This is dark and firm with a tough, austere character. It has weight, but the bitterness of too-much extraction gives a hard edge. The juiciness at the end doesn't compensate.",NA,84,30,Bordeaux,Médoc,NA,Roger Voss,@vossroger,Château Maison Blanche 2011  Médoc,Bordeaux-style Red Blend,Château Maison Blanche
35282,France,"Closed up and firm, the wine is not showing much in the way of expressive fruitiness. It does have a firm structure, but a taste of bitter extract gives hard tannins and smothers the black currant fruit flavors. In time, it will soften. Drink from 2017.",NA,84,25,Bordeaux,Haut-Médoc,NA,Roger Voss,@vossroger,Château Maurac 2011  Haut-Médoc,Bordeaux-style Red Blend,Château Maurac
35299,US,"High alcohol, to the tune of 15.5% by volume, is the defining element of this Zin. It gives heat and the sweet, glyceriney finish of a minor Port. The flavors are also too ripe for comfort, with raisins, prunes and brown sugar.",Private Reserve,84,38,California,Paso Robles,Central Coast,NA,NA,Dunning Vineyards 2011 Private Reserve Zinfandel (Paso Robles),Zinfandel,Dunning Vineyards
35425,Italy,"Thanks to careful clonal selection, this bright Vermentino shows a pristine quality. It is redolent of pear, peach and honey, and it shows a touch of dried herb on the finish.",Valcolomba,88,15,Tuscany,Maremma Toscana,NA,NA,NA,Carpineto 2011 Valcolomba Vermentino (Maremma Toscana),Vermentino,Carpineto
35681,US,"Coming from the highest corner of the limestone-laden vineyard at 1,275 feet—with views of the entire Santa Ynez Valley—this gives off broad, approachable aromas of lit match, bacon fat, purple fruits, pepper and smoked meats. Though full of dried cherry and smoked blueberry flavors, it's leaner in texture, with acidity that keeps it fresh. Drink 2017–2025.",Block Six Purisima Mountain Vineyard,92,55,California,Santa Ynez Valley,Central Coast,Matt Kettmann,@mattkettmann,Beckmen 2011 Block Six Purisima Mountain Vineyard Syrah (Santa Ynez Valley),Syrah,Beckmen
36057,Portugal,"While the wine has weight, it also has intense mineral structure. It piles the citrus flavors over more notes of apples and apricots, a medley of fruits that are shaped into a firm, concentrated structure. The wine has acidity along with a light toast edge.",NA,90,20,Dão,NA,NA,Roger Voss,@vossroger,Alvaro Castro 2011 White (Dão),Portuguese White,Alvaro Castro
36083,Chile,"Emphasizes intense passion fruit aromas that grow more pungent upon breathing. Feels tangy as it dances on the palate, with passion fruit, lemon-lime and tarragon flavors. Long and focused on the finish, with tons of zest.",1865 Single Vineyard,89,19,Leyda Valley,NA,NA,Michael Schachner,@wineschach,San Pedro 2011 1865 Single Vineyard Sauvignon Blanc (Leyda Valley),Sauvignon Blanc,San Pedro
36181,France,"Solid and tannic, this is a full-bodied wine with potential. Ripe fruits are dense and juicy.  With both structure and fruit, this wine will develop well. Drink from 2017.",En Combe Roy,88,NA,Burgundy,Fixin,NA,Roger Voss,@vossroger,Domaine Alain Jeanniard 2011 En Combe Roy  (Fixin),Pinot Noir,Domaine Alain Jeanniard
36183,France,"Fruity and jammy, this ripe wine has structure and acidity, along with a good depth of flavor. It will certainly age and shouldn't be drunk before 2017.",NA,88,NA,Burgundy,Savigny-lès-Beaune,NA,Roger Voss,@vossroger,Domaine Chandon de Briailles 2011  Savigny-lès-Beaune,Pinot Noir,Domaine Chandon de Briailles
36239,Chile,"If this isn't Chile's best Syrah, then it's among the top three. Graphite, tobacco, leather, blackberry, baked black plum and spice aromas set up a lively palate, with firm tannins and good acidity. Stewed plum, blackberry, toasty oak and licorice flavors finish with a grabby feel and lingering flavors of anise and black pepper. Drink through 2020.",Block g+i,92,40,Marchigue,NA,NA,Michael Schachner,@wineschach,Polkura 2011 Block g+i Syrah (Marchigue),Syrah,Polkura
36374,Portugal,"Distinctly mineral in character, this is a tough wine with its tense tannins and firm, very dry fruitiness. Black currant and berry fruits shine through this structure giving a full, juicy character. It's a wine of power and richness, still restrained by its tight, dry texture. Drink from 2018.",Colheita Tinto,88,15,Dão,NA,NA,Roger Voss,@vossroger,Casa da Passarella 2011 Colheita Tinto Red (Dão),Portuguese Red,Casa da Passarella
36549,France,This blend of Muscat and Gewurztraminer is all spiciness. It has peach freshness as well with just a touch of honey. It's immediately attractive.,Andante,84,18,Alsace,Alsace,NA,Roger Voss,@vossroger,Cave de Ribeauvillé 2011 Andante White (Alsace),Alsace white blend,Cave de Ribeauvillé
36613,Argentina,"Charred blackberry aromas carry a minerally note. This blend of Malbec, Cabernet Sauvignon and Syrah feels tight and drawing, although with time in the glass it lessens its grip. Meaty, savory, oaky notes top core blackberry flavors, while this takes on a sauvage note along with a can't-miss flavor of wood grain on the finish. Drink through 2022.",Santiago Limited Release,92,75,Other,San Juan,NA,Michael Schachner,@wineschach,Graffigna 2011 Santiago Limited Release Cabernet Sauvignon-Malbec (San Juan),Cabernet Sauvignon-Malbec,Graffigna
36748,US,"This offers pleasant notes of apricot, dark caramel, grapefruit, gooseberry and pineapple. It's medium in weight and texture, with acidity on the finish. Swirl it early and often to get the aromas going.",NA,85,8,California,Clarksburg,Central Valley,Virginie Boone,@vboone,Baron Herzog 2011 Chenin Blanc (Clarksburg),Chenin Blanc,Baron Herzog
37117,US,"Aromas of vanilla bean, coconut and cocoa meld with cherry cola and dark fruit. The palate has tart, focused cranberry and cherry flavors with a restrained, velvety feel.",Baby Bear,91,54,Washington,Columbia Valley (WA),Columbia Valley,Sean P. Sullivan,@wawinereport,Pursued by Bear 2011 Baby Bear Syrah (Columbia Valley (WA)),Syrah,Pursued by Bear
37294,France,"Wood aging has given this wine richness as well as a smooth texture. It is a ripe full-bodied wine, finely poised between fruit and more mature secondary flavors. The single vineyard wine is ready to drink.",Clos des Oratoriens,91,36,Loire Valley,Saumur-Champigny,NA,Roger Voss,@vossroger,Château de Chaintres 2011 Clos des Oratoriens  (Saumur-Champigny),Cabernet Franc,Château de Chaintres
37345,France,"Warm and ripe, it offers bitter cherry fruits, sweet berries and a layer of firm tannins. It's already balanced and delicious with weight and structure. At the end, it is all bright fruitiness.",Les Mombies,90,NA,Burgundy,Chambolle-Musigny,NA,Roger Voss,@vossroger,Domaine Chantal Lescure 2011 Les Mombies  (Chambolle-Musigny),Pinot Noir,Domaine Chantal Lescure
37469,France,"This is a fruity wine, full of acidity, ripe tannins and just touches of new wood. With the structural weight, it has some potential, leaving a fruity, fresher aftertaste.",NA,86,NA,Bordeaux,Saint-Estèphe,NA,Roger Voss,@vossroger,Château Tour Saint-Fort 2011  Saint-Estèphe,Bordeaux-style Red Blend,Château Tour Saint-Fort
37482,US,"Good, rich black currant, licorice and oak flavors provide plenty of drinking pleasure in this dry, full-bodied Cab. Fully approachable now, it wants pairing with sturdy roasted meats and stews. You might even decant it for an hour or two.",Annabella Special Selection,86,17,California,Napa Valley,Napa,NA,NA,Michael Pozzan 2011 Annabella Special Selection Cabernet Sauvignon (Napa Valley),Cabernet Sauvignon,Michael Pozzan
37490,France,"A soft, juicy wine, it is fresh with attractive red berry fruits. It has a crisp, light feel, with the tannins giving the possibility of medium-term aging.",NA,86,20,Bordeaux,Haut-Médoc,NA,Roger Voss,@vossroger,Château de Villambis 2011  Haut-Médoc,Bordeaux-style Red Blend,Château de Villambis
37507,France,"From the famous Chablis Grand Cru, this wine lives up to the vineyard's reputation. Steely in character, packed with a firm structure and tightly textured, it shows a citrus side that will be refreshing and attractive as the wine ages. But it does need time, so wait to enjoy until 2017.",Les Clos Grand Cru,93,80,Burgundy,Chablis,NA,Roger Voss,@vossroger,Simonnet-Febvre 2011 Les Clos Grand Cru  (Chablis),Chardonnay,Simonnet-Febvre
37512,France,"With three acres out of 36 in this Grand Cru, Faiveley is one of the larger proprietors. The wine is firm and structured with solid tannins, while black fruits give acidity and freshness to this massive wine. Drink from 2020.",NA,93,391,Burgundy,Chambertin Clos de Bèze,NA,Roger Voss,@vossroger,Domaine Faiveley 2011  Chambertin Clos de Bèze,Pinot Noir,Domaine Faiveley
37517,France,"Perfume partners with great acidity in this wine. The two work in harmony, resulting in a wine that has a soft texture, rich, jammy berry fruits and a backbone of tannins that will allow for aging. Drink from 2017.",Clos de la Mousse Premier Cru,93,60,Burgundy,Beaune,NA,Roger Voss,@vossroger,Bouchard Père & Fils 2011 Clos de la Mousse Premier Cru  (Beaune),Pinot Noir,Bouchard Père & Fils
37588,Italy,"Crushed red berry, black plum, prune, game and baking spice aromas carry on to the palate, along with dense black cherry and mocha. It's warm, soft and evolving fast so enjoy now.",NA,87,18,Tuscany,Rosso di Montalcino,NA,Kerin O’Keefe,@kerinokeefe,SassodiSole 2011  Rosso di Montalcino,Sangiovese,SassodiSole
37633,Italy,"Youthful and bright, Oltremé gives a new perspective to the Susumaniello grape. This demonstrates an informal style, which emphasizes the integrity of the fresh fruit flavors—cherry, blackberry and plum—which are surrounded by a soft, velvety texture.",Oltremé,88,18,Southern Italy,Salento,NA,NA,NA,Tenute Rubino 2011 Oltremé Susumaniello (Salento),Susumaniello,Tenute Rubino
37641,France,"Full bodied and rich, this has flavors of apple and lemon, with a warm and ripe feel that is balanced by a final mineral character. It needs several months to come together.",Mouton Cadet,87,10,Bordeaux,Bordeaux Blanc,NA,Roger Voss,@vossroger,Baron Philippe de Rothschild 2011 Mouton Cadet  (Bordeaux Blanc),Bordeaux-style White Blend,Baron Philippe de Rothschild
38106,Austria,"This intensely juicy wine is packed with red berry fruits, soft tannins and a light touch of wood. It is already a delicious, forward wine that's ripe and full bodied. It could age well for another 2–3 years.",Altenberg,89,25,Carnuntum,NA,NA,Roger Voss,@vossroger,Glatzer 2011 Altenberg St. Laurent (Carnuntum),St. Laurent,Glatzer
38119,US,"Sourced from vines over 103-years old, this wine has unusual concentration of flavor, in the form of black and red raspberries and Dr. Pepper. The wine showcases Zin's briary, brambly spiciness, as well as firm but drinkable tannins. Drink now–2016.",Dolinsek Ranch Old Vine,90,46,California,Russian River Valley,Sonoma,NA,NA,Portalupi 2011 Dolinsek Ranch Old Vine Zinfandel (Russian River Valley),Zinfandel,Portalupi
38175,Italy,"This offers breezy aromas of lemon, citrus mousse, cut grass and sweet basil. It is bright, lively and crisp, with the kind of fresh acidity that pairs with seafood and vegetable dishes.",Vento,87,18,Tuscany,Toscana,NA,NA,NA,Terre di Talamo 2011 Vento Vermentino (Toscana),Vermentino,Terre di Talamo
38412,US,"From a vineyard on the eastern side of the Silverado Trail in Oakville, this is rich and robust with a depth of dark berry flavor, tobacco and earth. Lush on the palate it's a special-occasion kind of wine, gorgeous and generous and a fine example of winemaking and viticulture coming together in a magical way.",Ames Vineyard,94,85,California,Oakville,Napa,Virginie Boone,@vboone,Piña 2011 Ames Vineyard Cabernet Sauvignon (Oakville),Cabernet Sauvignon,Piña
38476,France,"This is an austere wine that's tough on the palate and with high acidity. The black currant fruitiness is still developing, so the wine shouldn't be drunk before 2016.",NA,85,17,Bordeaux,Bordeaux Supérieur,NA,Roger Voss,@vossroger,Château Recougne 2011  Bordeaux Supérieur,Bordeaux-style Red Blend,Château Recougne
38561,US,"The spritz on this Chenin Blanc gives this wine a sparkling appeal. The flavors of citrus fruits, green peas and vanilla are lovely.",NA,89,15,California,Santa Ynez Valley,Central Coast,NA,NA,Roark Wine Co. 2011 Chenin Blanc (Santa Ynez Valley),Chenin Blanc,Roark Wine Co.
38772,France,"Barely off dry, this wine is rich and very perfumed, hinting at an attractive light oxidation from the wood aging. Almonds, white fruits and a fine, tight texture round it out. It will age, so drink from 2014.",Le Peu Morier,91,40,Loire Valley,Vouvray,NA,Roger Voss,@vossroger,Domaine Vincent Carême 2011 Le Peu Morier  (Vouvray),Chenin Blanc,Domaine Vincent Carême
38776,US,"Sourced entirely from the Boushey Vineyard, this is light but complex. A mix of rhubarb, pomegranate, earth and mushroom, it has a suggestion of savory umami flavors and even a hint of stable, all in good balance.",La Serenne,91,55,Washington,Yakima Valley,Columbia Valley,Paul Gregutt,@paulgwine ,Betz Family 2011 La Serenne Syrah (Yakima Valley),Syrah,Betz Family
38817,France,"This is a full, ripe wine, with elegant impressions of toast. Robust notes of melon and peach show strongly, giving a rich, warm feel that is brightened with acidity. Drink now through 2017.",Coquelicot,88,17,Provence,Vin de Pays Var,NA,Roger Voss,@vossroger,Château Routas 2011 Coquelicot Viognier-Chardonnay (Vin de Pays Var),Viognier-Chardonnay,Château Routas
38828,US,"The herbal Boulder Bluff bottling remains rather stubbornly closed, even after being open for several hours. It's tart with fruit flavors of cranberry and green apple.",Boulder Bluff Vineyard,88,68,Oregon,Chehalem Mountains,Willamette Valley,Paul Gregutt,@paulgwine ,Adelsheim 2011 Boulder Bluff Vineyard Pinot Noir (Chehalem Mountains),Pinot Noir,Adelsheim
39045,Portugal,"Smooth and ripe, it shows plenty of fruitiness with perfumed berry flavors, acidity and touches of wood. Although it lacks a bit in character, it is certainly an easy, rich wine to enjoy soon. Drink from 2015.",NA,87,NA,Tejo,NA,NA,Roger Voss,@vossroger,Quinta da Alorna 2011 Touriga Nacional (Tejo),Touriga Nacional,Quinta da Alorna
39049,US,"Savory and herbal, this Roussanne is given more time on lees and made to be rich and complex. It accomplishes those goals, providing medium body and high acidity, a texture that is dry, and wild in honey and dried apricot. Pair with lobster.",Reserve,87,40,California,Sierra Foothills,Sierra Foothills,Virginie Boone,@vboone,Terre Rouge 2011 Reserve Roussanne (Sierra Foothills),Roussanne,Terre Rouge
39249,US,"Ripe orange, lime and honey flavors combine with tingly, mouth-watering acidity to give this dry Chardonnay a sweet-and-sour taste. It's an easy wine to drink with mushroom risotto, garlic shrimp, chicken fajitas.",NA,87,20,California,Sonoma Valley,Sonoma,NA,NA,Wellington 2011 Chardonnay (Sonoma Valley),Chardonnay,Wellington
39276,France,"The wine shows very ripe fruits that are now at their peak. It is rich, rounded with touches of spice, toast and mature berries. The acidity is now totally integrated into this full-bodied wine that is ready to drink.",Cuvée Grand Réserve,91,12,Beaujolais,Beaujolais-Villages,NA,Roger Voss,@vossroger,Château de Lacarelle 2011 Cuvée Grand Réserve  (Beaujolais-Villages),Gamay,Château de Lacarelle
39314,US,"In a blind tasting, it's hard to imagine many people would identify this wine as from Washington, due to the coolness of the vintage and the style. It's almost impenetrable when first opened, with brooding notes of graphite, exotic spice, herbs, toast and dark fruit. The acids are mouthwatering, the tannins firm and tightly wound, and they need significant time to uncoil. But when they do, the wine glorious. Give it at least until 2019 in the cellar or a 24+ hour decant. One of the highlights of the vintage.",Sorella Champoux Vineyard,94,70,Washington,Horse Heaven Hills,Columbia Valley,Sean P. Sullivan,@wawinereport,Andrew Will 2011 Sorella Champoux Vineyard Red (Horse Heaven Hills),Bordeaux-style Red Blend,Andrew Will
39817,Germany,"Exotic spice notes accent ripe yellow-peach and apricot aromas on the nose of this briskly composed, dry Riesling. The palate is intensely mineral, with layers of wet stones and crushed earth that lend a savoriness to delicate fruit and floral flavors. Finishes long, with a note of lime zest.",Kiedrich Turmberg Trocken,90,50,Rheingau,NA,NA,Anna Lee C. Iijima,NA,Robert Weil 2011 Kiedrich Turmberg Trocken Riesling (Rheingau),Riesling,Robert Weil
39828,Germany,"Zesty, waxy aromas of lime peels and crushed stones belie the bright grapefruit and tangerine flavors in this dry, yet deeply mineral-laden Riesling. It's softly textured on the palate, with bright yet lenient acidity that leads into a lingering lemon-lime finish.",Junge Reben Kabinett Trocken,90,28,Rheingau,NA,NA,Anna Lee C. Iijima,NA,August Kesseler 2011 Junge Reben Kabinett Trocken Riesling (Rheingau),Riesling,August Kesseler
40280,US,"Rich and aromatic, this black label reserve displays excellent power and concentration. A dense core of cassis, licorice and espresso is brightened with vivid acidity, slowing fading through a long, smoky finish. Wait until 2016 for optimum enjoyment.",Estate Vineyard,92,60,Washington,Walla Walla Valley (WA),Columbia Valley,Paul Gregutt,@paulgwine ,Va Piano 2011 Estate Vineyard Syrah (Walla Walla Valley (WA)),Syrah,Va Piano
40362,France,"Produced from old vines, this textured, solid wine has a tight and firmly tannic character. Underneath, red cherry fruits are already releasing a fragrant side and the potential of bright fruitiness. Drink from 2016.",Les Vaumuriens,91,NA,Burgundy,Pommard,NA,Roger Voss,@vossroger,Domaine Chantal Lescure 2011 Les Vaumuriens  (Pommard),Pinot Noir,Domaine Chantal Lescure
40376,US,"Made with 54% Merlot and 46% Cabernet Franc, it spent 23 months in one-third new French oak. The overall structure is impressive, with firm acidity and streaks of iron and mineral around tight, taut black fruit. It will get even better with ample breathing time and/or further cellaring.",Archimage,91,52,Washington,Columbia Valley (WA),Columbia Valley,Paul Gregutt,@paulgwine ,Sleight of Hand 2011 Archimage Red (Columbia Valley (WA)),Bordeaux-style Red Blend,Sleight of Hand
40470,Italy,"Enticing aromas of mature plum and woodland berry unfold in the glass as do dark spice and balsamic scents. The full-bodied palate delivers steeped cherry, black raspberry flavors and a licorice note while firm, closely-knit tannins provide the framework. Drink 2016–2021.",Memini,91,NA,Southern Italy,Irpinia,NA,Kerin O’Keefe,@kerinokeefe,Guastaferro 2011 Memini Aglianico (Irpinia),Aglianico,Guastaferro
40502,France,"Tight and firm, this wine's herbal character and black currant fruit bring out the dry character of the wine and intense acidity on the finish.",NA,88,15,Bordeaux,Bordeaux,NA,Roger Voss,@vossroger,Château Bel Air Perponcher 2011  Bordeaux,Bordeaux-style Red Blend,Château Bel Air Perponcher
40522,Spain,"Spiced berry, dry oak and a note of latex define the nose on this ripe, likable, friendly Tempranillo. The wine is lively on the palate, with candied, jumpy flavors of berry fruits that finish with some foxiness and a wet-fur note. The emphasis here is on fresh fruit more than power or oakiness.",Vendimia Seleccionada,89,32,Northern Spain,Ribera del Duero,NA,Michael Schachner,@wineschach,Resalte 2011 Vendimia Seleccionada  (Ribera del Duero),Tempranillo,Resalte
40591,US,"You'd never guess that this was rocking it so hard with 16.3% alcohol, as this wine achieves balance in the face of such boozy contents. The nose holds a blackberry core with rusty, spicier edges of star anise. These are followed by a palate of black cherry and cedar, with enough tannins to ensure evolving drinking until at least 2018.",Michael's Estate Reserve,90,50,California,Paso Robles,Central Coast,Matt Kettmann,@mattkettmann,Adelaida 2011 Michael's Estate Reserve Zinfandel (Paso Robles),Zinfandel,Adelaida
40592,US,"Along with the Dolcetto, this Petite Sirah tops the new releases for this micro-boutique winery. Bright and lightly toasty, it's a forward wine, with pretty cherry, cola and earth components. An appealing and supple streak of leather comes with hints of spice and butterscotch, all woven together seamlessly.",NA,90,26,Washington,Yakima Valley,Columbia Valley,Paul Gregutt,@paulgwine ,Animale 2011 Petite Sirah (Yakima Valley),Petite Sirah,Animale
40610,Italy,"A blend of 85% Sangiovese, 10% Canaiolo and 5% Colorino, this offers delicate ripe black-skinned fruit and cooking spice aromas. On the palate, ripe black cherry, espresso and clove flavors are framed by firm tannins. Drink through 2019.",Riserva,89,30,Tuscany,Chianti Classico,NA,Kerin O’Keefe,@kerinokeefe,Mangiacane 2011 Riserva  (Chianti Classico),Red Blend,Mangiacane
40715,France,"Perfumed and rounded, this has fine acidity and a warm, sunny feel. Flavors of apples and pears are cut through with a lime juice note, yielding a balanced wine that will develop quickly.",NA,86,NA,Alsace,Alsace,NA,Roger Voss,@vossroger,Dopff Au Moulin 2011 Riesling (Alsace),Riesling,Dopff Au Moulin
40826,France,"Smooth and spicy, this is a soft style of Malbec. It has tannins, to be sure, but they are suavely integrated into the berry fruits, the touch of mint and the spice from wood aging. The aftertaste brings out refreshing layers of juicy acidity. Drink now.",NA,90,16,Southwest France,Cahors,NA,Roger Voss,@vossroger,Château Famaey 2011 Malbec (Cahors),Malbec,Château Famaey
40830,Chile,"Complexity on the nose comes via earthy aromas of licorice root, sandalwood and mild berry fruits. The palate is on the big and bullish side, but it's neither heavy nor fierce. Flavors of ripe blackberry, pepper and chocolate finish with a touch of herbs and mint. Drink through 2017.",Marques de Casa Concha,90,22,Buin,NA,NA,Michael Schachner,@wineschach,Concha y Toro 2011 Marques de Casa Concha Syrah (Buin),Syrah,Concha y Toro
41162,France,"Off-dry Riesling, rich, ripely textured and with great depth. This is a slightly spicy wine, full in the mouth and perfumed. Acidity gives shape and freshness to this apple and lime flavored wine. Drink after 2015.",Altenbourg,89,NA,Alsace,Alsace,NA,Roger Voss,@vossroger,Pierre and Charles Sparr 2011 Altenbourg Riesling (Alsace),Riesling,Pierre and Charles Sparr
41597,Italy,"A wonderful expression of Pecorino, this opens with a beautiful floral intensity and fresh aromas of honey, peach, apricot and yellow rose. There's a drying mineral note on the finish, concluding with a touch of zesty spice.",Trabocchetto,88,20,Central Italy,Colline Pescaresi,NA,NA,NA,Talamonti 2011 Trabocchetto Pecorino (Colline Pescaresi),Pecorino,Talamonti
41651,US,"Made from a blend of 77% Cabernet Sauvignon, 12% Merlot and 11% Syrah this herbal Cab divulges peppercorn on the nose as well as cola, leather and cedar. With structured tannins that don't get in the way, it's food-friendly and yet hearty, well-priced for the quality, with a finish of ripe blueberry and raspberry.",NA,87,22,California,North Coast,North Coast,Virginie Boone,@vboone,Edge 2011 Cabernet Sauvignon (North Coast),Cabernet Sauvignon,Edge
