id,country,description,designation,points,price,province,region_1,region_2,taster_name,taster_twitter_handle,title,variety,winery
59592,France,"Light and bright, this attractive, fruity wine has raspberry and red plum flavors along with a tannic core. It could age, although it's good to drink now.",NA,86,37,France Other,Côtes du Jura,NA,Roger Voss,@vossroger,Domaine Pignier 2011 Trousseau (Côtes du Jura),Trousseau,Domaine Pignier
59919,France,"A rich, wood-aged wine, its high proportion of Sémillon gives it a full and creamy character. Apples mingle with white plums, spicy quince and fresh rhubarb. Already delicious, it should age. Drink from 2016.",NA,92,62,Bordeaux,Pessac-Léognan,NA,Roger Voss,@vossroger,Château Brown 2011  Pessac-Léognan,Bordeaux-style White Blend,Château Brown
60826,Argentina,"Berry and plum aromas are spicy and saucy, with secondary notes of tomato and oregano. Snappy on the palate, this live-wire Malbec is a bit aggressive and acidic. Toasty oak and mint flavors accent fresh red-berry fruit prior to an energetic yet woody finish that's raw feeling but fair.",Reserve,87,18,Mendoza Province,Mendoza,NA,Michael Schachner,@wineschach,Ferllen 2011 Reserve Malbec (Mendoza),Malbec,Ferllen
61210,Italy,"Easy, fresh and true to the variety, this expression offers blue flower and forest berry notes, backed by almond and pistachio accents. The finish is crisp, tight and lean.",Case Ibidini,87,15,Sicily & Sardinia,Sicilia,NA,NA,NA,Valle dell'Acate 2011 Case Ibidini Nero d'Avola (Sicilia),Nero d'Avola,Valle dell'Acate
61260,Portugal,"Solid and dry, the wine is sustained by its rich tannins and earthy character. Rooted in the tough soils of the northeast, it's always going to be firm. Give it until 2015 to soften a little.",Tinto,85,NA,Trás-os-Montes,NA,NA,Roger Voss,@vossroger,Quinta do Sobreiró de Cima 2011 Tinto Red (Trás-os-Montes),Portuguese Red,Quinta do Sobreiró de Cima
61533,US,"This soft Zin bursts with blackberry and cherry fruit. Grippy, it's savory in coffee and leather with a slight astringency to the finish. It tends to be among Sobon's better bottlings every year.",Cougar Hill,86,18,California,Amador County,Sierra Foothills,Virginie Boone,@vboone,Sobon Estate 2011 Cougar Hill Zinfandel (Amador County),Zinfandel,Sobon Estate
61541,US,"Not quite as showy as its cousin Zinfandel, this Primitivo takes more time to emerge from its shell, eventually revealing scents of white pepper and graphite. There is absolutely no show of Zin's traditional hamminess either; instead, mouth-watering minerality and a vibrant acid structure lingers on the palate.",Nativo Estate,86,45,California,Paso Robles,Central Coast,Matt Kettmann,@mattkettmann,Oso Libre 2011 Nativo Estate Primitivo (Paso Robles),Primitivo,Oso Libre
61570,Italy,"Easy and cheerful, this has bright acidity and simple berry aromas. There's a hint of forest floor and a touch of bitter almond on the finish.",I Roccoli,85,15,Veneto,Valpolicella Classico,NA,NA,NA,Vigneti Villabella 2011 I Roccoli  (Valpolicella Classico),"Corvina, Rondinella, Molinara",Vigneti Villabella
61618,Italy,"This fresh Amarone offers an inviting fragrance of perfumed berry and exotic spice. Notes of graphite, black pepper and clove give depth to the ripe plum and blackberry flavors. It's balanced with firm, chewy tannins. Drink through 2019.",NA,90,73,Veneto,Amarone della Valpolicella Classico,NA,Kerin O’Keefe,@kerinokeefe,Le Salette 2011  Amarone della Valpolicella Classico,Red Blend,Le Salette
61666,Portugal,"In an oxidative style, this is a wine that is smooth and full of ripe fruit tones. With black plum and berry flavors it has just enough of a tannic edge, with a soft aftertaste.",Late Bottled Vintage,87,30,Port,NA,NA,Roger Voss,@vossroger,Quinta do Portal 2011 Late Bottled Vintage  (Port),Port,Quinta do Portal
62018,US,"This has apricot, orange and Meyer lemon notes, plus a sweet toastiness. It will appeal to consumers who enjoy Charonnays with a buttercream-like smoothness and a buttered popcorn flavor.",NA,86,30,California,Sonoma Coast,Sonoma,NA,NA,Flocchini 2011 Chardonnay (Sonoma Coast),Chardonnay,Flocchini
62027,US,"Elegant, dryish to off-dry and crisp in acidity, this Sauvignon Blanc has forward flavors of gooseberries, limes, white  sugar and vanilla. It's clean and fine to drink now.",NA,86,22,California,Happy Canyon of Santa Barbara,Central Coast,NA,NA,Star Lane Vineyard 2011 Sauvignon Blanc (Happy Canyon of Santa Barbara),Sauvignon Blanc,Star Lane Vineyard
62760,Italy,"This robust wine opens with aromas of red berry, tilled earth, dark baking spice and a balsamic note. The ripe, hearty palate delivers syrupy black cherry, juicy raspberry, clove and anisette alongside firm tannins. Despite the tannic structure, the dense fruit and warmth of alcohol make it already almost accessible. Drink 2017–2026.",Camilla,91,43,Piedmont,Barolo,NA,Kerin O’Keefe,@kerinokeefe,Grimaldi Bruna 2011 Camilla  (Barolo),Nebbiolo,Grimaldi Bruna
62761,US,"Fresh boysenberries and a blueberry sorbet character mix with notes of minty tarragon, dill and hot gravel on the nose of this wine, from an area between Gilroy and Morgan Hill. Peppercorns are prominent on the relatively light palate, along with tobacco, espresso and boysenberry.",Estate Select,91,36,California,Santa Clara Valley,Central Coast,Matt Kettmann,@mattkettmann,Jason-Stephens 2011 Estate Select Syrah (Santa Clara Valley),Syrah,Jason-Stephens
62950,Argentina,"After a gaseous, sulfuric opening, this Cab unfolds nicely. Berry aromas come with leather and a touch of dried cheese, while the palate feels very good, with creamy oak and fine tannins. Flavors of blackberry, cassis, oak and peppery woodspice end in minty fashion. Contains 15% Malbec.",Made with Organic Grapes Reserve,88,18,Mendoza Province,Tupungato,NA,Michael Schachner,@wineschach,Domaine Jean Bousquet 2011 Made with Organic Grapes Reserve Cabernet Sauvignon (Tupungato),Cabernet Sauvignon,Domaine Jean Bousquet
62953,US,"A very good Grenache, soft and appealing, with furry tannins framing rich flavors of cherries, herb tea and spices. Has the silky weight of a nice Pinot Noir.",Spur Ranch,88,30,California,San Benito County,Central Coast,NA,NA,La Marea 2011 Spur Ranch Grenache (San Benito County),Grenache,La Marea
63034,US,"Satisfies the Chardonnay sweet tooth, with vanilla, buttered toast and jammy apricot, orange, lime and honey flavors. There's good Central Coast acidity for balance.",NA,85,24,California,Monterey County,Central Coast,NA,NA,Bernardus 2011 Chardonnay (Monterey County),Chardonnay,Bernardus
63054,France,"Fruity, crisp, this is a classic Provence rosé. It is packed with fragrant raspberry fruits, bright acidity and a bright, warm, sun-drenched aftertaste. Drink now.",NA,85,12,Provence,Côtes de Provence,NA,Roger Voss,@vossroger,Barton & Guestier 2011 Rosé (Côtes de Provence),Rosé,Barton & Guestier
63154,Spain,"Cherry, red currant and minerally aromas are fresh and appealing. This blend of Tempranillo, Garnacha and Cabernet Sauvignon is pure and lithe on the palate, while toasty, minerally berry and cherry flavors finish dry, focused and with notes of licorice, cocoa and herbs. This succeeds by offering a little bit of everything good; drink through 2019.",Petit Saó,91,18,Catalonia,Costers del Segre,NA,Michael Schachner,@wineschach,Mas Blanch I Jové 2011 Petit Saó Red (Costers del Segre),Red Blend,Mas Blanch I Jové
63177,Italy,"Made with Teroldego from three different vineyards, this offers aromas of truffle, leather, scorched soil, black plum and a whiff of game. Aged and fermented in wood, the savory palate offers ripe blackberry, spiced blueberry, earthy notes of Mediterranean herbs and dark cooking spice. Firm but fine-grained tannins provide support. Drink 2016–2026.",Granato,92,72,Northeastern Italy,Vigneti delle Dolomiti,NA,Kerin O’Keefe,@kerinokeefe,Foradori 2011 Granato Teroldego (Vigneti delle Dolomiti),Teroldego,Foradori
63256,Spain,"Baked, rooty aromas of sandalwood, exotic spices and berry fruits are attractive. Though slightly grabby on the palate, this shows the right structure and build. Flavors of up-front oak, herbal plum and raspberry finish dry, with firm, pinching tannins. Drink through 2021.",Fincas de la Villa Reserva,90,20,Northern Spain,Rioja,NA,Michael Schachner,@wineschach,Bodegas Muriel 2011 Fincas de la Villa Reserva  (Rioja),Tempranillo,Bodegas Muriel
63300,US,"Thick and chewy, this is a concentrated Cabernet with a powdery coating to the palate that continues to pummel in intense red fruit. Rich and extremely fruit forward, it's not for the meek and may prove more tame with time.",Mario's Vineyard,87,50,California,St. Helena,Napa,Virginie Boone,@vboone,Trinchero 2011 Mario's Vineyard Cabernet Sauvignon (St. Helena),Cabernet Sauvignon,Trinchero
63311,US,"Much like its companion Rumba Pinot, this is light and tart, with sour cherry fruit. A whiff of smoke and streak of bell pepper come through in the finish, which is pleasant but quickly thins out.",Estate,87,32,Oregon,Willamette Valley,Willamette Valley,Paul Gregutt,@paulgwine ,Cubanisimo Vineyards 2011 Estate Pinot Noir (Willamette Valley),Pinot Noir,Cubanisimo Vineyards
63500,Italy,"A simple but well made Dolcetto, with aromas of black cherry and stewed prunes followed by plum, licorice and graphite on the palate. It closes with a bitter almond note. This would work well with lasagna.",Vigna Ciabot Russ,85,20,Piedmont,Dolcetto d'Alba,NA,Kerin O’Keefe,@kerinokeefe,Mario Gagliasso 2011 Vigna Ciabot Russ  (Dolcetto d'Alba),Dolcetto,Mario Gagliasso
63622,US,"Paul Hobbs coaxes beautifully classic Cab aromas and textures from this wine, which comes from the tricky 2011 vintage. Expect black currant, olive, cassis and peppercorn to intermingle on the palate amidst soft elegance, the perfect balance between fruity and herbal. On the finish a dusting of mocha turns up the dial on deliciousness.",NA,93,100,California,Napa Valley,Napa,Virginie Boone,@vboone,Paul Hobbs 2011 Cabernet Sauvignon (Napa Valley),Cabernet Sauvignon,Paul Hobbs
63736,US,"This Pinot has a cutting edge of citrusy acidity. On the plus side, it's also silky, with pleasant cherry candy, cola and oak flavors.",NA,84,20,California,Central Coast,Central Coast,NA,NA,De Loach 2011 Pinot Noir (Central Coast),Pinot Noir,De Loach
63754,US,"This is a light, simple Pinot Noir. It's not quite ripe, with a mushroomy edge to the cherries, cola and rhubarb. At the same time, it's silky, and fine for drinking now.",Diamond Collection,84,18,California,Monterey County,Central Coast,NA,NA,Francis Coppola 2011 Diamond Collection Pinot Noir (Monterey County),Pinot Noir,Francis Coppola
64000,France,"Dense and massive, this wine is still a baby. It gives it more tannin than fruit at this stage, very concentrated and with a dry, solid core. The fruit is there to feel, a rich mélange of black fruits and firm tannins. This powerful wine needs to age, so don't drink before 2019.",NA,94,262,Burgundy,Charmes-Chambertin,NA,Roger Voss,@vossroger,Roche de Bellene 2011  Charmes-Chambertin,Pinot Noir,Roche de Bellene
64011,US,"This wine doesn't skimp on barrel flavors or overall richness, even in this cool vintage. Oily, nutty and fragrant, with a scintillating mix of ripe yellow fruits and sweet toast, this viscous, generous wine is drinking beautifully and may be enjoyed immediately.",Sigrid,94,80,Oregon,Willamette Valley,Willamette Valley,Paul Gregutt,@paulgwine ,Bergström 2011 Sigrid Chardonnay (Willamette Valley),Chardonnay,Bergström
64309,Italy,"Castello Banfi in Tuscany does a great job with Chardonnay, as evidenced by this wine. It's rich and soft, with bright aromas of peach, citrus, vanilla and savory herb. A pinch of acidity on the finish works beautifully as well.",Fontanelle,90,19,Tuscany,Toscana,NA,NA,NA,Castello Banfi 2011 Fontanelle Chardonnay (Toscana),Chardonnay,Castello Banfi
64337,Italy,"Vibrant and savory, this blend of 70% Sangiovese, 15% Sagrantino and 15% Merlot delivers succulent black cherry, crushed plum, black pepper, grilled herb and mocha flavors alongside firm but velvety tannins. It's well balanced with surprisingly fresh acidity for the hot vintage. It's already drinking well but will be even better after 2016.",NA,91,25,Central Italy,Montefalco Rosso,NA,Kerin O’Keefe,@kerinokeefe,Antonelli 2011  Montefalco Rosso,Red Blend,Antonelli
64360,Italy,"Here's a big, hearty wine that opens with aromas of underbrush, tilled soil, truffle, stewed black-skinned fruit and a whiff of menthol. The palate offers blackberry jam, cherries marinated in spirits, coffee, mocha and a confectionary note alongside the warmth of evident alcohol. It's already rather evolved and accessible, with velvety tannins. Drink soon.",Vallocchio,90,75,Tuscany,Brunello di Montalcino,NA,Kerin O’Keefe,@kerinokeefe,Fanti 2011 Vallocchio  (Brunello di Montalcino),Sangiovese,Fanti
64363,Hungary,"This Cabernet Franc from Hungary has aromas of tart cherry, black plum and purple flowers. It is a medium- to full-bodied wine with flavors of tart cherry, pomegranate and cranberry juice. The tannins are soft and the finish is persistent.",NA,89,30,Villány,NA,NA,Jeff Jenssen,@worldwineguys,Bock 2011 Cabernet Franc (Villány),Cabernet Franc,Bock
64394,US,"The lime, kiwi, orange and lemon fruit flavors are so delicious, you won't miss the oak accents at all. Its bright, vital acidity makes it shine like polished silver. This is a very good food win at a reasonable price. With 20,000 cases produced, it should be relatively easy to find.",Stainless Unoaked,89,18,California,Central Coast,Central Coast,NA,NA,Chamisal Vineyards 2011 Stainless Unoaked Chardonnay (Central Coast),Chardonnay,Chamisal Vineyards
64410,France,"91-93. Barrel sample. Along with its Saint-Estèphe tannins, this wine proves to be richly fruity and complex, with notes of spice. The finish shows the acidity of the year.",Barrel Sample,92,NA,Bordeaux,Saint-Estèphe,NA,Roger Voss,@vossroger,Château Cos Labory 2011 Barrel Sample  (Saint-Estèphe),Bordeaux-style Red Blend,Château Cos Labory
64411,France,"91-93. Barrel sample. Lean and austere on the surface, this wine shows a bitter chocolate edge. It feels extracted, very dark and concentrated.",Barrel Sample,92,NA,Bordeaux,Saint-Émilion,NA,Roger Voss,@vossroger,Château la Gaffelière 2011 Barrel Sample  (Saint-Émilion),Bordeaux-style Red Blend,Château la Gaffelière
64491,Spain,"This blend is crisp and reasonably well focused on the bouquet. In the mouth, the wine is rubbery and tannic feeling, with mild astringency and flavors of generic berry fruit, oak and herbs. Good for basic occasions.",Rojo Granrojo,85,11,Central Spain,Vino de la Tierra de Castilla,NA,Michael Schachner,@wineschach,Bodegas Navarro López 2011 Rojo Granrojo Tempranillo-Cabernet Sauvignon (Vino de la Tierra de Castilla),Tempranillo-Cabernet Sauvignon,Bodegas Navarro López
64496,US,"Sourced from the Bacchus vineyard, this is an oaky, buttery Chardonnay that's fine for an every day quaffer. The oaky flavors quickly overtake fruit that is simple, clean, and apple flavored.",NA,85,17,Washington,Columbia Valley (WA),Columbia Valley,Paul Gregutt,@paulgwine ,Cloudlift Cellars 2011 Chardonnay (Columbia Valley (WA)),Chardonnay,Cloudlift Cellars
64503,South Africa,"Attractive aromas of fresh raspberry and strawberry lead the bouquet of this wine, with secondary accents of mocha and earth. Bright and lively on the palate, with tart red-fruit flavors of currant and rhubarb that carry through to a brisk, mouthwatering finish. Drink now.",NA,85,10,Robertson,NA,NA,Lauren Buzzeo,@laurbuzz,Robertson Winery 2011 Pinot Noir (Robertson),Pinot Noir,Robertson Winery
64520,Hungary,"There's a chalky minerality that carries from the nose to the palate of this bone-dry Hungarian rosé, adding a touch of elegance to the fresh red cherry and raspberry flavors. It is easy drinking and balanced in structure. Drink now.",Weninger & Gere,85,15,Villány,NA,NA,Anna Lee C. Iijima,NA,Gere Attila 2011 Weninger & Gere Rosé (Villány),Rosé,Gere Attila
64524,Portugal,"Bright and fruity, this has a ripe applesauce flavor that's cut with citrusy acidity. It's a great apéritif, with a soft texture and refreshing finish.",Alandra Branco,85,8,Alentejano,NA,NA,Roger Voss,@vossroger,Herdade do Esporão 2011 Alandra Branco White (Alentejano),Portuguese White,Herdade do Esporão
65005,US,"Strong and ripe with Zinny flavor— intense wild berry and cherry fruit as well as a briary, brambly mouthfeel. High alcohol gives it a glycerine richness.",NA,86,38,California,Paso Robles,Central Coast,NA,NA,Peachy Canyon 2011 Zinfandel (Paso Robles),Zinfandel,Peachy Canyon
65144,Austria,"One of two grapes found exclusively in Thermenregion (the other is Rotgipfler), Zierfandler, as here, produces floral wines with intense acidity. This wine is bright, lemon and pear fruits cutting the texture. There is just a touch of sweetness to balance all the acidity.",Spiegel,87,42,Thermenregion,NA,NA,Roger Voss,@vossroger,Johanneshof Reinisch 2011 Spiegel Zierfandler (Thermenregion),Zierfandler,Johanneshof Reinisch
65251,US,"This wine is luxurious with intense pineapple and tropical fruit flavors, but feels a bit overworked with buttery, toasty oak notes.",Dutton Ranch,87,44,California,Russian River Valley,Sonoma,NA,NA,MacRostie 2011 Dutton Ranch Chardonnay (Russian River Valley),Chardonnay,MacRostie
65315,Spain,"Raspberry, plum and schisty mineral notes make for an easy-to-process bouquet. This feels flush and fruity but not overly exact or distinct. Raspberry, red plum and a mineral note are the key flavors. The wine finishes peppery, dry and focused.",Predicat,88,20,Catalonia,Priorat,NA,Michael Schachner,@wineschach,Cellers Grifoll Declara 2011 Predicat Red (Priorat),Red Blend,Cellers Grifoll Declara
65316,Spain,"Jammy, gritty berry aromas set up a rubbery, full-force palate that doesn't tread lightly. Roasted, almost burnt black-fruit flavors finish firm. Overall, this feels right, while the flavors run a touch baked, rustic and stalky.",Roble,88,10,Catalonia,Montsant,NA,Michael Schachner,@wineschach,Finca Hispana 2011 Roble Red (Montsant),Red Blend,Finca Hispana
65356,France,"This wine has great power along with magnificently rich fruit. Wood aging provides a judicious support to its fullness and opulence. Acidity, black cherries and red berry fruits come together with firm tannins. Combined they are already in balance, but the wine needs to wait. Drink from 2018.",NA,96,480,Burgundy,Bonnes-Mares,NA,Roger Voss,@vossroger,Roche de Bellene 2011  Bonnes-Mares,Pinot Noir,Roche de Bellene
65451,Italy,"Reserved at first, this Brunello gradually reveals tilled soil and black-skinned fruit aromas. The dense, straightforward palate displays ripe plum and clove notes with a hint of licorice and closed-grained tannins.",Riserva,88,90,Tuscany,Brunello di Montalcino,NA,Kerin O’Keefe,@kerinokeefe,Poggio Nardone 2011 Riserva  (Brunello di Montalcino),Sangiovese,Poggio Nardone
65467,Spain,"Slightly herbal aromas veer off in the direction of grassy and rooty. This feels jagged and a bit choppy, with gritty roasted berry flavors. On the finish, that same gritty character persists and is joined by a tarry note.",Reserva,88,20,Northern Spain,Rioja,NA,Michael Schachner,@wineschach,Viña Bujanda 2011 Reserva  (Rioja),Tempranillo,Viña Bujanda
65546,France,"This balanced, fruity wine has gentle tannins and juicy red fruit flavors. It's fresh with acidity and a floral character that makes it already drinkable.",NA,84,15,Southwest France,Fronton,NA,Roger Voss,@vossroger,Château Coutinel 2011 Red (Fronton),Red Blend,Château Coutinel
65621,US,"Entirely estate-grown, 100% Merlot from old vines, this unfined wine is labeled vegan. Plush, briary, brambly fruit from the 30 year old vineyard brings an extra dimension to the wine, which shows a lovely balance of cranberry, raspberry, pie cherry and baking spice flavors. There's a hint of pastry crust in the finish, which is seamless and long. An absolute delight.",Seven Hills Vineyard,93,35,Washington,Walla Walla Valley (WA),Columbia Valley,Paul Gregutt,@paulgwine ,Seven Hills 2011 Seven Hills Vineyard Merlot (Walla Walla Valley (WA)),Merlot,Seven Hills
65643,Italy,"Leather, aromatic herb, mature dark-skinned fruit and a balsamic note take center stage. The full-bodied palate shows ripe wild cherry, black raspberry, mint and anise framed in enveloping refined tannins. Drink 2018–2023.",Campo di Marzo,90,25,Tuscany,Brunello di Montalcino,NA,Kerin O’Keefe,@kerinokeefe,Il Valentiano 2011 Campo di Marzo  (Brunello di Montalcino),Sangiovese,Il Valentiano
65755,Argentina,"Revancha is a new line of wines from esteemed winemaker Roberto de la Mota. This blends Malbec, Cabernet Sauvignon, Petit Verdot and Cab Franc. On the nose, it is spicy, lightly herbal and deep in fruit. A tight palate shows raw tannins and flavors of wild berry and oak-based coconut. Dry, flashy and a bit rough on the finish, this will benefit from a few more years in bottle. Drink through 2020.",La Gran Blend,92,33,Mendoza Province,Mendoza,NA,Michael Schachner,@wineschach,Revancha 2011 La Gran Blend Red (Mendoza),Bordeaux-style Red Blend,Revancha
65766,Argentina,"This is top-notch Argentine Cabernet Franc. Savory, exotic, oaky blueberry and blackberry aromas set up a bold palate with ample acidity and modest tannins. Berry flavors and oak spice are the key flavors, while a buttery oak note and a pinch of salt rise up on the finish. Drink now through 2018.",Gran Enemigo Agrelo Single Vineyard,92,110,Mendoza Province,Mendoza,NA,Michael Schachner,@wineschach,El Enemigo 2011 Gran Enemigo Agrelo Single Vineyard Cabernet Franc (Mendoza),Cabernet Franc,El Enemigo
66008,Australia,"Crisp and compact, the 2011 Diana Madeline undoubtedly needs at least another couple of years in the cellar. The nose is leafy and herbal, but the flavors show cherry fruit framed by subtle shadings of vanilla. The tannins are firm, imparting a drying sensation to the long finish.",Diana Madeline,90,109,Western Australia,Margaret River,NA,Joe Czerwinski,@JoeCz,Cullen 2011 Diana Madeline Red (Margaret River),Bordeaux-style Red Blend,Cullen
66364,US,"Prolific winemaker Andrew Murray crafted this blend of 60% Grenache and 40% Syrah for the Petras family, and it shows aromas of boysenberry, dark chocolate, coffee and dark licorice. The flavors are a bit wound up, dense yet not thick, with espresso and bitter chocolate most prevalent. This will improve with time.",16 Crows Cuvée,88,35,California,Santa Ynez Valley,Central Coast,Matt Kettmann,@mattkettmann,Highland Oaks 2011 16 Crows Cuvée Grenache-Syrah (Santa Ynez Valley),Grenache-Syrah,Highland Oaks
66623,Italy,"This barrel-aged Soave conveys aromas of candied citrus, pineapple, and toasted oak. The palate delivers butterscotch, sugary vanilla and lemon drops in a low-impact, muted style.",Casette Foscarin,86,29,Veneto,Soave Classico,NA,Kerin O’Keefe,@kerinokeefe,Monte Tondo 2011 Casette Foscarin  (Soave Classico),Garganega,Monte Tondo
66632,Italy,This fruity blend of Merlot and Cabernet Franc offers aromas of red currants and raspberry along with whiffs of bell pepper. The palate delivers vibrant blackberry and black cherry along with hints of black pepper. It's straightforward and made to be enjoyed young.,Red e.motion,86,16,Northeastern Italy,Venezia Giulia,NA,Kerin O’Keefe,@kerinokeefe,Tenuta Luisa 2011 Red e.motion Red (Venezia Giulia),Red Blend,Tenuta Luisa
66703,Italy,"This estate (owned by the Zonin family) has recently overhauled its white wine program, and the excellent results show with this beautiful Insolia. Fragrant citrus and peach aromas are followed by a creamy thickness and a spicy citrus-like intensity.",NA,89,17,Sicily & Sardinia,Sicilia,NA,NA,NA,Feudo Principi di Butera 2011 Insolia (Sicilia),Insolia,Feudo Principi di Butera
66732,Portugal,"This is an extracted wine, with licorice and dark chocolate flavors as much as fruit. It is tough at the moment, with dry tannins dominating the black plum flavor and the acidity. Leave until 2016 in the hope it will soften.",Coudel Mor Reserva,85,13,Tejo,NA,NA,Roger Voss,@vossroger,Adega Cooperativa do Cartaxo 2011 Coudel Mor Reserva Red (Tejo),Portuguese Red,Adega Cooperativa do Cartaxo
66903,France,"This is a smooth, ripe wine, just hinting at wood. Honey and lemon flavors are cut by tight, mineral acidity. It's perfumed from the Muscadelle in the blend, giving a rich wine that is developing fast. Drink from 2015.",NA,88,NA,Bordeaux,Bordeaux Blanc,NA,Roger Voss,@vossroger,Le Nardian 2011  Bordeaux Blanc,Bordeaux-style White Blend,Le Nardian
66912,US,"This is a monster Zin even by Sbragia standards. The wine feels hotter and more glyceriney than its official alcohol. It's also superripe in raisins and prunes, although the finish is totally dry. It defines a lusty, rustic style of California Zinfandel.",Gino's Vineyard,88,34,California,Dry Creek Valley,Sonoma,NA,NA,Sbragia 2011 Gino's Vineyard Zinfandel (Dry Creek Valley),Zinfandel,Sbragia
67178,Italy,"This opens with earthy aromas of ripe dark fruit, scorched earth, game and truffle. The concentrated palate doles out juicy black cherry, crushed raspberry, sweet cake spice, tobacco and herb accompanied by firm, fine-grained tannins and a vein of fresh acidity.",del Comune di Serralunga d'Alba,92,53,Piedmont,Barolo,NA,Kerin O’Keefe,@kerinokeefe,Giovanni Rosso 2011 del Comune di Serralunga d'Alba  (Barolo),Nebbiolo,Giovanni Rosso
67220,France,"The steep slope of Beauroy produces ripe grapes, but also wines that maintain intense minerality and structure. The Chablis is tight, nervy, and still young, but exhibits bright lemon and peach flavors touched with honey. Cellar this serious wine, and drink from 2015.",Beauroy Premier Cru,90,NA,Burgundy,Chablis,NA,Roger Voss,@vossroger,Pascal Bouchard 2011 Beauroy Premier Cru  (Chablis),Chardonnay,Pascal Bouchard
