id,country,description,designation,points,price,province,region_1,region_2,taster_name,taster_twitter_handle,title,variety,winery
29790,US,"Amazingly lush and delicious in blackberry and cherry pie, mocha and sweet new-oak flavors, this blend is also tannic to the point of being undrinkable at this time. You definitely want to give it until at least 2022 in the bottle.",Right Bank,92,90,California,Napa Valley,Napa,NA,NA,Caldwell 2011 Right Bank Red (Napa Valley),Bordeaux-style Red Blend,Caldwell
29794,US,"This is the winery's second release of this 100% Syrah from the esteemed Stagecoach Vineyard. It's enormously rich and opulent in blackberry, black cherry jam, chocolate, anise and pepper flavors. There's plenty of new French oak, but the wine easily shoulders it. It's a delicious sipper.",Stagecoach Vineyard Block I4,92,54,California,Napa Valley,Napa,NA,NA,Venge 2011 Stagecoach Vineyard Block I4 Syrah (Napa Valley),Syrah,Venge
29870,Israel,"Fragrant and floral, this Riesling shines with lively notes of honeydew melon, peach flesh, clementine oil and a hint of petrol. Light weight and well balanced, with brisk acidity that lends a juicy, mouthwatering nature to the close.",Single Vineyard Kayoumi,89,26,Galilee,NA,NA,Lauren Buzzeo,@laurbuzz,Carmel 2011 Single Vineyard Kayoumi White Riesling (Galilee),White Riesling,Carmel
30098,Spain,"An apple cider aroma comes across dusty, slightly maderized and heavy. This is a plump, wide Albariño with pithy citrus and white nectarine flavors. The finish features pithy, fleshy accents. Drink now.",Zios,86,18,Galicia,Rías Baixas,NA,Michael Schachner,@wineschach,Lusco 2011 Zios Albariño (Rías Baixas),Albariño,Lusco
30220,US,"Aged in stainless steel, this single-vineyard Viognier is aromatic and appealing, with notes of fresh flowers, peach and lees. It's off-dry, medium bodied, with a textured feel and light fruit flavors.",Steelhead Run Vineyard,87,19,Oregon,Rogue Valley,Southern Oregon,Sean P. Sullivan,@wawinereport,Quady North 2011 Steelhead Run Vineyard Viognier (Rogue Valley),Viognier,Quady North
30245,US,"This is an easy wine to drink now. There's some real elegance, with brisk acidity and fine tannins framing sour cherry and cranberry fruit. The silky texture is pure Pinot Noir.",Into the Fog,86,25,California,Los Carneros,Napa-Sonoma,NA,NA,Storyteller 2011 Into the Fog Pinot Noir (Los Carneros),Pinot Noir,Storyteller
30520,US,"From the oldest Chenin Blanc vines in the Dry Creek Valley, winemaker Leo Hansen crafts a dry, floral white with textured character and nuanced acidity that's garnished with layers of apple, herb and pear, and just a suggestion of tropical flourish on the finish.",Saini Farms,90,18,California,Dry Creek Valley,Sonoma,Virginie Boone,@vboone,Leo Steen Wines 2011 Saini Farms Chenin Blanc (Dry Creek Valley),Chenin Blanc,Leo Steen Wines
30676,France,"Wood-laden, spicy wine with some ripe black currant fruit and soft tannins. This is a warm, open wine that is likely to age over the next year.",NA,85,17,Bordeaux,Bordeaux Supérieur,NA,Roger Voss,@vossroger,Château Allégret 2011  Bordeaux Supérieur,Bordeaux-style Red Blend,Château Allégret
30678,France,"The aromas are of wood as much as fruit. While the palate also shows plenty of wood aging flavors, there is also a more floral, red berry fruit character that's already attractive. The acidity at the end gives intense freshness.",NA,85,15,Bordeaux,Bordeaux,NA,Roger Voss,@vossroger,Château Laubès 2011  Bordeaux,Bordeaux-style Red Blend,Château Laubès
30681,US,"This sports a smoky aroma, wrapped into tight, tart red fruits. There is an ashy undertone, and somewhat granular tannins.",Marina Piper,85,20,Oregon,Willamette Valley,Willamette Valley,Paul Gregutt,@paulgwine ,Cottonwood Winery of Oregon 2011 Marina Piper Pinot Noir (Willamette Valley),Pinot Noir,Cottonwood Winery of Oregon
30682,Germany,"Green, herbal notes are prominent on this brisk, savory Riesling. Lemony acidity and hints of bitter lime pith add a stark, refreshing quality that would accompany rich goat cheese or cured meats quite well.",Fritz Fisk,85,13,Mosel,NA,NA,Anna Lee C. Iijima,NA,Dr. Pauly Bergweiler 2011 Fritz Fisk Riesling (Mosel),Riesling,Dr. Pauly Bergweiler
30690,US,This 100% varietal wine is lightly aromatic with notes of fig and fresh spun cotton. It's medium bodied in feel with lemony acids but wants a bit more concentration to keep it together.,NA,85,22,Oregon,Umpqua Valley,Southern Oregon,Sean P. Sullivan,@wawinereport,Pyrenees 2011 Semillon (Umpqua Valley),Sémillon,Pyrenees
30737,US,"A spritzy, frizzante style, this is sweet and simple, with a clean flavor of orange.",NA,85,14,Oregon,Oregon,Oregon Other,Paul Gregutt,@paulgwine ,Foris 2011 Moscato (Oregon),Moscato,Foris
30746,Italy,"Very easy and fresh, this offers a quick succession of grapefruit, apricot and lemongrass aromas. It's a simple wine that should taste great with summer salads.",NA,85,15,Veneto,Marca Trevigiana,NA,NA,NA,Anna Spinato 2011 Pinot Grigio (Marca Trevigiana),Pinot Grigio,Anna Spinato
30750,Italy,Cavit is an important wine cooperative in northern Italy that is largely responsible for Pinot Grigio's immense popularity in the United States. This bottle shows easy tones of peach and citrus.,NA,85,10,Northeastern Italy,Delle Venezie,NA,NA,NA,Cavit 2011 Pinot Grigio (Delle Venezie),Pinot Grigio,Cavit
30798,US,"Perhaps Temecula's future is in Super Tuscans. This balanced blend of 50% Sangiovese, 21% Cabernet Sauvignon, 20% Merlot and 9% Cabernet Franc offers a complex nose of cranberry, pomegranate, pencil lead and chocolate sauce. Flavors of hot brick, white pepper, raspberry and stewed mushrooms rock the palate.",Amante,92,43,California,Temecula Valley,South Coast,Matt Kettmann,@mattkettmann,Falkner 2011 Amante Red (Temecula Valley),Red Blend,Falkner
30873,Spain,"A big step down from the past two vintages. This Verdejo lacks fortitude and clarity; it's grassy and flat on the nose, then cloying on the palate. Flavors of bland citrus are disjointed and underwhelming. Finishes grassy and green.",NA,82,10,Northern Spain,Rueda,NA,Michael Schachner,@wineschach,Cantarranas 2011 Verdejo (Rueda),Verdejo,Cantarranas
30879,US,"This is a simple, one-dimensional Chardonnay. It's dry in style with thin citrus and apricot flavors and just a hint of oak.",NA,82,12,California,California,California Other,NA,NA,Carmenet 2011 Chardonnay (California),Chardonnay,Carmenet
30919,Argentina,"This starts out tarry, but airing reveals aromas of tobacco, asphalt and oaky berry fruits. The mouthfeel is flush and extracted, but not overly heavy. Flavors of black fruits are more generic than specific, while the finish is tannic, with lively acidity. The blend is Malbec, Cabernet Sauvignon and Bonarda.",Corte B,91,30,Mendoza Province,Mendoza,NA,Michael Schachner,@wineschach,Vistalba 2011 Corte B Red (Mendoza),Red Blend,Vistalba
30922,Germany,"Whiffs of smoke and mineral lends complexity to pretty white peach and floral tones on this dainty off-dry Riesling. It's juicy with stone fruit, but maintains that streak of minerality and a clean, focused acidity that leads to a long, dry finish.",Tradition,91,22,Rheingau,NA,NA,Anna Lee C. Iijima,NA,Robert Weil 2011 Tradition Riesling (Rheingau),Riesling,Robert Weil
31004,Portugal,"Dominated by its tannins and woody characteristics, this is a tough, chunky wine. It has weight and potential depth of black fruit, needing at least four years to soften out.",Magna Carta Reserva,87,17,Alentejano,NA,NA,Roger Voss,@vossroger,Caves Velhas 2011 Magna Carta Reserva Red (Alentejano),Portuguese Red,Caves Velhas
31157,US,"Crisp and very floral, this is a beautiful showcase of Anderson Valley's cool climate and commitment to Alsatian varieties. There's a great depth of flavor here—fig, grapefruit, lime and orange peel—not to mention tremendous minerality. This is a wine that can be sipped all day long or enjoyed with fish, poultry or an onion tart.",Helluva Vineyard,92,20,California,Anderson Valley,NA,Virginie Boone,@vboone,Handley 2011 Helluva Vineyard Pinot Gris (Anderson Valley),Pinot Gris,Handley
31185,Italy,"Dark-skinned berry, blue flowers, tilled soil, forest floor and tobacco aromas lead the nose. The full-bodied palate doles out ripe black cherry, mature blackberry, raspberry, licorice and ground pepper alongside fresh acidity and smooth, polished tannins.",Vigna del Cuculo,90,NA,Piedmont,Barbera d'Alba Superiore,NA,Kerin O’Keefe,@kerinokeefe,Cavallotto 2011 Vigna del Cuculo  (Barbera d'Alba Superiore),Barbera,Cavallotto
31273,France,"Very gentle, perfumed honeysuckle notes are distinct and enticing on the nose. The palate follows this with a perfumed, opulent medium-sweetness that is reminiscent of sugar-plums and candied fruit pastilles: there are peach and plum and unbridled richness with a slight phenolic grip.",Sonnenglanz Grand Cru,91,37,Alsace,Alsace,NA,Anne Krebiehl MW,@AnneInVino,Domaine Bott-Geyl 2011 Sonnenglanz Grand Cru Gewurztraminer (Alsace),Gewürztraminer,Domaine Bott-Geyl
31462,Portugal,"From a great Douro vintage, this is a ripe wine, packed with generous fruit and concentrated tannins. Berry flavors and juicy acidity dominate a wine that has plenty of power while keeping elegance and stylishness. Drink now.",Reserva,93,23,Douro,NA,NA,Roger Voss,@vossroger,Quinta do Sagrado 2011 Reserva Red (Douro),Portuguese Red,Quinta do Sagrado
31632,Argentina,"This wine leads with big, rubbery, almost stewy aromas. In the mouth, this rich Malbec feels reduced and jammy, with heavy tannins. Flavors of blueberry and blackberry are infused with herbal notes, while the finish offers flavors of licorice and chocolate.",Grande Reserve,89,24,Mendoza Province,Tupungato,NA,Michael Schachner,@wineschach,Domaine Jean Bousquet 2011 Grande Reserve Malbec (Tupungato),Malbec,Domaine Jean Bousquet
31680,Italy,"This amber-colored wine is showing oxidation. The fruit has dried up, leaving only mineral, bitter walnut and flat sensations.",Don Chisciotte,82,10,Southern Italy,Campania,NA,Kerin O’Keefe,@kerinokeefe,Pierluigi Zampaglione 2011 Don Chisciotte Fiano (Campania),Fiano,Pierluigi Zampaglione
31747,France,"This is a full, perfumed wine that's medium sweet in flavor. It is rich in spice, packed with honey and lychees, and well balanced with light acidity. The wine has an opulence and a warming aftertaste. Drink until 2022.",Hatschbourg Grand Cru,91,25,Alsace,Alsace,NA,Roger Voss,@vossroger,Joseph Cattin 2011 Hatschbourg Grand Cru Pinot Gris (Alsace),Pinot Gris,Joseph Cattin
31855,US,"Some unripe green notes mark the ripe raspberry and cherry flavors on this Pinot Noir. Otherwise it is a silky, delicate wine, showing Santa Maria Valley charm and acidity.",Challen,86,70,California,Santa Maria Valley,Central Coast,NA,NA,Tantara 2011 Challen Pinot Noir (Santa Maria Valley),Pinot Noir,Tantara
33002,US,"With a translucent ruby color, this wine shows nice Pinot Noir character. It has a light, silky texture and flavors of sour cherry and raspberry candy, Dr. Pepper cola and sandalwood.",NA,85,13,California,California,California Other,NA,NA,Masked Rider 2011 Pinot Noir (California),Pinot Noir,Masked Rider
33149,US,"An earthy funk and puckeringly dry tannins mark this wine, which remains dry on the palate from start to finish, characterized along the way in leather and black pepper.",NA,85,75,California,Napa Valley,Napa,Virginie Boone,@vboone,Treasure 2011 Cabernet Sauvignon (Napa Valley),Cabernet Sauvignon,Treasure
33217,Austria,"There is more fruit than structure in this wine, giving the palate a bright, red-berried character and soft tannins. It's juicy, but there's also some smokiness. A blend of Zweigelt, Blaufränkisch and St Laurent, it is ready to drink now. Screwcap.",Tinhof Noir,86,18,Burgenland,NA,NA,Roger Voss,@vossroger,Tinhof 2011 Tinhof Noir Red (Burgenland),Austrian Red Blend,Tinhof
33226,Argentina,"Oak is the main characteristic in this Malbec. Spicy aromas of clove and mint steer otherwise generic berry scents toward a thick palate with pointed acidity. This is short on complexity and the fruit is mildly sour, while mint, oak and baked notes define the finish.",Reserve,86,15,Mendoza Province,Tupungato,NA,Michael Schachner,@wineschach,Finca Sophenia 2011 Reserve Malbec (Tupungato),Malbec,Finca Sophenia
33293,US,"Aromas like black olive, clove and dark cherry continue in the flavors of this full-flavored and full-bodied wine. Mellow oak notes like cedar and tobacco add complexity.",deb-ru-vée,87,36,California,California,California Other,Jim Gordon,@gordone_cellars,Longevity 2011 deb-ru-vée Red (California),Red Blend,Longevity
33620,France,"This is a rich wine that's full of apricot, melon and pear flavors. It has weight, ripe fruit and a good touch of minerality, with a clean and crisp finish. Age this for a year or two.",NA,91,13,Bordeaux,Bordeaux Blanc,NA,Roger Voss,@vossroger,Château Haut Grand Champ 2011  Bordeaux Blanc,Sauvignon Blanc,Château Haut Grand Champ
34061,Italy,"Aromas of underbrush, wild berry, dried herb and a balsamic note take shape in the glass. The round palate doles out crushed black cherry, ripe plum, sage and clove alongside soft acidity and polished tannins. Drink through 2016.",Villa Cambi,88,32,Tuscany,Chianti Superiore,NA,Kerin O’Keefe,@kerinokeefe,Castel di Pugna 2011 Villa Cambi  (Chianti Superiore),Red Blend,Castel di Pugna
34286,US,"New French oak lends toasty flavors of wood and butterscotch to this Chardonnay. It's rich and opulent with flavors of pineapple, orange and buttered toast.",Barrel Fermented,86,30,California,Napa Valley,Napa,NA,NA,Hendry 2011 Barrel Fermented Chardonnay (Napa Valley),Chardonnay,Hendry
34302,US,"As the name suggests, this is an elemental Cabernet, offering pleasant blackberry, cherry and oak flavors. Rich and ripe in California sunshine fruit, it's smooth in tannins and easy to drink.",Elements,85,18,California,Sonoma County,Sonoma,NA,NA,Artesa 2011 Elements Cabernet Sauvignon (Sonoma County),Cabernet Sauvignon,Artesa
34311,US,"Hints of nuts add a savory tone to subtle apple flavors on this dry Chardonnay. Tart, crisp lemon and lime acidity on the midpalate makes it effortlessly refreshing, leading to a pleasant honey and floral note on the finish.",NA,85,11,New York,Finger Lakes,Finger Lakes,Anna Lee C. Iijima,NA,Standing Stone 2011 Chardonnay (Finger Lakes),Chardonnay,Standing Stone
34622,Portugal,"Firmly structured, this has both great tannins and equally big, rich berry and black currant fruits that bring the acidity right up front. It is still young, emphasizing the fruit and freshness. The tannins and wood aging flavors need their chance. Drink from 2017.",Bridão Reserva,91,15,Tejo,NA,NA,Roger Voss,@vossroger,Adega Cooperativa do Cartaxo 2011 Bridão Reserva Red (Tejo),Portuguese Red,Adega Cooperativa do Cartaxo
34815,Argentina,"Asphalt and gaseous aromas take a while to settle, but after they do, leather and scratchy blackberry scents surface. It feels big and brawny, with max extraction. It tastes masculine but salty, with bitter chocolate and peppery accents. Bulky for $11 wine.",Reserve,84,11,Mendoza Province,Mendoza,NA,Michael Schachner,@wineschach,Trivento 2011 Reserve Syrah (Mendoza),Syrah,Trivento
34855,South Africa,"Winemaker: Dewaldt Heyns. This Shiraz-dominant blend, with 18% Grenache, 9% Mourvèdre and 2% Viognier, is spicy, structured and powerful. Intense notes of cigar box, leather, cured meat, licorice and anise frame the tight black-fruit core. Dense black berry, cherry and currant flavors unfold on the right, gripping palate, with a firm, spicy finish that lingers long. Despite its age, it comes from one of the best vintages in South Africa, and it has the stuffing to continue to age well through 2022.",Cape Winemakers Guild Die Erf Shiraz-Grenache-Mourvèdre-Viognier,92,NA,Tulbagh,NA,NA,Lauren Buzzeo,@laurbuzz,Saronsberg 2011 Cape Winemakers Guild Die Erf Shiraz-Grenache-Mourvèdre-Viognier Red (Tulbagh),Rhône-style Red Blend,Saronsberg
35298,US,"Straightforward in juicy red fruit and dry tannins, it has aromas reminiscent of saddle leather. This wine would work well for parties and larger gatherings, satisfying a range of palates.",NA,84,12,California,Lodi,Central Valley,Virginie Boone,@vboone,Cycles Gladiator 2011 Cabernet Sauvignon (Lodi),Cabernet Sauvignon,Cycles Gladiator
35404,US,"The lush nose is fragrant of orange blossoms and ripe peaches, and the palate tastes of Meyer lemon, lime and grapefruit. It's a fruit punch of a Riesling—delicious as a chilled sipper.",NA,88,13,Washington,Yakima Valley,Columbia Valley,Paul Gregutt,@paulgwine ,Mercer Canyons 2011 Riesling (Yakima Valley),Riesling,Mercer Canyons
35534,France,The wine has some maturity although its tannins are still very present. It has some juicy black-currant flavor that is shot through with the dry core. The aftertaste brings out more acidity and a more juicy character. Drink from 2018.,NA,87,20,Bordeaux,Blaye Côtes de Bordeaux,NA,Roger Voss,@vossroger,Château Crusquet de Lagarcie 2011  Blaye Côtes de Bordeaux,Bordeaux-style Red Blend,Château Crusquet de Lagarcie
35783,France,"Touches of toast from the wood aging give a spicy character. The toast brings out acidity at this stage rather than sweetness, with lemon and lime flavors dominant over the honey and botrytis in the background. Drink from 2018.",NA,90,NA,Bordeaux,Barsac,NA,Roger Voss,@vossroger,Château Broustet 2011  Barsac,Bordeaux-style White Blend,Château Broustet
36138,US,"Perhaps Temecula's future is in Super Tuscans. This balanced blend of 50% Sangiovese, 21% Cabernet Sauvignon, 20% Merlot and 9% Cabernet Franc offers a complex nose of cranberry, pomegranate, pencil lead and chocolate sauce. Flavors of hot brick, white pepper, raspberry and stewed mushrooms rock the palate.",Amante,92,43,California,Temecula Valley,South Coast,Matt Kettmann,@mattkettmann,Falkner 2011 Amante Red (Temecula Valley),Red Blend,Falkner
36145,US,"A blend of Olsen Estates and Stillwater Creek vineyards, this wine pops with heaping amounts of black pepper and raw meat aromas along with dried herb grace notes. It's full of fruit and savory flavors, with firm tannins backing it all up. An impressive wine, this should have a long life ahead of it.",NA,92,36,Washington,Columbia Valley (WA),Columbia Valley,Sean P. Sullivan,@wawinereport,Flying Dreams 2011 Monastrell (Columbia Valley (WA)),Monastrell,Flying Dreams
36185,France,"With spice and dark coffee flavors, this wine shows some wood aging. It also has considerable acidity and the brightest strawberry fruit. Lively and fragrant at the end, it can be drunk now.",Côte de Grisey Cuvée Juliette,88,30,Burgundy,Bourgogne Epineuil,NA,Roger Voss,@vossroger,Domaine Dominique Gruhier 2011 Côte de Grisey Cuvée Juliette  (Bourgogne Epineuil),Pinot Noir,Domaine Dominique Gruhier
36963,US,"A GSM blend of estate-grown fruit, this is delicate, brambly and shows light cherry-candy fruit flavors, benefitting from an elegant touch. There is a subtle hint of whipped cream and coconut as it winds down.",Misceo,88,34,Oregon,Rogue Valley,Southern Oregon,Paul Gregutt,@paulgwine ,Folin Cellars 2011 Misceo G-S-M (Rogue Valley),G-S-M,Folin Cellars
37141,US,"A Southern Rhône-style blend, this wine shows aromas of cranberry, raspberry, fresh herbs and peppery spices. The flavors show purity, richness and restraint, with a finish that lingers.",Slice of Pape,91,35,Washington,Columbia Valley (WA),Columbia Valley,Sean P. Sullivan,@wawinereport,Tranche 2011 Slice of Pape Red (Columbia Valley (WA)),Rhône-style Red Blend,Tranche
37245,Chile,"Jammy blackberry, rubber, graphite and raw oak aromas set up a full, weighty palate. Flavors of mint, licorice, creamy oak and chocolate accent brambly black-fruit flavors, while a minty finish simmers with power and subtle warmth. Drink through 2016.",Quiron,90,30,Colchagua Valley,NA,NA,Michael Schachner,@wineschach,Viña La Ronciere 2011 Quiron Carmenère (Colchagua Valley),Carmenère,Viña La Ronciere
37275,US,"This very limited reserve is from a particular block, and as with most block selections, it offers focused, somewhat constrained flavors. Precisely defined red berry fruit is set in a frame of vanilla, toast and coffee. It's a pleasant, albeit generic quaffer.",Reserve,88,30,Washington,Columbia Valley (WA),Columbia Valley,Paul Gregutt,@paulgwine ,Columbia Crest 2011 Reserve Merlot (Columbia Valley (WA)),Merlot,Columbia Crest
37302,Chile,"A woody jammy nose is lush and borders on raisiny. Stout, saturated and thick on the palate, this Cabernet blend from Curicó deals a broad swipe of giant blackberry, cassis and raisin flavors. A chunky finish with rubbery tannins is tasty and lush, but a bit over the top.",Limited Edition,91,40,Curicó Valley,NA,NA,Michael Schachner,@wineschach,Don Tony Perez 2011 Limited Edition Red (Curicó Valley),Red Blend,Don Tony Perez
37471,Argentina,"Red-fruit aromas operate solo on the bouquet. This feels tight, crisp and fresh, with plum, berry and peppery spice flavors. A dry, slightly abrasive and scratchy finish deals juiciness and lasting red-fruit flavors.",Oak Cask,86,11,Mendoza Province,Mendoza,NA,Michael Schachner,@wineschach,Conquista 2011 Oak Cask Malbec (Mendoza),Malbec,Conquista
37687,Argentina,"On the nose, aromas of sweet, red hard candy mingle with a note of animal fur. Fairly tannic and lively in the mouth, this has herbal, rubbery flavors alongside jumpy red-berry fruit. The finish is a bit abrasive.",Staccato Made with Organically Grown Grapes,84,10,Mendoza Province,Mendoza,NA,Michael Schachner,@wineschach,Caligiore 2011 Staccato Made with Organically Grown Grapes Malbec-Cabernet Sauvignon (Mendoza),Malbec-Cabernet Sauvignon,Caligiore
37719,Spain,"Cherry and crisp red currant aromas are racy and tutti-frutti in character. The palate delivers kick and acidity in addition to dry, pithy flavors of citrus fruits and nectarine. Dryness persists onto the finish, which is friendly but modest.",NA,85,8,Northern Spain,Campo de Borja,NA,Michael Schachner,@wineschach,Borsao 2011 Rosé (Campo de Borja),Rosé,Borsao
37950,US,"There are lots of dried tones to the nose: herbs, meat and hay. The palate shows more fruit, with tart cherry and raspberry flavors giving a snappy resistance to the grippy, sandy tannins.",NA,85,22,Nevada,Nevada,NA,Alexander Peartree,NA,Nevada Ridge 2011 Barbera (Nevada),Barbera,Nevada Ridge
37980,Canada,"Steely and compact, this rather reluctantly opens to reveal subtle complexity. The mix of tart blueberry and blackberry fruit is accompanied by scents of cured meat, menthol and garrigue. It spent 18 months in a mix of barrels and puncheons, yielding a pleasant finishing impression of cedar. Decant this for at least an hour or two.",Équinoxe,92,85,British Columbia,Okanagan Valley,NA,Paul Gregutt,@paulgwine ,Le Vieux Pin 2011 Équinoxe Syrah (Okanagan Valley),Syrah,Le Vieux Pin
38128,US,"Classic, elegant Pinot Noir aromas introduce this delightful wine. Whiffs of flowers, citrus and fresh herbs accompany a tart, pretty palate with nuanced rhubarb, cranberry and raspberry flavors.",Dundee Hills Vineyards,90,38,Oregon,Dundee Hills,Willamette Valley,Paul Gregutt,@paulgwine ,Winderlea 2011 Dundee Hills Vineyards Pinot Noir (Dundee Hills),Pinot Noir,Winderlea
38275,France,"Lean and austere, this is a firm, medicinal and herbal wine that's still very young. Red berry fruits, along with drying tannins and spice from wood aging hint at its aging potential. It's best to wait until 2016.",NA,90,NA,Bordeaux,Castillon Côtes de Bordeaux,NA,Roger Voss,@vossroger,Château d'Aiguilhe 2011  Castillon Côtes de Bordeaux,Bordeaux-style Red Blend,Château d'Aiguilhe
38287,US,"The aromatics on this Zin are amazing, ranging from mocha, fresh blackberries and cinnamon, to sweet bacon and Dr. Pepper. The palate is similar in profile, with small quantities of Mourvèdre, Petite Sirah and Syrah added for complexity. While the wine is dry, it has some glycerine viscoscity and heat from high alcohol. Drink this Zin with roasted and grilled meats.",Black Label,90,42,California,Paso Robles,Central Coast,NA,NA,Proulx 2011 Black Label Zinfandel (Paso Robles),Zinfandel,Proulx
38403,US,"Made by Robert Pepi, this wine reveals an elegance of dried herb and forest floor, while dry, generous tannins pack a punch. Blackberry and mocha lurk in the background, unable to overcome the wine's greener aspects.",Spring Mountain District,84,65,California,Spring Mountain District,Napa,Virginie Boone,@vboone,Eponymous 2011 Spring Mountain District Cabernet Sauvignon (Spring Mountain District),Cabernet Sauvignon,Eponymous
38492,US,"For the price, this is a pretty good Merlot for drinking now. It's soft and approachable with cherry, blueberry, red currant and oak flavors, along with a sightly sweet finish.",NA,85,22,California,Napa Valley,Napa,NA,NA,Oberon 2011 Merlot (Napa Valley),Merlot,Oberon
38555,France,"This is a light, citrus-fruit dominated wine. It has attractive fruitiness, tang and zest, and its acidity is crisp and refreshing. Apples and green fruits add a little richness at the end. Screwcap.",Vieilles Vignes Sur Lie,89,16,Loire Valley,Muscadet Sèvre et Maine,NA,Roger Voss,@vossroger,Château de la Ragotiere 2011 Vieilles Vignes Sur Lie  (Muscadet Sèvre et Maine),Melon,Château de la Ragotiere
38559,US,"This is a very dry Pinot Noir, lowish in alcohol by current standards. It's not showing particularly well now, with a sour cherry and cranberry tartness that makes the mouth water. You can chew on this wine and it reveals plenty of mushroomy, meaty complexities, but it remains aloof and tough. Give it at least five years in a good cellar.",Les Bon Temps Roule,89,55,California,Santa Barbara County,Central Coast,NA,NA,Martellotto 2011 Les Bon Temps Roule Pinot Noir (Santa Barbara County),Pinot Noir,Martellotto
